full_title,date
Gardaí appeal for information after woman attacked in early hours in Newlands Cross,2016
Stephen Murphy (29) was last seen on Wednesday at Cavan bus station,2016
Men arrested in relation to Clondalkin sexual assault released,2016
AIB performs poorly in latest European bank stress test,2016
Appeal issued for missing Cavan man,2016
AIB and Bank of Ireland among worst performers in Europe-wide stress tests -,2016
Eamon Shield told investors he would sell on repossessed cars at a significant mark-up,2016
#WorldNews: Denis Casey profile: ILP boss who did not recall authorising loans,2016
Willie McAteer profile: Anglo’s risk officer at centre of deals,2016
Woman says she felt her granduncle ‘owned my boobs’ after he assaulted her as a child,2016
Bray rearguard finally breached as Shamrock Rovers take point home,2016
#WorldNews: Clinton casts herself as the unifier against polarising Trump,2016
Ireland’s two main banks among worst performers in new stress tests,2016
#WorldNews: UK delays €21bn deal for nuclear plant at Hinkley Point,2016
Scientists have discovered that crystals produced by the insect are loaded with nutrients,2016
#WorldNews: Nusra’s move to cut al-Qaeda ties a tactic to avoid ‘terrorist’ label,2016
#WorldNews: Syria’s Jabhat al-Nusra says it is ending al-Qaeda ties,2016
"#WorldNews: Pope Francis makes solemn, silent visit to Auschwitz",2016
Met Éireann warns that rain and strong winds are expected after Monday,2016
Henrik Stenson gets over shaky start to take clubhouse lead,2016
#WorldNews: Brazil’s former president Lula to stand trial over Petrobras,2016
Judge describes child’s testimony as ‘very moving’ before jailing woman for two years,2016
"Woman underwent breast reduction due to abuse, court hears",2016
Sponsored: A return to Honduras – the new recruits on the Kenco #coffeevsgangs project,2016
"From @GenEmigration: ""Can I answer honestly about whether I'm glad to be back in Ireland?"" -",2016
"Man jailed for stealing €178,000 in car pyramid scheme",2016
Analysis: Dublin Bus and Iarnród Éireann rows are heading towards industrial action,2016
Ian O’Riordan: Let’s not give up on the Olympic dream,2016
Gibraltar top base for overseas firms selling Irish motor cover,2016
Two former senior managers of Life Line Ambulance Service claim unfair dismissal,2016
Ireland’s Olympic rowers close in on their holy grail,2016
#WorldNews: Bill Cosby drops lawsuit against sexual assault accuser,2016
Cockroach ‘milk’ could be the superfood of the future,2016
Girl neglected by mother ate fish food out of hunger,2016
Gardaí and the AA appeal to drivers to exercise caution ahead of bank holiday,2016
#WorldNews: Erdogan’s crackdown leaves Turkey’s opposition torn,2016
US economic growth of 1.2% misses estimates,2016
Mayo looking for a bit more fire from their big guns,2016
GALLERY: Images of the Day selected by @b_fitzsimons -,2016
Liz Young out to perfect bump and run at Women’s British Open,2016
#WorldNews: PanDEMonium: Simon Carswell’s Democratic convention diary,2016
Court allows appeal in case of Anthony Kelleher whose wife refused to give evidence,2016
Bank holiday weekend will see ‘a lot of good weather’,2016
Mr Justice John MacMenamin says system serves neither State nor applicants,2016
Decision by grandparents not to alert gardaí or social services to abuse ‘was a grave error’,2016
Heavyweight CRH and airline stocks lift Dublin,2016
Whistleblowers accuse David Hall of ‘serious wrongdoing’,2016
"Court hears long-serving judge held in high esteem by barristers, gardaí and court staff",2016
Dublin public transport users face double disruption,2016
"David Marsh stole €76,000 from Limerick couple, duped friends out of €8,000 for UFC tickets",2016
Galway Races: Heartbreak City continues Donagh Meyler’s dream week,2016
Researchers claim substances in e-cigarette vapour are likely to be carcinogenic,2016
TSSA union will now ballot its members forindustrial action,2016
Irish Times Ltd makes operating loss of €1.1m,2016
Donegal’s attacking prowess likely to crush Cork’s dream,2016
Pensioner (69) pleaded guilty to 18 counts of rape and sexual abuse in 1970s in Cork,2016
Viktoria Curilla sued the National Maternity Hospital over her care at birth,2016
'LÉ James Joyce' is assisting Italian authorities with humanitarian operations,2016
#WorldNews: Dutch bus driver fired for playing Pokémon Go on motorway,2016
Irish motorists urged to be careful following deadly week,2016
European bank stress tests: What to watch for,2016
Cork man given eight years for assaulting wife released from prison,2016
#WorldNews: Indian couple axed to death over 20c debt,2016
US station uses Nintendo game in the hunt for people with outstanding warrants,2016
Eamonn Cumberton remanded in custody over fatal shooting of Michael Barr,2016
GALLERY: Air Corps commissioning. Photographs by @alanbetson -,2016
Parents say ‘love for this animal’ prompted name choice,2016
"Families have a duty to report sex abuse, says judge",2016
Supreme Court judge critical of ‘inefficient’ asylum process,2016
Pigeon fancier faces ban after admitting cheating in big race win,2016
Tribute as Circuit Court’s Judge Alison Lindsay retires,2016
Two men have been arrested following operation in the Blanchardstown area,2016
Blockbuster drug Humira’s sales drive AbbVie’s profit,2016
#WorldNews: Syrian maternity hospital hit by air strikes,2016
"Two years in jail for conman over €84,000 fraud",2016
Luas works and weekend matches will mean long delays for those travelling in Dublin,2016
"E-cigarette smoke contains new toxic chemicals, study says",2016
Colt Knost not happy after pin moved at US PGA Championships,2016
Dublin Bus pay dispute: Clerical staff reject 8% offer,2016
Anglo verdict: EY responds to trial judge’s censure,2016
Man who fathered two children with stepdaughter jailed for 12 years,2016
"Fr Fintan Monahan named Bishop of Killaloe as Martin Drennan, Seamus Freeman retire",2016
Severely disabled girl awarded interim payment of €2.4m,2016
Irish naval vessel rescues 155 migrants from Mediterranean sea,2016
Jockeys pay final tribute to ‘prince’ of racing JT McNamara,2016
Sinn Féin member was shot dead in 2006 following his exposure as an MI5 agent,2016
#WorldNews: Can America learn to love Hillary Clinton?,2016
#WorldNews: Austria extradites Paris attacks suspects to France,2016
Spanish couple want to call son Wolf but officials say no,2016
"#WorldNews: Voice of ‘Postman Pat’, Ken Barrie, dies aged 83",2016
Drug maker Merck shares rise following cancer treatment sales,2016
Evidence delay in case of Sunset House murder accused,2016
Consultant geriatrician calls for move away from potent anti-psychotic drugs,2016
#WorldNews: Florida confirms first locally transmitted Zika cases,2016
Police officer uses Pokémon Go to catch criminals,2016
"Cocaine worth €420,000 seized in Dublin",2016
Fred Forsey Jnr (45) was sentenced to six years in jail with the final two suspended,2016
Robbie Keane set to retire from international football,2016
Bank holiday traffic disruption: What you need to know,2016
Two former senior managers of Life Line Ambulance Service claim unfair dismissal,2016
Glen Dimplex workers vote to strike in row over pay,2016
Female passenger is seriously injured in collision on Kilcock to Enfield road on Friday,2016
China approves Anheuser-Busch InBev takeover of SABMiller,2016
"Two Catholic bishops retire, one new appointment made",2016
Man charged over Denis Donaldson inquiry granted bail,2016
Pope asks God to forgive ‘so much cruelty’ at former Nazi camp where 1.5m people died,2016
Former FG councillor loses appeal against corruption conviction,2016
Sanofi hunts acquisition as profit dips 8.7%,2016
Conference hears elderly rights infringed by overmedication,2016
Have you noticed anything different at Starbucks lately? -,2016
James Redmond (60) was found not guilty by reason of insanity of murdering Mary Dargan,2016
Pope Francis pays silent tribute on visit to Auschwitz,2016
Whistleblowers at David Hall firm seek court protection,2016
"Four of five homeless families agree to move, fifth refusing to engage, High Court hears",2016
Man who shot neighbour dead committed to hospital after insanity verdict,2016
Former INBS director loses bid to stop Central Bank inquiry,2016
Alternative accommodation found for Lynam’s Hotel families,2016
Rooney: José Mourinho has brought back winning mentality,2016
Two injured after car hits parked truck in Co Kildare,2016
Holders Dundalk will face Crumlin United in FAI Cup,2016
#WorldNews: Donald Trump responds to Clinton speech with Twitter salvo,2016
"Politicians ‘should speak to the women who have gone through it’, says Dr Lara Kelly",2016
History made as German golfer shoots 58 on,2016
‘My baby’s remains in a cardboard box’: Irish GP’s abortion story,2016
Energy supplier Vayu snapped up by Gas Natural Fenosa,2016
"Judge says transactions at heart of #Anglotrial were 'dishonest, deceitful and corrupt'",2016
Inside Politics is a daily briefing from the @IrishTimesPol team. Sign up now.,2016
Audi profits driven down by Volkswagen emissions scandal,2016
"#WorldNews: Two San Diego police officers shot, one suspect in custody",2016
PlayStation helps deliver surprise profit at Sony,2016
Bryan Cooper facing a month out after Galway fall,2016
Facebook tax bill over Ireland operation could cost $5 billion,2016
UK consumer morale posts biggest drop since 1990,2016
#WorldNews: Shock as Britain opts to review Hinkley Point nuclear plan,2016
Italy’s Monte dei Paschi gets rescue proposal from UBS,2016
Andy Reid forced to retire from football aged 34,2016
Two being held following attack on woman in parkland area on Thursday morning,2016
Barclays profits fall 21% with warning over Brexit implications,2016
"John Bowe, Willie McAteer, Denis Casey convicted of taking part in €7bn fraud",2016
Two men arrested in connection with Clondalkin sexual assault,2016
Analysis: signs of good momentum in BoI results,2016
Russia defy Olympics by holding ‘alternative games’,2016
Five things you need to know this Friday morning -,2016
Zlatan Ibrahimovic can emulate Eric Cantona at Manchester United,2016
Mark O’Brien is the only Irish person taking part in the relay to bring the torch to Rio,2016
Stout believer in the #Guinness brand via @IrishTimesBiz,2016
German retail sales dip on the month in June but rise strongly on year,2016
London estate agent blames Brexit for 42% profit drop,2016
Three former bankers to be sentenced over Anglo conspiracy,2016
The Morning Sports Briefing,2016
Aer Lingus owner IAG reduces full-year profit outlook,2016
#WorldNews: Clinton warns of ‘moment of reckoning’ for United States,2016
Number with private health insurance surges,2016
"800 released from debt, Merkel holds firm on refugees, Dublin hotel may become homeless hostel",2016
Bank of Ireland posts €560m profit for first half of 2016,2016
Dublin teen carries Olympic torch ahead of opening ceremony,2016
Five things you need to know today,2016
Man who used CIÉ field for 30 years loses case,2016
Lynam’s Hotel in Dublin centre city may become homeless hostel,2016
Bankruptcy case study: Fending off banks was ‘full-time job’,2016
Suicide deaths in North hit 318 – the highest on record,2016
Donegal near top of national fatality rates for road deaths,2016
Coveney blocks plans for 500 houses near Dunboyne,2016
Ireland’s young sailors make gains,2016
#WorldNews: Cyprus reunification talks given urgency by Turkey coup tension,2016
#WorldNews: Almost 800 released from debt after shorter bankruptcy,2016
#WorldNews: Squalid camp grows as migrants mass at Hungary border,2016
#WorldNews: Terror attacks: Merkel holds firm on refugee policy,2016
#WorldNews: Berlin Letter: Draconian public order looms via smartphone app,2016
Ardmore Studios continues comeback with second strong year,2016
"In Donegal, a few hard truths must be accepted on road safety",2016
John Maughan hails Tipp and Clare campaigns,2016
Ireland hockey team making history as they advance on Rio,2016
Dan Martin and Nicolas Roche to assess form in San Sebastián,2016
"Opinion: Pub car parks are full, drink driving is rising but county’s traffic corps is down 50%",2016
Mounting GAA concern over the decline in attendances,2016
John Allen: County players could be given a break,2016
Introduction of one-year bankruptcy term was a lifeline for a mortgage-troubled couple,2016
"Additional 97,000 join schemes, bringing total insured in Republic to 2.12m or 46%",2016
"Higher than average rate, with speeding drivers a particular problem in the county",2016
"Figures obtained by Detail Data show of suicide fatalities registered, 245 were male",2016
Supreme court appeal dismissed but CIÉ not to seek costs,2016
"Nama offers to facilitate sale of property, at centre of court dispute, to city council",2016
Minister wants zoning rescinded as homes would be ‘detached and distant’ from town,2016
"“It’s getting worse and July has been a very hard month,” says Shane Ross",2016
James Redmond killed his neighbour in her kitchen and attempted to kill her daughter,2016
US PGA: Big guns struggle as wind stumps late starters,2016
Christopher Bardin alleged he suffered tinnitus after incident in Montrose toilet,2016
Appeal court upholds decision requiring UPC owner to impose ‘three strikes’ policy on customers,2016
Schweinsteiger and Januzaj facing Man United exits,2016
Perry Wharrie serving 30 year sentence for part in smuggling attempt at Mizen Head,2016
"From @GenEmigration: ""It took three decades for me to feel ‘at home' in Montreal"" -",2016
Five deaths being investigated where fentanyls have been implicated,2016
Council applies to imprison John Paul Doyle who illegally moved into Longford house,2016
Google’s Alphabet joins Amazon in beating expectations,2016
#WorldNews: EDF approves Hinkley Point nuclear project in Somerset,2016
"Urgent action needed on road safety, says Minister",2016
Jack O’Connor says labour movement should aim to increase innovation,2016
#WorldNews: Syria’s Nusra Front breaks ties with al-Qaeda,2016
#WorldNews: US apologises for 14 civilian deaths in Iraq and Syria,2016
#WorldNews: Police were warned of Normandy attack but lacked details to act,2016
#WorldNews: Indonesia executes four drug traffickers by firing squad,2016
#WorldNews: Theresa May on diplomatic tour around eastern Europe,2016
#WorldNews: UN envoy urges US and Russia to work together to reduce fighting in Syria,2016
#WorldNews: Dutch police say surviving Red Army Faction members still active,2016
Cork lose out but still well in the tie after Belgian trip,2016
#WorldNews: Obamas become Clinton’s star prosecutors of case against Trump,2016
Man (60) found not guilty of murder by reason of insanity,2016
New research claims radiation from deep space can cause cardiovascular problems,2016
RTÉ employee settles action over toilet roll dispenser injury,2016
Tony Martin can send bookies to Heartbreak City,2016
Hopes high as Irish rowing team depart for Rio Olympics,2016
Dubai firm with alleged links to Quinns conspiracy can be sued here,2016
"Galway Races: Ladies first as hats, heels and dresses take over",2016
"Virgin must take steps on illegal music downloading, court rules",2016
Unions and Government discuss move as a way of tackling pay inequality in the industry,2016
Russia’s Olympic chief says team will be cleanest in Rio,2016
Man appeals conviction as €440m cocaine not meant for Ireland,2016
"JT McNamara, who had racing ‘in his blood’ begins final furlong",2016
Scientists find the disease in a fossil from South Africa dating back 1.7 million years,2016
"Unions need to change mindsets, Siptu leader claims",2016
Putting woes continue for increasingly frustrated Rory McIlroy,2016
Alert issued on drug ‘600 times more potent’ than morphine,2016
Father threatened with jail as family refuses to vacate home,2016
Authority highlights inadequate isolation facilities at St Vincent’s University Hospital,2016
"Moon astronauts face higher rates of heart disease, study says",2016
Ruby Walsh guides Clondaw Warrior to Galway Hurdle win,2016
GALLERY: Images of the Day selected by @b_fitzsimons -,2016
#WorldNews: Little hard evidence about effect of media coverage on aspiring jihadists,2016
"US PGA Diary: ‘It’s like putting in Stackstown,’ says Harrington",2016
Director disqualified after siphoning €1m from PayPal account,2016
"Iarnród Éireann staff to vote on strike action, result of Dublin Bus staff ballot due on Friday",2016
Four of five killed in two Donegal crashes not wearing seat belts,2016
Leona Maguire proving she can mix with the best at Women’s British Open,2016
Teacher talks explore restoration of allowances,2016
Shay Given retires from international football,2016
Directors and former directors ordered to file statements of affairs by September 21st,2016
"Insurer Axa fined €675,000 for consumer code breaches",2016
Oldest evidence of cancer discovered in foot bone,2016
"#WorldNews: Turkish coup plotters not tortured, says ambassador in Ireland",2016
Hiqa criticises infection control at liver transplant unit,2016
Louth County Council raises threat to welfare of birds posed by wires and bridges,2016
Fears of AIB branch closures in North and Britain,2016
Sponsored: A return to Honduras – the new recruits on the Kenco #coffeevsgangs project,2016
Ireland ‘almost a laughing stock’ in dealing with migrants and refugees -,2016
GALLERY: Ladies' Day at the Galway Races,2016
Irish worshippers brave the rain and conditions at World Youth Day celebrations,2016
Paddy McKillen’s Clarendon wins contract for Cork CIÉ site,2016
LIVE BLOG: Jimmy Walker lead the US #PGAChampionship as Rory McIlroy struggles  -,2016
Dubliner Eoin Daly given three-year suspended jail sentence,2016
Garth Brooks has ‘no plans’ to play Páirc Uí Chaoimh,2016
Rail commuters may face disruption as wage talks collapse,2016
Ruby Walsh finally claims Galway Hurdle on Clondaw Warrior,2016
#WorldNews: PanDEMonium: Simon Carswell’s Democratic convention diary,2016
Donegal left numb by two crashes in 20 hours claiming five young lives,2016
Ford warns of $1bn hit from Brexit,2016
"Deirdre Jacob (18) disappeared metres from her home in Newbridge, Co Kildare, in 1998",2016
Angling notes: Anglers association protests end of IFI’s freshwater trout production,2016
Several birds killed by flying into power lines every year -,2016
Catholic pilgrims bring a little piece of Ireland to Krakow,2016
Less than impressive City leave Guardiola with work to do,2016
Liquidator confirmed for charity Console by High Court,2016
Bengal crossbreed Bobby is ‘very lucky’ to be alive following washing machine incident,2016
Drug smuggler couldn’t give urine sample due to ‘stage fright’,2016
Planchart makes it a double for Andrew Slattery at Galway,2016
University of Limerick research shows smokers’ habit may cost them life-saving treatment,2016
Gardaí issue renewed appeal in Deirdre Jacob case,2016
#WorldNews: Corbyn sees off bid to stop him standing for Labour leadership,2016
"Eoghan Dunne (4) is partially blind, cannot walk or stand unaided and is fed through a peg tube",2016
The tale of Helene Mayer – Nazi Germany’s Jewish Olympic champion,2016
Cat survives being trapped in a 60C wash cycle,2016
Texas designer’s tourist attraction ‘celebrates five centuries of city’s maritime legacy’,2016
AIB to discuss restarting dividend payments,2016
Big Orange romps home to defend Goodwood Cup title,2016
The augmented reality stamps feature images of some of Ireland’s most scenic views,2016
Smoking dialysis patients less likely to get kidney transplant - study,2016
"#WorldNews: Germany is ‘at war’ with Islamist terrorists, defiant Merkel says",2016
Bryan Cooper hospitalised after Galway fall,2016
Boy left severely disabled over treatment delays receives €2.4m,2016
IMF warns on post-Brexit risks to Irish banking sector,2016
Former senior Sinn Féin official was shot dead in Co Donegal in 2006,2016
"Eric Kuhne, architect of Titanic Belfast visitor centre, dies",2016
Sky profits climb 12% but customer churn increases,2016
Tens of thousands gather at foot the Jasna Gora monastery in Czestochowa,2016
Dashcam footage sought in Clondalkin sexual assault inquiry,2016
Man due before court in relation to murder of IRA spy Denis Donaldson,2016
An Post releases new Wild Atlantic Way stamps,2016
#WorldNews: MH370 captain had Indian Ocean course plotted on home simulator,2016
Victim impact statement of Zoltan Sandro follows sentencing of Marta Herda,2016
Temperatures to reach 20 degrees with warmest conditions in north-west of country,2016
Fall fails to stop Pope Francis celebrating Mass in Poland,2016
Brother of harbour murder victim left heartbroken after death,2016
The five had discontinued their cases following Louise O’Keeffe Supreme Court case,2016
Marta Herda found guilty of murdering colleague in harbour drowning trial -,2016
Sunshine forecast for weekend – but good news ends there,2016
Sales up 35% at BT Group after EE purchase,2016
Court of Appeal ruling expected to have ‘unfortunate’ consequences for other cases,2016
Men who tried to resume actions over alleged abuse will not face costs,2016
Ryanair CEO’s overall pay packet jumps 33% to €3.2 million,2016
Marta Herda (29) was charged with the murder of Csaba Orsos (31) in Arklow,2016
Circuit Court judged not to have jurisdiction to make possession orders,2016
Norwegian Air row could damage EU-US trade relations - warning,2016
Des Cahill claims plans to bring Brooks and Adele to Pairc Ui Chaoimh being discussed,2016
AstraZeneca profit plunges on lower sales of cholesterol drug,2016
#WorldNews: North Korean seeks refuge in South Korean consulate – reports,2016
"Shell disappoints market as weak oil, BG deal costs hit profits",2016
The 18 pound explosive is believed to be of English origin and date from 20th century,2016
Woman found guilty of murder in harbour drowning trial,2016
DMS hiring 50 new staff in Dublin expansion,2016
#WorldNews: Senior Turkish generals resign a day after military cull,2016
Retail sales decline 5.8 per cent on a monthly basis,2016
#WorldNews: Bashar Assad offers amnesty to rebels who surrender to authorities,2016
Sam Allardyce blocked from giving Paul Clement England role,2016
Old bomb found in Kildare town under examination,2016
Regulator warns on ‘speculative’ CFD investments,2016
Cesc Fàbregas apologises for tackle on Ragnar Klavan,2016
Mayor ‘confident’ Garth Brooks will playCork gig in 2017,2016
"Volkswagen profit falls on scandal effects, lower sales",2016
"Irish Rail ‘moving the goalposts’ in work talks, says union",2016
"From @GenEmigration: 'Even our parents knew we'd be better off abroad', by @lynch_philip in Tasmania -",2016
Rockefeller fund takes stake in Mainstream’s African venture,2016
Inside Politics is a daily briefing from the @IrishTimesPol team. Sign up now.,2016
#WorldNews: Second attacker in French hostage killing identified,2016
Combination of Spring tide and bank holiday weekend will leave beaches totally exposed,2016
BNP Paribas revenues rise 2.2 per cent to €11.32 billion,2016
Manchester United expect to seal Paul Pogba deal within 48 hours,2016
Group of men understood to have attacked woman at a parkland area in Clondalkin,2016
Going to the beach this weekend? Beware of venomous Weever fish,2016
Samsung reports second-quarter profit of $5.1 billion,2016
Alleged sexual assault of woman by gang in Dublin investigated  #Clondalkin,2016
Two men and a woman died in the head-on collision in Co Donegal,2016
"Five things you need to know today, including: Obama rebukes Trump, the power of your nose and nurses leaving home:",2016
"Two men and one woman die in crash near Letterkenny, injured man taken to hospital",2016
The Morning Sports Briefing,2016
Alleged sexual assault of woman by gang in Dublin investigated,2016
"Barack Obama rebukes Trump, the power of your nose and Irish nurses leaving home",2016
Three people killed in head-on collision in Co Donegal,2016
AIB apologises for overcharging tracker mortgage customers,2016
George Pell’s office says ‘ABC has no licence to destroy reputation of innocent people’,2016
"The summer of science: keep kids busy with dinosaurs, robots and space mail",2016
Up to 50% of nurses hired under UK drive again take flight,2016
Guinness sales up 4% as Diageo sees other beer brands decline,2016
Sonia O’Sullivan: Atlanta ’96 turned my life on its head,2016
RT @IrishTimesLife Princess Khumalo: Direct provision does not define me. Via @NewToTheParish,2016
Five things you need to know today,2016
Rape survivor advises sexual assault victims not to wash,2016
Vatican treasurer reportedly under investigation over abuse claims,2016
"Judge says €4,500 a week to house troubled teenager is ‘daft’",2016
Leap pipes: All you need to know about this hazard,2016
AIB’s pre-tax profit falls to €1bn in first half of 2016,2016
#WorldNews: Obama rebukes Trump as ‘homegrown demagogue’,2016
HSE offers to house young autistic man in family’s garden,2016
DPP has publication ban extended in Dublin child care case,2016
Analysis: Recruitment and retention clash with pay policy,2016
Case study: ‘I just want the quiet qualities of life – a job and a safe place’,2016
Young homeless the fastest growing group among destitute,2016
Innovation Awards: Scriba,2016
No grants paid to households for lead pipe replacement,2016
GAA Statistics: 14 footballers just one card away from suspension - who are they?,2016
The rewild show: Aurochs 2.0 and other species to make a European comeback,2016
Cork City hoping to upset the odds in Genk,2016
"Cultural, structural, and conscious and unconscious bias all need to be tackled to reverse the trend",2016
