full_title,date
Greencore sales rise 4% in financial third quarter,2016
Jim McGuinness: Why Dublin and Kerry lead the chasing pack,2016
Five things you need to know today,2016
Hibernia says too early to assess Brexit impact on Dublin,2016
Mount Merrion planning refusal to be appealed,2016
Japan to miss FY2020 GDP target of 600 tn yen,2016
Anglo verdict: Witnesses praise bankers ahead of sentencing,2016
Kerry rape: why did Hussey carry out such a brutal attack?,2016
#WorldNews: Man kills 19 in knife attack at centre for disabled in Japan,2016
Dutch men and Latvian women are the world’s tallest,2016
Shannon to Dublin pipeline faces watertight opposition,2016
Schools may have to reduce teaching time for religion,2016
Demolition of O’Devaney Gardens to be completed,2016
#WorldNews: Michelle Obama steals the show at Democratic convention,2016
Five killed in crashes on Irish roads in 24-hour period,2016
Confident US PGA holder Jason Day looking to double up,2016
#WorldNews: Clinton camp blames pro-Trump Russians for cyberattack,2016
#WorldNews: PanDEMonium: Simon Carswell’s Democratic convention diary,2016
#WorldNews: French minister rejects allegations of Nice cover-up,2016
#WorldNews: Disillusioned Jeremy Corbyn backers deserve no sympathy,2016
#WorldNews: Turkey orders arrest of 42 journalists in rolling crackdown,2016
Amazon gets permission from UK to explore drone deliveries,2016
Marital rape remains extremely difficult to prosecute,2016
GAA boss acknowledges fall in championship attendances,2016
Hasanour and the importance of the draw at Galway,2016
Stephen Kenny believes Dundalk can go one better,2016
Cunningham to discuss Dublin future with county board chiefs,2016
Waterford’s Austin Gleeson battling a nasty ear injury,2016
Last remaining blocks of flats in Dublin complex to be razed for new development,2016
Mother and her 14-year-old son were among those killed in fatal incidents,2016
Psychology reports give no clues why Hussey broke into house and raped woman twice,2016
Supporters and family members speak in court on behalf of the three men,2016
"Maths, Irish and English to be prioritised under radical new curriculum proposals",2016
Irish people fail to make the top 10 for height in massive international study,2016
Paddy McKillen Jr and Matt Ryan want to build on site of former Kiely’s pub,2016
Analysis: Just two people have been convicted of the crime since it was made illegal in 1990,2016
The final part in the series on the Irish Water project examines criticisms of the plans,2016
"Leap card holders aged 4-18 go free on Dublin Bus, Luas and Dart until August 7th",2016
Whistleblower Yuliya Stepanova to appeal Olympic ban,2016
Revenue officials discover bags containing 17kg of drug in a lorry at Rosslare Europort,2016
Glorious Goodwood: Officials pursue Group One status for Lennox Stakes,2016
Criminal Assets Bureau and other units could be affected if lease deal proves elusive,2016
#WorldNews: Man kills at least 15 people in Japan knife attack,2016
"Woman left ‘broken, terrorised, waiting for my death’ after double rape in 2014",2016
Cocaine worth an estimated €1.2m seized in Co Wexford,2016
Children with Leap cards get two weeks’ free travel,2016
Case admitted to Commercial Court list after rejection of claims of delay by Templevara,2016
"Sam Allardyce: ‘Bring it on, hey lads. I’m hardened over many, many years’",2016
Galway Races get up and running with a Ruby Walsh winner,2016
Man jailed for 13 years for rape of women (73) in her Kerry home,2016
Doctor who confused ankle and elbow says ‘bloody price’ for Medical Council treatment,2016
"Watching TV a harmless habit? Wrong, study reveals seductive killer",2016
"Gardaí may have to move out of Harcourt Square HQ, court told",2016
#WorldNews: Merkel under pressure after Germany hit by fourth attack,2016
Receiver eyes possession of car park at Pavilion in Dún Laoghaire,2016
"Research based on sample group of over 86,000 people flags risk of ‘prolonged sitting’",2016
GPA’s position strengthened by new €6.2m deal,2016
Medical Council told gardaí of threats made by suspended doctor,2016
#WorldNews: Democratic convention begins in chaos as departing boss jeered,2016
"Issues such as uniforms, voluntary contributions likely to be subject of parents charter",2016
"Watching TV a harmless habit? Wrong, study reveals seductive killer",2016
Schools will be obliged to consult with parents on key decisions,2016
Swamp Fox defies draw to take Monday’s feature at Galway,2016
European country has 190 cases of mosquito-borne Zika infections at latest count,2016
Stoke City confirm signing of Joe Allen from Liverpool,2016
Dubliner was also a managing director of Guinness and chairman of Shelbourne FC,2016
Six PTSB mortgage customers awarded compensation,2016
"First Zika birth defect recorded in Spain, say authorities",2016
Gardaí believe fire began after teenagers gained entry to Douglas property,2016
#WorldNews: Israeli soldier defends shooting of wounded Palestinian,2016
GRA ‘disappointed’ at Government’s imposition of Fempi legislation on new recruits,2016
Senior executive takes Kerry Group to court over change to job,2016
Decline in oil prices weigh on global energy stocks,2016
England complete Old Trafford rout to level Pakistan series,2016
"Jury has three possible verdicts – guilty of murder, acquittal or guilty of manslaughter",2016
Former Labour Court chairman Finbarr Flood dies aged 77,2016
Manchester rivals left red-faced by fixture fiasco,2016
Shock and dismay at destruction of historic Vernon Mount in Cork,2016
"Images of the day, selected by @b_fitzsimons",2016
#WorldNews: Germans on edge and Merkel on defensive after attacks,2016
"No sign of waning zeal for extended purge during which over 60,000 people targeted",2016
Roberto Martínez heads Hull City managerial shortlist,2016
Officers target Belcamp House site as part of inquiry into Patrick Lawlor’s disappearance,2016
Garda group says pay cuts ‘punitive’ for young members,2016
Galileo Gold and The Gurkha to renew Ascot rivalry at Goodwood,2016
Central Criminal Court jury considers verdict in harbour drowning case,2016
Laurentia Racu said she lost a nail after a ‘heavy’ store door slammed on her hand,2016
Gardaí begin dig in search for missing Dublin man,2016
24-hour Coolock Flyefit gym evacuated at 2am after car driven through entrance,2016
Turkey orders arrest of 42 journalists in rolling crackdown,2016
English RFU agree eight-year deal with Premiership Rugby,2016
Facebook v Schrems: next round set for February,2016
"Student (25) loses €60,000 claim over broken finger",2016
77-year old lured his six-year-old niece to his home with the promise of biscuits,2016
Shay’s Short Game: Four way tie at the Ballyliffin Pro-Am,2016
Dublin gym damaged after car driven into doors and set on fire,2016
Clare man who sexually assaulted nieces given suspended sentence,2016
Naoufal Fassih in court on foot of Dutch arrest warrant on charges of money laundering,2016
Extradition request for man with suspected link to Kinahan gang,2016
GAA and GPA reveal new agreement worth €6.2m per year,2016
#WorldNews: Tycoon Philip Green accrued ‘cash beyond the dreams of avarice’,2016
Steve Hansen’s new contract not expected to alter Joe Schmidt’s thinking,2016
"#WorldNews: Independence still an option for Scotland, says Sturgeon",2016
Government’s jobseeker website jobsireland.ie down,2016
#WorldNews: German authorities disgree over whether Ansbach an Islamist attack,2016
‘Repeal the 8th’ mural in Project Art Centre in Temple Bar removed,2016
British PM keen to avoid ‘return to borders of the past’,2016
Charity links to opaque financial vehicles examined by regulator,2016
Ryanair responds to Brexit by shifting growth to Europe from UK,2016
Sam Allardyce On... The new England manager’s take on the big topics,2016
Tony Martin’s Pyromaniac open to run on Thursday,2016
Sanofi to add up to 40 jobs at Waterford plant,2016
High court rules fraudster Breifne O’Brien as a bankrupt,2016
VHI reports after-tax surplus of €45.5m for 2015,2016
Florida shooting: ‘The kid I was holding... he was 14-years-old that got shot’ #FortMyers,2016
"Man jailed for 10 years for threatening, assaulting and raping his wife",2016
Verizon to buy Yahoo's core business for almost $5bn,2016
#WorldNews: Nice attacker’s history of violence and aggression,2016
Sam Allardyce: ‘Far too early’ to know if Wayne Rooney will retain captaincy,2016
"Flood plans offer little ‘real solutions’, warns TD",2016
Galway races: The ordinary people dedicated to making their sport extraordinary,2016
Man to be sentenced for raping elderly woman at Kerry house,2016
Violent attacks will dent German business morale,2016
Female army captain wins action over blocked promotion,2016
"Philip Green responsible for BHS collapse, says UK report",2016
Cork software firm CoreHR announces 300 new jobs,2016
Florida shooting: Three people detained for questioning #FortMyers,2016
Baltusrol - The three key holes at this week’s PGA championship,2016
"UPDATE: Florida shooting: Two dead, 17 injured in gun attack on nightclub #FortMyers",2016
William Hill gives frosty response to Rank and 888 approach,2016
Three former bankers to be sentenced over Anglo conspiracy,2016
FAI say Lionel Messi will lead Barcelona out at the Aviva,2016
"European stocks rose, while oil held losses after sliding to the lowest close since May",2016
"#WorldNews: Florida shooting: Two dead, 13 injured in gun attack on nightclub",2016
Iseq boosted as Ryanair maintains full-year outlook,2016
Woman and 14-year-old son die in Galway road incident,2016
Guardian media group hit with record £173 million loss,2016
Jason Day’s first title defence doesn’t go to plan in Canada,2016
The Morning Sports Briefing,2016
Nintendo shares dive as company plays down Pokemon Go impact,2016
Hiscox considers setting up new EU arm to weather Brexit,2016
Can parents trust a disciplinary process overseen by teachers?,2016
Teachers guilty of misconduct face ban under fitness-to-teach,2016
The Manchester derby in China has been cancelled,2016
Eir launches €200 million secured notes tap issue,2016
Update: Bavaria is reeling from its fourth bloody attack in a week #Ansbach #Germany,2016
German documentary team ride Irish wild west,2016
"Fire badly damages historic Co Cork house #VernonMount, hat tip to @Brian_Mc_Mahon for pic",2016
Plan for delivery of smart electricity meters delayed,2016
Joe Mulholland not ready to hand over reins of summer school just yet,2016
State agencies audited over access to phone records,2016
Mortgage arrears in Ireland fall by almost a fifth,2016
HSE unaware of more senior executive links to businesses,2016
Irish scientist speaks by live link from 20m below sea surface,2016
Five things you need to know today,2016
Shannon to Dublin pipeline: An Irish water dilemma,2016
Proposed Dublin family court complex under threat from rezoning,2016
Consumer queries: New EU roaming caps cause confusion,2016
Smurfit Kappa likely to report strong results next week,2016
Age no longer a barrier for top-class players,2016
Four kinds of pesto put to the testo,2016
Ken Early: Manchester United a victim of their own financial might,2016
@DerekinBerlin reports on latest attack in #Germany as Syrian refugee blows himself up,2016
Rare 12th century kite brooch found in Connemara,2016
More refugees to arrive in Ireland as scheme ‘operational’,2016
England’s problem a lack of wit on the pitch,2016
UK lawyers seek to join Irish roll after Brexit,2016
Nicky English: Galway show lesson learnt from Leinster final defeat,2016
"Lives “put on hold” by court delays, divorce solicitor says",2016
Ryanair profit growth ‘modest’ at 4% in first quarter,2016
Kirby and Kelly provide ideal soundtrack to Froome’s win,2016
Splitting couples wait 12 months for court date,2016
Punters’ fingers crossed for Chadic and Robbie McNamara,2016
"Argentina: The Irish priest, ex-minister and $9m in a convent",2016
Eileen Battersby: Irish equestrian talent feted everywhere but here,2016
#WorldNews: Ill-informed Munich tweets were a dream for Isis propaganda,2016
#WorldNews: Ali David Sonboly spent a year planning Munich attack,2016
#WorldNews: Germany: Explosion kills one in town of Ansbach,2016
Tyndall National Institute reports revenues of €31.6m,2016
Downwardly mobile: the plunge in standards of living,2016
Dermot Weld willing to give up Galway Races crown,2016
Galway and Waterford eagerly grasp their second chance,2016
Angling Notes: Inland Fisheries closing down three of four fish farms,2016
Male boxers at Rio will compete without headguards,2016
Russian athletes escape blanket ban from IOC,2016
Davy Fitzgerald to take time out before deciding his future,2016
Fire crews tackle blaze at historic house Vernon Mount in Cork,2016
Jhonattan Vegas rolls dice to win Canadian Open by one stroke,2016
Chris Froome now up with greats after third win in France,2016
IOC’s Russia decision makes for a ‘sad day for clean sport’,2016
Handy Guide to Sport on Television this Week,2016
Waterford’s Derek McGrath pleased with a job well done,2016
Man dies in suspected accident at clay pigeon shooting club,2016
Motorbike passenger killed in Sligo crash,2016
Conor Purcell strikes it big on debut senior year,2016
Stepanova banned as IOC clears way for Russians,2016
Amateur heroes draw Sunday crowds,2016
Paul Broadhurst wins his debut British Senior Open at Carnoustie,2016
Man’s body found on Carrauntoohil in Co Kerry,2016
Dan Martin finishes ninth overall in Tour de France,2016
Pakistan spared the follow-on but England remain on course for victory,2016
Tipp beat Derry to qualify for first All-Ireland quarter-final,2016
#WorldNews: Munich attack: City reels from night of terror and bloodshed,2016
"No indication machete attack in Germany was linked to terrorism, say police -",2016
Verizon to announce $5 billion deal to buy Yahoo on Monday,2016
#WorldNews: Leaked emails disrupt plans for Democratic display of unity,2016
#WorldNews: Tory anger over reported possible compromise on migration,2016
Galway hit Clare with the price of Leinster final redemption,2016
Portmarnock’s Conor Purcell claims South of Ireland title,2016
"RAF Red Arrows draw 90,000 to Bray Air Display",2016
Sky’s the limit as Chris Froome wins third Tour de France,2016
GALLERY: Bray Air Display #BrayAirShow -,2016
"A Syrian refugee has killed a woman with a machete in southwest Germany, a police spokesman has said -",2016
Drinks lobby calls for 15% cut in alcohol tax in next budget,2016
#WorldNews: Maureen Dowd: Trump revels in own version of dystopia,2016
#WorldNews: Purge escalates of suspected coup backers in Turkey,2016
Mixed martial arts club Kyuzo keeps tight grip on reality,2016
Simon Boylan in Mexico: 'The Ireland I visit now is not the same place I left behind' -,2016
Tony Martin willing to bring Pyromaniac case to High Court,2016
Seen and heard: what the Sunday newspapers are reporting,2016
#WorldNews: Kabul bombing marks change of strategy by Islamic State,2016
Buoyant Banner book their place in the last eight,2016
#WorldNews: Woman ‘killed’ in machete attack in southwest Germany,2016
Failed insurer’s Irish agent to refund some premiums to motorists,2016
Revenue takes aim at opaque financial special purpose vehicles,2016
Lewis Hamilton wins Hungarian Grand Prix to top driver standings,2016
Under-par Waterford get past Wexford to set up clash with Cats,2016
Celtic sign Kolo Toure on one-year deal,2016
Manchester United increase bid for Paul Pogba to €110m,2016
Russia will not face a blanket ban from competing in the Rio Olympics -,2016
Graves condition – An Irishman’s Diary about a premature obituary from 1916 -,2016
"Regenerating Ballymun: new aspirations, old problems? by @OliviaKellyIT -",2016
José Mourinho hoping to get players ‘home safely’ after chaotic China tour,2016
I just have a few questions about rape culture. . . -,2016
Limerick minors ease past Wexford to set up Dublin clash,2016
LIVE BLOG: Waterford are about to take on Wexford in Thurles in their All-Ireland hurling quarter-final -,2016
Shane Lowry: ‘I want to put the last three weeks behind me’,2016
"The man who killed nine people in Munich bought his gun on the internet, the Bavarian state crime office has said -",2016
#Munich shooting: Gunman ‘planned attack for a year’ -,2016
European Tour planning on six hole professional events,2016
Healy-Raes criticised for attending funerals of people they do not know -,2016
#WorldNews: At least 14 feared dead in suicide bombing in Baghdad,2016
Russia facing Olympic judgement day as IOC decides fate,2016
#WorldNews: People spend night in cars as queues to Dover continue,2016
#WorldNews: Syrian government air strikes put four hospitals out of action,2016
Longford earn valuable point but remain rooted to the bottom,2016
"'When you balance things up, why would we go back to Spain? For the sun? Life isn’t just about the weather.'",2016
Brandt Snedeker takes one shot lead into final round in Canada,2016
Manchester United plane arrives in Beijing after getting ‘lost’,2016
Inside Politics is a daily briefing from the @IrishTimesPol team. Sign up now.,2016
Brian Boyd: The petulant adult-children of Generation Snowflake have a point,2016
"Lack of empathy, not Isis, is the thread that links Nice and German train killers",2016
#WorldNews: G20 will use ‘all policy tools’ to lift growth as Brexit weighs,2016
Kerry councillor defends calim that “even ISIS” would have spared a Kerry holy well from demolition,2016
I’m not an emigrant who pines for Ireland; I’ve made another home abroad,2016
"#WorldNews: Anger, mourning in Afghanistan after Kabul suicide attack",2016
#WorldNews: Candlelit vigils held in Munich to remember victims of attack,2016
Friendly neighbours Clare and Galway evolving into adversaries,2016
Vladimir Putin and the White House condemn the #Kabul bombing -,2016
Nico Rosberg’s Hungarian Grand Prix pole under investigation,2016
Irish youngster scores for Celtic but Leicester maintain winning momentum,2016
Dan Martin set to finish in ninth place overall in Tour de France,2016
#WorldNews: Clinton and Kaine round on Trump at Miami rally,2016
Tireless Podge Collins picked to go from the start for Clare hurlers,2016
Joe Root’s mammoth innings helps England dominate Pakistan,2016
Console phone bill had not been paid for 12 months,2016
Tipperary join Clare in first ever quarter-final after thrilling win,2016
With a clenched fist David Moyes celebrates Sunderland win,2016
#WorldNews: Florida healthcare network accused of $1bn fraud,2016
Highland Reel takes King George VI And Queen Elizabeth Stakes at Ascot,2016
Afghanistan’s interior ministry says the death toll in the #Kabul suicide bombing has risen to 80  -,2016
Clare sail into a first ever All-Ireland football quarter-final,2016
Several staff suspended after illegal drugs found in ambulance,2016
"#WorldNews: Floods in China leave more than 150 dead, 100 missing",2016
Chris Froome set for third Tour de France title after penultimate stage,2016
#WorldNews: Munich shooting: What we know so far,2016
The Denis O’Brien dossier: what happened to the USB memory stick?,2016
A game of two halves: The Olympics' filthy underbelly -,2016
Paul Pogba ‘is not worth £86 million’ says Paul Scholes,2016
Site off Malahide Road searched for man missing for 12 years,2016
Kolo Toure arrives in Glasgow for Celtic medical,2016
#WorldNews: Welsh teenagers injured after bus crashes in France,2016
"At least 61 killed in Kabul bombing, public health ministry says -",2016
At least 29 dead as Islamic State claims responsibility for suicide bombing in Kabul -,2016
#WorldNews: ‘At least 10 killed’ in explosion at Kabul protest,2016
"#WorldNews: Turkey’s Erdogan orders closure of more schools, extends detention period",2016
Wexford’s new Model army provide reasons to be cheerful,2016
