full_title,date
#WorldNews: Germany attacks: extra security promised as shock remains,2016
#WorldNews: Terror attacks: Pressure mounts on European leaders,2016
#WorldNews: US military opens formal inquiry into air strike in Syria,2016
#WorldNews: Humanising Hillary: Selling a public figure to the public again,2016
#WorldNews: Pope Francis says terror attacks show that ‘world is at war’,2016
#WorldNews: Tánaiste ‘concerned’ about Trump’s election rhetoric,2016
#WorldNews: European Commission puts pressure on Poland over courts,2016
#WorldNews: Clinton would seek talks on Brexit fallout if elected,2016
#WorldNews: France church attack: tensions mount in town after priest killing,2016
National Lottery launches automated Twitter service,2016
How to draw more women into Stem,2016
Olivia Mehaffey and Leona Maguire to showcase Major talent,2016
Galway Races: Pyromaniac can remain centre stage in feature,2016
US PGA preview: Rory McIlroy a man on a mission,2016
"By ‘rewilding’ Europe – assisting the return of species such as bison, deer and wild horses – it is hoped that...",2016
Conor Murray braced for new beginning with Munster,2016
Managing the dream of sucess in women’s GAA,2016
Are the kids getting bored? Here’s a handful of ways to keep their minds nourished,2016
Young man is in care in the UK but is due to be discharged at weekend as funding for placement is ending,2016
"As long as potential for charges is realistic, restriction will continue, says judge",2016
"Annual spend of €250,000 is higher than cost of Eton College, says Judge Patrick Durcan",2016
"Lewis Davis has stayed in numerous hostels, some of which he describes as ‘horrific’",2016
"Homeowners in line for financial aid of up to €4,000 for removal of hazardous piping",2016
"With over 630 vacancies the Government is to offer permanent jobs to 1,500 graduates",2016
Figures indicate almost 700 young adults in emergency lodging last month,2016
Woman’s husband was not prosecuted because vital evidence of attack was lost,2016
Only 90 recruited in push but Government to offer permanent jobs to graduates,2016
Solution is to replace lines and Irish water is set to spend €370m over the next decade,2016
Tony Kavanagh says he contracted superbug due to poor hand hygiene at St Vincent’s hospital,2016
Mark Russell took action against business partner over duplicate Iron Throne,2016
Scientists have discovered a microbe in some noses that can kill dangerous bacteria,2016
Government makes several judicial recommendations and appoints new HEA chair,2016
MRSA case study: ‘I was on fire. The pain was intolerable’,2016
"Five families can remain in Lynams while alternative housing is found, court hears",2016
Heather Clatworthy (34) is the first swimmer in almost 90 years to cross 13-mile channel,2016
Solicitor for doctor cites technical problems with Skype line from Nigeria,2016
"Human nose can help kill superbugs, research claims",2016
James McCarthy back training with Dublin footballers,2016
One in 40 people living in Dublin is a millionaire,2016
US PGA Diary: Why Pádraig Harrington is going for Olympic gold,2016
#WorldNews: Turkey shuts down more than 130 media outlets,2016
"‘Game of Thrones’ replica dispute is resolved, court hears",2016
Waterford end 22 years of Under-21 hurling hurt,2016
Minister Richard Bruton names former head of Royal College of Surgeons as chairman,2016
Albert Reynolds’s daughter nominated as High Court judge,2016
Markets wrap: PTSB surge lifts Irish financial stocks,2016
Christopher Bardin says he has suffered tinnitus in his left ear following the accident,2016
Donagh Meyler guides Lord Scoundrel to Galway Plate win,2016
Galway races: Simple pleasures keep Ballybrit magic alive,2016
#WorldNews: Donald Trump accused of backing Russian ‘espionage’,2016
#WorldNews: Islamic State posts video of ‘Normandy attackers’,2016
Facebook fails to show up for seventh tax summons from IRS,2016
Homeless families can stay in Nama hotel until end of August,2016
Members of public can view ship moored at Sir John Rogerson’s Quay,2016
#WorldNews: US lottery winner invested money in crystal meth,2016
Mother of two completes Irish sea swimming challenge,2016
#WorldNews: Catalan independence parties approve blueprint for secession,2016
RTÉ 2fm and Today FM continue to shed listeners,2016
Dozens of bags containing used needles and other waste discovered during city works,2016
Fitness inquiry into doctor who left her post adjourned,2016
New board Higher Education Authority given added business focus,2016
Iarnród Éireann says nine Dart trainees being prevented from completing training,2016
#WorldNews: PanDEMonium: Simon Carswell’s Democratic convention diary,2016
GALLERY: Images of the Day selected by deputy picture editor @alanbetson -,2016
RTÉ employee sues over toilet roll dispenser that struck his head,2016
"Luas workers find bags of syringes, hazardous waste in Dublin",2016
Irish founder of Argentina’s navy remembered as tall ship sails into Dublin,2016
High Court had decided former justice Barry White could resume practice as a barrister,2016
Frances Fitzgerald may appeal ruling on retired judge,2016
Unions accused of urging staff not to train new rail drivers,2016
Boston University research discovers Great Red Spot drives unusually hot atmosphere,2016
#WorldNews: EU institutions ‘cool off’ for recess as fiery debates loom,2016
Lord Scoundrel captures Galway Plate for Gordon Elliott,2016
Dave Hannigan: Justin Gatlin not coming back with saintly virtues,2016
Hurricane three times size of Earth behind Jupiter’s heat,2016
Marta Herda is accused of murdering colleague by driving into harbour where he drowned,2016
Bill Clinton’s convention speech made Hillary human again,2016
Sugar tax on fizzy drinks could encourage cross border ’gray trade’,2016
Jason Day ‘running on empty’ ahead of US PGA,2016
New chief executive is a barrister and former head of the Equality Authority’s legal section,2016
#WorldNews: Freddie Gray prosecutors drop charges against officers,2016
Darren Clarke names Sam Torrance as Ryder Cup vice-captain,2016
Leigh Griffiths the saviour for Celtic with crucial away goal,2016
Ciarán Murphy: Football championship trumping hurling in every way,2016
"David Corcoran who punched cyclist on footpath ordered to pay €3,900 compensation",2016
"Personal Finance Q&amp;A: We want to buy a house, but when is the best time?",2016
Terms agreed to allow Quinn case to be adjourned,2016
#WorldNews: Turkish crackdown on press continues with journalists’ arrest,2016
Free Legal Advice Centre appoints Eilis Barry as CEO,2016
Sean Carraher was convicted of ‘defamatory’ online posts about Sgt Conor Gilmartin,2016
Gonzalo Higuain move shows grotesque transfer fees show no signs of letting up,2016
"Get Inside Politics: A morning email on Tuesday, Wednesday and Thursday from our political staff. Sign up now.",2016
What will Longford’s Center Parcs be like when completed?,2016
Executive who strangled cyclist spared criminal record,2016
New agreement aims to address the ‘growing problem’ of illegal hare-coursing,2016
‘Whistleblower’ jailed for claiming garda was corrupt,2016
Jury in Arklow murder trial to continue deliberations Thursday,2016
Sponsored: A return to Honduras – the new recruits on the Kenco #coffeevsgangs project,2016
Family and friends pay tribute to the former Labour Court chairman at his funeral,2016
#WorldNews: Pope Francis says terror attacks show that ‘world is at war’,2016
Home winners thin on the ground in early stages at Galway,2016
ISPCA joins with Government to tackle wildlife crime,2016
#WorldNews: Reports of explosion near migration office in Germany,2016
Luas Cross City works mean restrictions and diversions will be in place in the city centre,2016
Darragh Ó Sé: Injury-time an x-factor that could decide Sam’s destination,2016
Statue of Francis Ledwidge unveiled at Richmond Barracks,2016
The Gurkha flashes home to take Sussex Stakes at Goodwood,2016
Central Bank sells further €500m of Anglo-linked bonds,2016
"‘When this was first mooted people said this is an April fools’ joke’, says Kevin Moran",2016
Gayle Killilea Dunne fails to get asset transfer case halted,2016
Dublin faces ‘significant’ traffic disruption over bank holiday,2016
Manchester City confident of signing John Stones,2016
"Jonathan and Patrick Dowdall charged with false imprisonment, assault and threats to kill",2016
Former Sinn Féin councillor and father charged over death threats,2016
"#WorldNews: John Hinckley jnr, who tried to kill Ronald Reagan, freed by judge",2016
Finbarr Flood remembered as ‘highly principled’,2016
‘Unnameable’ Islamic State atrocity stirs fears of escalation,2016
Vladimir Putin: Russian athletes are victims of ‘discrimination’,2016
One in 40 people living in Dublin a millionaire,2016
State Street pays $383m to settle allegations of overcharging,2016
Center Parcs holiday village project a ‘dream’ for midlands,2016
Ross Allen found guilty of manslaughter for his part in killing of Christy Daly in 2013,2016
The main threat to the future of the Olympics: Who actually wants to hold them?,2016
Jim Gavin confident James McCarthy will be fit for last eight,2016
Court of Appeal rules wife of Brian O’Donnell can proceed to contest trespass injunction,2016
"Ciarán Hancock: A good year for Irish banks, but certainly not a great one",2016
Man who kept lookout while father shot to death jailed for eight years,2016
"#WorldNews: Japan knife attack suspect shows no remorse, say police",2016
Planned Boston flights from Cork and Shannon delayed until next year,2016
Mary O’Donnell ‘entitled to argue’ Gorse Hill right of residence,2016
#WorldNews: Normandy attack: France’s Hollande meets religious leaders,2016
Fiat Chrysler under investigation by US authorities,2016
#WorldNews: Why security experts think Russia was behind DNC breach,2016
Journalists are getting younger but loss of experience brings problems,2016
"Lack of CCTV recording leaves both parties vulnerable to false accusations, says judge",2016
Russian Olympics team continues to take shape with fencers declared eligible,2016
#WorldNews: French church killer Adel Kermiche: ‘A ticking time bomb’,2016
Week-long cabin crew strike set to cost Air France €40m,2016
Producers apologise after character carrying hot drinks slips on paper covered in Arabic script,2016
Teams to be allowed an extra substitute in FA Cup's latter rounds,2016
Judges should not return to work as barristers,2016
Social welfare interviews behind closed doors ‘not standard’,2016
There will be over 500 lodges and apartments and a glass-roofed swimming complex,2016
Zinedine Zidane hints at Real Madrid interest in Paul Pogba,2016
Dispute concerns delays by HSE in implementing evaluation of workers’ roles,2016
Peugeot posts record earnings despite sales dip,2016
PSNI appeal for anyone who was in Regent Street area Tuesday night to come forward,2016
Fireman Sam ‘Koran trip’ episode pulled from streaming site,2016
"State to buy 5,000 acres in Dublin mountains from Nama",2016
Michel Barnier appointed chief Brexit negotiator for EU,2016
Circuit of Ireland Rally cancelled for 2017,2016
Payments to barristers employed by the State rose to €14 million last year,2016
What will Longford’s Center Parcs be like when completed?,2016
UK GDP picks up pace in second quarter,2016
"Some 30,000 hospital support staff to ballot for strike action",2016
"An Bord Pleanála approves plans for €232m holiday village, with number of conditions",2016
"Court of Appeal leads to rise in legal fees, says DPP",2016
Brian Boyd: Why I sometimes pretend that I am not Irish on my holidays,2016
Jack McHugh had been visiting a relative in Munich last week when incident took place,2016
Center Parcs granted permission for Longford holiday village,2016
"ITV sees ad revenues ahead of market view, to cut costs",2016
Irish teenager (16) dies after swimming accident in Germany,2016
Deutsche Bank warns of deeper cuts after quarterly revenue drop,2016
European Commission ‘to begin arbitration process’ to break impasse over planned route,2016
Three arrested over ‘suspicious’ death of man in Newtonards,2016
Irish Water to spend €370m replacing lead pipes,2016
Inside Politics is a daily briefing from the @IrishTimesPol team. Sign up now.,2016
GlaxoSmithKline invests £275m in UK despite Brexit vote,2016
#WorldNews: Dozens killed or wounded in Syrian bomb attacks,2016
Men aged in 40s and 20s dead following two-vehicle collisions,2016
Five things you need to know today -,2016
The Morning Sports Briefing,2016
Air France-KLM says militant attacks hitting revenue,2016
Two men killed in separate crashes in Kildare and Meath,2016
Cork Chamber welcomes move to end Cork-Boston flight row,2016
Compulsory purchase order was not sought on 18th century property gutted by fire,2016
Airbus Group hit by €1.4bn in charges in second quarter,2016
"BASF’s quarterly profit down on weak oil, crop chemicals units",2016
GPA deal shows heavy burden on GAA players,2016
Darragh Ó Sé: Injury-time an x-factor that could decide Sam’s destination,2016
Tullow back in profit as seeks to raise production,2016
Cork council defends decision not to buy Vernon Mount House,2016
Dublin Rape Crisis Centre line sees surge in first-time callers,2016
Smurfit Kappa raises dividend as earnings grow 8%,2016
"Clinton makes history, France warns of ‘war of religions’, Irish Water to spend €370m",2016
Sailor in capsized yacht rescued after activating location device,2016
Five things you need to know today,2016
Irish Water to spend €370m replacing lead pipes,2016
Irish Water will replace lead pipes of non-bill payers,2016
Scouts help asylum-seekers adapt to life in Ireland,2016
Irish profit of €7.66m for engineering firm Jacobs,2016
Patients waiting for endoscopies to be fast-tracked,2016
Critics put fire in bellies of Galway ahead of quarter-final clash against Tipp,2016
#WorldNews: Hillary Clinton makes history in becoming Democrat nominee,2016
Carlton site permission gets five-year extension,2016
IOC’s ‘spineless’ attitude proves last straw for disillusioned Hartmann,2016
#WorldNews: Normandy attack: France aims to prevent ‘war of religions’,2016
#WorldNews: ‘Unnameable’ Islamic State atrocity stirs fears of escalation,2016
#WorldNews: Hillary Clinton secures Democrat presidential nomination,2016
Most of Shannon Airport’s profits wiped out by €2m pension payment,2016
Michael Dwyer’s mother criticises Bolivian government,2016
Rory McIlroy hungry to end ‘drought’ in Majors,2016
Horse racing industry mourn death of JT McNamara,2016
"Galway Festival: If Riches doesn’t fire, Carberry can pounce on Killer Crow",2016
US PGA Championship: Shane Lowry eyeing the big prize,2016
Juventus sign Napoli striker Gonzalo Higuain for €90m,2016
Caroline Dwyer expresses her ‘disgust’ during trip to Bolivia to investigate son’s murder,2016
Limerick city water supply to be treated with a chemical to lessen lead later this year,2016
Utility will also allocate €78m to combat lead contamination as part of new plan,2016
Investment of €1m in outsourced tests set to benefit those waiting a year or longer,2016
Development of shopping complex involves demolition of Moore Street ‘battlefield site’,2016
New programme is ‘showing the way’ by connecting Irish youth and refugees,2016
Centre’s annual survey notes a ‘resurgence’ in the reporting of childhood sex abuse,2016
Man found in water clinging to vessel 30km off Carnsore Point,2016
"#WorldNews: ‘Multiple’ bodies found at house near Phoenix, Arizona",2016
Pep Guardiola closes in on £40m Leroy Sané,2016
Former Sinn Féin official was killed by Real IRA after it emerged he was an M15 informer,2016
Two men arrested over Denis Donaldson murder,2016
Roddy L’Estrange: Blinking lights and other revelations for Vinny,2016
Apple sells more iPhones than expected in third quarter,2016
Dundalk trail Bate Borisov after away leg but are still in the tie,2016
Galways falls silent as jockeys and stable staff remember JT McNamara,2016
Mamadou Sakho’s Liverpool future in doubt after defender sent home from US tour,2016
#WorldNews: Sanders struggles to unite his ‘political revolution’ behind Clinton,2016
"Since the scheme was launched, more than 1,200 loans have been drawn down",2016
One of the attackers who killed an elderly priest in #Normandy was wearing an electronic surveillance tag -,2016
Galway Festival: Creggs Pipes moves to another level with fourth successive win,2016
Convicted money launderer brought case after officers damage home during search,2016
Credit union loan scheme to low-income families to be expanded,2016
"Adel Kermiche (19) who had been under close surveillance identified as one of #Normandy attackers, prosecutor says -",2016
'We must be merciless' says former president Nicolas Sarkozy #Normandy -,2016
"#WorldNews: US exile Fethullah Gulen directly involved in coup, says Turkish PM",2016
'They filmed themselves. It was like a sermon in Arabic around the altar' #Normandy -,2016
Study of 750 food paintings from the past five centuries,2016
#WorldNews: Lone wolf attacks raise the tempo of terror in Europe,2016
Healthcare and consumer stocks boost European markets,2016
It was a Glorious Goodwood for James McDonald and Dutch Connection,2016
Italy races to secure privately-backed bailout of Monte Paschi,2016
Fitness-to-practise inquiry hears ophthalmologist presented ‘fabricated’ documents to defer exam,2016
#WorldNews: Democrats play down claims of party disunity after chaotic scenes,2016
John Condon fails in High Court bid to overturn decision,2016
#WorldNews: Murder of French priest exposes vulnerability of pastoral carers,2016
Russian athletes in Rio - who’s in and who’s out?,2016
"Images of the day, selected by @b_fitzsimons",2016
Drug dealer loses compensation bid after gardaí ‘wrecked’ house,2016
IFA president urges State to tackle ‘income volatility’ due to Brexit vote and low prices,2016
"Think you’re an oil painting? You need bread, meat, sausages and more bread",2016
#WorldNews: Muslim leader Ali Selim urges media to avoid linking attacks to Islam,2016
Most primary schools typically spend up to 2½ hours teaching faith formation,2016
Brewer AB InBev raises offer for rival SABMiller after Brexit,2016
#WorldNews: PanDEMonium: Simon Carswell’s Democratic convention diary,2016
Doctor guilty of professional misconduct over sick certs,2016
Farmers want extra time to pay tax bills due to ‘income crisis’,2016
Draft proposals to reform teaching hours for religion draw mixed response,2016
Road Safety Authority calls for drivers to ‘return to basics’ after 500 arrests in July,2016
Brexit will have worse affect on North than UK,2016
Solicitor with ‘very bad record’ must work under supervision,2016
#WorldNews: Bernie Ecclestone’s mother-in-law ‘kidnapped’ in Brazil,2016
"Iarnród Éireann must agree to reduce hours for train drivers, NBRU and Siptu warn",2016
Concern as road deaths and drink-driving arrests rise,2016
As expected Portstewart will host the 2017 Irish Open,2016
"#WorldNews: Murdered by Islamic State in his Normandy church, who was Fr Jacques Hamel?",2016
Ryan Bastin hit on head by wing mirror as he crossed road outside grandmother’s house,2016
Gibraltar insurer ‘hopelessly insolvent’ as Irish claims face liquidator,2016
Railway unions threaten industrial action ahead of talks,2016
Dublin v Donegal/Tyrone v Mayo potential double-header may cause ticket deficit,2016
Significant Irish contingent involved in first solar-powered round-the-world flight,2016
Examiner appointed to Dobbins restaurant and Leixlip hotel,2016
Elderly Catholic priest forced to kneel before being killed by ‘two soldiers of the Islamic State’ in #Normandy.,2016
"#WorldNews: World View Podcast: Putin admired at home, ‘demonised’ abroad",2016
"Victim says he blames rapist father, not woman who is facing sentencing for cruelty",2016
Medication included pills for treating Alzheimer’s disease and for thinning blood,2016
Quinn family seek to ease ‘hugely oppressive’ freezing orders on assets,2016
#WorldNews: Harrison Ford ‘could have been killed’ on Star Wars set,2016
Gonzalo Higuain on verge of joining Juventus - Sky Italy,2016
Irish aircraft leasing firm buys three Boeing Dreamliners,2016
Blathnaid Morrison left with visible scar following incident in Clondalkin,2016
Priest ‘forced to kneel’ before being killed at #Normandy church -,2016
Brendan Rodgers impressed by young Irish centre back Eoghan O’Connell,2016
"Victim was sleeping beside her husband and toddler when she was attacked, court heard",2016
British bank warns customers it could start charging for deposits,2016
Boy left with severe brain injury after crash awarded €5m,2016
Solar Impulse 2 flight ‘shows need to alter energy use’,2016
Marta Herda accused of killing man by driving him into sea at Arklow in her car,2016
"Damages of €40,000 for girl who cut forehead in creche",2016
Market traders fined for selling prescription drugs from stall,2016
Alan Patton faces a count of arson with intent to endanger life,2016
Boy tells court he does not blame mother for abuse he suffered,2016
Optinergy to create 50 new jobs following acquisition,2016
Four female lecturers alleging gender discrimination in a competition for promotion,2016
Apple earnings tonight: what to expect,2016
#WorldNews: Biggest danger Japan faces from latest attack is overreaction,2016
Jail for man who raped nephew’s wife at caravan park,2016
Police say one person has been detained in the investigation as Islamic State claim #Normandy church attack,2016
"Holiday Village to create 750 jobs during construction phase and 1,000 permanent posts",2016
Sponsored: A return to Honduras – the new recruits on the Kenco #coffeevsgangs project,2016
Kenny and May agree they do not want to see ‘borders of past’ return -,2016
Belfast man in court accused of setting fire to man’s sleeping bag,2016
Judge orders preliminary hearing in NUIG discrimination case,2016
Decision follows decision by Minister for Health to end permanent prohibition,2016
How Maser’s #Repealthe8th mural achieved its objective through being erased -,2016
Jury resumes deliberations in harbour murder case,2016
"#WorldNews: New Zealand vows to wipe out rats, other invasive predators",2016
Private equity firm KKR’s earnings beat forecasts,2016
Martin Stokes (25) sentenced to 10 years in prison for attack on child in Co Westmeath,2016
New drugs deliver for Eli Lilly,2016
Gay man drops legal challenge to blood donation ban,2016
Judge says he was satisfied the prosecution case did not establish the offence of coercion,2016
Arsenal have €35 million bid for Alexandre Lacazette rejected,2016
"Normandy church attackers claimed allegiance to Isis, says Hollande -",2016
Post-it notes and Scotch tape maker 3M’s profit falls,2016
Bord Pleanála decision on Longford Center Parcs appeal due today,2016
Investigation into online comments which mocked Prince for living on ‘public money’,2016
#WorldNews: Gunman reported to have shot doctor and killed himself,2016
Rory McIlroy grouped with Jason Day and Phil Mickelson at Baltusrol,2016
Verizon reports 5.3% fall in revenue,2016
Man jailed for raping girl (14) to appeal conviction,2016
#WorldNews: Ansbach bomber video warns of looming Isis car bomb attacks,2016
Mourners hear of Mr Kelly’s involvement with charities around the country,2016
Social welfare official found not guilty in Sligo oral sex case,2016
The Vatican has condemned the 'barbarous killing' of a priest during a French church siege -,2016
Padraig Harrington relishing prospect of Olympic adventure,2016
Funeral of businessman Des Kelly held in Co Meath,2016
"Essential for cross-Border agriculture that no ‘hard border’ formed, says Michael Creed",2016
Icon clinical trials group reports record new business,2016
Ministers ‘keen to secure’ best post-Brexit Irish agriculture deal,2016
Prince George allegedly criticised by British Council employee,2016
Homeowners warned about paying too much for house insurance,2016
Pat Hickey defends IOC decision not to impose blanket ban on Russia,2016
Ladbrokes and Coral must sell shops to get merger cleared,2016
Tributes paid to ‘hero’ jockey JT McNamara,2016
BREAKING: Reports say one hostage has been killed during attack on French church -,2016
"Man Group’s funds fall in first half, Brexit yet to hit flows",2016
Report from advisory committee states there is ‘very low’ risk of salmonella from eggs,2016
"Raw eggs safe for pregnant women to eat, says UK safety committee",2016
#WorldNews: Men armed with knives take several people hostage in France,2016
Former leading amateur jockey JT McNamara dies aged 41 -,2016
#WorldNews: Footage of hooded teenage inmate strapped to chair sparks inquiry,2016
Pepper Homeloans’ cuts variable mortgage rates,2016
#WorldNews: At least 7 killed in attack on peacekeepers’ base in Somalia,2016
#WorldNews: Michelle Obama and Hillary Clinton: from adversaries to allies,2016
Former leading amateur jockey JT McNamara dies aged 41,2016
Gardaí investigating man’s death in what appears to be a workplace incident,2016
BP Oil misses quarterly profit expectations,2016
Man’s body found at Navan Retail Park,2016
#WorldNews: Solar plane completes first round-the-world flight,2016
The Morning Sports Briefing,2016
From iris scanners to super-sized storage: a roundup of the rumours,2016
Taking Note: what can we expect from Samsung’s newest phone?,2016
"Japan knife attack, the Democratic national convention and teaching time for religion",2016
Inside Politics is a daily briefing from the @IrishTimesPol team. Sign up now.,2016
