full_title,date
Government working on online mental health services,2018
Minister defends lobbying for release of doctor,2018
New customs facilities being built in Dublin Port ahead of Brexit,2018
Subscriber Only: I have started to use unprescribed drugs to help me focus,2018
People in urban areas ‘more likely’ to face social exclusion,2018
"Government and public bodies largest source of income for charities, says report",2018
State to transpose critical EU cybersecurity law ‘in coming days’,2018
Minister defends lobbying for release of doctor jailed for not paying tax,2018
Four female lecturers promoted after NUIG gender discrimination dispute,2018
Martin says Varadkar ‘chancing his arm’ with 2020 election plan,2018
Mental Health Commission scathing on patient care,2018
IVF’s slow Irish birth: ‘It was not greeted with open arms’,2018
Your handy guide to sport on television today.,2018
In her victim impact statement the young woman recalled how terrified she had been during the attack. She said the medical exam afterwards felt like re-living the attack because it was so intrusive.,2018
Central Bank seeks David Drumm trial transcripts for probity inquiry,2018
Five men who say they are “nomadic businessmen” have brought High Court proceedings arising out of income tax assessments issued against them by the Criminal Assets Bureau.,2018
"""I went to the HAP office on ParkgateStreet, and asked to be declared as homeless. I don’t even want to start describing what it was like there. It was a pretty sad place, it really got to me""",2018
"Kerry County Council is to erect warning signs after toxic blue-green ‘algae’ appeared over the past number of days in Killarney’s largest lake, and major tourist attraction, Lough Lein",2018
"Music industry’s silence in wake of R Kelly’s outburst is damning, writes Ed Power",2018
Former director pleaded guilty to thefts while treasurer of Carline Learning Centre and while a tax agent for family and friends,2018
Government to change how farms treated under Fair Deal scheme,2018
The spread of Japanese Knotweed on local authority land in Stoneybatter has sparked concern among local homeowners who fear its presence may seriously damage and devalue their properties.,2018
The man remains missing and the woman is currently being treated in a Greek hospital for a serious burn injury.,2018
Crumlin locals asked to provide parking to families of sick children,2018
GAA promise to consider hosting Liam Miller tribute match at Pairc Ui Chaoimh,2018
Taoiseach open to extension of March #Brexit deadline,2018
Government approves scheme to diversify green energy,2018
British army officer jailed for 18 months following death of 21-year-old Irish soldier,2018
Ian Paisley could make some unwanted history for himself and his party by becoming the first MP to be unseated under relatively new British legislation that allows the public to petition for his removal from office.,2018
"Use of transvaginal mesh devices put on pause, says Minister for Health",2018
Joan Freeman asks councils to hold meetings to help possible presidential candidates,2018
"Temperatures have risen globally about 1 degree Celsius above pre-industrial levels, as a result of greenhouse gases put into the atmosphere from activities such as burning fossil fuels, while increases in the Arctic have been much greater",2018
K2 climber Jason Black lost two colleagues on the world’s second highest mountain,2018
"The issue was raised by a staff member about a consultant, who was employed on a “sessional” basis and is no longer working at St Columcille’s Hospital. It led to an investigation of all procedures conducted by the consultant.",2018
Former DCU president at centre of conflict of interest row in Scottish university,2018
"A department statement said the legislation will “ban the above-face-value resale of tickets for sporting and entertainment events in designated venues with a capacity of 1,000 or over”.",2018
"Carpenters, electricians and plumbers needed for Cameroon",2018
Ian Paisley has become the first MP to face the prospect of a recall by-election after the House of Commons voted to suspend him for 30 days because he failed to declare two family holidays paid for by the Sri Lankan government.,2018
A 65-year-old describes an eight-month struggle to find a Dublin home,2018
Sponsored: Paddy Coynes and the Swagman are just two of the bars visited along the new Atlantic Whiskey Way route.,2018
Five nomadic businessmen want to appeal income tax assessments by CAB,2018
Wicklow teenager stole two bags of cash from employer to pay drug debt,2018
A 19-year old Donegal man who orally raped a young woman who was acting as a “good Samaritan” has been given a five year sentence with the final three years suspended,2018
Former director stole over €1 million from Dublin charity and other sources,2018
Stoneybatter residents urged to take legal action over invasive knotweed,2018
"The election of Charlie Haughey as leader of Fianna Fáil and taoiseach in 1979 prompted fears amongst British diplomats that they were in for a “rough ride” due to his republican sentiments, newly-declassified papers reveal",2018
Ian Paisley could make unwelcome history for DUP,2018
Sponsored: A new electric vehicle can cost 74 per cent less to run than a comparable new diesel engine car,2018
"""She behaved for all the world like a queen, provoking the begrudging comment to me of a Fianna Fáil TD that he had not expected to see the day when we would export our monarchy to Ireland""",2018
"Greek wildfires tragedy, Dublin Theatre Festival launch, Emily Bronte bicentenary... Images of the Day, selected by deputy picture editor @b_fitzsimons",2018
Driver survives gun attack in Derry after car rammed,2018
"Passengers have little sympathy for striking Ryanair pilots who have “great jobs” earning up to €200,000 a year, the airline’s chief marketing officer has said.",2018
Irish MEP says calm debate needed on security and defence,2018
The remains of an Irishman who went missing nine years ago in France have been found,2018
The Irish Society for the Prevention of Cruelty to Animals has advised pet owners to be vigilant and keep their animals away from lakes or ponds that contain the bloom.,2018
Algerian man challenges minister’s refusal to revoke deportation order,2018
"Inquiry into National Maternity Hospital would undermine confidence, court told",2018
"The couple are understood to have been separated as they fled the blaze which broke out in the town of Mati east of Athens, late on Monday afternoon",2018
The legislation is designed to tackle the secondary sale of tickets on resale websites which often charge much higher prices for sold-out events,2018
"“Banks still have a distance to go to live up their slogans of putting customers first,” says Central Bank",2018
"St Columcille’s Hospital in Loughlinstown, has conducted a review of 157 colonoscopies  performed by a consultant between November 2017 and April 2018. The hospital recommended that 65 patients be called back for a repeat procedure",2018
Minister for Children says Tuam bodies could be exhumed if it is ‘logistically possible’,2018
Irish couple on honeymoon caught up in Greek wildfires,2018
State entitled to costs in abortion referendum legal challenge,2018
Irish woman killed in Canadian crash named as Meaghan Miller,2018
Irish holidaymakers travelling to Greece advised to speak to travel companies,2018
Killarney’s largest lake contaminated with toxic ‘algae’,2018
Reselling tickets for more than face value to be banned,2018
65 patients recalled by Dublin hospital over incomplete colonoscopies,2018
Subscriber Only: Jim McGuinness on beating Dublin; Özil row indicative of the world,2018
Head of NI cancer charity calls for boys to receive HPV vaccinations,2018
Subscriber Only: Looking to buy a home? Top tips to seal that big acquisition,2018
Funeral takes place of pensioner who was beaten to death,2018
Permission for challenge to proposed incinerator at Cork harbour granted,2018
"Solicitor struck off for taking €173,543 from dead woman’s estate",2018
GAA officials set for Tuesday meeting over Liam Miller benefit match,2018
Sinn Féin seeks emergency September  summit on Irish Brexit issues,2018
Ryanair says sorry to passengers saying striking pilots have ‘great jobs’,2018
"Family of woman who died of cancer secures €600,000 HSE settlement",2018
Night-time water restrictions to persist for second week,2018
Perpetrator of ‘frightening’ Dublin Bus attacks avoids jail,2018
Cloudy southeast: region’s economic recovery ‘running out of steam’,2018
Ex-Ulster and Ireland rugby player admits having blade in public,2018
Abortion referendum challenger to appeal High Court ruling,2018
Ian Paisley will ‘not go quietly into the night’ despite Sri Lanka holiday debacle,2018
Donegal man (19) who raped young woman who was acting as a “good Samaritan” given five year sentence with final three years suspended,2018
Drones to monitor water quality in west,2018
Number waiting on hospital trolleys surges 26 per cent,2018
"Extend HPV vaccine to boys, says Hiqa assessment",2018
"Brothers secure €50,000 after being attacked by Krystle bouncers",2018
FG Ministers row openly at affordable rent scheme announcement,2018
‘Extremely fortunate’ no fatalities in fire at popular Wexford beach,2018
Students will be obliged to record activities for new Leaving Cert PE examination,2018
Remains of Dublin man found in France nine years after disappearance,2018
"The family of man who died at a Mayo hospital settle action for €55,000",2018
‘False information’ about Dublin Bus redesign slated,2018
Man pleads guilty to repeated rape of a Spanish student in Dublin last summer,2018
"Subscriber Only: Boycotting Israeli culture is not the answer, despite its dreadful treatment of Palestinians",2018
Teenager (16) appears in court charged with attempted burglary of pensioner’s home,2018
Irish citizen pleads guilty to terrorism charges in US,2018
Colours of dinosaurs thrown into doubt by University College Cork analysis,2018
Schools face ban on linking admissions to church attendance,2018
Varadkar cited trade fears as reason to expand diplomatic reach,2018
Brexit a ‘lose-lose-lose situation’ - Croatia's prime minister,2018
"Centre left and centre right parties are ‘redundant’, MacGill hears",2018
Fine Gael row distracts from St Michael’s Estate saga,2018
World Meeting of Families accused of blacklisting liberal Catholic group,2018
Your handy guide to sport on television today.,2018
Homeless man prevented by High Court from leaving hospital,2018
Ex-soldier sentenced to six years over video footage of child,2018
Man injured and woman arrested following Longford crash,2018
Consultant psychiatrist suspended from job takes High Court proceedings,2018
"Liam Miller testimonial: ""This is not a match, it is a fundraiser""",2018
Zappone says Tuam bodies could be exhumed if it is ‘logistically possible’,2018
Union seeks security measures after Connolly Station assault,2018
Sisters express relief as court upholds father’s rape sentence,2018
Order restraining husband visiting wife in nursing home lifted,2018
Brexit: North can operate under different rules to UK – Coveney,2018
"Fire impact at Curracloe in Wexford, caged birds sing in Thailand, bucket holiday on the Danube: Images of the Day, selected by deputy picture editor @b_fitzsimons",2018
Southeast struggles to keep its youth: ‘I would like to come back someday’,2018
"Application blocked for Belgian nudist beach over concerns ""sexual activity"" would frighten . . . larks",2018
Investigations are continuing into a large blaze that ripped through 13 acres at Curracloe beach,2018
"Woman never recovered from twin’s death in Carrickmines fire, funeral told",2018
Prosecution wraps up case in Gareth Hutch murder trial,2018
Donegal man (19) who raped ‘good samaritan’ and spat in her face is jailed,2018
Exotic and newly discovered deep-water coral identified off Ireland's west coast,2018
GAA officials to meet on Tuesday over Liam Miller benefit match,2018
Cloudy southeast: region’s recovery ‘running out of steam’,2018
Sponsored: Paddy Coynes and the Swagman are just two of the bars visited along the new Atlantic Whiskey Way route.,2018
Woman behind ‘frightening’ Dublin Bus attacks avoids jail,2018
Former Ulster and Ireland rugby player admits having blade in public,2018
Night-time water restrictions to continue for second week,2018
Young Irish woman killed in Canadian crash named as Meaghan Miller,2018
Primary teachers may be converted for second-level roles,2018
Fine Gael Ministers row openly at affordable rent scheme announcement,2018
"Brothers win €50,000 after being beaten up by Krystle bouncers",2018
"Presidential hopeful Gerard Craughwell ""can’t afford"" to contest election",2018
Students will have to record activities for new Leaving Cert PE exam,2018
"Family of man who died at Mayo Hospital settle action for €55,000",2018
‘Extremely fortunate’ no one perished in blaze at Wexford's Curracloe beach,2018
Man pleads guilty to repeated rape of Spanish student in Dublin last summer,2018
‘False information’ about Dublin Bus redesign criticised by US transport planner,2018
Teenager (16) appears in court for attempted burglary of pensioner’s home,2018
Colours of dinosaurs thrown into doubt by new UCC study,2018
Homeless man restrained by High Court from leaving hospital,2018
Principal resigns from Greystones school over admissions dispute,2018
"Japanese Knotweed is aggressive, destructive, invasive and spreading to homes in a Dublin neighbourhood",2018
Rare and newly discovered deepwater coral identified off the Irish west coast,2018
Prosecution closes its case in Gareth Hutch murder trial,2018
"Woman never got over twin’s death in Carrickmines fire, funeral told",2018
"Trump and Brexit could lure more scientists to Ireland, says research chief",2018
Belgian nudist beach blocked over concerns ‘sexual activity’ would scare larks,2018
"European Union should push back against Trump back on trade policies, says Hogan",2018
Conor McGregor’s father disgusted by ticket machine coining it and the “bloody cheek” of Irish  rail,2018
Aggressive plant spreading to homes in Dublin neighbourhood,2018
"Conor McGregor’s father complains coins ruin his ‘slim-fit, hand-fitted Hugo Boss suit’",2018
Teacher supply crisis: Primary-school teachers may be converted for second-level roles,2018
Liam Miller game: ‘This is not a match - it is a fundraiser’,2018
"Aggressive, destructive and invasive plant spreading to homes in Dublin neighbourhood",2018
Subscriber Only: Magnifico Molinari the Italian pioneer; David Clifford the Kerry saviour,2018
Humanity ‘devouring resources faster than it can create them’,2018
Brexit: Amazon chief warns of ‘civil unrest’,2018
"Trump warns Iran to ‘never, ever threaten’ US",2018
Liam Miller match: Cork mayor appeals to GAA’s ‘sense of community’,2018
Principal resigns from Greystones school in admissions row,2018
‘False information’ on Dublin Bus redesign slated by planner,2018
‘Extremely fortunate’ no one died in fire at popular Wexford beach,2018
Greener public transport fund has gone virtually unused,2018
Car insurance cost declines eroded by surge in fuel prices,2018
"Universal free GP care to be downgraded to long-term objective, according to Cabinet papers",2018
Funeral of twin sister of Carrickmines fire victim to take place,2018
Sláintecare may progress at slower pace due to cost restraints,2018
‘False information’ about Dublin Bus agenda slated by planner,2018
New figures show extent of ‘class gap’ in higher education,2018
Builders sought for ‘rapid delivery’ modular apartments,2018
Universal free GP care to be significantly delayed,2018
Sites worth more than €430m vacant in Dublin,2018
Disability rights group calls for ‘drastic increase’ in support,2018
Nama urged to tell of dealings with Belfast law firm at centre of Project Eagle,2018
Subscriber Only: Cultural boycott of Israel cannot be justified,2018
Primary-school teachers may be converted for second-level roles,2018
Principal resigns from Greystones school over admissions row,2018
"General’s private car rental cost €310,000 over four years",2018
Refugee left homeless after closure of direct provision centre,2018
Supermac’s founder eyes Ennis motorway project,2018
"Campers leaving duvets, cans, tents and rubbish in mountains",2018
Galway to commemorate America’s first ‘sports star’,2018
Preparing for the back-to-school season,2018
Man dies in multi-vehicle crash in Belfast,2018
Ryanair cancels 16 flights on Tuesday as strikes continue,2018
Images of the Weekend,2018
"More than 2,000 children wait in excess of a year for heart specialist",2018
Roscommon exhibition charts living colour of rural townland,2018
Four Irish jobs available for every qualified nurse seeking work,2018
Three fatalities in farming during safety week,2018
Male motorcyclist killed in Wicklow crash,2018
Co Offaly community says goodbye to ‘dearly loved’ farmer,2018
Large dune fire forces evacuation of Curracloe beach,2018
Varadkar acknowledges role West Cork played in the fight for Irish freedom,2018
"Two Irish climbers make summit of world’s second-highest mountain, K2",2018
Visa troubles force Russian team out of NI youth football tournament,2018
"Hopes rising Liam Miller match can go ahead at 45,000 capacity Páirc Uí Chaoimh",2018
Viking Splash Tour vessels may come from same stock as fatal US ‘duck boat’,2018
"Ian Paisley should not be punished further for Sri Lankan trips, says Sammy Wilson",2018
Starving puppies rescued from trailer in field in Athenry,2018
Ambulance personnel halt industrial action plan after legal action threat from HSE,2018
Boy (8) dies after road traffic accident in North,2018
Nearly 200 Irish and UK politicans call on Theresa May to reform North’s abortion laws,2018
Irish woman (21) dies in single-vehicle crash in Canada,2018
"Young mother who took her own life was devastated by homelessness, event hears",2018
Subscriber Only: ‘Our son has come out as gay. How do we support him?',2018
Are you scrambling to find a place to live for the coming academic year? Are rental price hikes making it harder than ever to make ends meet? Share your story,2018
Your guide to sport on television today.,2018
"Mother who took her own life was devastated by homelessness, event hears",2018
Sponsored: “This mini adventure proved there are probably lots more things we can try together as a family”,2018
Plaque honouring Irish students who died in balcony collapse is unveiled in Berkeley,2018
Viking Splash vessels may come from same stock as fatal US ‘duck boat’,2018
Truck carrying horses overturns on the M50,2018
Subscriber Only: David McWilliams: ‘F**k business' Brexit could be a gift for Ireland,2018
Gaelic Players Association calls for Páirc Uí Chaoimh to host Liam Miller tribute game.,2018
"Pope must address abuse when he visits Ireland, archbishop says",2018
New opinion poll shows a drop in support for Fianna Fáil,2018
Miriam Lord: ‘Make Ireland late again’,2018
DUP meets to discuss Paisley’s political future after Sri Lankan holiday scandal,2018
Liam Miller match development hailed as ‘welcome’ as GAA seeks meeting,2018
"Louise Doyle’s account of her sister Niamh, who died in a road crash that claimed four lives, is a story of enduring love",2018
A plaque will be unveiled later today in Berkeley California to commemorate the six Irish students who died when a balcony collapsed in the university town three years ago.,2018
Subscriber Only: Fintan O'Toole: Putin pulling West into hole he has dug for Russia,2018
EuroMillions ticket sold in Midlands scoops Offaly lot of money,2018
Plaque to honour Irish students who died in Berkeley balcony collapse,2018
Subscriber Only: Miriam Lord: Annual end of Dáil year awards,2018
Referendum commission to oversee blasphemy poll announced,2018
Thinking Anew – A time for solidarity and mercy,2018
Call for incentives for people to work until aged 70,2018
Gsoc officer allegedly ‘coached’ garda’s solicitor,2018
A sister’s story: ‘She looked like she was asleep’,2018
Varadkar proposes summer 2020 election date to Martin,2018
Church services,2018
Eye on Nature: Your notes and queries for Ethna Viney,2018
Nature takes refuge as drought dries the landscape,2018
Your guide to sport on television today.,2018
Judge lauds 85-year-old who took on burglars in Luton,2018
EU questions independence of Ireland’s marine investigations body,2018
Man jailed for nine years for raping wife twice in one night,2018
"No policing reduction in west, Minister and acting Garda chief say",2018
Sharp backstop differences between Varadkar and May,2018
Sponsored: “This mini adventure proved there are probably lots more things we can try together as a family”,2018
"Liam Miller benefit should be held at Páirc Uí Chaoimh, says Kelly",2018
Images of the Day,2018
Judge invites cervical cancer woman and lab to mediation,2018
Eir warns public of new scam targeting phone users,2018
Seventeen dead after tourist boat capsizes in Missouri,2018
PSNI investigating alleged major police data breach,2018
Ian Paisley: one scandal too many,2018
St James’s Hospital apologises for diagnosing wrong type of cancer,2018
Walking and cycling route from Dublin to Galway planned,2018
Department of Justice’s contract with Co Roscommon hotel will not be renewed,2018
HSE urges vigilance after two measles cases reported in Dublin,2018
"Brexit White Paper largely unworkable, says Michel Barnier",2018
Applications to challenge abortion referendum result rejected,2018
Dean Evans pleads guilty to murder of Peter Butterly,2018
"Juror ‘smiled and winked’ at rape complainant, appeal told",2018
"Subscriber Only: The power of selfies: Empty, vapid, narcissistic? Think again",2018
Catching the wave: harnessing Ireland’s water power,2018
‘I just wanted for the little girl in me to be believed’,2018
Theresa May dodges potshots in a place called F-e-r-m-a-n-a-g-h,2018
Memorial statue of Terry Wogan ‘defaced’ in Limerick,2018
"Varadkar, Martin meet to discuss Fine Gael-Fianna Fáil deal",2018
Subscriber Only: Rory McIlroy ready to attack; Lee Chin's full-time hurling isn't working,2018
Food and drink sector is worst for environmental compliance,2018
Remarkable footage of sole survivor of Amazon tribe emerges,2018
Man jailed for 18 years for raping daughter from age of three,2018
Man jailed for life for murder of Cork woman,2018
Devil in the detail on thorny issue of children changing gender,2018
Man makes unprecedented High Court action against the State,2018
Brexit: What happens to Britain if the UK leaves the EUwithout a deal?,2018
Facebook agrees to share data on referendum during the abortion referendum campaign,2018
Potential presidential candidate offered free tickets to councillors,2018
Mother forced to fight for inquest into son’s death supports law changes,2018
"Galway Travellers living in rat-infested conditions, report finds",2018
Health service efforts to manage budgets have ‘consistently failed’,2018
Bird forces plane to circle over coast near Bray before landing at Dublin Airport,2018
Public consulted on retailers applying fees to gift vouchers,2018
Remarkable footage of sole survivor of Amazon tribe emerges,2018
Fórsa calls for third party involvement in Ryanair strike talks,2018
"Conor Quinn (24) should be getting ready to celebrate the birth of baby who will be named after him, funeral told",2018
Public sector pension costs forecast to more than double by 2040,2018
State’s reliance on private landlords rises sharply,2018
Garda ‘expected to die’ while hanging on to high woman’s car,2018
Theresa May to tell EU ‘unworkable’ backproposal must change #Brexit,2018
"Galway Travellers living in rat-infested conditions, report finds",2018
Support for mandatory reporting of perinatal deaths to coroners,2018
Mother forced to fight for inquest into son’s death supports law changes,2018
Potential presidential candidate offered free tickets to councillors,2018
Lidl looted during Storm Emma set to reopen next month,2018
Your guide to sport on television today.,2018
"Garda overtime and legal aid rates threaten justice system, reports warn",2018
Health service efforts to manage budgets have ‘consistently failed’,2018
May insists there will be no hard Border after #Brexit,2018
Suspected bird-strike forces plane to land at Dublin Airport,2018
Wedding ring lost on beach in Co Donegal found by children building sand castles,2018
Public consulted on retailers applying fees to gift vouchers,2018
Priest at funeral of stab victim questions carrying of knives,2018
"Sponsored: “There’s a plenitude of strong, Irish female broadcasters. I didn’t have to look far for inspiring media role models”",2018
St Malachy’s seminary in Belfast is to close,2018
Garda ‘expected to die’ while hanging on to high woman’s car,2018
Teenager acquitted of raping schoolmate in Co Donegal,2018
State’s reliance on private landlords rises sharply,2018
Cost of recruiting 371 HSE staff per month ‘not sustainable’,2018
"Garda overtime and legal aid rates threaten justice system, reports say",2018
GAA urged to make Páirc Uí Chaoimh available for Liam Miller benefit game,2018
Higher risk of blood clots in hospital than . . . flying,2018
Sponsored: “This mini adventure proved there are probably lots more things we can try together as a family”,2018
"A new Airbus, May in Fermanagh and a mammoth discovery - The Images of the Day selected by @b_fitzsimons",2018
Brexit influx will increase State’s office rent bill,2018
