full_title,date
Overcrowded hospitals and rural callouts push up ambulance response times,2018
Plebiscite due on Enniscrone versus Inishcrone conundrum,2018
"Almost 1,000 civil servants paid less than living wage",2018
A civil servant’s story: ‘I’ll have to cut back on my food bill’,2018
New technological university for greater Dublin area to be announced,2018
Irish plan to put cancer warnings on alcohol being closely watched,2018
"Strawberry farmer loses €200,000 of fruit due to hot weather",2018
Pricewatch: ‘I’d hate to be the person who bought the cooker that Pricewatch built’,2018
Finding tuna that you don’t need to drown in mayonnaise,2018
"Pricewatch: A problem with Eir – yes, yet another one",2018
"Attackers threw device from moving car at home of Gerry Adams , CCTV reveals",2018
Sponsored: “The best part of the day was when we all finally mastered the boards and were in the middle of the lagoon”,2018
Irish tennis players break world record after 60-hour marathon,2018
Big birds and Australian acrobats in store for Galway Arts Festival,2018
"Nearly one in five Garda stations unable to access internet, Minister says",2018
Bookings for World Meeting of Families events in Dublin ‘break all records’,2018
Housing strategy for Dublin city to be reviewed amid affordability concerns,2018
Sponsored: “The cost of vehicles is coming down. Lots of people now believe they could own an electric vehicle at some point in the future”,2018
Irish scientists find distinct immune system in newborn babies,2018
"A pensioner killed in his home in Dublin was fatally attacked by a man known to him just after having drinks to celebrate his birthday, gardaí believe.",2018
"France wins World Cup 2018, Trump golfs in Scotland, rain in Dublin... Images of the Weekend, selected by Deputy Picture Editor @alanbetson",2018
Dublin’s Children’s Court deals with cases from thefts of sweets to joyriding and assault,2018
Extremely rare white lobster turns up in Bantry Bay,2018
Mary McAleese likes ‘argumentative’ Pope Francis who ‘likes you to argue back’,2018
"The Children’s Court cases: The boy with the hammer, the girl in the dress",2018
Galway singer with cervical cancer seeks access to clinical trial,2018
"Cork is get a new €5 million pedestrian bridge across the River Lee which will be used by 11,000 people a day to enter and leave the city centre.",2018
Lifeboat called out to assist two yachts off Co Cork coast,2018
"Night-time water restrictions will come into force in Dublin city centre and 33 suburbs across the greater Dublin area on Monday, Irish Water has confirmed.",2018
"“I won’t shut up. I’ll smash his face in” ... Humanity, justice and anger at Dublin's Children's Court",2018
"Arsenic levels in seaweed have ‘negligible’ impact on human health, study finds",2018
Concern for ‘fragile’ Skellig Michael as visitor numbers rise,2018
Restaurants fear losses over night water restrictions,2018
‘I thought we were done for’ - passengers on Ryanair flight describe emergency landing,2018
Notices in hotels ask guests to conserve water in light of shortages,2018
Wicklow chief fire officer: ‘very concerned’ over threat to three homes at height of blaze,2018
Shouts heard from home of Dublin man (74) just before death,2018
Co Meath Liverpool fan Seán Cox regains consciousness in hospital,2018
"Fires leave parts of Bray Head ‘a blackened, lunar landscape’",2018
FG senator calls for ‘drunk tanks’ to free up emergency departments,2018
Subscriber Only: ‘We're not exclusive but is it wrong if I sleep with someone else?',2018
Government-ordered aerial survey uncovers ‘extremely significant’ features in Co Meath,2018
Woman survives 200ft drop and seven days on radiator water after California crash,2018
Victim’s SUV hits wall after leaving the N5 near Swinford,2018
Cork to get new €5 million bridge in city centre,2018
Man dies in Mayo single-vehicle crash,2018
Postmortem due on man found with serious injuries in west Dublin house,2018
Your guide to sport on television today.,2018
Man arrested over death of elderly man in Clondalkin,2018
Simon Coveney and Arlene Foster visit Derry after violent unrest,2018
Subscriber Only: Fintan O'Toole: There is nothing undemocratic about voting again on Brexit,2018
"Sponsored: ""Retailers can focus on their core business while we deliver the energy expertise”",2018
Four-year-old child rescued after boat capsizes off Co Cork,2018
Sponsored: “The best part of the day was when we all finally mastered the boards and were in the middle of the lagoon”,2018
Hundreds protest against far-right rally in Belfast,2018
Sponsored: “The cost of vehicles is coming down. Lots of people now believe they could own an electric vehicle at some point in the future”,2018
Potential presidential candidate welcomes Sinn Féin announcement,2018
Pilots and passengers have just minutes before decompression knocks them out,2018
Bray Head blaze threatens to engulf nearby homes,2018
Ryanair emergency: German investigation starts,2018
"Subscriber Only: David McWilliams: Croatia wins at football, loses in economics – the opposite of Ireland",2018
Police suspect masked gang behind ‘sectarian’ arson attack on Belfast school,2018
The ship formerly known as Boaty McBoatface is launched,2018
"Sinn Féin is to run a presidential candidate against Michael D Higgins, ensuring an election in the autumn",2018
Gardaí appeal for help in locating missing Drogheda teenager,2018
Hospitalised Ryanair passengers must take 18-hour bus to Croatia,2018
Irishman (30) extradited to US over charges of working on ‘dark web’ marketplace,2018
Subscriber Only: Ken Early: Mourinhoball will be real winner of the World Cup,2018
‘I thought we were done for’ - passengers on Ryanair #FR7312 flight describe 'scary' emergency landing in Germany,2018
‘I thought we were done for’ - passengers on Ryanair flight describe emergency landing,2018
