full_title,date
Prohibition had many effects on American society - chief among them the proliferation of criminal enterprise and incognito drinking dens,2018
Restaurants’ plan to charge for ‘no-shows’ blocked,2018
North divided over Ian Paisley jnr in wake of Sri Lanka scandal,2018
Sponsored: “Doing something like this is very important for everyone in the family”,2018
Weakening of Gulf Stream could result in rapid temperature increases,2018
Film on Ford: Cork car workers feature in documentary,2018
Bray Air Display and Foynes Air Show dazzle crowds despite rain,2018
‘Male chauvinist’ Ireland: 5 things we learned from latest British state papers,2018
"Fake news has plunged democracy into crisis with voters being systematically manipulated by campaigns of hate and disinformation, a British parliamentary committee has warned.",2018
"Sponsored: Workplace health and wellbeing programmes can empower staff to perform the best they can at work and home, both mentally and physically",2018
#LostLeads: Prohibition America trumped Ireland for drunkeness 'three times over',2018
Fisherman killed in Co Waterford leaves ‘huge void’ in family,2018
Observations about Mary Robinson and Charles Haughey among documents,2018
"The owners of unoccupied properties could face extra taxes if they remain empty for more than a year, according to the Government’s National Vacant Housing Reuse Strategy 2018-2021",2018
"A number of older people had to leave their homes in the Co Antrim village of Muckamore due to flooding, and Antrim Castle Mall shopping complex in the county also had to be shut.",2018
It was early in 1928 when one Irish Times reporter quickly learned what most people would come to realise: prohibition wasn’t really working.,2018
‘Continuous rise’ in Skellig Michael visitors alarms heritage group,2018
"While Ireland is slowly changing in its approach in terms of gay and lesbian rights and gender recognition, it still has a long way to go when it comes to trans rights, said one protester",2018
"Make greater use of compulsory purchase powers, local authorities told",2018
How ‘Humanae Vitae’ crushed the hopes of millions of Catholics,2018
An Irish Times reporter on American Prohibition: 'I can say honestly that in twelve days in America I saw more cases of alcoholic intoxication than I have ever seen in Ireland for three times that period' #LostLeads,2018
Irish ecologist says threat posed by Japanese knotweed vastly overstated,2018
"“We see companies like Google and YouTube marching at the front of the march, which is meant to be a protest march, a march for what we disagree with in society on how we’re treated”",2018
"#LostLeads: ""I can say honestly that in twelve days in America I saw more cases of alcoholic intoxication than I have ever seen in Ireland for three times that period""",2018
Croagh Patrick on Reek Sunday: Annual outing draws smaller-than-anticipated number of pilgrims this year,2018
"“If I get the required four Council nominations I will run the most modern, dynamic, interactive election campaign possible,” says Duffy",2018
"“It’s not good enough that there’s only one surgeon in Ireland who will provide surgery to trans masculine people and that their waiting list is years and years long,” said one protester",2018
The State’s cash-strapped institutes of technology say they need up to €400 million over the next five years if they are prove fit for purpose to meet the needs of a growing number of students.,2018
The cremation of a Northern Ireland man was refused by the Dublin coroner for administrative purposes.,2018
Inquiry into ‘alleged sexual assault’ on girl at Irish college,2018
"""It’s very difficult for members of the transgender community to actually find a place to live where they feel safe . . . where they’re not going to have rocks thrown at them or be name called""",2018
Irish man in his 20s killed in Texas truck collision,2018
Liam Miller decision brings GAA’s PR nightmare to an end,2018
Red Arrows fly over Dublin ahead of Bray Air Display,2018
"The late soccer player’s family are happy GAA has let game go ahead at Páirc Uí Chaoimh, organiser says",2018
Man (46) rescued from Croagh Patrick as thousands climb for Reek Sunday,2018
Lost Leads: American speakeasies trumped Ireland for drunkenness ‘three times over’,2018
‘I love the place’: US billionaire John Malone on his €300m Irish portfolio,2018
Ocean current changes could alter Irish climate for two decades,2018
Peter Robinson’s Irish unity remarks ‘music to the ears’ of Republicans,2018
Prohibition America trumped Ireland for drunkeness 'three times over',2018
Prohibition America trumped Ireland for drunkeness 'three times over' #LostLeads,2018
Hundreds march in Dublin’s first trans pride protest,2018
An Irish Times reporter on a US assignment in 1928 witnessed the futility of prohibition,2018
"Crowd of 30,000 needed ‘to justify’ moving Liam Miller tribute",2018
Dublin coroner delays cremation of Northern Ireland man,2018
American speakeasies trumped Ireland for drunkenness ‘three times over’,2018
Severe flooding in North as month’s rain falls in afternoon,2018
‘Critical’ need for investment in institutes of technology,2018
Future of National Broadband Plan thrown into doubt,2018
Subscriber Only: ‘I'm worried I am addicted to my ex',2018
Subscriber Only: Diarmaid Ferriter: Truth of what lies beneath Tuam home must be uncovered,2018
Your handy guide to sport on television today.,2018
Former Northern Ireland first minister Peter Robinson’s has been accused of becoming a “Sinn Féin echo chamber” after suggesting that preparations should be made for the possibility of a united Ireland.,2018
Liam Miller decision brings GAA’s PR nightmare to an end,2018
Peter Robinson said he believes UK Government ministers see the Irish Government as “rigid if not antagonistic” and that this has “planted the seeds of regression in the relationship between the two countries,2018
Sponsored: “Doing something like this is very important for everyone in the family”,2018
‘Brazen’ dumpers leave 400 tyres next to motorway,2018
"The international investor talks about his assets in Ireland, Netflix, Trump, and succession plans",2018
"Sponsored: Workplace health and wellbeing programmes can empower staff to perform the best they can at work and home, both mentally and physically",2018
Subscriber Only: School summer holidays are great . . . for the kids,2018
RAF Red Arrows to fly over Dublin this evening,2018
"North should prepare for united Ireland possibility, says Peter Robinson",2018
Hundreds march in Dublin’s first trans pride protest,2018
Subscriber Only: David McWilliams on the seven rules of life to avoid a financial crisis,2018
"Such is the level of anger at the recent jailing for tax evasion of one of their number, the respected north Co Dublin general practitioner Dr Bassam Naser, the residents have taken to the barricades – in a very polite but determined manner.",2018
Forecasters warn of flooding in North amid torrential rain,2018
‘Do not swim’ notice issued for Dublin’s Balbriggan beach,2018
‘Male chauvinist’ Ireland: Here's 5 things we learned from latest British state papers,2018
'It’s not my first day in an aircraft': Aer Lingus pilot in tetchy row with air traffic controller,2018
Dublin’s first Trans Pride Parade kicks off at Liberty Hall,2018
"“A cry in the office is not that strange. . . A cry in court is pretty unusual. . . I have done both in the last few weeks,” say the Tipperary solicitors fighting the #CervicalCheck cases",2018
'Blood Moon' lunar eclipse: In pictures,2018
"""There is definitely going to be a scarcity of potatoes and vegetables in Ireland. I think it will start hitting in the next two to three weeks""",2018
The association had last week insisted it was prohibited in rule from hosting games other than those under its control in its stadiums but its officials on Saturday decided the match could be staged at the ground.,2018
I don’t expect my own house to burn down but I still insure it because it could happen’,2018
Pope accepts US cardinal’s resignation following sex abuse scandal,2018
"Humanae Vitae provoked the greatest challenge to papal authority since the Reformation. However, its 50th anniversary this week is destined to pass without whisper where the Catholic Church is concerned.",2018
Subscriber Only: David McWilliams: Seven rules of life to avoid a financial crisis,2018
"A weakening of major ocean currents in the Northern Atlantic, including the Gulf Stream that warms Ireland, could trigger a sudden change to Ireland’s climate that could last for two decades, Irish scientists have warned",2018
Northern Ireland divided over Ian Paisley jnr in wake of Sri Lanka scandal,2018
GAA to consider if Páirc Uí Chaoimh can host Liam Miller tribute,2018
Are you scrambling to find a place to live for the coming academic year? Are rental price hikes making it harder than ever to make ends meet? Share your story,2018
Organisers feel trans issues have been overshadowed in wider LGBTI+ community,2018
New meaures to aid ‘justice being administered in public’,2018
"Irish Water have extended a nationwide hosepipe ban for at least another month, as water supply levels remain at critically low levels.",2018
Man (27) charged with murder of Brian Phelan in Co Down,2018
"The Restaurants Association of Ireland (RAI) has said up to a fifth of bookings made in the run-up to Christmas last year were “no shows”, resulting in heavy losses for establishments left with unsold tables.",2018
"The residents of Howth and Sutton are renowned for many things, but campaigning on behalf of convicts is not one of them.",2018
‘Humanae Vitae’: 50 years on from the artificial contraception ban,2018
Blood Moon dazzles in longest lunar eclipse of 21st century,2018
Woman (37) whose smear tests were incorrectly reported feels let down by system,2018
GAA set to approve Liam Miller match under joint fundraiser,2018
Pressure builds on the Government over ‘empty’ promise to cancer women,2018
Thinking Anew – ‘The sacrament of the present moment’,2018
‘A cry in court is pretty unusual’ – fighting the CervicalCheck cases,2018
Pressure builds on Government over ‘empty’ promise to cancer women,2018
Ocean current changes could alter Irish climate for two decades,2018
Potatoes stop growing in parched earth of north County Dublin,2018
Irish Red Cross cutbacks may raise ‘concern’ over finance use,2018
Howth and Sutton residents campaign in support of jailed GP,2018
Church services,2018
"Make greater use of compulsory purchase powers, local authorities told",2018
‘Humanae Vitae’: 50 years on from artificial contraception ban,2018
Poisoned and preyless: obstacles to rewilding Ireland with eagles,2018
Eye on Nature: Your notes and queries for Ethna Viney,2018
Your handy guide to sport on television today.,2018
Beef burgers recalled as use-by date wrong by one month,2018
Largest recorded brood of barn owls found in Antrim,2018
"Teenager who caused €50,000 in damage to detention campus gets four years",2018
"Witness in Hutch murder trial was ‘willing participant,’ court hears",2018
Sponsored: A new electric vehicle can cost 74 per cent less to run than a comparable new diesel engine car,2018
Gardaí from Criminal Assets Bureau raid two properties in Limerick,2018
Eight-year sentence for man who sexually assaulted nieces,2018
"Limerick woman scalded, stabbed, and beaten by boyfriend, court told",2018
Subscriber Only: Why do business people run for president? They just want to be loved,2018
Man who raided post office ‘as a joke’ jailed for two and a half years,2018
Car used in Newry murder located,2018
Agreement in charity case - ODCE to access Console computers,2018
It's almost time... What you need to know about Friday’s rare blood moon eclipse,2018
North should prepare for possibility for united Ireland says former DUP leader,2018
Irish RAF pilot Major Edward ‘Mick’ Mannock remembered in Glasnevin,2018
Sponsored: “Doing something like this is very important for everyone in the family”,2018
Travellers on roadside or in overcrowded homes increased 66 per cent in 5 years,2018
GAA set to approve Liam Miller match under joint-fundraiser,2018
BREAKING: GAA set to approve Liam Miller tribute match under joint fundraiser,2018
"Greek fires, a new stamp and hockey history-makers - The Images of the Week",2018
"Sponsored: Workplace health and wellbeing programmes can empower staff to perform the best they can at work and home, both mentally and physically",2018
"Man entitled to €263,000 following suicide of wife after hospital discharge",2018
Water restrictions extended another month as levels ‘critically’ low,2018
State Claims Agency seeking resumption of mediation in Morrissey cervical cancer case,2018
Abortion referendum appeal to be heard in August,2018
Family appeals for information 20 years after Deirdre Jacob disappeared,2018
Man accused of garda murder sent forward for trial to Central Criminal Court,2018
Co Down man faces charges for allegedly sexually grooming child,2018
Subscriber Only: Are you still paying over the odds to insure your car?,2018
Garda wins appeal against assault convictions,2018
Crumlin hospital apologises to parents over death of baby,2018
Lloyds Pharmacy strikes: staff reject proposals,2018
Abortion referendum appeal to be heard in August,2018
Maternity hospital’s move to new site not on hold because of legal action,2018
Heatwaves made over twice as likely due to climate change,2018
"Barrister under threat of legal action died by suicide, inquest found",2018
PSNI call for public’s assistance following Newry murder,2018
Defence of honest belief ‘not acceptable’ in rape cases says DRCC,2018
Dermot Desmond cannot proceed with action linked to Moriarty Tribunal,2018
Sgt Maurice McCabe settles defamation case against ‘Irish Times’,2018
Subscriber Only: Limerick are the real deal; Ireland the history makers in London,2018
Classmates of Irishman killed in Greek fires set up fundraising page,2018
Subscriber Only: Ireland's bankers have learnt little from the crash,2018
Ryanair executive claims Aer Lingus pilots to blame for ongoing strikes,2018
Trócaire donations reach highest levels in 14 years,2018
Gardaí stop Ford Transit and find a horse inside,2018
Waterford stabbing: Teen (17) released without charge,2018
What you need to know about Friday’s rare blood moon eclipse,2018
Wet weekend ahead with ‘marked change’ in weather,2018
Call to stop cattle exports to ‘horrendous’ Libyan slaughterhouses,2018
Man who infected two former partners with HIV is jailed for 10 years,2018
"Enact legislation to tackle ‘foreign influence’ in political process, says Standards in Public Office Commission",2018
Significant decline in gun dealerships leading to more smuggling,2018
"Social media safety framework needed for pre-teens, youth forum told",2018
RCSI trial ‘significantly prevents’ oesophageal cancer,2018
Consent in claims of rape explored by Law Reform Commission,2018
New crime of ‘gross negligence rape’ is put forward,2018
"‘Pale, male and stale’ - MacGill Summer School showing its age",2018
Dublin council has ‘serious concerns’ over new Garda HQ,2018
"Driver who claimed €60,000 over minor crash gets just €5,000",2018
CervicalCheck controversy: Surge in new legal cases,2018
Your handy guide to sport on television today.,2018
Harris concerned over ‘unanswered questions’ at NMH,2018
"Disabled woman awarded €40,000 over treatment at centre",2018
Suspended sentence for man who viciously assaulted girlfriend,2018
"‘Systems failure’ led to 26-year-old’s death, inquest hears",2018
Judgment reserved in ICA case,2018
Community in north Dublin protest at plan to end direct bus route to city centre,2018
Sponsored: Paddy Coynes and the Swagman are just two of the bars visited along the new Atlantic Whiskey Way route.,2018
"Woman raped by uncle as a child awarded €200,000",2018
Reforms at cytogenetics lab at Crumlin hospital necessary to meet best practice – HSE,2018
Zappone ‘hopeful’ Government will act on recommendations from mother and baby homes’ group,2018
Garda appealing assault conviction says he punched woman ‘in defence’,2018
Einstein’s black hole predictions confirmed for first time by scientists,2018
Dolours Price revealed to film-makers her involvement in Jean McConville's murder,2018
"‘Mammy, please don’t die’ child tells terminally ill mother",2018
Tributes paid to Irish honeymooner who perished in Greek inferno,2018
Sponsored: A new electric vehicle can cost 74 per cent less to run than a comparable new diesel engine car,2018
Some church teachings have ‘as much validity as Danny Healy Rae’s views on climate change’,2018
North Dublin cycle and walkway gets approval,2018
Alien killer spider devours native lizard in first recorded Irish case,2018
Polish man to resist extradition after European court ruling,2018
Aer Lingus pilot recorded in tense exchange with air traffic controller,2018
Juror in rape trial ‘felt uncomfortable’ in jury panel,2018
Major gas leak reported in Drogheda,2018
Subscriber Only: Stephen Collins: Varadkar's future may hang on Micheál Martin,2018
Weather alert: heavy rain on the way as extended dry spell set to end,2018
"Images of the Day, selected by @alanbetson",2018
25-year-old man dies in hospital after Co Waterford stabbing,2018
"‘I am not frightened to die, but I don’t want to,’ says Ruth Morrissey",2018
Sponsored: “Doing something like this is very important for everyone in the family”,2018
Dozens of homes searched by gardaí for child abuse images,2018
Emma Mhic Mhathúna to buy the house in Dublin where she receives treatment,2018
Sentencing of serial sex attacker Patrick Nevin is adjourned,2018
"Dublin barber fined €5,000 in transgender discrimination case",2018
Aer Lingus pilot recorded in tetchy exchange with air traffic controller,2018
‘I felt it was all my fault’: Mothers describe being destitute in new documentary film,2018
Tributes paid to Irish man who died in Greek fires,2018
‘I felt it was all my fault’: Mothers describe homeless experience in new documentary,2018
"Emma Mhic Mhathúna, who has terminal cancer, is to move near Dublin where she is receiving medical treatment, the High Court has heard today.",2018
Man who infected two partners with HIV jailed for ten years,2018
"Met Éireann forecasting that the long spell of sunny, dry weather is coming to an end",2018
Speculation that lawyers for UFC fighter Conor McGregor are close to reaching a plea deal with New York prosecutors,2018
Calls to halt cattle exports to inhumane Libyan slaughterhouses,2018
Ireland has been ranked 14th in a global table of skin cancer susceptibility,2018
‘Huge drop’ in gun dealerships leading to ‘more smuggling’,2018
A 25-year-old man has died after being found with an apparent stab wound in Co Waterford,2018
"Social media safety guidelines needed for pre-teens, youth conference told",2018
UFC fighter Conor McGregor strikes plea bargain in US assault case,2018
The full extent to which famine and conflict devastated Ireland in the early 14th century has been revealed for the first time.,2018
Tributes paid to ‘selfless’ Irishman killed in Greek wildfires,2018
People have been urged to used public transport to get to the Phoenix Park in Dublin for the visit of Pope Francis next month.,2018
Sentencing of serial sex attacker Patrick Nevin adjourned,2018
"Ruth Morrissey: ‘I am not frightened to die, but I don’t want to’",2018
Fears have been expressed for the future of Ireland’s only native lizard species after a specimen was found to have been eaten by an alien killer spider.,2018
Emma Mhic Mhathúna to buy house in Dublin where she receives treatment,2018
Heavy rain on the way as a typical Irish summer returns,2018
People warned to use public transport during Pope’s visit,2018
Ireland’s native lizard under attack from false widow spiders,2018
Wildfire victim’s mother already lost son and husband tragically,2018
Dublin’s first Trans Pride Parade to be held on Saturday,2018
Co Down bodyguard who reached K2 summit says he would ‘do it all again’,2018
"Irish are 14th most susceptible to skin cancer, study finds",2018
"Subscriber Only: Why Cork's Harnedy could be key, Mary Hannigan pays tribute to Eamon Dunphy",2018
One fifth of Health and Safety inspections were on farms in 2017,2018
Man (25) dies after being found with apparent stab wound in Co Waterford,2018
Cancer scandal: ‘Irene just wanted to live long enough to see Oscar start school’,2018
Think smart and user-friendly when it comes to tackling air pollution,2018
Maps reveal scale of economic devastation in 14th century Ireland,2018
CervicalCheck inquiry’s final report due in September,2018
Children’s hospital lab has high risk of ‘serious error’,2018
Tributes paid to Irish man who died in Greek fires,2018
The importance of a good hedgerow,2018
A lot to digest: are nanoplastics bad for human health?,2018
Your handy guide to sport on television today.,2018
Dolours Price told film-makers of her direct involvement in murder of Jean McConville,2018
Epileptic man who left teen incapacitated after car crash jailed for 3½ years,2018
Farmer undertakes not to trespass on Wexford lands,2018
Nearly €8m to be invested in technology for libraries,2018
Spectacular blood moon to be visible over Ireland,2018
Michael Fassbender’s family allowed to resume work on Killarney premises,2018
Man not guilty of assaulting judge by reason of insanity,2018
Considerable ‘preparation’ went into Gareth Hutch’s murder,2018
Sponsored: Paddy Coynes and the Swagman are just two of the bars visited along the new Atlantic Whiskey Way route.,2018
Man shot in leg during successive gun attacks in Ballymun,2018
Ambulance staff to ballot for strike action in row over negotiation rights with HSE,2018
Cora Sherlock: Repeal of Eighth Amendment ‘radical drift backwards’,2018
Sponsored: A new electric vehicle can cost 74 per cent less to run than a comparable new diesel engine car,2018
An inquiry was launched into the circumstances of an incident in which a man was struck twice with a Garda ASP baton during a protest,2018
"Almost 2,000 complaints received by Gsoc about the Garda in 2017",2018
Homeless woman jailed for burglary at Joan Burton’s home,2018
"Block on east-west border ‘non-negotiable’, says Hammond",2018
NUI Galway refuses to divulge cost of settling gender-row cases,2018
A huge 20km wide lake of liquid water lies beneath the southern ice cap of Mars,2018
Ireland cannot meet its 2020 greenhouse emissions targets and is now “completely off course” to achieve other decarbonisation goals,2018
Minister urged to prevent closure of Four Courts restaurant,2018
Wexford girl (9) schools Shane Ross on gender equality in sport,2018
A coroner has urged parents to check ingredients after a 10-year-old boy suffered a fatal allergic reaction to a McDonald’s chicken wrap,2018
"Images of the Day, selected by @alanbetson",2018
Dismissed principal secures court orders to stop her being replaced,2018
High Court case over Dublin Horse Show entry withdrawn,2018
"Irish man Brian O'Callaghan-Westropp who went missing during the worst wildfires to hit Greece in more than a decade has died, his family has confirmed.",2018
Fr Donnchadh Ó Cuinn argued that as a native Irish speaker he is entitled to conduct official business through Irish and the State had breached those rights.,2018
The Government is working on a “radical” transformation of mental health services by directing sufferers to the internet rather than visiting doctors and counsellors,2018
Underground lake discovered beneath ice cap on Mars,2018
EU court backs Irish judge’s right to query Polish justice system,2018
Man pleads guilty to facilitating criminals to carry out Sunset House murder,2018
Ireland ‘completely off course’ to meet emissions goals,2018
"Daniel Goulding, Ciaran Sheehan, Mick Malone and Colm Sheehan are backing the campaign to allow the Liam Miller benefit match take place at Páirc Uí Chaoimh in September",2018
Boy died after allergic reaction to McDonald’s peri peri chicken wrap,2018
Priest fails in court bid to halt his drink driving trial,2018
Staff in State-funded voluntary organisations providing health and social care services are to go on strike on September 18th,2018
"Proposed patient safety fines for healthcare providers ‘a joke’, says Vicky Phelan",2018
Health and social organisations for September strike over pay restorations,2018
Eamon Dunphy to leave his role with RTÉ Sport,2018
Government may insist on access to State-funded sports facilities,2018
GAA players support holding Liam Miller tribute match in Páirc Uí Chaoimh,2018
Woman with breast and cervical cancer begins action over smear tests,2018
Simon Coveney: Ireland would back Brexit extension talks request,2018
"Boy injured playing football to receive €45,000",2018
"Boy injured playing football in Phoenix Park to receive €45,000",2018
Nearly 400 people on trolleys in country’s hospitals,2018
Coveney says Ireland would back Brexit extension talks request,2018
Four women lecturers promoted after NUIG gender discrimination dispute,2018
Government working on online mental health service applications,2018
Dutch viagra experiment terminated after 11 babies die,2018
"Subscriber Only: Darragh Ó Sé says Super 8s will stand to Kildare, Pro 14 fixtures revealed",2018
Are you scrambling to find a place to live for the coming academic year? Are rental price hikes making it harder than ever to make ends meet? Share your story,2018
Martin says Varadkar ‘chancing his arm’ with election plan,2018
