full_title,date
"Ask Facebook to leave Ireland if it won’t control content, says cyberpsychologist Dr Mary Aiken",2018
Couple whose daughter died days after birth at Waterford Hospital settle action,2018
What happened to the public bench outside the Powerscourt Centre?,2018
"Review states no exodus of nurses, while pay competitive",2018
Nomination-seeking candidates for presidency invited to Waterford,2018
Police sources say Irish boy (14) may have lost balance on chair in fatal Spain balcony fall,2018
"Nearly 5,000 children referred to Tusla had no social worker by December",2018
Falling primary school numbers will lead to ‘hundreds’ of surplus teachers,2018
EU calms Taoiseach’s fears of physical Border checks after #Brexit,2018
Teenager acquitted of raping schoolmate (16) in Donegal,2018
Subscriber Only: Why are Irish borrowers paying over the odds for mortgages?,2018
Bird forces plane to circle over coast near Bray before landing at Dublin Airport,2018
Coal is not yet dead: Industry’s failure to ditch it is a cause for concern,2018
Man who delivered drugs to help pay off brother’s drug debt jailed for 2½ years,2018
Gender dictionary: Do you know your intersex from skoliosexual?,2018
Sarah Bardon: Has the Government’s plan to end homelessness achieved anything?,2018
Cost to HSE of recruiting 371 staff a month ‘not sustainable’,2018
Rent caps to be introduced for purpose-built student accommodation,2018
Wedding ring lost on Donegal beach found by children building sand castles,2018
Aer Lingus flight to Dublin forced into Shannon diversion,2018
Family of woman who sued GP over alleged wrongful death settle action,2018
"World Meeting of Families welcoming to all, says Archbishop Martin",2018
We have been surprisingly passive in Ireland in responding to the issue of suicide,2018
High Court cannot decide on case of mother with mild intellectual disability,2018
Woman ‘nearly left for dead’ after being struck by iron bars settles action,2018
Donohoe says Government will broadly balance its books this year,2018
Subscriber Only: British Open gets underway; Brian Howard worthy of Paul Flynn comparisons,2018
Spectacular Festival of Families planned for Croke Park,2018
"Woman fled State after husband attacked her, court hears",2018
"Almost 5,000 children referred to Tusla had no social worker by December",2018
"Parents pay €1,200 a year to put children though secondary school",2018
"Farmers and the food industry in particular are set to play a key role in turning energy from waste, such as pig slurry, into heating.",2018
‘A lot of people genuinely care about the environment’,2018
"Is coal making a comeback? No, it’s just ‘dead cat bounce’",2018
Irish boy (14) may have lost balance on chair in Spain balcony fall,2018
Solar power: rays of hope,2018
Woman who sued Dublin Bus and lost must pay costs of the case,2018
Rainfall’s coming home: but sun will be back before long,2018
"Ireland must do better on green energy, says SSE Ireland chief",2018
Gates into Phoenix Park to undergo restoration work ahead of Pope’s visit,2018
Miriam Lord: 'Baywatch' to the rescue as Ministers tog out,2018
Food and drink sector is worst for environmental compliance,2018
Woman struck by iron bars from trailer while out walking sues,2018
Constance Markievicz honoured in Westminster event,2018
Small businesses call for rejection of minimum wage increase,2018
Teenager who drove at Garda car three times jailed for 16 months,2018
EU calms Leo Varadkar’s fears of physical Border checks after Brexit,2018
Are you scrambling to find a place to live for the coming academic year? Are rental price hikes making it harder than ever to make ends meet? Share your story,2018
Judge set to rule on applications challenging abortion referendum result,2018
‘The next 10 years are going to see change that we probably cannot imagine’,2018
What happened to the public bench outside Dublin Powerscourt Centre?,2018
Number of assaults last year at highest rate since 2008,2018
‘Obsessive’ university student assaulted girlfriend and keyed car,2018
"Dublin Horse Show expected to attract 100,000 visitors to RDS",2018
Catching the wave: harnessing Ireland’s water power,2018
Plugging the gaps: the benefits of retrofitting,2018
Farming forecast: turning waste into energy,2018
Failure to reduce our greenhouse gas emissions is not an option,2018
Wind is changing for offshore energy,2018
Man and woman arrested in Donegal over alleged waste offences,2018
"‘Jobless’ man driving 2017 Mercedes around Dublin, court told",2018
"Vet wore Trump mask and gave fist pump to human resources manager, court told",2018
Industry’s failure to ditch coal a cause for concern,2018
‘The next 10 years are going to see change that we probably cannot imagine’,2018
Heated debate: making our homes carbon-free,2018
Food and drink sector is worst for environmental compliance,2018
"Woman fled State after husband attacked her, court hears",2018
Subscriber Only: Newton Emerson: Sinn Féin's presidential bid risks leaving it exposed,2018
"Parents pay €1,200 a year to put children though secondary school",2018
Dowth Hall redevelopment was opposed by Government,2018
"Some major bus routes will be worse off under €2bn reform plan, TDs warn",2018
The Empty Set: this article is about nothing at all,2018
Ireland has much to learn from Germany’s Energiewende,2018
Suicide: the best strategies attempting to counter this major problem,2018
"Pope’s visit should show a ‘diverse, inclusive’ State, Ministers told",2018
State of change: How the Irish Government is supporting a green energy sector,2018
Your guide to sport on television today.,2018
"Health reforms may happen at ‘slower pace’ due to cost, warns Varadkar",2018
Third Ryanair pilots’ strike likely on Tuesday,2018
"Repairing roads the most important council service, survey finds",2018
"Sponsored: “There’s a plenitude of strong, Irish female broadcasters. I didn’t have to look far for inspiring media role models”",2018
Activists mark 100 years since birth of Mandela,2018
A woman who suffered catastrophic injuries when she was struck by iron bars protruding from a passing trailer while out for a morning walk has sued at the High Court,2018
Two people who died when their 15ft fishing vessel capsized off Malin Head in Co Donegal have been named locally,2018
Westminster byelection may be inevitable following Ian Paisley suspension,2018
Senator Joan Freeman writes to councils seeking presidential nomination,2018
"A happy horse, a family reunited and a homecoming - The Images of the Day",2018
Second man arrested over attack on home of Gerry Adams,2018
Archaeologists to down trowels at medieval site in Dublin over pay claim,2018
Vet who wore Donald Trump mask to work challenges removal,2018
Sponsored: “This mini adventure proved there are probably lots more things we can try together as a family”,2018
Galway creche temporarily closed after outbreak of Ecoli,2018
Non-denominational graveyard opens in Killarney,2018
Denis Naughten set for Facebook meeting over violent material,2018
Jason and Dean Bradley sentenced to life for murder of Neil Reilly,2018
Woman struck by iron bars from trailer while out walking sues,2018
Small businesses call for rejection of minimum wage increase,2018
Arrest follows seizure of €3 million ecstasy haul in Dublin,2018
Vet who wore Trump mask to work challenges removal,2018
Teenager who drove at Garda car three times jailed for 16 months,2018
Karen Bradley pledges movement on key NI appointments,2018
Carl O'Brien (@carlobrien): Does Ireland really need more universities?,2018
‘Obsessive’ university student assaulted girlfriend and keyed her car,2018
"Sharp increase in defamation cases could be result of growing social media use, solicitors believe",2018
Lawyer accuses woman of ‘lying through her teeth’ about crash,2018
Planning permission for Co Clare wind farm overturned,2018
"Dublin Horse Show expected to attract 100,000 visitors to RDS",2018
Donegal drownings: Two male victims named locally,2018
Man charged with money laundering at Dublin District Court,2018
Arrest follows seizure of €3m ecstasy haul in Dublin,2018
Ryanair strike Q&amp;A: What should I do if my flight is cancelled?,2018
Families disappointed Amhrán na bhFiann will not be enshrined in Irish law,2018
MetroLink plan: ‘Mistake’ to squander rail spending on south Dublin line,2018
Water restrictions: Emergency planners meet as ‘very little rain forecast’,2018
Bradley brothers sentenced to life for murder of Neil Reilly,2018
"Subscriber Only:  ‘My mother has one set of rules for family, and one set for me'",2018
Retail Excellence suspends Facebook partnership after revelations,2018
‘I always had a lot of time for him’: Roy Keane urges support for Liam Miller testimonial match,2018
Boy (13) accused of Ana Kriegel murder remanded in custody,2018
Widow of Malak Thawley fails in legal bid over death inquiry,2018
Two children of Austin Darragh lose court challenge over will,2018
"Man spared jail over €167,000 social welfare fraud",2018
Couple caught with ‘Aladdin’s cave’ worth of stolen items in hotel room,2018
Water restrictions: State’s emergency planners meet as ‘very little rain forecast’,2018
Donegal drowning: Victims in water for hours before rescue,2018
Theresa May to make Brexit reassurance visit to Northern Ireland,2018
Man arrested over bomb attack on Gerry Adams home released,2018
Constance Markievicz to be formally recognised as Westminster’s first female MP,2018
National minimum wage likely to rise to €9.80,2018
Psychiatric hospital in Carlow extensively damaged by fire,2018
"Five HSE staff overpaid nearly €300,000, audit finds",2018
"Use of facial-imaging software for anti-fraud measures is legal, Minister says",2018
Life 'back to normal' for Thai cave rescuer who lives in Clare,2018
Brexit: Amendments to Brexit Bill ‘unhelpful’ – Coveney,2018
New agency to develop State lands in bid to tackle housing crisis,2018
Gsoc declined to investigate Garda weapon being fired in house,2018
Man (25) charged over seizure of loaded gun in Dublin,2018
"Two-year-old boy killed after being struck by car in Bray, Co Wicklow",2018
Referendum needed to change definition of ’family’ in Constitution,2018
Subscriber Only: Kerry lacking leaders; Cork City bow out in Warsaw,2018
Couple caught with ‘Aladdin’s cave’ worth of stolen items in hotel room,2018
Two dead and one in hospital after fishing boat capsizes off Donegal,2018
Does Ireland really need more universities?,2018
Gsoc declined to investigate Garda weapon firing in house,2018
Life 'back to normal' for Thai cave rescuer who lives in Clare,2018
Excessive mileage claimed by some staff at St Luke’s unit - audit,2018
"Five HSE staff overpaid nearly €300,000, audit finds",2018
National minimum wage likely to rise to €9.80,2018
Presidential candidates: FG may restrict who councillors can help,2018
"Dispute processes must precede garda access to State bodies, Cabinet told",2018
Your guide to sport on television today.,2018
Subscriber Only: Keeping your savings on deposit is costing you money,2018
Breaking: Two dead after fishing boat capsizes off Donegal,2018
"Two year old boy killed after being struck by car in Bray, Co Wicklow",2018
The Bill provides for the extension of an automatic three-month driving ban to first-time drink-driving offenders and making it an offence for the owner of a vehicle to allow a learner driver use the vehicle unaccompanied,2018
One person dead and two rescued after fishing boat capsized off Donegal,2018
Limerick jockey who lost cancer struggle goes final furlong,2018
Gardaí believe suspect in Mallow fatal stabbing panicked and fled to the UK,2018
"Institute of Technology (DIT), IT Tallaght and IT Blanchardstown will merge into a technological university in January",2018
'We are now back at Celtic Tiger levels' #DoYouUseCocaine,2018
Dublin colleges to merge into technological university in January,2018
'Airsoft enthusiast' arrested after bag of weapons found in van at Mountjoy Prison,2018
"Sponsored: “There’s a plenitude of strong, Irish female broadcasters. I didn’t have to look far for inspiring media role models”",2018
Karlin Lillington: Why do we keep privileging digital worlds when they seemingly lack the capacity to sufficiently moderate themselves?,2018
HSE issues ‘harm reduction’ guidelines on how to take cocaine,2018
"UK political instability 'shouldn’t give us cause for panic', says Varadkar",2018
"Intentions of new laws often hard to discern, Chief Justice says",2018
"Tour de France, drought in England, attack helicopters in Taiwan... Images of the Day, Selected by Deputy Picture Editor @alanbetson",2018
Who are the winners and losers on EU-Japan trade deal?,2018
"John Boylan has brought his own proceedings against CAB claiming losses arising out of the career-ending injury to Labaik, contending it was due to CAB allowing the horse to be run",2018
"Student knocked down by car awarded €256,000 damages",2018
Families disappointed Amhrán na bhFiann will not be protected by law,2018
Alert at Mountjoy Prison as ‘airsoft guns’ found,2018
"Mark Hehir, who captained Galway at under-21 level, stole €300,000 from his former employers over a six-month period in 2016",2018
"Cork-born Michael Ring, who attempted to fight off his attackers with a billiard cue, suffered fractured discs in his spine, a black eye, cuts to his wrists and bruising on the brain during the attack in Luton",2018
Reprieve expected for family facing deportation to Georgia,2018
"Cheltenham-winning horse bought with proceeds of crime, CAB claims",2018
"Girl (9) settles action over shoulder injury at birth for €525,000",2018
Inquiry launched into extensive fish kill in Tipperary river,2018
UK lottery winner thanks shopper for ‘life-changing’ queue jump,2018
"For the southern Irish, God is now seen as redundant and unnecessary, says Belfast cleric",2018
Court was right not to jail young footballer who stole to fund gambling,2018
Men convicted of causing grievous bodily harm to pensioner (84),2018
Planning appproval for Co Clare wind farm overturned,2018
Eleven of those arrested were males aged between 16 and 19,2018
Rising social media use may be behind surge in defamation cases,2018
Islamic prayer centre in Swords gets the go-ahead,2018
€40m in dormant bank accounts to be given to community projects,2018
Can computers match people when it comes to investment?,2018
Northern Secretary expected to reconstitute policing board,2018
Cantillon: EU may be China’s trump card in dealing with US tariffs,2018
Rapist made defamation threat to victim after relative told of abuse,2018
Subscriber Only: Keeping cash on deposit is costing you - what can you do?,2018
"'Japan and the EU are sending a powerful message to promote free, fair and rules-based trade, and against protectionism'",2018
‘Cast iron’ backstop guarantee needed following Brexit Bill amendments – SF,2018
"Uniting the creative industries within one department bears an obvious logic, which is why it will probably never happen, writes @IrishTimesLaura",2018
PSNI arrests 12 teens over murder of homeless man in Derry,2018
Judge says offenders are wasting suspended sentence chances,2018
Brexit: Commons decision on customs ‘safeguards’ North’s place in UK,2018
"'When you think that everything you own is going to go up in flames, it’s pretty scary'",2018
The stark warning comes in an annual assessment of risks from Taoiseach Leo Varadkar’s own officials,2018
Bishops warned that students who opt out will receive an unfair advantage if they are allowed to take extra classes in examinable subjects #Education,2018
Woman killed on her Co Galway farm,2018
Pilots and passengers have just minutes before decompression knocks them out,2018
Men arrested over firearm questioned by gardaí,2018
Ireland ‘least Christian’ part of English-speaking world,2018
Our top read story this morning on @IrishTimes - Fintan O’Toole: Brexit White Paper puts the UK on a road to nowhere,2018
Subscriber Only: Jim McGuinness on a slow start to the Super 8s; Harrington says time is on McIlroy's side,2018
Insurance policies to be hit with 2% levy for next seven years,2018
Pupils opting out of religion must not get extra tuition - bishops,2018
Irish Water independence given cautious cross-party backing,2018
Housing crisis likely to last for ‘foreseeable future’,2018
Sharks could be heading for Irish seas as waters warm,2018
Body of drowned teenager to be flown back from Spain today,2018
Dublin's Phoenix Park named one of world’s best urban green spaces,2018
"5,500-year-old passage tomb uncovered at Dowth is ‘find of a lifetime’",2018
Fraudsters ordered to pay expenses over car rental scam,2018
Pussy Riot member jailed for 15 days over World Cup final pitch invasion #WorldCupFinal,2018
Sporting events spark domestic abuse in England – is the same true for Ireland?,2018
FG may allow councillors back rivals to Higgins presidency bid,2018
Housing crisis likely to last for ‘foreseeable future’,2018
There may not be enough waste to feed Poolbeg plant,2018
No agreement on Sláintecare funding package,2018
Pupils opting out of religion must not get extra tuition - bishops,2018
Policing Authority an 'impediment to accountability' says legal academic,2018
Ireland ‘least Christian’ part of English-speaking world,2018
Gorse fires: ‘We need three or four days of rain to kill this off’,2018
Your guide to sport on television today.,2018
Council to consider construction of log cabin homes in gardens,2018
Phoenix Park named one of world’s best urban green spaces,2018
Ryanair accused of downplaying emergency landing which injured dozens,2018
Attackers of Adams and Storey homes are ‘enemies of peace’,2018
"5,500-year-old passage tomb at Dowth is ‘find of a lifetime’",2018
A delusional Donald Trump plays to Vladimir Putin’s agenda,2018
The opening of a number of schools in time for the new school year is in doubt following pickets by subcontractors who say they have not been paid money owed to them for work done.,2018
The lead archaeologist said the people who built the tombs would probably have been “the children or grandchildren or great grandchildren of some of the first farmers in Ireland”,2018
"The spokeswoman said Leo Varadkar had said on many occasions that, based on the high levels of health spending per year, “people are entitled to expect a better service”.",2018
"The son was previously secretly recorded at home as threatening and verbally abusing his mother, who has dementia, and had tried last week to remove her from the hospital, the court was told.",2018
Brú na Bóinne is the area within the bend of the river Boyne that contains one of the world’s most important prehistoric landscapes perimeter.,2018
Night-time water restrictions are now in place until 5am across the city centre and in 33 suburbs in Dublin and Wicklow,2018
Sponsored: “The cost of vehicles is coming down. Lots of people now believe they could own an electric vehicle at some point in the future”,2018
"A 5,500-year-old passage tomb uncovered in the heart of the Brú na Bóinne World Heritage site in Co Meath is “the most significant megalithic find in Ireland in the last 50 years”, archaeologists believe.",2018
"A judge has said that a family of four who were the victims of a kidnap robbery, deserve enormous respect for their “uncommon and unbending faith” in the criminal justice system.",2018
Ryanair says ‘small number’ of passengers treated as a precaution after the incident,2018
"Irish Water timeline - from controversy and protests to payment cancellations, refunds and separation",2018
Phoenix Park named one of world’s best urban green spaces,2018
"Structural repairs costing in the region of €250,000 are to go ahead immediately at eight blocks of flats at a Dublin City Council complex, ahead of its demolition.",2018
"5,500-year-old passage tomb at Dowth is ‘find of a lifetime’",2018
Two arrested after firearm found during car search in Dublin,2018
Gardaí made 38 phone record requests after Gareth Hutch killing,2018
Thirteen hospitalised after suspected ammonia leak,2018
"Trump vs Putin, Obama in Kenya, Red Arrows at Farnborough Airshow... Images of the Day, selected by Deputy Picture Editor @alanbetson",2018
Unveiling of new schools in doubt after sub-contractors picket,2018
The assaults on the children took place in 2016,2018
The court heard the Wicklow man (30s) attempted to strangle two of the children and left them when he thought they were dead.,2018
Irish Water timeline: from March 2011 to July 2018,2018
Gardaí have said it may be some days before positive confirmation that a helmet and lifejacket retrieved off the north Mayo coast last week belongs to missing Rescue 116 winch operator Paul Ormsby,2018
"Sponsored: “There’s a plenitude of strong, Irish female broadcasters. I didn’t have to look far for inspiring media role models”",2018
President Donald Trump said on Monday he saw no reason to believe Russia had hacked the 2016 US presidential election to help him win.,2018
"Cost of €250,000 to repair council flats ahead of demolition",2018
Man (47) charged with assault in connection with his father’s death,2018
Company director gets 10 years for arson and attempted fraud,2018
Taoiseach believes benefits of €15bn health spending not seen by patients,2018
Man jailed for attempted murder of teen on Hellfire camping trip,2018
Local media reported the missing Irishman was 19-years-old and was living nearby in Spain on a language programme,2018
Archbishop Diarmuid Martin says youth alienated by Catholic Church,2018
Irish dancing teacher seeks to halt disciplinary hearing,2018
Subscriber Only: Nicky English: beating Kilkenny a major step forward for Limerick,2018
Number stuck in direct provision due to housing scarcity soars,2018
Planners want to reconsider development at St Anne’s Park,2018
"A 22-year-old woman lay alive in a coma for at least four hours after being assaulted and strangled by her boyfriend in a squat in Cork city centre, a murder trial has heard",2018
"Elderly woman must not be visited in hospital by son, husband",2018
The court heard the Wicklow man attempted to strangle two of the children and left them when he thought they were dead.,2018
Mixed reaction in Sandymount to incinerator expansion plan,2018
Archbishop says youth alienated by Catholic Church,2018
Four men have been sentenced to a total of 53 years for their roles in a gang that kidnapped a family of four and carried out a €2.08 million cash-in-transit van robbery.,2018
Body of Irish teenager recovered from lake in Spain,2018
Items discovered believed to belong to the Rescue 116 crew,2018
Law to enable doctors be more open with patients and families,2018
Temperatures to climb into mid-20s by weekend,2018
Woman (22) lay in coma for hours before dying in Cork squat,2018
Government has spent €1bn purchasing homes since 2011,2018
Man (37) pleads guilty to unlawful killing of nephew’s friend,2018
Council to consider construction of log cabin homes in gardens,2018
Four sentenced over ‘heinous’ €2m Dublin kidnap robbery plot,2018
"Subscriber Only: Cold-blooded France win their second World Cup, Galway sink Kerry in Super 8s",2018
Co Cork vet has registration cancelled due to ‘professional misconduct’,2018
Man pleads guilty to attempting to murder four children,2018
Still sucking diesel: Taxi drivers ignore Ross’s electric car incentive,2018
"Almost 1,000 civil servants paid less than living wage",2018
"Garda awarded €250,000 after gun incident left him with PTSD",2018
"Nearly one in five Garda stations unable to access internet, Minister says",2018
Irish scientists find distinct immune system in newborn babies,2018
Lack of enforcement of environmental laws ‘a national scandal’,2018
Gardaí investigating sulphuric acid sent to Sunday World offices,2018
"Arsenic levels in seaweed have ‘negligible’ impact on human health, study finds",2018
Concern for ‘fragile’ Skellig Michael as visitor numbers rise,2018
Ryanair accused of downplaying emergency landing which injured dozens,2018
Dublin water restrictions to be reviewed next week,2018
Galway singer Áine Morgan with cervical cancer seeks access to clinical trial,2018
Mary McAleese likes ‘argumentative’ Pope Francis who ‘likes you to argue back’,2018
Extremely rare white lobster turns up in Bantry Bay,2018
Young musician dies from injuries after assault in Waterford,2018
"A civil servant’s story: ‘I’ll have to think about sharing a room. As a woman in her 30s, it is horrible’",2018
Irish citizens in NI could lose EU rights post-Brexit - warning,2018
Are you scrambling to find a place to live for the coming academic year? Are rental price hikes making it harder than ever to make ends meet? Share your story,2018
"Strawberry farmer loses €200,000 of fruit due to hot weather",2018
Three men rob Co Limerick bookmakers,2018
Sporting events spark domestic abuse in England – what about Ireland?,2018
Body of Irish teenager recovered from lake in Spain,2018
Shouts heard from home of Dublin man (74) just before death,2018
Most read story on @IrishTimes right now: Irish Water to take over sole control of services from councils,2018
Cork to get new €5 million bridge in city centre,2018
Woman survives 200ft drop and seven days on radiator water after California crash,2018
FG senator calls for ‘drunk tanks’ to free up emergency departments,2018
"Man dies in crash at Mohill, Co Leitrim",2018
New south Dublin town plan appealed to An Bord Pleanála,2018
Council to consider construction of log cabin homes in gardens,2018
Still sucking diesel: Taxi drivers ignore Ross’s electric car incentive,2018
