full_title,date
"It's not often an Irish woman lands on the cover of British Vogue,.Now activist Sinead Burke has done it ...",2019
New immigrant registration system for students introduced,2019
Victorian-era sex toy ‘returned to Ireland’ after crowdfunding bid,2019
"“There is a sense among Catholics that they have inherited injustice. I have marched with the students and sung, 'We shall overcome'”",2019
"The dildo, which is at least 130 years old, and is believed to have been owned by a wealthy Anglo-Irish household, received more than 100 bids from nearly 40 different countries when it was auctioned in April 2017",2019
Book of evidence served on Alan Wilson,2019
High Court suspends declaration of unconstitutionality of law,2019
Irish teenager wins Google science award for microplastics project,2019
"The public services card (PSC) system runs the risk of becoming a centralised database containing intimate, personal information, the UN’s special rapporteur on extreme poverty Philip Alston has said",2019
Man (62) returned for trial on charge of sexually assaulting girl in hospital,2019
"Sponsored: ""It’s handier than driving and much easier for us - you can close your eyes and simply relax""",2019
UCC lecturer named new special rapporteur on child protection,2019
Opening hours of children’s urgent care centre restricted by a further three hours a day,2019
A Cork man who raped his neighbour after she asked him to leave her house has been jailed for 7½ years,2019
Medical Council urged to review language skill assessment for doctors,2019
Hung jury in trial of Louth woman charged with murdering boyfriend,2019
Man who took part in robbery ‘spree’ jailed for five and a half years,2019
Motor assessor tells Ennis court the two cars never collided,2019
Man who raped neighbour after refusing to leave her house jailed for 7½ years,2019
Businessman Jim Mansfield jnr will seek trial date,2019
Cork’s Shakey Bridge to close for major €1.7m renovation,2019
Boy who claimed deflated ball led to injury fails in court action,2019
Netherlands’ ‘burka ban’ set to unravel before it begins,2019
Gardaí admit they were not prepared for Regency Hotel attack,2019
Two men jailed over €5.5m forestry investment fraud,2019
"UK prime minister Boris Johnson visits a Scottish naval base, an 8-year-old boy is killed by a train after being pushed from a platform in Germany and a Galway Imam inspects the damage to a mosque following an early morning attack - Images of the Day",2019
Siblings seek ‘enhanced inquest’ into brother’s killing,2019
Do you have an old story to tell? We would like to hear it,2019
Former Christian Brother charged with assaulting schoolboy,2019
Garda announces reshuffle following promotions,2019
The judge granted a six-month stay to each of the Mays on the execution of the repossession orders to allow them time to find alternative accommodation,2019
Waiting list for Fair Deal scheme up 16 per cent in just three weeks,2019
Gerald Jennings said through his solicitors the verdict 'sent a strong message to the public that the high standard of conduct expected from our gardaí was not met in this case',2019
The Supreme Court has dismissed an appeal by businessman and anti-eviction activist Jerry Beades against a €9.6 million judgment order granted against him concerning loans advanced for a development of 48 apartments in north inner city Dublin.,2019
Greta Thunberg to sail across Atlantic for UN climate summits,2019
Man awarded €1.1m for wrongful arrest by gardaí over attack on fiancee,2019
A Proper Person to be Detained review: A difficult family story,2019
Separated couple have second house repossessed over €2m mortgage debt,2019
Further restrictions to opening hours of new children’s urgent care centre,2019
Leading officials in Frankfurt made direct contact with senior Government figures over the appointment of Gabriel Makhlouf.,2019
"""We are a very well integrated community and it’s terrible after all our efforts that we are still victimised like this,"" says the president of the Ahmadiyya Muslim Association of Ireland",2019
Only a fraction of the landlords who have rented out properties on Airbnb and other “home-sharing” websites have registered them under the Government’s new short-term letting rules.,2019
"Family of man (29) who died while cutting trees, settles for six figure sum",2019
Bipartisan committee ‘deeply concerned’ at Boris Johnson’s rejection of backstop (via @irishtimesworld),2019
The report also warns the Republic is unlikely to see levels of migration similar to those witnessed in the mid-2000s and will face a battle with other countries to secure talen,2019
Three-man ‘hit for hire team’ get sentences totalling 36.5 years for planning to kill Hutch family member,2019
“Cian has masses of potential and he deserves the same chances as everyone else”,2019
Proposed minimum corporate tax rate could affect State's ability to attract FDI,2019
Mosque on outskirts of Galway city vandalised,2019
Could we see an Irish winner from Love Island? Can Maura Higgins and Greg O'Shea beat firm favourites Tommy Fury and Molly-Mae Hague? All will be revealed on the final tonight ...,2019
Support package will help struggling beef sector as October 31st deadline  approaches,2019
Supreme Court dismisses Jerry Beades’ appeal against €9.6 million judgment orders,2019
About a dozen individuals reported injured in incident at Gilroy garlic festival in California,2019
Cutting VAT on new homes would help more people escape the rent trap,2019
Man who conspired to assissinate Dubliner jailed for six years,2019
'I tried to wake him up and touched his face and his hands and he was cold as ice',2019
The life and tragic death of Trinity graduate and writer Sophie Hingst,2019
Man released without charge after ‘sting’ in Cork,2019
Cody the constant in Kilkenny's success; McIlroy fails to show on final day in Memphis,2019
Gabriel Makhlouf’s succession to top post triggered direct contact by Frankfurt officials,2019
Summer tuition scheme excludes those with mild or moderate learning disability,2019
"Bill for doctors, nurses and support staff to plug healthcare gaps comes in at €135m",2019
A unique institution continues to accommodate those people of divergent political views,2019
Rule change paves way for Anila Devasia to be first contestant not of Irish heritage,2019
Minister set to signal extension to accelerated process for Strategic Housing Developments,2019
ICCL: The poor are being forced to trade data for public services,2019
The project will involve the construction of an underpass on the North Circular Road,2019
Local authorities receive just a handful of notifications of short-term rental properties,2019
Spokeswoman said the changes are being made for reasons of convenience,2019
Online interactions can be important for brands – but there are potential pitfalls,2019
Is there any comeback when a teen accidentally runs up a big mobile bill?,2019
Construction difficulties delay opening of €230 million bypass by more than  six months,2019
"Hundreds of thousands not taking up PRSI dental, optical benefits",2019
Developers risk losing fast-track permission unless start made,2019
"Months after the death of Polish man Michal Wasikiewicz on the steps of St Audoen’s Church in Dublin, his family are still trying to figure out what happened",2019
Indian nurse (27) makes Mary from Dungloe history,2019
Church of Ireland marks 150 years since end of role as state church,2019
"HSE agency spend hits €900,000 daily on agency staff",2019
"Down syndrome children suffering discrimination, say parents",2019
"Cliff Taylor: We need affordable homes, not unaffordable loans",2019
ECB raised concerns over new Central Bank of Ireland boss,2019
Nicky English: Tipp's resilience sees them through in a testing semi-final,2019
Polish man shocked to learn son died and was buried in Dublin,2019
New multimillion-euro cycle path in north Dublin included in BusConnects plans,2019
‘Family and friends keep asking me when his funeral will be held’,2019
Only a fraction of Airbnb landlords register under new letting rules,2019
Garda Síochána to replace Huawei equipment,2019
So-called influencers: how much influence do they actually have?,2019
Work on State’s longest bridge delays New Ross bypass opening,2019
"Russian opposition leader Alexei Navalny has been admitted to hospital after suffering a serious allergic attack while in detention, his spokeswoman said.",2019
Sponsored: “No one ever says no to you. You are never told you can’t do something. I’ve never heard those words spoken to me in 17-and-a-half years”,2019
"Greyhounds on a protest march, Bray Air Display, and the Mary from Dungloe. It's the Images of the Weekend, selected by deputy picture editor @laurahutts",2019
"Sponsored: ""It’s handier than driving and much easier for us - you can close your eyes and simply relax""",2019
"Hoax calls take up seven hours of police time every day, PSNI says",2019
Bray Air Display: ‘I thought the yellow lad was a goner’,2019
‘Outstanding in its field’: Boris Johnson among scarecrow festival entries,2019
Keith Byrne: ‘Nothing good comes from sending me home’,2019
Improvements made for second trial of College Green plaza,2019
Persistent speeding during M7 upgrade works criticised,2019
Second gun attack in Ballymun in three days,2019
"CCTV needed in all creches, say parents in wake of exposé",2019
Sun shines on Croagh Patrick as pilgrims seek a spiritual lift,2019
"❝ I ignore them. Every single one. No matter how young, charming, or worthy the cause, because I know and you know there is method at work here.",2019
Why we should stop sending politicians to Brussels,2019
The days of Ireland using its corporate tax regime as a key attraction for foreign direct investment may be numbered - but where do we go next?,2019
'Gentle' Clare man was a beacon of light for tens of thousands who saw him as a source of sense in a nonsensical world,2019
The US Supreme Court has cleared the way for the Trump administration to use billions of dollars in Pentagon funds to build sections of a border wall with Mexico.,2019
"A viable device discovered in Co Armagh was an attempt by dissident republican to murder police officers, the PSNI has said.",2019
Sammy Wilson reacts angrily to Simon Coveney's criticism of UK Brexit policy,2019
"Dry, sunny weather coming but night-time temperatures will dip",2019
Actor Pauline McLynn calls for greyhound racing to be outlawed at Dublin demonstration,2019
"A Waterford man has become the first person to paddleboard prone around Ireland, undertaking the record-breaking feat to raise money for Waterford Hospice",2019
Information sought on bag owned by missing woman Deirdre Jacob,2019
"The UK government is “operating on the assumption” that Britain will leave the EU without a deal on October 31st, Michael Gove has said.",2019
Families fled as passengers allegedly used furniture as weapons on board the P&amp;O ferry,2019
Royal Jordanian Falcons headline opening day in Bray during weekend of flying acrobatics,2019
Burglars are suspected of having wiped out broadband coverage for hundreds of homes and businesses in the west of Ireland in an attempt to avoid being detected as they broke into a shop.,2019
Scouting and school abuse case settled for six figure sum,2019
Speaker Nancy Pelosi condemns 'racist attacks' against Elijah Cummings,2019
"'Very real prospect' that no agreement is reached by October 31st, says Gove",2019
Public advised not to drink two types of water from shop chains,2019
Preparations for another showdown after day of clashes in Hong Kong left two dozen injured,2019
"""You’ll fly in considerable luxury at whatever time suits you,"" promised Ryanair in one of its first newspaper ads in 1985",2019
‘How do I leave my partner without feeling guilty?',2019
Spar and Londis bottled water recalled over arsenic levels,2019
Medieval Irish Pilgrims to Santiago de Compostela review,2019
Here is your handy guide to sport on television today,2019
Two people have died and 16 others have been injured after an internal balcony at a nightclub in South Korea collapsed,2019
A home for less than €300k in Dublin? Here's 30 to get you started,2019
"Sponsored: Donal Skehan: “I’m showing my little fella these fantastic places that I grew up in for the first time, and it does bring on homesickness”",2019
Burglary linked to internet blackout in Ballinasloe,2019
Sponsored: “No one ever says no to you. You are never told you can’t do something. I’ve never heard those words spoken to me in 17-and-a-half years”,2019
"Sponsored: ""It’s handier than driving and much easier for us - you can close your eyes and simply relax""",2019
Crowds turn out for ‘spell-binding’ Bray Air Display,2019
A Treatise on Northern Ireland: Tearing up myths about the Troubles,2019
Man (24) wounded in leg with knife during fight in Dublin,2019
Waterford man completes round-Ireland paddleboard trip,2019
Protesters urge end to State support over ‘horrors’ of greyhound racing,2019
Late actor and director was a cornerstone of stage and screen on these shores,2019
"Sophie Hingst (31) was a troubled young woman who came to live and work in Dublin. She was found dead in her bed just over a week ago, it is suspected that she died by suicide. Derek Scally tells her story.",2019
Parents meet with Hyde &amp; Seek management after child care exposé,2019
Is the heat keeping you up at night? Relief is on the way,2019
Police targeted by explosive device in Co Armagh,2019
How to holiday cheaply in Spain: Everything you need to know,2019
Next Saturday sees the 100th edition of the Liffey swim. The Dublin institutions's popularity has ebbed and flowed but it remains a unique sporting and cultural event for the capital,2019
Two architects of social change in Northern Ireland,2019
David McWilliams (@davidmcw): Ireland needs to pay more attention to global trends than regional ones,2019
Taoiseach says people in the North will question union if Britain crashes out of EU,2019
Fintan O'Toole: Johnson must confront tyranny of fact,2019
"Thinking Anew – ‘Lord, teach us to pray’",2019
Houses available for rent down by almost 2% in 2018,2019
Champion of Irish culture in London bows out after 13 years of service,2019
FAI chief Donal Conway steps forward despite chaos,2019
Former judge ‘rejects’ calls to decriminalise drugs,2019
What are these insects on my broad beans? Readers’ nature queries,2019
A tale of two MPs: Stella Creasy and Conor McGinn,2019
The unsung fate of the ocean’s Atlantic herring,2019
"Poor access to rail networks breaches rights, disability protesters claim",2019
Here is your handy guide to sport on television today,2019
Polish LGBT groups are holding solidarity marches and events in 30 cities on Saturday to protest growing hate speech and violence against their community.,2019
Palestinian leaders have suspended all agreements with Israel in protest over its demolition of Palestinian homes earlier this week in the Jerusalem-area village of Sur Baher.,2019
❝ We need a zero-tolerance approach to tackle the minority of providers who put profit ahead of the best interests of children.,2019
"Sponsored: Booking a tailored, luxury family holiday can create memories to last a lifetime. Here are some recommended destinations for 2019",2019
Irish man dies in road crash in Australia,2019
A woman who claimed an aerosol dry shampoo turned into “a flame-thrower” when she sprayed it in a nightclub bathroom has settled her High Court action on terms including undisclosed damages.,2019
"The Arctic is suffering its worst wildfire season on record, with huge blazes producing smoke that can be seen from space",2019
"Sponsored: Donal Skehan: “I’m showing my little fella these fantastic places that I grew up in for the first time, and it does bring on homesickness”",2019
"❝ There comes a moment, though, when chancers are found out",2019
Sweden dismisses Trump’s outburst over A$AP Rocky case,2019
"Croagh Patrick parking shortage has created ‘huge’ safety risk, locals claim",2019
"Mr Rees-Mogg will not be “pleased to learn” anything, he will not “note/understand your concerns” nor will he “invest (in schools etc)”, and the phrase “no longer fit for purpose” has been deemed no longer fit for purpose.",2019
Travellers must appear before judge after failing to vacate site,2019
Sponsored: “No one ever says no to you. You are never told you can’t do something. I’ve never heard those words spoken to me in 17-and-a-half years”,2019
Man (21) who buried car on family farm after fatal hit-and-run avoids jail,2019
Europe’s record heatwave threatens Greenland ice sheet,2019
Dozens of Drumcondra residents protest outside Hyde &amp; Seek creche,2019
"Sponsored: ""It’s handier than driving and much easier for us - you can close your eyes and simply relax""",2019
"Paying by card convenient, but it leaves a trail of personal data",2019
❝ British-Irish relations are now at their lowest in a generation and it is vitally important that the rupture does not grow and fester.,2019
Gardaí seize 12 caravans and power tools at halting site in Rathcoole,2019
The Irish Times asked readers who pay for childcare in creches in Ireland to share their experiences – both positive and negative. Here is what they had do say.,2019
A man has been taken to hospital after a stabbing incident in Dublin city centre.,2019
"NI will question union in event of no-deal Brexit, warns Varadkar",2019
Woman who claimed aerosol dry shampoo became ‘flame-thrower’ settles case,2019
Jail for woman who stole Co Donegal pensioner’s life savings,2019
"An Australian tourist who injured his leg after slipping and rolling down three steps of a stone stairs at the National Museum of Ireland has been awarded almost €67,000 damages by a High Court judge.",2019
Dutch man living in England jailed for falsely claiming social welfare,2019
"A 51-year-old man has been jailed for six years for conspiring to possess an explosive substance, a firearm and ammunition.",2019
"Australian tourist wins €67,000 over fall at National Museum",2019
Jailed for man who conspired to buy guns and grenades on Dark Net,2019
Jackie Tyrrell: All-Ireland semi-final is the worst stage possible to lose at,2019
Man stabbed near Grafton Street in Dublin,2019
Man injured by rampaging cow released from hospital,2019
"Tánaiste Simon Coveney has said new British prime minister Boris Johnson’s approach to Brexit was “very unhelpful” and would block an agreement, after Mr Johnson rejected a key Irish demand his predecessor had agreed to.",2019
Donegal man jailed for threatening to kill and rape gardaí,2019
New children’s hospital facility to open within days despite ‘unsafe’ warning,2019
Are you a student looking for a place to rent in Ireland? Tell us your story,2019
Supreme Court to hear Ruth Morrissey judgment appeal,2019
An injunction ordering Facebook and Twitter to remove any photographs or other material identifying the two boys convicted of murdering Ana Kriégel will remain in place until after their sentencing in November.,2019
Ana Kriégel murder: social media injunction extended until November,2019
"Who, apart from banks and card companies, has ever demanded that the option to pay for things anonymously by legal tender be taken away or rendered obsolete?",2019
Former Irish footballer Paul McGrath issues appeal over missing son,2019
Jackie Tyrrell on oblivion of losing a semi-final; Ireland have a real chance at Lord's,2019
Dublin City Council refused planning permission for drug injection centre,2019
UPDATE: Luas Green Line services between St Stephen’s Green and Dawson St have been suspended this morning after a man was stabbed,2019
New Northern Secretary to meet Coveney and parties today,2019
One of Smith’s first tasks is to show he will be an honest broker in the North,2019
"New children’s facility ‘unsafe’, say top doctors",2019
Luas green line between Stephen’s Green and Dawson St suspended,2019
"Parnell Square deal should be investigated by PAC, says councillor",2019
Air Corps pilots to train with Royal Australian Air Force,2019
Forgotten Co Longford ready to be centre of Irish tourism,2019
Barriers sidelined for second College Green plaza trial,2019
Victoria Cross won by Irishman to go on display in Dublin,2019
Businesses bemused by council’s ‘strange’ pedestrianisation of College Green,2019
Here is your handy guide to sport on television today,2019
‘New to the Parish: Mandla Ncube arrived from Zimbabwe in 2016 (via @IrishTimesLife),2019
The @IrishTimes Group is looking for an IT Business Analyst/Project Manager,2019
"Sponsored: The table in Pauline Sugrue’s kitchen served as their family table for 20 years in Australia, and now students who attend her cookery school in Donegal eat from it",2019
"Welfare, tax systems will not address issues keeping people in poverty",2019
Disability centre residents exposed to shouting and pushing – Hiqa,2019
Controversial direction on High Court asylum cases to be reviewed,2019
Cork coroner urges automatic reviews of all fatal crash sites,2019
OPW says decision to remove books amid GDPR concerns ‘erred on the side of caution’,2019
"Sponsored: Booking a tailored, luxury family holiday can create memories to last a lifetime. Here are some recommended destinations for 2019",2019
Gardaí seize ‘childlike sex doll’ during series of raids,2019
London Letter: Britain’s new PM delights Tory MPs with cynical performance in the Commons,2019
Mater hospital unit uses technology to identify cancer without need to remove tissue,2019
"Two brothers have been sentenced to six years in prison for their roles in the theft of an estimated €205,000 from a reclusive woman.",2019
"Sponsored: Donal Skehan: “I’m showing my little fella these fantastic places that I grew up in for the first time, and it does bring on homesickness”",2019
Johnson’s backstop abolition demand simplifies Varadkar’s task,2019
Luas green line services delayed after incident near Trinity College,2019
Parnell Square cultural quarter plans collapse after costs soar,2019
"‘Decent bloke’ robbed McDonald’s outlet after threat on his life, court told",2019
"The family of Irishman, Keith Byrne has expressed their relief and delight that he has been freed from custody in the US and allowed return home to his family pending an appeal against a decision to deport him back to Ireland.",2019
Murderer revealed sexual abuse as child to prison psychology service,2019
Comedian Sil Fox (86) denies sexually assaulting woman,2019
Sponsored: “No one ever says no to you. You are never told you can’t do something. I’ve never heard those words spoken to me in 17-and-a-half years”,2019
Woman (31) remanded in custody after being charged with mugging in Cork,2019
Sam Clarke Kavanagh has sued over burns to her hand and face suffered in 2015 incident,2019
Woman claims dry shampoo aerosol in nightclub turned into ‘flamethrower’,2019
Tomasz Paszkiewicz had pleaded guilty to the manslaughter of Marek Swider in Cavan,2019
Ireland’s first digital surgery unit ‘will reduce complications’,2019
Visitor books to be returned to heritage sites after privacy fears clarified,2019
Father of three will have opportunity to appeal case to a judge to try and stay in the US,2019
"Woman (76) lived in fear of brothers who stole €205,000 from her",2019
Agency to be quizzed by Oireachtas committee on how centres could remain open,2019
"Staff exceeded remit and engaged in unacceptable practices, Minister for Justice says",2019
Complaint was made around two weeks ago and predates the RTÉ Investigates broadcast,2019
Court approves €2.5m payment for girl with cerebral palsy,2019
"The men, believed to be from Sudan, are being detained but are in good health",2019
Keith Byrne’s family welcome his release from custody in US,2019
Det Garda Pat Muldowney says cattle were ‘of valuable assistance’,2019
"Mothers bringing sons to be shot by appointment, Police Authority hears",2019
What do the new mortgage figures tell us about the property market?,2019
Money was paid by National Transport Authority for two-day visit of Pope Francis last August,2019
Limerick-based student wins silver at International Mathematical Olympiad,2019
Gardaí investigate pre-existing claim of assault on girl at Hyde &amp; Seek creche,2019
Three men found in back of truck by gardaí in Galway,2019
UK prime minister says ‘time limit not enough’ in first House of Commons statement,2019
No bull: Cattle help gardaí round up fleeing burglar,2019
Company to appoint ‘expert external consultant’ to review management and service,2019
"Communities living in fear of eight-year-old gang members, forum told",2019
"The woman was eight months pregnant at time of 2011 incident in Tallaght, Dublin",2019
Tusla is set to appear before the Oireachtas Committee on Children as early as next Wednesday following an undercover investigation that revealed a pattern of disturbing behaviour and practices in a chain of Dublin creches,2019
Creche claims documentary ‘does not reflect who we are’,2019
Does your child attend a crèche in Ireland? We would like to hear your story,2019
"Woman’s €60,000 claim over petrol station fall dismissed by judge",2019
Meat factory worker jailed for nine years for killing housemate with boning knife,2019
Comedian Sil Fox (86) denies sexually assaulting woman,2019
"An appeal has been initiated over a controversial High Court decision, with far-reaching implications, that applicants for citizenship must have “unbroken” residence here for a year prior to their application",2019
Choosing a creche: the parents’ checklist,2019
