full_title,date
Here is your handy guide to sport on television today,2019
Cavan man ordained auxiliary bishop of Armagh archdiocese,2019
"Shane Lowry's was a win forged from the depths of despair of a year ago, when he cried in his car after missing the cut at Carnoustie – his fourth straight missed cut in the championship – and wondered where his game was headed #TheOpen",2019
Sponsored: “It’s a very good work environment made up of a highly engaged group of people with a strong can-do attitude and a clear sense of ownership”,2019
Brave new world for Dublin’s College Green comes with barriers and grey skies,2019
Greens urged not to waste support surge by propping up Fine Gael or Fianna Fáil,2019
The Irish Times view on third-level reform: university autonomy should be protected,2019
"“I was on the podium and it was near the end of the service when I heard screaming and shouting. I looked to my left and could see people running, screaming and shouting.”",2019
#TheOpen: Shane Lowry wins the Claret Jug! A final round of 72 sees Offaly golfer secure a six shot victory at Portrush,2019
The @IrishTimes Group is looking for an IT Business Analyst/Project Manager,2019
"Offaly man Shane Lowry has won the British Open at Portrush, Co Antrim",2019
Man and child hospitalised after suffering injuries at festival in Co Wicklow,2019
Deported man says ‘ruthless’ US immigration system leaves no options,2019
Reports of alleged assault made after protest outside greyhound track,2019
The @IrishTimes Group is looking for a Research Executive,2019
One person ‘seriously injured’ as car drives into crowd at Dundalk cemetery,2019
"Efforts to bring abortion to Northern Ireland ‘insidious,’ says Foster",2019
British Open: How sport and Shane Lowry are uniting Ireland,2019
"FAI president seeking re-election is mind boggling, says Shane Ross",2019
Dora goes exploring: Sanctuary owner appeals for help tracking missing wallaby,2019
‘We’re all in trouble’ if new PM tears up Brexit deal – Coveney,2019
First toad captured in garden in south Dublin following public appeal,2019
"It was believed that the tests were likely to remain accurate even though they had expired, but the HSE said it recalled some women for a second test as a precaution.",2019
An Post workers protest in Cork as mail centre faces closure,2019
Here is your guide to sport on tv today,2019
A man has died following a road traffic collision involving a motorcycle and a car in Co Cork,2019
Sponsored: “Companies are going to need a new set of strategies because what they are doing now is not enough anymore”,2019
FAI president Donal Conway expressed the hope that the vote to pass recommended rule changes will be seen as significant in the normalisation of its relationship with government and the restoration of public funding,2019
Man killed in road traffic collision in Co Cork,2019
Ireland’s Shane Lowry forged into a commading lead at the British Open as he moved to 16 under after a stunning third round on a becalmed Dunluce links on Saturday,2019
"Revealing the scale of the expired tests for the first time, the HSE said of the 11,500 identified, about 4,000 women were invited to attend their GP for a precautionary repeat cervical screening test",2019
"Around 11,500 women given out-of-date CervicalCheck smear tests – HSE",2019
Sponsored: “It’s a very good work environment made up of a highly engaged group of people with a strong can-do attitude and a clear sense of ownership”,2019
"A 45-year-old man has appeared at Dublin District Court charged with the murder of a man at Clinchs Court, North Strand, in the city in the early hours of Friday morning",2019
Man (45) charged with murder of another man in Dublin,2019
"Iran’s Revolutionary Guards posted a video online showing speedboats pulling up alongside the Stena Impero tanker, its name clearly visible",2019
Shane Lowry (-12) moves into one-shot lead at British Open. Follow the closing stages of the third round in Portrush (via @IrishTimesSport),2019
A US-bound Aer Lingus flight has made an emergency landing at Dublin Airport this Saturday afternoon after suffering an engine failure,2019
EA group of environmental and transport activists have blocked traffic in Dublin’s South William Street to highlight the “urgent” need for action to address the city’s air pollution,2019
Fintan O'Toole: Eoin Morgan showed England its better self,2019
The @IrishTimes Group is looking for an IT Business Analyst/Project Manager,2019
Aer Lingus flight makes emergency landing in Dublin after birdstrike,2019
Woman (49) asks to be remanded in custody,2019
Environmental activists block traffic in Dublin city centre,2019
"Varadkar: ‘There’s racism and homophobia. But I’m a big boy, I can take it’",2019
I was a garda. I was gay. I lost my job,2019
"‘Make climate change personal in your life’, Robinson urges",2019
The @IrishTimes Group is looking for a Research Executive,2019
Woman (49) in court on drugs charges asks to be remanded in custody,2019
"‘Make climate change personal in your life’, Mary Robinson urges",2019
Greyhound board to meet UK counterparts,2019
Man in his 20s stabbed in Belfast,2019
Daniel Ortega’s government stands accused of repression and worse,2019
Cloudy weekend to give way to temperatures of up to 28 degrees next week,2019
Greyhound board to meet UK counterparts to develop tracking system,2019
Restaurant review: There's a saucy new chick on the block in Dublin city,2019
"Nasa will put a woman on the moon by 2024, says former astronaut",2019
European politicians should not be afraid to disagree with Trump - FF leader,2019
How should the moon landing be remembered 50 years on?,2019
Man killed in Dublin knife attack named,2019
Man in his 20s stabbed in early morning incident in Belfast,2019
Rail users face disruption as Tara Street and Pearse stations close for weekend,2019
"Mental health among prisoners must be addressed, says Minister",2019
Bailey set to lose FG whip over swing compensation claim,2019
Man (45) killed in Dublin knife attack is named,2019
Keith Byrne signs passport document which could lead to deportation,2019
Rail users face disruption as Tara Street and Pearse stations closed for weekend,2019
"College Green pedestrianisation will block ‘main artery’, say taxi drivers",2019
"Mental health among prisoners must be addressed, says Charlie Flanagan",2019
Maria Bailey set to lose FG whip over compensation claim,2019
"College Green traffic ban will block ‘main artery’, say taxi drivers",2019
UK ‘deeply concerned’ over oil tanker seizure by Iran,2019
Miriam Lord’s Awards,2019
"A gay man, I was dismissed from An Garda Síochána in the 1980s",2019
How to holiday cheaply in Italy: Everything you need to know,2019
"Ireland can do “much more” to address the problem of severely mentally ill people being kept in prison, Minister for Justice Charlie Flanagan has said",2019
Thinking Anew – Never too busy to listen and learn,2019
Nurses likely to begin getting extra payments from August under new deal,2019
New children’s urgent-care centre will only open 8am to 6pm on week days,2019
"Mental health among prisoners must be addressed, says Flanagan",2019
‘Will they sink into the surface?’ Covering the moon landing,2019
Church services,2019
Are these painted ladies mating and what’s this fish? Readers’ nature queries,2019
"As the ice melts, what will become of our planet?",2019
Fine Gael is set to remove the party whip in the Dáil from Dún Laoghaire TD Maria Bailey over her controversial personal injuries claim against a Dublin hotel,2019
Here is your guide to sport on tv today,2019
Man convicted of deer poaching in Co Wicklow,2019
Minimum wage a tool for equality but no panacea for poverty,2019
A 90-year-old man has sent his love to his deceased parents on the Bulletin Page of The Irish Times,2019
Farmer claims for €1.65m in losses following combine harvester incident,2019
"Gardaí seize guns, ammunition and €1 million worth of drugs in Dublin",2019
Lawyers for Irishman Keith Byrne are pursuing further legal avenues in a last-minute bid to halt his deportation. Mr Byrne signed an application for an Irish passport on Friday which could pave the way for his deportation,2019
Father’s crimes should not have denied child Irish citizenship,2019
The garda sustained a gunshot wound to his ankle at Mayorstone Park garda station in Limerick city on Thursday,2019
US Ambassador Edward Crawford comes home to Boherbue,2019
Man stabbed another man while out celebrating finishing Leaving Cert,2019
"Minister for Housing Eoghan Murphy was criticised by the Opposition for the comments he made defending the co-living developments, which see occupants have their own bedrooms but share some facilities",2019
Greyhound board pulls out of Rose of Tralee sponsorship,2019
Sponsored: “Companies are going to need a new set of strategies because what they are doing now is not enough anymore”,2019
"Widow of man who died of carbon monoxide poisoning settles action for €170,000",2019
Girl (15) missing from Navan since Wednesday,2019
Reports of kangaroo spotting in rural Co Cork,2019
Hundreds of bouncy castle operators may go out of business,2019
Mid-West Type 1 diabetes patients offered ‘disgraceful’ services,2019
Garda undergoes surgery after accidentally shooting himself in foot,2019
Tourists contributing to overcrowding at Kerry hospital,2019
Keith Byrne signs passport form which could lead to deportation,2019
College Green traffic-free plaza trial to begin on Sunday,2019
"The US ambassador visits the home of his ancestors in Co Cork, Lowry leads the charge at Portrush while walkers take advantage of the weather at Dublin Bay - The Images of the Day",2019
"Revenue officers seize more than 2,500 cigarettes, €18,000 in cash",2019
Donald Trump renews attack on Democratic Congresswoman,2019
Eoghan Murphy: Co-living comparison to ‘boutique hotel’ not a ‘good one’,2019
Merkel calls for fresh thinking to negate need for Border backstop,2019
Sponsored: “It’s a very good work environment made up of a highly engaged group of people with a strong can-do attitude and a clear sense of ownership”,2019
The Levelling: A banker's prescient warning of the growing debt crisis,2019
Brother and sister jailed over faking mother’s will,2019
Judge refers serious allegations made against father of baby boy to gardaí,2019
Family settle case over death of 88-year-old man,2019
Historian says Varadkar has breached letter and spirit of the Belfast Agreement,2019
Greyhound board pulls out of Rose of Tralee sponsorship over online threats,2019
Hopping mad: Kangaroo spotted in rural Co Cork,2019
Tourists contributing to overcrowding at Kerry hospital emergency department,2019
Northern Ireland residents 'to be affected by citizenship ruling',2019
Man charged with having weapons outside Dublin nightclub,2019
‘I love you Ma and I miss you’ - a 90-year-old’s message to his parents,2019
The @IrishTimes Group is looking for an IT Business Analyst/Project Manager,2019
First College Green traffic-free plaza trial to begin on Sunday,2019
Brother and sister jailed for faking mother’s will,2019
Suspected arsonist reportedly planned Japan’s worst mass killing in 18 years,2019
"Weather warning: Thunderstorms, flooding, soaring temperatures",2019
Family settle case over death of 88-year-old man in hospital,2019
"Ireland ‘engaging with international actors’ to help bring Lisa Smith home, says Charlie Flanagan",2019
Cherry blossom trees planted ‘in silly places’ being cut down,2019
The @IrishTimes Group is looking for a Research Executive,2019
Man arrested over fatal stabbing,2019
German chancellor sent some wise words to the Euro flag man on his wedding day,2019
Telling the truth may not always be best,2019
‘I love you Ma and I miss you’ - a 90-year-old’s message to his Ma and Da,2019
Dáil exposed by its rejection of trade deal,2019
Tech graduates earn most within five years of leaving college,2019
Angela Merkel sent some wise words for the Euro flag man on his wedding day,2019
"Resurgence in salt intake linked to heart disease, stroke and cancer",2019
Merkel: ‘The Withdrawal Agreement is the Withdrawal Agreement’,2019
Dublin’s Tara and Pearse stations to close over weekend,2019
"Weather: Thunderstorms, flooding, soaring temperatures forecast",2019
"Music may be better than drugs at calming patients, research finds",2019
Cocaine worth €2.5m found in horsebox that came off ferry in Rosslare,2019
Jackie Tyrrell: Kilkenny's leaders delivered right on cue,2019
Ireland ‘engaging with international actors’ to help bring Lisa Smith home,2019
Man in mid-40s dies after stabbing in Dublin,2019
Screening process review recommended after death in Cork Prison,2019
Angela Merkel sent some wise words to the Euro flag man on his wedding day,2019
NI residents to be affected by citizenship ruling – immigrant council,2019
Northern Ireland residents to be affected by citizenship ruling – immigrant council,2019
Screening process review recommended following death in Cork Prison,2019
"Ireland ‘engaging with international actors’ to bring Lisa Smith home, says Flanagan",2019
"Weather warning: Thunderstorms, flooding, soaring temperatures forecast",2019
Motorcyclist (19) killed in Mallow crash,2019
Three sentenced to death for Swedish backpacker murders in Morocco,2019
"Eir behaviour in rural broadband like that of ‘spoiled child’, says Ring",2019
Publications on abortion coming off banned books list,2019
Shane Lowry casts himself into spotlight at Portrush; Jackie Tyrrell on stepping up at crunch time,2019
Man in mid-40s dies after early-morning stabbing in Dublin,2019
Charlie Flanagan says Ireland won’t sign up to migrant agreement,2019
Is it financially worth going to college? New data says yes,2019
Hundreds of ambulance workers to stage 24-hour strike,2019
Builder of children’s hospital slates ‘uncontrollable risks’,2019
Gang feuds and staff shortages blamed for prison assaults,2019
Cherry blossom trees planted ‘in silly places’ being cut down in Dublin,2019
Tech graduates earn most within five years of college exit,2019
"Over 7,000 trees felled by local authorities in 18 months",2019
Barbecues and a picket fence: Finland shows off its liberal prison system,2019
"Residents ‘devastated’ by felling of trees, letters to councils show",2019
Here is your guide to sport on tv today,2019
Call Him Mine: Dial M for murderous prose,2019
"Since 2009, MEPs can no longer employ close relatives. The maximum monthly amount available for all of costs involved in recruiting personal assistants is €24,943 per MEP",2019
"The new 39km-long stretch of the M11 has come in “on time and on budget”, the Taoiseach said. It will cut peak journey times between Dublin and Wexford by 30 minutes",2019
"St Luke’s General Hospital, Kilkenny, and the HSE gave an unreserved apology for failings in care afforded to a man at the hospital before his death in April 2014",2019
Three food plants responsible for third of EPA complaints,2019
Australian family fears for Irish citizenship applications after ruling,2019
Body of homeless man discovered in Cork city,2019
"KBC wants orders requiring siblings Michael Anthony, David and Geraldine McGann to vacate their family home at Falsk, near Strokestown in Co Roscommon",2019
Man told to leave repossessed home or face prison,2019
"The 41-year-old man, who cannot be named to protect the identity of the victim, has been sentenced to two years’ imprisonment for three counts of sexual assault committed at his home in Dublin on October 23rd and 30th, 2016",2019
MPs vote to make abortion legal in the North,2019
Figures show 20 Dublin Bus staff were assaulted this year,2019
Varadkar willing to meet cervical smear women to discuss apology,2019
"In an incident at a roadworks at Bunratty, Co Clare the driver drove his bus carrying passengers from Cork from Shannon airport over three traffic cones after ‘getting a bit thick’ with the roadworks foreman, the court heard",2019
Concerns that unrepaired barriers on motorways threaten commuters,2019
"Suspected Isis follower should be allowed return home, say Louth TDs",2019
Brother of Gerry Hutch dies after fall at his home,2019
Man jailed after assaulting Luas commuter with a screwdriver,2019
"For those in search of a home, either to buy or rent, it is well worth remembering one of the golden rules of property: you are not just buying or renting a house, you are buying into a neighbourhood",2019
Flanagan accepts ‘surprise’ High Court ruling on citizenship,2019
Tinsmithing and winterage on the first list of Irish intangible heritage,2019
"Leo Varadkar said the Brexit withdrawal agreement, which spells out how the backstop would apply, would not be changed",2019
One of Ireland’s last tinsmiths wonders who will carry on the tradition after him,2019
Heavy rain is expected in parts of the country on Friday as Met Éireann issue a status yellow rainfall warning,2019
Varadkar raises prospect of Brexit backstop applying only to North,2019
"Addressing a packed church in Castleknock, Dublin on Thursday morning for Karl Shiels' funeral, parish priest Fr Kieran Coghlan said: “What’s important is how we fill that gap between the time we come into this world and the time we leave it""",2019
Sponsored: “Companies are going to need a new set of strategies because what they are doing now is not enough anymore”,2019
Taoiseach opens Enniscorthy bypass amid locals’ concerns,2019
LATEST: Status yellow weather warning issued for parts of Ireland for tomorrow,2019
"Following in his father’s footsteps, 46-year-old Paraic O’Brien has cut hedges in south Tipperary around Cahir and Clonmel for a quarter of a century, but he dreads the job during the winter months",2019
Wife of Irish man facing deportation says all she has is hope,2019
"Keith Byrne, originally from Fermoy in Co Cork, was arrested by Immigration and Customs Enforcement (ICE) officials in Philadelphia while travelling to work last Wednesday. He has been told to leave the country by Friday or face going to prison",2019
The Court of Appeal quashed the conviction on Thursday over the trial judge’s failure to instruct the jury on the presumption of innocence. The court ordered a retrial,2019
Kilkenny hospital apologises to family of 75-year-old who fell from hospital bed,2019
Brexit and Boris Johnson – what does it mean for sterling?,2019
"Eugenie Houston had argued, just as it was said about the Holocaust “how did we let it happen”, the same could be said about her treatment in that it was reminiscent of where good people accepted an unacceptable regime",2019
What should I do if I’m bitten by a Noble False Black Widow spider?,2019
"Construction work on the new rail traffic control centre, which is being funded the Government’s 2040 plan, is due to begin this year, and should be in operation by 2024",2019
In the last year Northern Ireland has seen a spate of suspected gang-related crimes including a series of thefts of cash machines. The Northern Ireland Affairs Committee of MPs at Westminster is to examine the threat posed,2019
Girl (14) was sexually assaulted by man after being invited for sleepovers,2019
"‘They tell me I am destroying the hedge, but I am here to maintain it’",2019
Bus Éireann driver described as ‘danger on the road’ banned,2019
❝Britain is still faced with the same series of improbable outcomes to the Brexit saga,2019
Bank’s case over Strokestown eviction property delayed,2019
❝Northern Ireland is careening towards direct rule regardless of the wishes of the British or Irish governments,2019
Sean Leahy was aged five when the accident happened in 2016. He was knocked to the ground by an electric car which drove out of a parking space and fractured his lower leg,2019
"Barrister who says she was treated like Jew in Nazi Germany, loses case",2019
Leo Varadkar has said Ireland is ready for Brexit and that 700 extra officials had been employed and temporary structures set up at Dublin Airport and Dublin and Rosslare seaports,2019
Man jailed for rape has conviction quashed on ‘almost inconceivable’ omission by judge,2019
New €135m rail control centre planned for Heuston Station,2019
"""The length of days is not the sole measure of our lives. What is important is how we have lived, loved and what we have achieved. Karl filled his life and lived it to the full.""",2019
"The Tory leadership contender’s brandishing of a kipper during a speech in London on Wednesday night to lambaste unnecessary EU regulation was completely misplaced, an EU Commission spokeswoman said on Thursday",2019
The @IrishTimes Group is looking for an IT Business Analyst/Project Manager,2019
"EU proposed new Brexit deal, British minister claims",2019
"Boy knocked down by electric car settles case for €55,000",2019
The @IrishTimes Group is looking for a Research Executive,2019
"Clicks, beeps and hisses: the sounds of the 1969 moon landing",2019
MPs to look at increase in crime gangs using Irish Border,2019
Provoking a general election would be ‘irresponsible’ – Micheal Martin,2019
"How current motorists, new car buyers and those importing from the UK will be affected by the tax changes",2019
Clare Daly hires Mick Wallace’s son as her EU parliamentary assistant,2019
Enniscorthy bypass will ‘utterly transform’ Wexford town,2019
Middle-income taxpayers may lose out if PRSI and USC is merged,2019
"“I want her child to be able to come home, I would never separate a mother and child, so yes, I want her to come home.”",2019
"Port delays likely under no-deal Brexit, warns Varadkar",2019
Record-breaking heatwave set to hit continental Europe – but Ireland will miss out,2019
Funeral for actor Karl Shiels is taking place in Dublin today,2019
The really hot air is not likely to reach Ireland though temperatures will be warmer than normal with highs of 24 degrees in the early part of next week,2019
At least 55 animal types displaced in UK due to climate change,2019
Leo Varadkar wants suspected Isis supporter Lisa Smith to return to Ireland,2019
Make a move to Dublin's secret sought-after streets,2019
Funeral for actor Karl Shiels to take place in Dublin today,2019
Record-breaking heatwave set to hit continental Europe – again,2019
Enniscorthy bypass will ‘utterly transform’ town,2019
Irish ISIS woman fears she will never be able to return to Ireland,2019
Growing expectation Keith Byrne will be deported from US on Friday,2019
Philosophers claim global warming makes having children immoral,2019
Follow all of the action from Portrush; Brian Hurley the Cork goal machine,2019
"“I’m enjoying it because I have to get the word out to the American people,” Trump said, accusing the four congresswoman of saying “horrible things”",2019
Learning maths without even trying,2019
Row brews over plan to rezone scenic area of Kerry for housing,2019
How Israel used desalination to address its water shortage,2019
"National water supply has world-leader potential, says Irish Water",2019
Should Ireland look to desalination to solve its water shortage?,2019
Bishops denounce Westminster attempt to bring abortion to North,2019
Adoption files around the country could be seized under new Bill,2019
"Unionists fear return to violence, loss of identity in united Ireland – new study",2019
Political dangers to HSE break-up process many and varied,2019
Provoking a general election would be ‘irresponsible’ – Martin,2019
"Clicks, beeps and hisses: the music of the 1969 moon landing",2019
Here is your guide to sport on tv today,2019
"Sweet Sorrow review: A quiet, tender testament to first love",2019
Voluntary severance package for senior gardaí at ‘well advanced’ stage,2019
Peter Flanagan: Could Boris be Britain’s first cute hoor prime minister?,2019
Irish nun given prestigious honour for six decades of teaching,2019
Gsoc informed after man attempts to take own life while in Garda custody,2019
'You’d never expect this in Ireland – you’d never expect to be bitten by a spider and have to go to hospital or whatever',2019
"Son took over cannabis operation from father to pay mortgage, court told",2019
"Entire board of greyhound body should resign, says Ross",2019
Man pleads guilty to child pornography charges in Kerry,2019
Bills for exceeding fresh and wastewater limits will be €500 a year for some households,2019
"Government health reforms will remove layers of managers, Harris says",2019
Ewe turn: Motorist gets stuck on ‘Sheep Highway’ at Kerry pier,2019
"Older non-drivers lonelier than those who drive, according to study",2019
"Irish festivals celebrate the 50th anniversary of the moon landing, hundreds of pieces of luggage are left behind at Duesseldorf airport and sheep graze in the centre of Paris - Images of the Day",2019
"Under plans announced by the Government, health and social care will in future be planned and delivered in six health regions across the country",2019
Sponsored: “I don’t have a degree so it was great that the company looked at me as a person. I’m hard-working and that’s what they saw”,2019
"Citizenship applicants cannot leave Ireland for a year before application, judge rules",2019
The judge said the siblings' offences “strike at the very heart and foundation of decent family values”,2019
Motorcyclist dies following collision in Co Meath,2019
Baby avoids injury after bedroom window smashed in alleged racist attack,2019
Sponsored: “Companies are going to need a new set of strategies because what they are doing now is not enough anymore”,2019
Simon Harris says HSE was 'never fit for purpose',2019
Ruling marks an end to ‘forced separation’ of couples,2019
‘I left my job because it was boring and now I regret it',2019
