full_title,date
Results of investigation into alleged surveillance of prison officers to be released,2019
"Murtagh and Ireland tear through England, Peter Harte on black card tightrope",2019
Hyde &amp; Seek controversy: Tusla to appear before committee,2019
Fuel mishap scuppers Frenchman’s bid to cross Channel on hoverboard,2019
"RTÉ reporter found crowding, poorly trained staff, cheap meals and  instances of poor care",2019
Fans at Lord’s cricket ground treated to rare sight of first-ever  Ireland-England Test match,2019
"Ministers to discuss drug cautions, night culture scheme and childcare at  final meeting",2019
Wheelchair users upset and exhausted by constant breakdown of lifts at  train stations,2019
"Weather watch: Humid in Ireland, heatwave in Europe",2019
Third level reforms will have ‘no implications’ for academic freedom,2019
Worried about what your kids might see on the internet? Don’t shut down –  take control,2019
Does your child attend a crèche - tell us your story,2019
Controversial citizenship ruling is being appealed,2019
Zappone ‘deeply upset’ by undercover creche investigation,2019
"More than 1,200 vulnerable people ‘at risk’ unless residences regulated",2019
The health advantages of green spaces in urban areas,2019
Beautiful bat biology unlocks clues about healthy ageing,2019
Newton Emerson: Exploitation of social reforms in North a ridiculous spectacle,2019
Climate council says Ireland must be prepared for extreme heatwaves,2019
Howzat? England bowled out by Ireland on Boris’s first day as PM,2019
Geriatrician calls for heatwave response plan for the elderly,2019
Embassies may not claim diplomatic immunity on workers’ rights,2019
Calls for fully accessible train platforms across rail network,2019
Students warned of rental scams ahead of new academic year,2019
Searching for carbon-neutral heaven in a world hellbent on waste,2019
Here is your handy guide to sport on television today,2019
The Killing of Thomas Niedermayer: A quietly angry book,2019
"The second highest spender was independent Joan Freeman who spent €253,000 in total, according to SIPO",2019
"The popular Oktoberfest festival that has taken place in Dublin’s docklands for the past 10 years has been cancelled this year due to “unprecedented increases” in the event’s insurance premium, organisers have said.",2019
Undercover investigation of Dublin creches finds disturbing practices,2019
Parents advised to spend time in creches observing practices,2019
Creche owner has appeared in court in past over issues around childcare,2019
Creche owner Anne Davy is seen shouting at very young children when the room they are playing in becomes untidy and flipping toddlers on to their stomachs in an effort to get them to go to sleep,2019
"Creche practices ‘a recipe for disaster’, says childcare expert",2019
A teenage boy whose mother took him to gardaí­ after she learned he had repeatedly raped his eight-year-old nephew has received a deferred sentence,2019
Tusla requests additional materials from RTÉ on creches,2019
"If you're still baffled by the Brexit Backstop (#BorisJohnsonPM #cabinetreshuffle), the Cricket given Ireland's Test match performance today (#ENGvIRE), or maybe both... we have one helpful explainer... 👇",2019
Leo Varadkar tells Johnson new Brexit deal ‘not going to happen’,2019
Sacked Bradley disappointed not to be able to lead Stormont restoration talks,2019
The court heard the student had initially come to break up a dispute after a third boy threw a biscuit at the victim’s face,2019
The @IrishTimes Group is looking for an IT Business Analyst/Project Manager,2019
Boy (15) forced child to perform sexual act while they were playing computer games,2019
Farmers dismiss calls to reduce cattle herd as ‘flawed logic’,2019
"Sponsored: The table in Pauline Sugrue’s kitchen served as their family table for 20 years in Australia, and now students who attend her cookery school in Donegal eat from it",2019
"Man sues over alleged sexual assault by teachers, scout leader",2019
Man who stole 800-year-old mummified head jailed for 28 months,2019
"Lowest expenses of just under €120,000 were incurred by Peter Casey who came second",2019
My husband had an affair while I was being treated for breast cancer,2019
"Business, farm leaders warn Johnson of negative no-deal effects for NI",2019
Resignation watch: Wave of departures as Johnson assumes office,2019
Karen Bradley sacked as Northern Secretary by Boris Johnson,2019
"Sponsored: Booking a tailored, luxury family holiday can create memories to last a lifetime. Here are some recommended destinations for 2019",2019
"Boris Johnson takes over Number 10, Ireland cause chaos at Lord's and Mueller back under the spotlight - The Images of the Day",2019
"An overtime ban by psychiatric nurses, which would have led to significant disruption to mental health services, has been suspended.",2019
"Boris Johnson used his first speech as prime minister of the United Kingdom to insist that Brexit will be delivered, and that he will give the country “the leadership it deserves”.",2019
Deferred sentence for teen who raped his eight-year-old nephew,2019
"The head of the Climate Change Advisory Council has warned that in terms of adapting society to the changing climate, there was a need to plan for conditions that are worse than we expect.",2019
Varadkar tells Johnson new Brexit deal ‘not going to happen’,2019
The decision in December 2010 to introduce a lower salary scale for newly appointed teachers is at the heart of the teacher supply crisis.,2019
"Sponsored: Donal Skehan: “I’m showing my little fella these fantastic places that I grew up in for the first time, and it does bring on homesickness”",2019
"“I am standing before you today, to tell you the British people, that those critics are wrong – the doubters, the doomsters, the gloomsters are going to get it wrong again,” the UK's new prime minister has said",2019
An owner of a Dublin creche chain is stepping away from “front line childcare provision” after shortcomings in the running of her childcare business were uncovered.,2019
It was nice while it lasted. . .,2019
Greystones man charged with 23 counts of theft,2019
Over 150 doctors affected by cancellation of exam due to computer glitch,2019
The victim is now unable to follow his chosen career by joining the army due to failing the physical exam,2019
"Farmer, who suffered horrific injuries to his hand, settles court action",2019
Cork woman and son found guilty of long campaign of harassment,2019
"Ireland must prepare to deal with extreme future heat waves of the kind that recently swept across Europe, the head of the Climate Change Advisory Council has warned.",2019
Psychiatric nurses suspend overtime ban in row with HSE,2019
Minister wrongly applied regulations relating to free movement of persons in EU,2019
The HSE has apologised at the High Court to a 69-year old woman who suffered a major stroke after she was discharged from a hospital without her blood thinning medication,2019
The Supreme Court has been asked to urgently hear an appeal against a key High Court judgment in the case of terminally-ill Ruth Morrissey.,2019
Dublin student who punched and kicked a fellow pupil unconscious gets suspended sentence,2019
"Settled residents should lose the right to object to Traveller accommodation and council chiefs should be “encouraged” to use emergency powers to force through Traveller housing plans, experts say",2019
"Ireland must prepare to deal with extreme heatwaves, warns climate council",2019
"Department defends decision, saying ‘we have to be careful with the online polls’",2019
Boris Johnson becomes new UK prime minister after meeting queen,2019
Supreme Court urged to hear urgent Ruth Morrissey appeal,2019
Richard Bruton told climate change is ‘bigger than Brexit or the National Broadband Plan’,2019
"New punitive measures for failing to reduce plastic consumption, signals Bruton",2019
HSE apologises after woman left without medication suffered major stroke,2019
Rain forecast as warm spell set to end,2019
Darragh Ó Sé: Mayo will have no fear of Donegal's Rochford factor,2019
Hyde &amp; Seek owner leaves ‘front line’ role after undercover RTE report reveals ‘issues’,2019
Government’s climate policies come under sustained attack at MacGill Summer School,2019
State downplays results of its own poll which found support for scrapping time changes,2019
Siptu calls for Bruton action after Offaly ESB plant refused permission to burn peat past 2020,2019
Dublin creche chain owner steps away from childcare duties,2019
Why schools are struggling to hire teachers ahead of the new academic year,2019
"#ENGvIRE: Now might be an appropriate time to re-share this article about the Brexit  backstop, explained through cricket by @SiCarswell",2019
State’s use of public funds to buy carbon credits ‘has no domestic benefit’,2019
Union warns of job losses after power plant decision,2019
Heavy rain is expected in the early days of next week to end the recent spell of good weather.,2019
Rain forecast as warm spell set to end,2019
Former UUP leader Mike Nesbitt says unionism will not disappear in united Ireland,2019
This promises to be a great day for Irish sport; Mayo will have no fear of Rochford,2019
Group calls for councils to use emergency powers to force through housing plans,2019
Shake-up to change how the State spends money on projects that cost more than €1bn,2019
"Kam McLeod, Bryer Schmegelsky considered dangerous, public advised to call police if spotted",2019
Unionists ‘could hold balance of power into perpetuity’ in all-Ireland parliament,2019
Buying a car: What is the best way to pay for it?,2019
North’s politicians wonder if Boris Johnson will be a ‘statesman or showman’,2019
"Bailey did not make ‘fraudulent’ claim against hotel, Taoiseach says",2019
Bailey demotion potentially damaging to Varadkar within FG,2019
"Ban on visitor books at tourist sites could have been avoided, watchdog says",2019
Bereft Dublin locality pulls together in wake of suicides,2019
"Doll’s house sells for ‘mad’ price of €48,000 at Kilkenny auction",2019
Drug possession reforms to be discussed by Ministers,2019
"Settled residents should lose right to object to Traveller accommodation, experts say",2019
"One person files over 3,100 complaints about Dublin Airport noise in six months",2019
Here is your handy guide to sport on television today,2019
Fintan O'Toole: Britain's fate may rest on Boris Johnson's ability to polish poo,2019
Cork woman involved in cocaine ‘factory’ has 10-year sentence cut in half,2019
Judge tells accident victim he is ‘grossly overweight’,2019
Number of dogs euthanised continued to fall last year,2019
Gold for Ireland! 16-year-old Rhasidat Adeleke has won the 100m at the European Youth Olympic Festival in Baku,2019
The @IrishTimes Group is looking for an IT Business Analyst/Project Manager,2019
'I was dead on two occasions – the doctors told my wife; they said I would not be alive in the morning. But I am still here',2019
Review of how the State processes forestry planting applications announced,2019
"Images of the Day, selected by @laurahutts",2019
Shane Lowry: Thousands flock to Clara for ‘relatable’ golfer’s homecoming,2019
"Sponsored: The table in Pauline Sugrue’s kitchen served as their family table for 20 years in Australia, and now students who attend her cookery school in Donegal eat from it",2019
Munster technological university bid fails to get green light,2019
Pamela Flood and Ronan Ryan could be facing imprisonment,2019
"Sponsored: Booking a tailored, luxury family holiday can create memories to last a lifetime. Here are some recommended destinations for 2019",2019
"Boy (13) whose ear was ‘gripped’ and held by teacher awarded €17,500 damages",2019
Shane Lowry now a superstar but a very accessible superstar,2019
"Donegal recorded the highest temperature today with the mercury at Malin Head reaching 25.7 degrees, while in Dublin the Phoenix Park hit 25.5 degrees #summer #heatwave",2019
Mourners at John Hutch funeral told of ‘traumatic time’ for family,2019
Maria Bailey: 'I regret very much that I took the case',2019
"Man who caused €3,000 damage when stuck in lift suffered from panic attacks",2019
"US president Donald Trump has said: “A really good man is going to be the prime minister of the UK now, Boris Johnson. A good man. He's tough and he's smart. They're saying ‘Britain Trump’. They're calling him ‘Britain Trump’,”.",2019
Legal action over terms of reference in Siteserv case settled,2019
"'I did not see what my wife and children saw: their father with blood pouring out of him, then their grandfather dying in the hall, the smell of gunsmoke, policemen all over the place’",2019
"Child scaled by hot chocolate spill on Ryanair flight awarded €25,000",2019
Teenager who raped sleeping woman is jailed for six years,2019
Leo Varadkar: 'I hope this will send a clear message to other public representatives about taking such cases in future',2019
Rescuer and rescued reunited in Limerick after 56 years,2019
Two men plead guilty to helping criminal organisation murder Vincent Ryan,2019
"More than 1,000 fish rescued from dry Grand Canal in Dublin",2019
Majority of community mental health services likely to be cancelled,2019
Shane Lowry the ‘accessible superstar'; Dublin could lose home neutral venue,2019
Judge rules against fund’s court bid to set aside cert protecting Ronan  Ryan from debts,2019
Offaly plant refused permission to keep burning peat after 2020,2019
"Lack of meaningful progress over recruitment and retention difficulties,  union says",2019
Former PM tells ‘The Irish Times’ the likely new Tory leader has little  room for manoeuvre,2019
Legal ban on enforcement action over unlicensed peat extraction lifted by court,2019
Brexiteer poised to assume power as Tory MPs push back against possible  no-deal exit,2019
‘Only for them my daughter wouldn’t be here:’ Father thanks young men after rescue,2019
Boy (12) settles action over circumstances of his birth for €10.5 million,2019
Third of disability centres ‘failing on safeguarding standards’,2019
Critics say the latest immigration measure is a ‘massive and dangerous  change’,2019
AGSI member is accused of acting as a security consultant in his spare time,2019
"‘We need a statesman, not a showman’: NI reaction to Boris",2019
Stamps issued in commemorative set feature a misspelling of the Irish word  for ‘moon’,2019
"Peter Heathwood, campaigner for a pension for those injured in the  Troubles, tells his story",2019
OPW issues order as it is concerned messages left by visitors create  privacy risk,2019
MacGill summer school told calls for border poll are ‘premature’,2019
"Galway International Arts Festival 2019 largely overcomes issues with venues, via @IrishTimesCultr",2019
Anger among commuters as Irish Rail fixed problem too soon,2019
Who better than the likely next British PM to sell a withdrawal agreement  tweak as a win?,2019
BREAKING: Boris Johnson declared leader of British Conservative Party,2019
Minister says he will consider options on the issue after criticism by  Judge Peter Charleton,2019
"They are not just hammering other teams, they are beating the bookies, via @IrishTimesSport",2019
Man (20s) being treated for serious head injuries following assault,2019
Warm spell looks set to last until weekend with highs of up to 22 degrees  on Sunday,2019
Four men arrested over alleged Dublin city assault,2019
Tuesday weather: Temperatures to soar over 26 degrees,2019
Restaurateur wins first round in legal battle to retain Dublin home,2019
Garda inspector accused of acting as a security consultant in his spare time,2019
Man to appear in court over Dundalk cemetery incident,2019
Teenager arrested over serious assault in Dublin city centre,2019
Visitor books banned from major tourist sites amid GDPR concerns,2019
"Plans to move patient treatment away from hospitals and into the community will be undermined by significant inequalities in the spread of health services, a major study has found",2019
Healthcare reform threatened by geographic inequalities in services,2019
Garda inspector suspected of double-jobbing at Coolmore Stud is interviewed by detectives,2019
Proposal on extra legal protections for court reporters rejected,2019
Hiqa says it cannot adopt softer line on standards for facilities under fiscal strain,2019
Health providers fear curtailing staff will lead to clash with Hiqa,2019
Plans for new €50m hospital in north Dublin to be lodged,2019
An Post makes one giant spelling error as it marks one small step for man,2019
Dublin Bus express routes receive highest customer complaints,2019
Troubles victims: ‘Daddy saw me in the body bag and dropped dead of a heart attack’,2019
Signing off: Visitor books banned from major tourist sites amid GDPR fears,2019
Reforms for State’s tribunal system to be examined,2019
Here is your handy guide to sport on television today,2019
"The socialite lived in Epstein’s homes, and has been linked to his sexual abuse charges",2019
Dublin homeless families to get free public transport access for August,2019
"Ellie Kisyombe, an asylum seeker who ran as a local election candidate for the Social Democrats this year, says she has been granted leave to remain in Ireland.",2019
Why is kitting out your children for school so expensive?,2019
Campaigner for child sexual abuse victims to be honoured,2019
Man hospitalised after being shot in west Belfast,2019
Garda deployment to Middle East halted by pay disagreement,2019
A five-year-old girl swept out to see on an inflatable device was rescued by three members of the public on Monday who took up to 20 minutes to swim back to shore.,2019
"Canadian police said there is “nothing to indicate” that a double murder was related to the discovery of a burning car and a man’s body some 500km south, and the disappearance of two Canadian teenagers",2019
A nurse has had his registration suspended for a year for professional misconduct including sending a patient an MMS message containing a private and/or naked image on his mobile phone.,2019
Man jailed for four years for sexual assault of niece,2019
Pat Kenny loses bid to prevent apartment blocks near Dalkey home,2019
"Restaurateur Ronan Ryan, husband of former RTÉ presenter Pamela Flood, has won the first round in a fresh legal battle against a US private equity fund to keep the couple’s Dublin home.",2019
Sponsored: “It’s a very good work environment made up of a highly engaged group of people with a strong can-do attitude and a clear sense of ownership”,2019
Families informed of concerns about client fund use at Stewarts Care,2019
Psychiatric nurses to reinstate overtime ban after pay talks collapse,2019
Clara GAA will place to host to Shane Lowry’s homecoming event on Tuesday evening at 6pm,2019
Ellie Kisyombe granted leave to remain in Ireland,2019
Most read: Ghislaine Maxwell - Jeffrey Epstein’s ‘lady of the house’ and ‘madam’,2019
Locals at Esker Hills club recall ‘mischievous’ teenager who became British Open champion,2019
Law liberalising abortion and same-sex marriage in NI passes final stage,2019
Father of Paddy Jackson secures judgment in libel action over false claims on Twitter,2019
"“Love wins. Today that message rang out from Westminster,” said one LGBTQ+ rights campaigner",2019
Girl (5) rescued off Dublin beach after being swept out to sea on inflatable,2019
"“If there was craic going he was in the middle of it. He would always be the one laughing, and would never be in bad form.”",2019
Government still working on behalf of Keith Byrne – Coveney,2019
"Tropical cyclones followed quickly by deadly heatwaves will be a growing threat as global temperatures continue to rise to a dangerous level for human beings, according to climate scientists in Ireland and the UK",2019
"Images of the Day, selected by @laurahutts",2019
Restaurateur wins first round in battle to retain Dublin home,2019
"Former taoiseach Brian Cowen is making progress in treatment for an illness which has seen him hospitalised since earlier this month, his brother Barry has said.",2019
Student seen taking ‘lots of selfies’ at cliff edge before fatal fall,2019
A man has had his conviction for raping his granddaughter quashed after reports were obtained to determine whether he was fit to stand trial at the Central Criminal Court more than a year ago.,2019
Details for Shane Lowry’s homecoming event have been announced,2019
World’s ‘most beautiful ship’ docks at Dublin Port,2019
"The warning relates to a number of models, including Indesit, Hotpoint, Creda, Swan and Proline dryers, built between 2004 and 2015.",2019
The @IrishTimes Group is looking for an IT Business Analyst/Project Manager,2019
Lowry’s victory ‘the biggest thing to happen to Offaly ever’,2019
Verdict of medical misadventure returned into death of baby at Kilkenny hospital,2019
Child rescued near Portmarnock beach may have been using lilo,2019
"Sponsored: The table in Pauline Sugrue’s kitchen served as their family table for 20 years in Australia, and now students who attend her cookery school in Donegal eat from it",2019
Trevor the toad is now in the care of the Herpetological Society of Ireland where staff are awaiting his first bowel movement with great interest so they can determine what he has been eating.,2019
"Brief warm spell could see highs of up to 28 degrees in some areas, says Met Éireann",2019
"Una Mullally: People who actually wanted to create something for their fellow city folk are ground down by a city where anything goes for those with deep pockets and big backers, and everyone else is tossed aside (via @irishtimesoped)",2019
The @IrishTimes Group is looking for a Research Executive,2019
Teenage victim later gave birth to child that DNA tests found was fathered by accused (37),2019
Nurse who sent naked image on his mobile phone to patient suspended,2019
Send me back to Ireland – the country I came from,2019
"Brian Cowen making ‘progress’ in hospital treatment, brother says",2019
Cyclones followed by deadly heatwaves will be growing threat - study,2019
Man (75) has conviction for raping granddaughter quashed,2019
"Swedish car-maker Volvo is recalling 507,000 vehicles worldwide because of a faulty engine component that could lead to a fire.",2019
Several tumble dryer brands recalled over fire risk,2019
Dublin teenager accused of stealing mother’s car remanded on continuing bail,2019
"A 17-year-old Dublin boy accused of reaching speeds of 240km/h after stealing his mother’s car and leading gardai on a high speed pursuit, has been remanded on continuing bail.",2019
Posting video of elderly man on social media ‘reprehensible’ - judge,2019
Department willing to fund Lowry homecoming celebrations – Ross,2019
Judge jails ‘sexual predator’ for raping girl in church grounds,2019
Garda helicopter ‘struggled to keep up’ with boy driving 240km/h,2019
Only five members of press will be allowed in court for sentencing hearing on October 29th,2019
Simon Coveney: Next British PM will not ignore NI stalemate,2019
Man in his 70s transferred to Beaumont and treated for head injury after being hit by car,2019
Owner of miniature chihuahua Gizmo issues appeal after seeing him carried away by gull,2019
Central Bank warns Government to save corporation tax windfall as a ‘buffer against the next downturn’,2019
Central Bank joins warnings over Government spending plans,2019
Tánaiste Simon Coveney has warned the next UK prime minister that major changes to the backstop are “just not going to happen”.,2019
Man struck by car at Dundalk graveyard in serious condition,2019
"The two boys convicted of murdering 14 year old Ana Kriégel last year will not be permitted to view each other’s full probation reports, a judge has directed.",2019
Shane Lowry wins the British Open; Kerry and Donegal draw in thriller,2019
Kriégel murder trial: convicted boys won’t have access to each other’s probation reports,2019
Dog missing after seagull swoops into Devon garden,2019
"Nearly 50,000 children waiting to see a paediatrician",2019
Scientists studying Dublin toad with great interest,2019
Irish bouncy castle industry in trouble as sole insurer jumps out,2019
Over 125 care centres and nursing homes at risk of closure,2019
Teachers ‘highly critical’ of English language schools,2019
Teenager killed in Co Tyrone car crash,2019
Co Down native says Cork man Keith Byrne should ‘take it on the chin’ if sent home,2019
Homeless families under ‘huge additional stress’ in summer,2019
Homeless in summer: ‘To have one or two days out to look forward to would be huge’,2019
Cockroaches and mould among complaints about emergency housing,2019
Dora the Explorer - the wandering wallaby - is home safe and sound after being found near Kilworth village in North Cork early this morning.,2019
Cork’s wandering wallaby Dora home ‘safe and sound’,2019
Plans shelved to build social housing without permission,2019
Dublin Writers Museum to price artistic treasure trove,2019
Travellers given Monday deadline to leave Thurles land,2019
Sugary drink tax revenue falling short of expectations,2019
Shane Lowry profile: From pitch and putt to champion golfer,2019
Potatoes have ‘huge image issue’ among the youth,2019
Monday and Tuesday to see temperatures hit at least 26 degrees,2019
"Rape victims should be allowed give evidence by video-link, say barristers",2019
‘Unacceptable use’ of client funds at Stewarts Care focus of review,2019
‘We need to sex up the potato and ... show its health credentials’,2019
Why is kitting out your children for school so expensive?,2019
