,text,date,source,value
97,Anti-Isis proposals floated at Republican debate would likely be war crimes,2015-12-16T18:43:45Z,Guardian,0
98,Rotherham grooming ring suspect 'repeatedly broke into children's home',2015-12-16T18:35:39Z,Guardian,0
99,Mother critical of police amid search for missing London schoolgirls,2015-12-16T18:35:00Z,Guardian,0
100,Why the stigma of suicide hurts so much | Tim Lott,2015-12-16T18:33:15Z,Guardian,0
101,Dixons Carphone eyes record Boxing Day sales despite pre-Christmas lull,2015-12-16T18:30:40Z,Guardian,0
102,Gilbert Arenas' plan to boost WNBA: less clothing and fewer 'ugly' players,2015-12-16T18:24:27Z,Guardian,0
103,Online sexism is so out of control that we can no longer ignore it,2015-12-16T18:16:18Z,Guardian,0
104,Die Hard fan gets Hollywood movie deal,2015-12-16T18:16:15Z,Guardian,0
105,"Rihanna, set aside the new music and put out your Greatest Hits",2015-12-16T18:11:17Z,Guardian,0
106,A-level music to include female composers after student's campaign,2015-12-16T18:04:55Z,Guardian,0
107,Don’t rely on Syria’s ‘moderate’ fighting force. It doesn’t exist | Mowaffaq Safadi,2015-12-16T18:02:16Z,Guardian,0
108,"UK ties with Gaddafi were like 'a criminal conspiracy', high court hears",2015-12-16T18:01:45Z,Guardian,0
109,The LA schools bomb hoax: we can't let the work of a few sow chaos for the many | Tedra Osell,2015-12-16T18:00:24Z,Guardian,0
110,Alan Yentob criticised by BBC director general over behaviour in Kids Company coverage,2015-12-16T17:57:20Z,Guardian,0
111,Roman Polanski revisits Holocaust experiences in candid interview,2015-12-16T17:56:13Z,Guardian,0
112,Horse racing tips: Thursday 17 December,2015-12-16T17:46:19Z,Guardian,0
113,Libya’s rival governments reject delayed UN-brokered national unity deal,2015-12-16T17:45:57Z,Guardian,0
114,My night with Trump and the other chumps | Tim Dowling,2015-12-16T17:45:21Z,Guardian,0
115,Unison head faces leadership challenge from the left,2015-12-16T17:43:47Z,Guardian,0
116,Evgeny Lebedev sounds out interest in cut-price national the i,2015-12-16T17:41:26Z,Guardian,0
117,Congress passes bill to extend health coverage for 9/11 responders,2015-12-16T17:36:12Z,Guardian,0
118,VW gets go-ahead to repair diesel cars affected by emissions scandal,2015-12-16T17:35:59Z,Guardian,0
119,SuperGroup shuns heavy discounting before Christmas,2015-12-16T17:32:10Z,Guardian,0
120,Chipotle's not dead – there's just more for us brave souls who still want to eat it,2015-12-16T17:30:56Z,Guardian,0
121,Tribeca 2016: Tina Fey and Tom Hanks named as featured speakers,2015-12-16T17:25:37Z,Guardian,0
122,Brazil politician named racist of the year for comments about indigenous people,2015-12-16T17:23:20Z,Guardian,0
123,Jennifer Lawrence to 'play Robert De Niro's mother',2015-12-16T17:22:37Z,Guardian,0
124,Ghostbusters enshrined in cinematic immortality at Library of Congress,2015-12-16T17:18:02Z,Guardian,0
125,"For trans people, NHS delays are all too often a matter of life and death | Jane Fae",2015-12-16T17:17:03Z,Guardian,0
126,Deliveroo and Crowdcube join Tech City UK’s rising stars,2015-12-16T17:17:00Z,Guardian,0
127,Alex Hales fails again and gives Trevor Bayliss an England headache,2015-12-16T17:09:26Z,Guardian,0
128,How to run a profitable food business,2015-12-16T17:08:26Z,Guardian,0
129,"Transparent recap: season two, episode six – is a vagina like the Holocaust?",2015-12-16T17:07:19Z,Guardian,0
130,FTSE climbs for second day ahead of Fed but Arm falls on iPhone concerns,2015-12-16T17:06:17Z,Guardian,0
131,Nicki Minaj faces calls to cancel Angola concert amid human rights concerns,2015-12-16T17:04:25Z,Guardian,0
132,The Great British Bake Off: 2015 ratings win will be the icing on the cake,2015-12-16T17:00:21Z,Guardian,0
133,George Ford out to catch Eddie Jones’ eye by doing the business with Bath,2015-12-16T16:53:50Z,Guardian,0
134,New report highlights how business can support sustainable development goals,2015-12-16T16:47:55Z,Guardian,0
135,UK retailers recall hoverboards following government advice,2015-12-16T16:42:59Z,Guardian,0
136,The Force Awakens: is the acting strong in this one?,2015-12-16T16:41:57Z,Guardian,0
137,Fox's live TV crucifixion musical The Passion sounds like an unholy mess,2015-12-16T16:38:45Z,Guardian,0
138,Santander eyes RBS branch takeover,2015-12-16T16:36:42Z,Guardian,0
139,BBC unveils management structure ahead of BBC Studios spin-off,2015-12-16T16:32:36Z,Guardian,0
140,What should I wear? Fashion's biggest questions – according to Google,2015-12-16T16:32:27Z,Guardian,0
141,The Guardian Culture Professionals Network’s top 10 stories of 2015,2015-12-16T16:30:46Z,Guardian,0
142,Abby Wambach on how to fix US men's soccer: fire Jürgen Klinsmann,2015-12-16T16:23:21Z,Guardian,0
143,Eagles of Death Metal to return for Paris concert after terrorist attacks,2015-12-16T16:20:27Z,Guardian,0
144,Top 10 books about justice and redemption,2015-12-16T16:18:22Z,Guardian,0
145,Republican debate leaves Iowa voters unmoved: 'I'd like more cohesiveness',2015-12-16T16:18:21Z,Guardian,0
146,Watford close to signing Roma’s Juan Iturbe on loan with £11m buyout option,2015-12-16T16:16:28Z,Guardian,0
147,Shippea Hill: the railway station that saw just 22 journeys in a year,2015-12-16T16:15:25Z,Guardian,0
148,Letter: William McIlvanney was a calm and understated teacher,2015-12-16T16:11:08Z,Guardian,0
149,Is Star Wars: The Force Awakens really female-friendly?,2015-12-16T16:08:32Z,Guardian,0
150,Sport quiz of the year 2015 – live!,2015-12-16T16:07:59Z,Guardian,0
151,Spanish elections: leftist mayors work to convince people to vote again for change,2015-12-16T16:07:58Z,Guardian,0
152,"What chance do care leavers stand, with support services being shredded?| Lola Okolosie",2015-12-16T16:06:09Z,Guardian,0
153,Israeli museum hopes to solve mystery of looted painting,2015-12-16T16:03:42Z,Guardian,0
154,WIN: a very merry Christmas stocking from Women in Leadership,2015-12-16T16:01:26Z,Guardian,0
155,"Nicola Walker: ‘You wonder what your life has come to, telling someone what sort of biscuit you are’",2015-12-16T16:00:03Z,Guardian,0
156,"Worktown: The Astonishing Story of the Project that Launched Mass Observation, by David Hall – review",2015-12-16T16:00:03Z,Guardian,0
157,The Force Awakens: share your Star Wars memorabilia and fan art with us,2015-12-16T15:55:28Z,Guardian,0
158,TV swansongs: the final Peep Show and the art of saying goodbye,2015-12-16T15:52:34Z,Guardian,0
159,Paris climate talks turn up the heat on world leaders – podcast transcript,2015-12-16T15:52:09Z,Guardian,0
160,Feature writing with Elizabeth Day,2015-12-16T15:48:15Z,Guardian,0
161,Cod and haddock catches to increase under EU fishing quotas,2015-12-16T15:45:32Z,Guardian,0
162,Congress adds contested cybersecurity measures to 'must-pass' spending bill,2015-12-16T15:41:14Z,Guardian,0
163,De Raaff: Waiting for Miss Monroe CD review – songs haunted by the ghost of Norma Jean,2015-12-16T15:39:29Z,Guardian,0
164,Jeff Koons: master of parody or great American conman?,2015-12-16T15:38:47Z,Guardian,0
165,There is a new form of climate denialism to look out for – so don't celebrate yet | Naomi Oreskes,2015-12-16T15:38:38Z,Guardian,0
166,Alvin and the Chipmunks: the Road Chip review – Marx-ish zeal for chaos,2015-12-16T15:36:23Z,Guardian,0
167,Letter: ‘Luc Bondy had the ability to release actors to explore’,2015-12-16T15:35:38Z,Guardian,0
168,The Notorious BIG – 10 of the best,2015-12-16T15:35:14Z,Guardian,0
169,Stuart Hall released from prison after serving half of sentence,2015-12-16T15:21:56Z,Guardian,0
170,The Fiver | Darth José in a bit of a pickle,2015-12-16T15:21:32Z,Guardian,0
171,Stop telling us there is a silver lining to these domestic violence figures | Frances Ryan,2015-12-16T15:16:51Z,Guardian,0
172,Baltimore police preparations ahead of Freddie Gray verdict alarm activists,2015-12-16T15:16:26Z,Guardian,0
173,Two-thirds of women in Papua New Guinea suffer domestic abuse – how can it be stopped?,2015-12-16T15:15:25Z,Guardian,0
174,Can a simple yes or no ever be the right answer in philosophy?,2015-12-16T15:05:16Z,Guardian,0
175,Wife of marine jailed for killing Taliban fighter optimistic of appeal,2015-12-16T15:04:24Z,Guardian,0
176,Philip Hammond: 'Syria talks in New York could lead to UN resolution',2015-12-16T15:00:23Z,Guardian,0
177,'Socialism' the most looked-up word of 2015 on Merriam-Webster,2015-12-16T15:00:17Z,Guardian,0
178,Niel Bushnell: 'you only live one life if you don't read',2015-12-16T15:00:16Z,Guardian,0
179,Ruby Redfort: Pick Your Poison by Lauren Child - review,2015-12-16T15:00:16Z,Guardian,0
180,Hatton Garden jewellery heist: defendant breaks down in court,2015-12-16T14:54:05Z,Guardian,0
181,"BBC rated most accurate and reliable TV news, says Ofcom poll",2015-12-16T14:53:46Z,Guardian,0
182,Roy Evans obituary,2015-12-16T14:53:38Z,Guardian,0
183,Las Vegas: city divorced from reality was fitting spot for Republican debate,2015-12-16T14:52:54Z,Guardian,0
184,Labour demands inquiry into Prince Charles's access to cabinet papers,2015-12-16T14:52:43Z,Guardian,0
185,Peter Kosminsky: ‘I thought I was a very odd choice for Wolf Hall’,2015-12-16T14:48:33Z,Guardian,0
186,BBCNOW/Andersson review – potent dramatic power,2015-12-16T14:41:35Z,Guardian,0
187,Chelsea’s José Mourinho fast becoming much ado about nothing | Marina Hyde,2015-12-16T14:27:00Z,Guardian,0
188,Alex Salmond brands Trump 'loser' after judges reject windfarm appeal,2015-12-16T14:23:30Z,Guardian,0
189,"Bye bye Zaha, hello fried egg! New designs unveiled for Tokyo Olympic stadium",2015-12-16T14:03:54Z,Guardian,0
190,Syrian refugees: World Bank and UN urge major change in handling of crisis,2015-12-16T14:00:13Z,Guardian,0
191,"Memphis teen 'was running away' when shot dead by police, witnesses say",2015-12-16T13:57:36Z,Guardian,0
192,Republican candidates consolidate support by sticking to scripts at debate,2015-12-16T13:56:58Z,Guardian,0
193,Steve McClaren and Louis van Gaal show topsy-turvy nature of management | Paul Wilson,2015-12-16T13:56:35Z,Guardian,0
194,Cameron and Corbyn clash over NHS funding at PMQs,2015-12-16T13:55:22Z,Guardian,0
195,Jailed MI6 informant blocked from taking case to court of human rights,2015-12-16T13:54:48Z,Guardian,0
196,Lucia Devine obituary,2015-12-16T13:46:33Z,Guardian,0
197,Snow White review – a roam through the wild landscape of a child's imagination,2015-12-16T13:44:11Z,Guardian,0
198,"Christmas Oratorio review – Bach from memory engaged, the voices impressed",2015-12-16T13:42:24Z,Guardian,0
199,How would Snowden vote? Republican debate shows limited options,2015-12-16T13:40:05Z,Guardian,0
