full_title,date
The French far right is hijacking the Strasbourg shooting to sow division | Cécile Guerin,2018
"Regular female-led football coverage ‘generations’ away, says Jacqui Oatley",2018
Slum landlord family must pay £250k under crime proceeds act,2018
Paul Trouble Anderson obituary,2018
The training wheels are off: taking an Action to release,2018
Chopin: Scherzos and Ballades review – restored to uncompromising glory,2018
"Steve Carell and Timothée Chalamet on drugs, disillusionment and playing father and son",2018
The House That Jack Built: in defence of the serial killer movie,2018
Leeds promotion push unlikely to be affected by fate of Eleven Sports,2018
Hospitals 'in red zone' with record numbers of A&E patients,2018
"London's Black Cultural Archives get £200,000 stopgap funding for survival",2018
'It will kill me' – behind the devastating Avicii documentary,2018
England and Wales police funding rise of £970m 'not enough',2018
Theresa May confirms she will not lead Tories into next election,2018
Trump denies he directed Michael Cohen to 'break the law',2018
"'Toxic, cut-throat': the work culture awaiting junior lawyers",2018
Cheshire PC is jailed for 25 years for sexual assault and grooming,2018
Clive Anderson on Whose Line Is It Anyway? We were making it up as we went along,2018
Foreign Office denies state funds went to Twitter account attacking Labour,2018
Cyclists 'exposed to less air pollution than drivers' on busy routes,2018
Pusha T review – ratcheting energy turns drug raps into art,2018
"It's rare to see a child in the workplace, but it really shouldn't be | Kaitlin Solimine",2018
Yemen: ceasefire agreed for port city of Hodeidah,2018
Who wants to be Donald Trump's lawyer? He needs a good one | Richard Wolffe,2018
Italy cuts deficit target for 2019 to 2.04% to avoid EU sanctions,2018
Londoners troll New York Times with deluge of 'petty crimes',2018
"If the remain campaign makes the same mistakes again, it will lose again | Ash Sarkar
",2018
Will Africa’s first high-speed train be a £1.5bn magic bullet for Morocco? | Will Doig,2018
Robin Thicke and Pharrell Williams to pay $5m in final Blurred Lines verdict,2018
The Breakdown | England’s dilemma: undermine Eddie Jones or risk scramble for a top coach,2018
The 30 best boyband members – ranked!,2018
Taylor Swift used facial recognition software to detect stalkers at LA concert,2018
Geraint Thomas has no regrets over new deal before Sky pulled team backing,2018
Fire and Fury wins ‘total loser’ Michael Wolff a place on authors’ rich list,2018
"Sri Lanka: president's dissolution of parliament illegal, top court rules",2018
Matthew Bourne’s Swan Lake review – electrified return to the wild,2018
"Finally, some good news: the ERG has been aggressively made love to by an ass | Marina Hyde",2018
"Jeremy Hunt wrong in breast cancer screening statement, inquiry says",2018
Arthouse Marvel? Lucrecia Martel reveals she was approached for Black Widow,2018
Martin Glenn resigns as FA chief executive after challenge-packed tenure,2018
10 of the best delis for traditional food and Christmas treats,2018
How do you beat the Christmas blues? Take charge in the kitchen,2018
Germaine: The Life of Germaine Greer by Elizabeth Kleinhenz review – a career of controversy,2018
The 50 best films of 2018 in the US: No 7 – The Favourite,2018
"Paul McCartney review – Lennon, Wings, Quarrymen and more in wide-ranging homecoming",2018
New mother dies after going missing in Scottish hospital,2018
Snow White review – festive filth from Julian Clary and Dawn French,2018
"Global warming should be called global heating, says key scientist",2018
Cambridge academic defends idea of giving six-year-olds the vote,2018
Knife crime offences rise to highest level since 2010,2018
'The second worst prime minister ever': readers on May's confidence vote,2018
Hand of clod? Brexit and Theresa May divide England's 1986 World Cup squad,2018
Black people more likely to have force used against them by police,2018
Prevent referrals over rightwing extremism rise by over a third,2018
Donald Trump Jr calls his father a Christmas 'regifter',2018
Thursday US briefing: Bruised Theresa May sees off leadership coup,2018
Manhunt for Strasbourg gunman continues across German border,2018
Cheltenham tweaks welcome but perception of racing's safety may never change | Talking Horses,2018
What was your favourite book of 2018?,2018
What would a city that is safe for women look like?,2018
Why are hundreds of US children suffering from a paralyzing illness?,2018
Mueller inquiry a 'field day' for white-collar lawyers as they rake in millions,2018
Lizzie review – mythic axe murders get an edgy update,2018
Labour and Tories reject Theresa May's call for cooperation,2018
The Anti-Sports Personality of the Year awards 2018 | Simon Burnton,2018
Bonmarché warns high street trading worse than 2008 recession,2018
Black lung disease is still killing miners. The coal industry won't hear it,2018
The Glorious Art of Peace: Paths to Peace in a New Age of War by John Gittings  – review,2018
Bury bank on new owner to end financial misery at historic club,2018
"Pete Shelley's Tour de force, Miami's Miracle and Premier Passions | Classic YouTube",2018
'They are bullies': The American businessman taking on PSG at Bordeaux,2018
May’s real plea to the EU: save me from a second referendum | Matthew d’Ancona,2018
Why I’ve decided it’s OK to accept an honour from the Queen | Ms Dynamite,2018
'Death sentence': butterfly sanctuary to be bulldozed for Trump's border wall,2018
King Arthur by Nicholas J Higham review – was he a fiction from the start?,2018
Ten companies pay 45% of all corporate tax in Australia,2018
Football transfer rumours: Yaya Touré to join Crystal Palace or West Ham?,2018
‘Someone cares’: the secret volunteers filling in for the welfare state | Frances Ryan,2018
'They don't care': Facebook factchecking in disarray as journalists push to cut ties,2018
NRL player Jack de Belin charged over alleged sexual assault,2018
'City living no be easy': Accra by Richard Opoku Agyeman – an urban comic,2018
The Mere Wife by Maria Dahvana Headley review – a modern Beowulf,2018
"Can I get a gaming PC for £500, and which games console is best?",2018
Brazil: same-sex couples rush to the altar ahead of Bolsonaro inauguration,2018
Tax transparency: which companies pay the most and least tax in Australia?,2018
First test of new FFA board delivers an outcome in its own image | Richard Parkin,2018
Victorian schools could lose billions as state-federal negotiations break down,2018
Banks urged not to fund coal power as government moves to underwrite projects,2018
Paying my Dartford Crossing fine has become a French farce,2018
Thursday briefing: Bruised May takes her Brexit battle forward,2018
10 cool shopping districts around the world: readers’ tips,2018
Modelling wasn’t for me. My real passion is being a nurse | Katarina Keeler,2018
'I must continue': Statue of Liberty climber still protesting despite facing prison,2018
"The 50 best albums of 2018, No 7: Kamasi Washington – Heaven and Earth",2018
The 50 best TV shows of 2018: No 6 – Derry Girls,2018
The 50 best films of 2018 in the UK: No 7 – Cold War,2018
"Free Solo review – jaw-dropping high jinks on a 3,000ft rock face",2018
Jonathan Pie’s American Pie review – viral ranter takes a sub-Theroux US road trip,2018
Microsoft Surface Headphones review: close but no cigar,2018
Forever prisoners: were a father and son wrongly ensnared by America’s war on terror?,2018
How to create a leaderless revolution and win lasting political change | Carne Ross,2018
Revealed: FBI kept files on peaceful climate change protesters,2018
Betting firms to ban pre-watershed TV adverts during live sport events,2018
"In troubling times, it’s best to turn to your inner poet | Ruth Padel",2018
"Gun deaths in US rise to highest level in 20 years, data shows",2018
Thursday’s best TV: This is My Song; Billy Connolly’s Ultimate World Tour,2018
What happened next? ‘Drinking for the sake of drinking. It’s madness’: how Adrian Chiles cut back on booze,2018
Country diary: a winter chorus line,2018
'Her goose is cooked': newspapers ask how long Theresa May can last,2018
The untold story of how India's sex workers prevented an Aids epidemic,2018
Religious freedom and LGBT kids: Coalition kicks can down the road with yet another review,2018
Two new chemical plants under consideration near WA's Burrup rock art,2018
Backdown over axing of NDIS funding to life-threatening condition,2018
"Australia’s carbon emissions highest on record, data shows",2018
Gilbert Rozon: Just for Laughs founder charged with rape and indecent assault,2018
May survives confidence vote with a majority of 83 – as it happened,2018
Theresa May defeats Tory coup over Brexit deal but is left damaged,2018
Netflix has revolutionised food TV – and Australian networks need to be watching,2018
New Zealand courts banned naming Grace Millane’s accused killer. Google just emailed it out | Toby Manhire,2018
Scott Morrison and the Business Council are pushing coal – but on what evidence? | Richard Denniss,2018
FFA settle on staggered A-League expansion over next two years,2018
Morrison government announces new federal anti-corruption commission,2018
George Pell: Pope Francis removes Australian cardinal from inner circle,2018
"If you've been abused as a child, Queensland is the unluckiest state to be in | Bri Lee",2018
Bradford music teacher shortlisted for $1m global education prize,2018
Six slime and putty toys sold in UK fail to meet safety standards,2018
Les Misérables with 'contemporary relevance' to air on BBC,2018
University acceptance rates for students with lower grades on the rise,2018
"BBC's new EastEnders set over budget by £27m, watchdog finds",2018
UK property market at weakest since 2012 as Brexit takes toll – Rics,2018
"Quick crossword No 15,164",2018
"Cryptic crossword No 27,691",2018
José Mourinho says he learned ‘nothing’ in Champions League loss to Valencia,2018
Labor won't rule out using 'accounting tricks' to meet emissions reduction targets,2018
"Champions League last 16: who’s hot, who’s not and potential match-ups",2018
What happens now for the prime minister and her Brexit plans?,2018
Australia turns back on allies as it refuses to cut emissions above Paris pledge,2018
Alisson the rock in Liverpool’s solid defence but Matip injury is a blow,2018
Manchester City 2-1 Hoffenheim: Champions League – as it happened,2018
Tottenham braced for fresh Real Madrid interest in Pochettino at end of season,2018
The 11 best Nintendo Switch games of all time,2018
Valencia 2-1 Manchester United: Champions League – as it happened,2018
Theresa May is now a lame duck – too weak to take back control of her party | Martin Kettle,2018
Briefing battle begins over meaning of May's victory,2018
Leroy Sané’s fine double fires Manchester City past Hoffenheim,2018
Manchester United miss chance to top group after Spanish lesson at Valencia,2018
"The Double Dealer review – sly schemers, randy wives and foolish cuckolds",2018
The Guardian view on Theresa May’s vote of confidence: a reluctant reprieve,2018
Trump hush money: no charges for National Enquirer company over payments – as it happened,2018
"Cat Condo is the stupidest, most cynical game in the App Store. So why can’t I stop playing? | Tom Hawking",2018
Coalition to unveil new laws to guard religious freedom but stalls on LGBT students,2018
National Enquirer owner admits coordinating 'catch and kill' payment with Trump campaign,2018
Tory headbangers save the Maybot – for the time being at least | John Crace,2018
Theresa May survives. Things are so bad we have to be grateful for that | Polly Toynbee,2018
"Weatherwatch: St Lucia's storm, the flood that changed Europe",2018
The last-minute pledges and promises that helped May survive leadership challenge,2018
Amazon meets public opposition at first hearing for New York headquarters,2018
Maurizio Sarri calls alleged racist abuse of Raheem Sterling ‘disgusting’,2018
May win will prompt relief in Brussels but not concessions,2018
What now for Team Sky? Vultures will already be circling their top riders,2018
NSW accused of jeopardising Sydney's water supply with decision to axe firefighters,2018
The Mule review – Clint Eastwood's drug running drama is a slow misfire,2018
Corrections and clarifications,2018
Climate change talks lead to heightened pledge to cut emissions,2018
Leigh Griffiths takes break from Celtic to tackle off-field problems,2018
"Morning mail: May battles to hold on, Coalition backs coal, Trump's 'dirty deeds'",2018
"Anastasia Dobromyslova: ‘Being a girl, I’ve had to fight for my spot in darts’",2018
Eleven Sports may be facing closure in UK after only four months,2018
Senate to vote on Yemen amid growing skepticism over US-Saudi alliance,2018
'Raging' Santa angers parents with beard-ripping tantrum,2018
Markets rally as hopes for breakthrough in US-China trade dispute rise,2018
Canada Goose shares slide amid Beijing-Ottawa row over Huawei CFO arrest,2018
May signals she will step down before 2022 election,2018
Jamie Robson disciplined by Dundee United for blacking up at players’ party,2018
Superdry co-founder ramps up comeback campaign as shares plunge,2018
Turkey primed to start offensive against US-backed Kurds in Syria,2018
The Guardian view on global warming: time is running out | Editorial,2018
Trump's former fixer Michael Cohen sentenced to three years in prison,2018
Leicester hope Manu Tuilagi will put passion for club before cash,2018
Sainsbury’s and Asda challenge CMA over merger,2018
London homicides now highest annual rate for a decade,2018
Yahoo parent Verizon cuts value of media brands by $4.6bn,2018
Scotland freezes threshold for higher-rate income tax,2018
Tories reinstate MPs suspended over sex allegations for confidence vote,2018
"British Cycling coaches 'jealous' of athletes' success, says BMX champion",2018
Chasing Bono review – charming portrait of a wannabe rock star,2018
Thomas Baptiste obituary,2018
Any boost to sterling if the PM survives is not likely to last | Larry Elliott,2018
More than 200 women accuse famous Brazilian spiritual healer of sexual abuse,2018
Trying to improve racial diversity in the media | Letters,2018
The collapse of democracy in England’s schools | Letters,2018
The class divide in Oxbridge interviews | Letters,2018
Act now to reduce health inequalities | Letters,2018
We need a non-proliferation treaty for fossil fuels | Letter,2018
Endless work leaves no time to volunteer | Letters,2018
Naming mystery is a bit of a Cliff-hanger | Brief letters,2018
"Landlord fined £25,000 over lack of hot water for disabled tenant",2018
Chérif Chekatt: who is the Strasbourg shooting suspect?,2018
Nicolás Maduro accuses White House of direct role in assassination attempt,2018
YG review – turned up anthems and Donald Trump takedowns,2018
Strasbourg shooting: French and German police hunt gunman,2018
"UTI test often fails to detect infection, say researchers",2018
Ireland's economy 'threatened by Tory fundamentalists',2018
"Women-led films dominate at the box office, study finds",2018
Calls for end to gilets jaunes protests in wake of Strasbourg shooting,2018
Markets rally as China 'rewrites economic plan'; pound jumps over $1.26 - as it happened,2018
The ‘farcical’ drug scanners locking out Melbourne immigration centre visitors,2018
"The 10 best Australian films of 2018: zombies and swingers and ghosts, oh my!",2018
Thai tourist is first Strasbourg shooting murder victim named,2018
Housing is enough of a worry – don't scare us with warnings of rising interest rates | Greg Jericho,2018
Coalition signals it will provide taxpayer support for new and existing coal plants,2018
Hakeem Al-Araibi: Australian Interpol office alerted Thailand to arrival of refugee,2018
Australia head west and into the unknown for second Test against India | Geoff Lemon,2018
Mary Poppins Returns review –  a spoonful of state-of-the-art genetically modified sweetener,2018
This rotten government is too riven with division to unite parliament | Jon Trickett,2018
‘What happens to Brexit?’ Andrew Sparrow answers readers’ questions,2018
Hungary passes 'slave law' prompting fury among opposition MPs,2018
Confidence vote: majority of Tory MPs publicly back May,2018
Spider-Man: Into the Spider-Verse proves Hollywood can't out-Marvel Marvel,2018
Rolls-Royce to stockpile parts in case of hard Brexit,2018
What happened in previous Tory leadership challenges?,2018
Chris Froome: Team Sky is not finished yet despite sponsor pulling plug in 2019,2018
Tony Adams to become new president of Rugby Football League,2018
Woman who faked her own kidnap and assault jailed by London court,2018
"Knobbled: Cork spends €6,000 polishing door handles to impress Prince Charles",2018
Julián Castro calls Latinos to action as he moves toward 2020 run,2018
GRiZ: the EDM artist using his star power to make a difference,2018
An Elephant Sitting Still review – on the edge of despair in the new China,2018
"What happened next? How Melania Trump’s jacket revealed her true politics to the world
",2018
Shamelessness: it’s the Conservatives’ superpower | Richard Godwin,2018
The Fiver | The Modern Pantheon of Memorable Anfield Saves (est. Dec 2018),2018
"SAG nominees 2019: A Star is Born, Mrs Maisel and Ozark lead the race",2018
Sweden suspends funding for UN Aids agency as Britain urged to follow suit,2018
Genetic study of people with acne raises prospect of new treatment,2018
Gwendoline Riley's 'brutal' novel about toxic marriage wins Geoffrey Faber prize,2018
What happened next? The super raccoon who scaled a skyscraper,2018
Zack Steffen is unlikely to ever play for Man City. So why did he join them?,2018
Neil Young claims victory in protest against Barclaycard,2018
Revealed: Google's 'two-tier' workforce training document,2018
1985 review – desperately moving Aids-related drama,2018
"Neil Young's made a start, but the arts must do more to oppose dirty money | Molly Scott Cato",2018
From Killing Eve to Love Island: the best TV style icons of 2018,2018
Ian Paisley under pressure over holiday to Maldives,2018
Mortal Engines: what Philip Reeve's predator cities tell us about our world,2018
I'm dreaming of a dark Christmas: seasonal horror,2018
Super Smash Bros Ultimate review – the fighting game with everything,2018
Sunderland ‘Til I Die shows all that is right and wrong in English football | Barry Glendenning,2018
Tory leadership challenge: the main contenders,2018
I predict a Riley: Kaiser Chiefs find new employment as art curators,2018
Grenfell cladding firm: 'fire could have been put out with simple extinguisher',2018
"Strasbourg attack: 'It lasted for minutes, but felt like hours'",2018
Cheltenham Festival to reduce field sizes in bid to improve safety,2018
Labour must seize this moment to bring down May’s government | Zoe Williams,2018
Capita failure over cervical screening letters more extensive than thought,2018
What did I learn at private school? They should be abolished,2018
Team Sky’s legacy: titles and ambition tarnished by coldness and allegations | Richard Williams,2018
"Theresa May could stand down before election, No 10 suggests",2018
What happened next? How teenage shooting survivor David Hogg became a political leader,2018
Time magazine names Jamal Khashoggi and persecuted journalists 'person of the year',2018
Tate Britain commissions Mike Nelson to transform its central galleries,2018
PMQs verdict: good May performance – but not one for history books,2018
How Native American tribes are bringing back the bison from brink of extinction,2018
Brexit cliff-edge looms as Tories wage 40-year-old civil war,2018
Home Office trying to force two disabled children to leave country,2018
Antarctic diary records horror at finding Captain Scott's body,2018
PMQs: Jeremy Corbyn demands immediate vote on Brexit deal,2018
Facebook among firms named on Myanmar human rights 'dirty list',2018
Chinese women trafficked to UK 'being failed by Home Office',2018
"That Night Follows Day review – adults' truths and lies, voiced by children",2018
"Brexit delay for a Brexiter PM is 'unrealistic', says EU",2018
Pistol Annies: the country 'girl group' confronting divorce and darkness,2018
Theresa May vows to fight leadership vote  'with everything I've got',2018
Māori Santa invited to Wellington parade after racist boos in hometown,2018
What does this vote of no confidence mean? | Ian Birrell and others,2018
Harry Kane says Spurs are Champions League contenders after Barça draw,2018
The 50 best films of 2018 in the US: No 8 – Can You Ever Forgive Me?,2018
In Miniature by Simon Garfield review – how small things illuminate the world,2018
How to cook the perfect coquilles St Jacques | Felicity Cloake,2018
'Hi-tech robot' at Russia forum turns out to be man in suit,2018
Business leaders urge MPs to end infighting after May survives vote,2018
"Christmas editorial, 1944: 'we need a new Europe, democratic, prosperous, progressive'",2018
‘Even a half-finished show is a victory’: Russian bands fight new crackdown,2018
"Good sports: 14 health, sports and fitness Christmas gifts",2018
Wednesday US briefing: Trump and Democrats in heated Oval Office row,2018
Talking Horses: BHA defends whip rules after 'thrashed' horses claims,2018
Absentee-ballot fraud scandal speaks to wider issue of racism in North Carolina,2018
"As climate change bites in America’s midwest, farmers are desperate to ring the alarm",2018
Tell us: what was your favourite game of 2018?,2018
Shenzhen's silent revolution: world's first fully electric bus fleet quietens Chinese megacity,2018
If every racist at football was silenced stadiums would still be full of racists | John Barnes,2018
"My shopping habits help Amazon take over the world. Alexa, this ends now | Krista Burton",2018
Now hiring for 'the worst job in government': Trump's chief of staff,2018
Who will be PM in the morning? All your questions answered,2018
Inside the 14 December edition of the Guardian Weekly,2018
Susan Atkins: 'We must take the threat to women in public life seriously',2018
Top 10 fictional booksellers,2018
Snowy 2.0: Malcolm Turnbull's pet project given go-ahead by board,2018
This is a national crisis – not the time for a pointless Tory feud | Jonathan Freedland,2018
What is the smallest football ground a European champion has lost at? | The Knowledge,2018
Yannick Nézet-Séguin: ‘Of course everything is dramatic. It’s opera!’,2018
Luka Doncic's genius has managed to make a great NBA rookie class look average,2018
'A beacon in the dark of winter': the Christmas songs that shaped us,2018
Luton aim high once again after building on their talented reserves | Ben Fisher,2018
"I don’t want to tell alcoholic patients to keep drinking, but I have to | Mariam Alexander",2018
Bill Shorten stares down Andrew Bolt and says he would unite employers and unions as PM,2018
Teenagers arrested after Birmingham school stabbings,2018
Football transfer rumours: Real Madrid's Marco Asensio to join Spurs?,2018
Country diary: the cloven ash – a two-headed enigma,2018
Dixons Carphone loses £440m in six months,2018
Welsh-language pop culture is having a party – and everyone’s invited | Rhiannon Lucy Cosslett,2018
"Tell Them of Battles, Kings and Elephants by Mathias Énard review – Michelangelo in Constantinople",2018
"Payday loan applicants asked to hand over bank passwords, inquiry hears",2018
'Significant step': Indigenous groups to be given seat at Closing the Gap table,2018
Scott Morrison fails to persuade states to lower migration rate at Coag,2018
TUC calls for 1m manufacturing and hi-tech jobs by 2030,2018
News from the I’m a Celebrity jungle: goodness thrives in strange places | Fiona Sturges,2018
Brexit: Challenge to May's leadership intensifies as senior Tory declares 'no confidence' - Politics Live as it happened,2018
Brexit in chaos as MPs trigger vote of no confidence in May,2018
"ABC and SBS online news and hit shows not hurting commercial media, panel rules",2018
Wedding Cake Rock: new fence will stop visitors climbing 'unsafe' Instagram attraction,2018
New rules spell out when doctors can allow patients with brain damage to die | Sarah Johnson,2018
'A different type of housing spreads': Manchester by Ben Tallon – an urban comic,2018
One Hundred Lyrics and a Poem by Neil Tennant review – escapism and intensity from the Pet Shop Boys,2018
The race to replace Theresa May: who are the likely candidates?,2018
Uber pushed for UK congestion charges that would hit poor hardest,2018
Stefania Giannini: 'Strong universities lessen social tensions',2018
"NSW Greens on brink of 'irrevocable split', two right faction MPs warn",2018
Unemployment: individual character flaw or mere feature of capitalism | First Dog on the Moon,2018
"Olga Edwards, Sydney woman whose ex-husband murdered her children, found dead",2018
New Elena Ferrante-inspired street art to be unveiled in Naples,2018
Wednesday briefing: Brexit – threat to May's leadership builds,2018
Wednesday’s best TV: Death and Nightingales; Old People’s Home for 4 Year Olds: Christmas,2018
Twitter chief Jack Dorsey responds to criticism over 'amazing' Myanmar tour,2018
Broadband too slow in more than a quarter of UK homes – report,2018
Apple 12.9in iPad Pro review: bringing back the wow factor,2018
"The 50 best albums of 2018, No 8: Kacey Musgraves – Golden Hour",2018
The 50 best TV shows of 2018: No 7 – The Good Fight,2018
Dag Hammarskjöld crash inquiry: UK and South Africa criticised for not cooperating,2018
"If you want to understand the gilets jaunes, get out of Paris | Nora Bensaâdoune",2018
The 50 best films of 2018 in the UK: No 8 – Widows,2018
