full_title,date
The Grenfell Tower fire was a national disaster. It needs a national response | Seraphima Kennedy,2017
"The best albums of 2017, No 8: Thundercat – Drunk",2017
ITV film reveals serious failings at UK children’s homes,2017
‘A sack of regrets waiting to happen’ – how to avoid a Christmas party nightmare,2017
The top 10 video games of 2017,2017
The 50 best TV shows of 2017: No 5 Big Little Lies,2017
"Wednesday’s best TV: Vanished by the Lake, Peaky Blinders, Detectorists",2017
Roy Moore’s stunning defeat reveals the red line for Trump-style politics | Richard Wolffe,2017
Country diary: snow changes everything the other side of the doorstep,2017
"Sam Dastyari should be 'out of the Senate now', Turnbull says",2017
Bennelong byelection: Liberals link Keneally to jailed Labor MPs in online campaign,2017
Catalan secessionists face steepest challenge in Barcelona's bruised beltway,2017
Doug Jones's victory speech in Alabama: 'This race has been about dignity',2017
Chinese authorities collecting DNA from all residents of Xinjiang,2017
Grappling with Rome: David Marr's lessons from the royal commission,2017
Japanese kanji of the year is 'north' – thanks to Kim Jong-un,2017
Australia’s Steve Smith says two more bad sessions can lose England the Ashes,2017
Worker exploitation: Victorian body to crack down on abuse of employees,2017
Australia revel in portrayal of England's Ashes tour as out of control | Geoff Lemon,2017
Barnaby Joyce says New Zealand should 'back off' on offer to resettle refugees,2017
Northern Territory to decide about fracking ban only after inquiry's final report,2017
Jennifer Lawrence to star in film adaptation of Hannah Kent's Burial Rites,2017
Rugby Australia choose best person for job but Castle's appointment still symbolic | Kate O'Halloran,2017
After Dastyari’s downfall we must question the hold of big money on any political party | Jeff Sparrow,2017
Australia to bid for 2027 Rugby World Cup and 2021 women’s tournament,2017
Bollywood sexual harassment: actors speak out on Indian cinema's open secret,2017
Roy Hodgson: ‘Where we are in the table you have to work hard for every win’,2017
Body found in search for man who went missing on freezing night,2017
Tory rebels confident of securing 'meaningful vote' on Brexit deal,2017
Ashley Barnes’ late goal against Stoke sends Burnley soaring into top four,2017
"Make Facebook liable for content, says report on UK election intimidation",2017
Westminster watchdog investigates Camelot’s funding of good causes,2017
"Polish up your pecs: women prefer strong men, say scientists",2017
Hundreds of thousands of EU nationals 'may not get right to stay in UK',2017
What can be done about abuse on social media?,2017
Grenfell fire fundraiser shortlisted for $1m global teacher prize,2017
"Cryptic crossword No 27,379",2017
"Quick crossword No 14,852",2017
Alex Miller evokes lost Melbourne and past loves in 'private and personal' novel,2017
Crystal Palace’s Bakary Sako and James McArthur strike late to stun Watford,2017
Chelsea bounce back with comfortable win over Huddersfield Town,2017
José Mourinho questions Manchester City’s education and blames them for brawl,2017
Manchester City need defensive signing to avoid trouble says Pep Guardiola,2017
Roy Moore arrives on horseback for Alabama vote as sister says 'every single woman is lying',2017
"25,000 children in Britain are problem gamblers, report finds",2017
"Jack Wilshere a January transfer target for West Ham, says David Moyes",2017
José Mourinho and Pep Guardiola pass buck and fail to face the truth | Daniel Taylor,2017
Rafael Benítez airs frustration over Newcastle transfer budget uncertainty,2017
Sam Allardyce cancels Christmas party because of Everton’s festive demands,2017
Mohamed Salah may be next in line for Liverpool rotation after injury scare,2017
"US ready for talks with North Korea 'without preconditions', Tillerson says",2017
Court upholds Obama-era ban on new Grand Canyon uranium mines,2017
Grenfell survivors demand justice at parliament gathering,2017
World Bank to end financial support for oil and gas extraction,2017
Huddersfield Town 1-3 Chelsea: Premier League – as it happened,2017
"Inflation rises to 3.1%, adding to UK cost of living squeeze",2017
Damian Green may be cleared 'because he wasn't minister at time',2017
"Faulk, McNabb among pundits taken off air amid sexual harassment allegations",2017
Weatherwatch: the 'halcyon days' of December hark back to the kingfisher,2017
More Mr Bean than John Wayne: thumbs down for Roy Moore's horsemanship,2017
Corrections and clarifications,2017
Alabama court gives last-minute order that could impede recount procedure,2017
Salford fire: sixth person arrested over arson attack,2017
Egyptian pop singer sent to prison for video that 'incited debauchery',2017
Morning mail: environment funding cut by a third,2017
UK police rescue nine suspected victims of slavery from British trawlers,2017
"Ian McClelland, founding CEO of Guardian Australia, promoted to new role",2017
The Guardian view on the Brexit vote: mutiny wanted | Editorial,2017
The Guardian view on Putin in Syria: victory and desolation | Editorial,2017
UK fuel prices could rise by 3p a litre after North Sea pipeline closure,2017
Democracy undermined on all sides as Brexit starts to take shape | Letters,2017
"Max Clifford ain’t my scamster, say PR folk | Letter",2017
CND wasn’t involved in George Blake’s escape | Letters,2017
"Children need trained teachers, not careerists | Letters",2017
A less rose-tinted view of Justin Trudeau’s Canada | Letters,2017
Why no Beano about Corbyn’s peace award? | Letters,2017
"Vocational education funding at lowest level in a decade, report says",2017
In Jerusalem we have the latest chapter in a century of colonialism | Karma Nabulsi,2017
Ruth Davidson says she would consider standing to be an MP in future,2017
Ombudsman called in after death of 11th immigration detainee,2017
Westfield sale looks like a knee-jerk reaction to the Amazon age | Nils Pratley,2017
Brexit debate: how many MPs does it take to fill eight hours of dead air?  | John Crace,2017
Trainers joust over King George prospects of Bristol De Mai and Might Bite,2017
What David Attenborough should have said at the end of Blue Planet | Patrick Barkham,2017
Ryanair pilots based in Ireland to stage one-day strike next week,2017
Former Facebook executive: social media is ripping society apart,2017
"Tragedy, outrage and optimism: Gary Younge on editing the Bedside Guardian",2017
Adrian Searle's top 10 art shows of 2017,2017
Polish regulator fines US-owned broadcaster over protests coverage,2017
Donald Tusk says getting Brexit deal by next autumn will be 'furious race against time' – as it happened,2017
"The Golden Globes have ignored female directors. In the year of #MeToo, this won’t wash",2017
"UK faces Christmas squeeze as inflation hits 3.1%, outpacing wages – as it happend",2017
Stars are the new stripes: why fashion is turning to the spiky side,2017
Mike Campbell obituary,2017
David Davis scrambles to salvage EU relations after 'damaging trust',2017
Six perfect Christmas gifts for Donald Trump's biggest fans,2017
Facebook to stop routing ad revenue via Ireland amid pressure over taxes,2017
Alastair Cook’s milestone Test doubles up as the ‘biggest game of our lives’,2017
Old master paintings given to National Gallery by Dutch aristocrat,2017
EU announces €9bn in funding for climate action,2017
"Meet Dracula, the bloodsucking tick which feasted on dinosaurs 99m years ago",2017
Palmer & Harvey: 400 more workers lose jobs weeks before Christmas,2017
Robert Rowland obituary,2017
Europe's biggest mall owner buys Westfield for $25bn,2017
New York bombing suspect reportedly posted Trump 'failed to protect' US,2017
Micheline Dumon obituary,2017
Wales’ Six Nations hopes hit by Taulupe Faletau’s knee injury,2017
Tories restore whip to MP suspended for using racist language,2017
Amaravati Buddhist art to finally be seen in full glory at British Museum,2017
Guardian Media Group makes new commercial appointments to support strategy and strengthen Guardian US and Guardian Australia,2017
Environment funding slashed by third since Coalition took office,2017
Swinging Safari review – Kylie Minogue and Guy Pearce in outrageous ode to 70s Australia,2017
"Gas prices still too high despite government intervention, ACCC finds",2017
"Naplan scores: Australia's civics education 'woeful', minister says",2017
"Strictly-inspired alternatives to ‘dad-dancing’ – from Harriott Hopping to Nancy Prancing
",2017
Fossil hunters find bones of human-sized penguin on New Zealand beach,2017
LiAngelo and LaMelo Ball sign pro contracts with Lithuanian club,2017
"Cat Person is 'mundane', Austen is 'dross': why do so many men hate female writing?",2017
Cold comfort: how to be warm and fashionable at the same time,2017
Diane Brace obituary,2017
New mortgage lending in UK reaches highest level since 2008,2017
New Zealand bans vaginal mesh implants,2017
The Fiver | It’s back to the comparative mundanity of actual football,2017
Cambridge don leaves college after new investigation into harassment claims,2017
"Samantha Fox on fame at 16, stalkers and David Cassidy: ‘I kneed him and told him where to go’",2017
Labour must say it: Britain should stay in the single market after Brexit | Chuka Umunna,2017
Trump’s lawyers call for second special counsel to investigate Russia special counsel,2017
Single all the way: why Christmas is the most wonderful time of year to be alone | Lizzie Cernik,2017
UK box office suffers worst week in years as The Last Jedi looms,2017
New universities regulator warns of senior pay crackdown,2017
"In Venezuela, Maduro’s opponents must not lose faith in elections | Reynaldo Trombetta",2017
How did I handle casual racism in Los Angeles? Awkwardly | Romesh Ranganathan,2017
Inside the 15 December edition,2017
Share your favourite UK winter walks for the chance to win a £200 hotel voucher,2017
Misalliance review – Shaw's women talk the talk in an English country garden,2017
A shocking way to fund UK care homes | Nils Pratley,2017
Shropshire villagers snap up woollies and fuel in Britain's coldest place,2017
New York attack: police in Bangladesh question Akayed Ullah's relatives,2017
Struggling to express your feelings? Get an imaginary friend,2017
Subway attack worries Brooklyn's Little Bangladesh: 'We don't stand behind this stupidity',2017
What could Vienna’s low-cost housing policy teach the UK?,2017
Cat Person going viral shows how rare it is to explore women’s sex lives | Rhiannon Lucy Cosslett,2017
Tens of thousands of Israelis attend ultra-Orthodox rabbi's funeral,2017
Golden eagles released in Scotland with hope they will fly south,2017
Althea Efunshile joins Channel 4 board after government U-turn,2017
UK Christmas shoppers to spend record £4.2bn on food and drink,2017
So men are afraid after #MeToo? Think about what it's like for women | Jessica Valenti,2017
Potty training gets messy. But I wouldn’t pay anyone else to do it | Fran Taylor,2017
"Disabled people should be seen as individuals, not as a drain on the taxpayer | Frances Ryan",2017
"'Heat not burn' cigarettes still harmful to health, say government advisers",2017
Minister outlines how EU nationals will apply for UK 'settled status',2017
Fire union calls for 'compromised' Grenfell expert to stand down,2017
The untold story of the Siberian Bear: why Latvia’s rugby hero is an inspiration | Robert Kitson,2017
Marsha de Cordova: As a disabled MP I have to do more work and more prep,2017
James Vince drives us crazy but other England batsmen’s flaws also maddening | Andy Bull,2017
Labour isn’t flip-flopping on Brexit – this is practical politics | Maya Goodfellow,2017
"Hey Alexa, is it true you’re a lefty feminist?",2017
Letter: Christine Keeler obituary,2017
The Tories’ rebranding won’t wash: being green is about more than fluffy bunnies | Molly Scott Cato,2017
Send us your questions for Zadie Smith,2017
Can a GM banana solve Uganda's hunger crisis? | Alon Mwesigwa,2017
Attrib. this: Eley Williams's experimental stories are a microblast,2017
India bans condom adverts during primetime TV,2017
"Guardian Weekly Letters, 15 December 2017",2017
Is it romance or is it just infatuation? Your answers,2017
Good to meet you ... Rowland Jepson,2017
"Trump visit to UK expected in new year, says US ambassador",2017
Online abuse must be curbed. But who decides where the line is drawn? | Owen Jones,2017
Man dies in explosion at Birmingham metal factory,2017
Working in healthcare over Christmas and new year? Tell us your stories,2017
Jim Mallinder sacked as director of rugby at Northampton Saints,2017
The Guardian and The Observer win three prizes at the British Journalism Awards,2017
Are women better novelists than men? Your best comments on the Guardian today,2017
Bitcoin buyer beware: US SEC warns 'extreme caution' over cryptocurrency investments,2017
TV comedy like Chinese Burn doesn’t smash stereotypes. It reinforces them | Yuan Ren,2017
Mariah Carey review – delightful diva is all you want for Christmas,2017
Arsène Wenger says footballers cannot replicate respect shown in sumo wrestling,2017
Street-smart Pat Cummins can give the Waca a roaring Ashes farewell | Jason Gillespie,2017
Calls for greater fossil fuel divestment at anniversary of Paris climate deal,2017
"Surveillance firms spied on campaign groups for big companies, leak shows",2017
Sheryl Crow criticizes country stars for not 'taking a stand' on gun control,2017
The Silicon Valley paradox: one in four people are at risk of hunger,2017
The rightwing takeover of the US court system will transform America | Paul Butler,2017
Time to break the myth: there’s no such thing as a 'good' or 'bad' immigrant,2017
Robert Mueller is closing in on Trump. Congress must protect his investigation | Max Bergmann and Max Boot,2017
'No shame': how the Trump administration granted big oil's wishlist,2017
These poignant and fun memes show the humanity of all Dreamers,2017
"Wildcats, butterflies, tortoises: all are endangered by Trump's border wall",2017
"She could have been a top US soccer player. Problem was, she was undocumented",2017
This is what the hours after being deported look like,2017
How to Disappear review – why the benefits system is on another planet,2017
Christmas gift guide: the best subscriptions,2017
Running on empty: the refugee who found a second home at Kent AC,2017
David Squires on … the Manchester and Merseyside derbies,2017
Why the robin needs to be pushed off its snowy Christmas card perch | Richard Smyth,2017
The NBA has surpassed the NFL as the league of America’s future | Kareem Abdul-Jabbar,2017
"Nicola Hobbs: ‘It was really hard at first to have both, football and the fire service’ | Suzanne Wrack",2017
Film depicts reality for young parents at risk of having a child taken into care,2017
UK to bring back beavers in first government flood reduction scheme of its kind,2017
Talking Horses: Hoping that fiery tearaway Yorkhill follows Gold trail,2017
Priest jailed for child abuse images lived on scandal-hit Caldey Island,2017
Inside the secret world of the corporate spies who infiltrate protests,2017
Football transfer rumours: Liverpool's Mohamed Salah to Real Madrid?,2017
"The A to B of Abba: Nirvana, holograms and Des Lynam",2017
Congregation fights to save church where Harriet Tubman worshipped,2017
Big web firms may face prosecution over online abuse,2017
Britain's cold snap continues as schools stay shut for second day,2017
England's Rugby League World Cup attracts venue interest from overseas,2017
"Stop accusing men of overreacting – 'man flu' really does exist, doctor claims",2017
MPs urged to back Brexit bill clause to protect child refugees,2017
She fought for her community as a Black Panther. Will gentrification force her out?,2017
'Nobody cares about us': Britons living in rest of EU voice their dismay,2017
Insurance giant Axa dumps investments in tar sands pipelines,2017
It's not asking the earth for independent watchdog to fill EU gap,2017
I’ve watched Prince in Sign o’ the Times 156 times. Is that wrong? | Nell Frizzell,2017
Clive Lewis cleared by Labour over sexual harassment claim,2017
The billionth treatment for river blindness – photo essay,2017
'Our playground': London cyclists find utopia in Regent's Park,2017
Donald Trump's accusers demand Congress investigate sexual misconduct claims,2017
Domestic violence: can moving power out of Whitehall make a difference?,2017
Corbyn refuses to firm up Labour's Brexit plans,2017
"Charles Jenkins, US soldier who defected to North Korea, dies aged 77",2017
Wet wipes make up 93% of matter causing UK sewer blockages,2017
Roy Moore battles bigotry claims on eve of Alabama vote: 'Our attorney is a Jew',2017
They made the education news in 2017 – but what happened next?,2017
Microsoft Surface Book 2 review: a powerful yet pricey laptop-tablet combo,2017
Alan Partridge is a Brexiter – how would other classic TV characters vote in 2017?,2017
Keith Chegwin: a born entertainer with natural likability,2017
Are we ignoring an epidemic of sexual violence in schools?,2017
Brexit weekly briefing: new catchphrase enters lexicon as talks move on,2017
"What a performance, trying to swap our tickets for The Ferryman",2017
Nelson in the spotlight: is a storm brewing in New Zealand's boho bay?,2017
Spinning by Tillie Walden review – portrait of adolescence on ice,2017
School admissions in England are becoming a wild west | Fiona Millar,2017
'I challenge them to leave but force them to stay': playwrights on their audiences,2017
"With Indigenous recognition, Turnbull should listen, not lecture | Shireen Morris",2017
The traders cashing in on Rohingya misery: 'It's the best profit of my life' | William Worley,2017
"Take the kids to … Lappa Valley Steam Railway, Cornwall",2017
Best albums of 2015: No 1 – To Pimp a Butterfly by Kendrick Lamar,2015
"At 60, should I give up my unfulfilling job in a school and try something new?",2015
Breakfast brainstorms and dirty dishes: inside an entrepreneurs' houseshare,2015
"Viral video: Star Wars, One Direction and House of Cards",2015
"Islamic State's defeat by Iraqi forces just a matter of time, says top navy official",2015
Away in a Maltese manger: Gozo's Bethlehem,2015
Democrats punish Bernie Sanders campaign following Clinton data breach,2015
"Friday’s best TV: TFI Friday, Captain Webb, Queen: From Rags to Rhapsody, The Best Exotic Marigold Hotel",2015
Kellingley closure: last coalminers to resurface as way of life disappears,2015
Spain’s election will be felt across the whole continent  | Owen Jones,2015
More than 14m people to hit roads on busiest Christmas travel day,2015
Combat among the cows,2015
Numbats given reprieve as WA council scraps plans for rubbish dump,2015
Stomping singalongs and toilet trouble as Cold Chisel wreck the joint one more time,2015
Coles pulls Harper's Bazaar from sale over 'inappropriate' naked Miranda Kerr cover,2015
The drugs don't work: our post-antibiotic future could already be here,2015
Malcolm Turnbull slaps down MPs' criticism of Asio chief over Islam advice,2015
Soundwave music festival cancellation causes confusion over ticket refunds,2015
"The government's cultural barbarism and plunder of the arts, continued",2015
Lachlan Heywood appointed editor of News Corp's Courier-Mail,2015
Tasmania to offer apology and quash historical convictions relating to gay sex,2015
"Australian bikie refused entry to New Zealand, prompting talk of diplomatic retaliation",2015
"QBE Insurance 'discriminated' against student with depression, says tribunal",2015
"A year in Australian politics: after a steady drumbeat of fear, 2015 ends on hopeful note",2015
Chinese activists force fed cat excrement to suspected animal 'torturers',2015
"ACCC alleges jobseekers promised good jobs, big pay if they sign up to training courses",2015
Australia wins international legal battle with Philip Morris over plain packaging,2015
Women's fertility underestimated by 68% in 'highly inaccurate' hormone test,2015
Melbourne and Adelaide to sweat it out as temperatures climb past 40C,2015
How pens  and ergonomic furniture are changing the face of Indigenous business,2015
EU leaders struggle to reach migrant agreement at Brussels summit,2015
It’s time for progressives to reclaim the 'war on Christmas' and give it a new force | Jason Wilson,2015
Models in France must provide doctor's note to work,2015
Real Madrid’s Florentino Pérez rules out immediate return for José Mourinho,2015
San Bernardino: shooters' neighbor charged with conspiring to commit terrorism,2015
Abbot Point coal port expansion faces hurdle over 'secret' tugboat harbour,2015
Police marksman arrested after shooting suspect dead in Wood Green,2015
Lampedusa Cross will be British Museum director's final aquisition,2015
David Bowie's Blackstar album: 'An unexpected left turn that deepens the mystery' – first-listen review,2015
Workers could hold key to unlocking executive pay gap,2015
Prisoners' use of legal highs 'puts severe strain on ambulance services',2015
Workers demotivated by executives' high pay – survey,2015
"Solar energy: Australia is not an innovation nation, it's an inertia nation",2015
Secret US mission in Libya revealed after air force posted pictures,2015
"Unravelling the mystery of Djalu Gurruwiwi, a living Yolngu legend",2015
Fufanu: Few More Days to Go review – thrillingly malevolent and catchy tunes,2015
Snoopy and Charlie Brown: The Peanuts Movie review – return of a lovable loser,2015
Rory McIlroy praises the calming presence of low key Erica Stoll,2015
Meat Wave: Delusion Moon review – slashing riffs and silvery melody from outstanding Chicago punk trio,2015
"Beaten in surfing's world title race, Mick Fanning is still a champion for the ages",2015
"Beach Slang: The Things We Do to Find People Who Feel Like Us review – loud, punky alt-rock done right",2015
"Sparks & Embers review – sparks fly, but this two-hander is excruciating",2015
Man jailed for posting antisemitic material ahead of 'Jewification' rally,2015
"Claudio Ranieri deserves greater credit for Leicester rise, says Roberto Martínez",2015
"Nadia Reid: Listen to Formation, Look for the Signs review – introspection and oomph on indie-soul debut",2015
Daddy's Home review – humiliation in parenting,2015
Liverpool close in on deal for Marko Grujic from Red Star Belgrade,2015
Sam Allardyce unsure what to expect when Sunderland play at Chelsea,2015
Sherpa review – peril in the shadow of Everest,2015
"Girl Band: Holding Hands with Jamie review – thumping, crashing sound and fury from Dublin punks",2015
Dylan Hartley’s concussion puts England captain appraisal on hold,2015
Daylight Versions: the Leaf Library review – melancholy wonder on delightful debut,2015
Talk about Dylan Hartley says much about Eddie Jones’s England plans | Robert Kitson,2015
The rise and rise of Exeter contrasts with curious fall of Northampton | Dean Ryan,2015
'Game-changing' perovskite solar tech could be cheaper and more efficient,2015
Mick Fanning narrowly loses world surf title bid to Adriano de Souza,2015
Auntie Flo: Theory of Flo review – heady blend of world music and house,2015
José Mourinho sacked by Chelsea – as it happened,2015
Disturbances flare in Calais as refugees try to break into lorries to reach UK,2015
"Lights, camera, earthquake!",2015
Jeffrey Lewis & Los Bolts: Manhattan review – anti-folk star still capable of surprises,2015
Why do I keep meeting men who have commitment issues?,2015
The Internet: Ego Death review – Odd Future offshoot muse on love and lust,2015
Special treatment not enough to save José Mourinho in the end | Dominic Fifield,2015
Chelsea sacked José Mourinho over ‘palpable discord’ with players,2015
Guus Hiddink can claim closure at Chelsea after raw wounds from Holland | David Hytner,2015
Thundercat: The Beyond/Where the Giants Roam review – eerie ambience and transcedental grooves,2015
The 50 best films of 2015 in Australia: No 1 – Bridge of Spies,2015
Corrections and clarifications,2015
Obama says no 'specific and credible' threat is facing the United States,2015
Edinburgh council reject plans for old Royal High school hotel,2015
Pharmaceutical (and Wu-Tang) villain Martin Shkreli has courted controversy,2015
Foreign Office cleaners warned over pay query,2015
Thatcher’s old clothes being peddled as investments? She would love it | Gaby Hinsliff,2015
"Adeus, José – a fittingly operatic departure for the Chelsea manager",2015
Britain’s pro-Europeans need to find a Shirley Williams | Martin Kettle,2015
The Guardian view on the end of deep mining: adieu to the aristocracy of the working class | Editorial,2015
The Guardian view on fighting Isis: the opening of a Saudi front | Editorial,2015
Nobel laureate at centre of female scientists row to leave UK for Japan,2015
Labour and the need for a new political narrative | Letters,2015
Global corporate tax dodges do untold harm | Letters,2015
Readers recommend: songs about mountains | Peter Kimpton,2015
Raised US interest rates could stunt the growth of startup businesses,2015
Jeremy Corbyn says he opposes making EU migrants wait to receive benefits,2015
The Martin Shkreli schadenfreude will pass when he wins like every other CEO | Chris Lehmann,2015
Society of mosques to boycott 'racist' anti-terror Prevent programme,2015
'Like being on death row': the final week in Kellingley colliery,2015
Britain hopes to send hundreds of troops to Libya after peace deal,2015
José Mourinho still a great manager​ despite return of familiar flaws | Daniel Taylor,2015
UN accused of 'gross failure' over alleged sexual abuse by French troops,2015
The Guardian view on Shirley Williams: a dignified departure | Editorial,2015
