full_title,date
No Hard Feelings review – life lessons and love stories in a refugee shelter,2020
"Last-minute Brexit deal vital for UK economy, government told",2020
What is the ratchet clause and could it sink the Brexit talks?,2020
Biden picks California attorney general to lead US's post-Trump Covid response,2020
"A lexicon of Brexit double-speak: what they say, what it means",2020
Exiled Hong Kong legislator calls for action after HSBC bank accounts frozen,2020
Toyota will not invest in electric cars in UK until after 2027,2020
MEP József Szájer being caught at an orgy is hilarious – but it doesn't mean the whole EU is sleazy | Emma Beddington,2020
The assassination of an Iranian scientist will make Joe Biden's job harder | Mohamad Bazzi,2020
Kevin Sinfield hopes marathon fundraising efforts can help find MND cure,2020
Mother of girl who died after asthma attack ‘knew nothing’ about pollution risk,2020
Min Birdsey obituary,2020
Murmurs of discontent over Brexit talks could yet become a roar,2020
Mikel Arteta not blind to Arsenal shortcomings but can't see a solution | Nick Ames,2020
What happens if the UK and EU fail to agree a Brexit deal?,2020
Here Awhile review – assisted-dying drama weighed down by cliche,2020
Hard remainers wouldn't accept a soft Brexit. Now we're all paying the price | Owen Jones,2020
We have realised too late the abstract and concrete realities of Brexit can't be reconciled | Zoe Williams,2020
Torino fluff chance of derby win after all-too familiar collapse at Juventus,2020
Mystery illness puts 450 in hospital in Indian state of Andhra Pradesh,2020
"Thomasina Miers' recipe for pear, panettone and chocolate trifle",2020
A novel idea: is the book always better than the film?,2020
Michel Barnier says Brexit talks will not go beyond Wednesday,2020
Euphoria: Trouble Don’t Last Always review – Zendaya shines in bleak midwinter tale,2020
'Boris Johnson's lustre has faded': European media dissect painful Brexit talks,2020
Have Leipzig become Bayern’s greatest Bundesliga irritant? | Andy Brassell,2020
Annotated solutions for Genius 209,2020
TV style icons of 2020: Ted Danson as The Good Place's dapper demon,2020
Former appeal court judge to lead UK review of Human Rights Act,2020
Teachers and parents in the UK: what has this term been like?,2020
"Churn baby churn: butter-heavy recipes, from indulgent gnocchi to satisfying shortbread",2020
Covid blood test can predict patient survival chances,2020
Trump's top team in turbulence | First Thing,2020
John Mitchell obituary,2020
Elli Glevey obituary,2020
The 50 best films of 2020 in the US: No 10 – The Nest,2020
Rachel Roddy's Christmas recipe for cassata Siciliana cake | A kitchen in Rome,2020
How we met: ‘I’d hear the noise of the fax machine and be excited to see if it was her’,2020
"‘Brazil is a racist country, statistically’: Luedji Luna, the bold voice of Bahia",2020
Breakaway Premier Golf League presses ahead with plan to land top players,2020
Minister decries Millwall fans who booed players for taking a knee,2020
Monster Hunter film pulled from China after scene sparks backlash,2020
TikTok investigating videos promoting starvation and anorexia,2020
Crossword blog: Meet the setter – Vulcan,2020
Talking Horses: Chacun Pour Soi cements status with winning return,2020
Israel to investigate shooting of Palestinian child,2020
Mike Ashley's Frasers Group in talks to buy collapsed Debenhams,2020
"Justice must be guiding principle in US vaccine rollout, says top expert",2020
Out in the wild: how Ken Layne created an alternative to clickbait in the desert,2020
"'Right now, I'm in panic mode': US freelancers plead with Congress to pass Covid relief",2020
Poem of the week: My Stranger by Maria Taylor,2020
Are you getting the Pfizer coronavirus vaccine this week in the UK?,2020
Spanish shantytown residents face third month without power as snow forecast,2020
PM apologises for erroneously stating Kevin Rudd had left and re-entered Australia during Covid,2020
Tell us: what are your best tips for recovering from a hangover?,2020
"Coca-Cola, Pepsi and Nestlé named top plastic polluters for third year in a row",2020
Millions of Californians put under strict Covid lockdown,2020
Liverpool plan to reward 'untouchable' Fabinho with new contract,2020
A moment of pride: why 2020 has been a big year for the lesbian movie,2020
Prawn salad and baked ricotta: Rachel Roddy's Christmas starters – recipes | A kitchen in Rome,2020
Jets and Jaguars fans are obsessed with the No 1 pick: they shouldn't be,2020
B&Q owner Kingfisher to repay £130m of Covid business rates relief,2020
'I don't know what Iran wants': Mariam Claren's fight to free her mother,2020
Biden mulls options in case Republicans try to block cabinet picks,2020
"Stores in remote Indigenous communities not engaged in price gouging, inquiry finds",2020
Pipeline factory near Ningaloo Reef reportedly scrapped – as it happened,2020
Little pygmy possum found on Kangaroo Island after fears of decimation in bushfire,2020
Premier League: 10 talking points from this weekend's action,2020
WHO looks at giving Covid-19 to healthy people to speed up vaccine trials,2020
"UK public's £100bn Covid savings could help recovery, says Haldane",2020
Sturgeon faces growing SNP rebellion over leadership style,2020
Sports rorts inquiry calls on Sport Australia to clarify legality of grants made,2020
Young Heroes of the Soviet Union by Alex Halberstadt review – a genealogy of trauma,2020
'It's not weird or foreign': the Ugandan monk bringing Buddhism to Africa – photo essay,2020
"Our £1,000 cooker is unsafe but we can’t get it fixed",2020
So you want to be a solicitor? Here's how to apply,2020
Why my council is refusing to help the Home Office deport rough sleepers | Emine Ibrahim,2020
Should I use my savings to overpay my mortgage?,2020
Amazon Echo 2020 review: the best-sounding smart speaker under £100,2020
Tree of the week: ‘I’d tie myself to this Norway maple rather than see it cut down’,2020
"I’ve been defrauded, quizzed and flagged as abusive. On the plus side, my anger used up eight calories",2020
'Game-changer': £1m pledged to help refugees resettle in UK,2020
Lawyers denied access to asylum seekers in Kent barracks,2020
UK music streaming startup backed by Kylie secures £13m funding,2020
Builders run short of supplies as UK port holdups raise Brexit concerns,2020
Coalition proposes four-year jail sentence and $1.1m penalty in wage theft crackdown,2020
Six of the best new train journeys in Europe for 2021,2020
Not to be sneezed at: how 3D printing is supersizing the tiny world of pollen,2020
"TV tonight: Metres, miles and smiles as the Vicar of Dibley takes on social distancing",2020
Victoria Covid hotspots: list of Melbourne and regional case locations,2020
Santa! Are you one of the grown ups who lies – or one who shatters the magic of childhood? | First Dog on the Moon,2020
Monday briefing: Brexit negotiations continue after fishing breakthrough,2020
'Remarkable': South Australian surfer with serious shark bite injuries swims to shore and walks 300m,2020
Factory-farmed salmon: does it make sense to grow fish in indoor tanks?,2020
Pluck and pamper: Lotus Beauty waxes lyrical about the salon,2020
"Brandon Cronenberg on gougings, knifings and pokerings: 'CGI is too floaty and unreal'",2020
The Bee Gees’ Barry Gibb: ‘There’s fame and there’s ultra-fame – it can destroy you’,2020
"The 50 best albums of 2020, No 10: Moses Sumney – Græ",2020
Starwatch: Venus and the moon reward early-risers,2020
Met faces legal action over spies' use of dead children's identities,2020
"The 50 best films of 2020, No 10: Never Rarely Sometimes Always",2020
Joe Biden’s drive for diversity in top political jobs is only an illusion of change | Nesrine Malik,2020
Reporting from Greece: 'This country has become a poster child for resilience',2020
"Covid deepens south and north of England inequalities, study finds",2020
'The panto pulls in people': how a theatre cancellation affects the local economy,2020
Densely packed BAME communities in England bear brunt of Covid-19,2020
'It’s very frustrating': the Covid inequality dividing Blackburn,2020
NSW police watchdog seeks power to investigate deaths in prison,2020
Country diary: trolling for butterflies under a bridge,2020
WW1 trench fever identified in former homeless man in Canada,2020
"Rudy Giuliani has coronavirus, Donald Trump says",2020
Lab-grown chicken tastes like chicken – but the feeling when eating it is more complicated | Naima Brown,2020
Georgia runoff debate: senator Kelly Loeffler refuses multiple times to accept Biden victory,2020
'Stronger together': Taiwan foreign minister urges new alliance against China,2020
Coalition proposes retrospectively stripping misclassified casuals of up to $39bn in claims,2020
Cashless debit card: government's own research finds underwhelming support,2020
Papua New Guinea ambulance service given no money in budget,2020
"Italy's death toll passes 60,000 – as it happened",2020
Doctors step up drive for probe into PPE and Covid deaths among health workers,2020
No buts: Keir Starmer did not inspire Helen Fielding's Mark Darcy,2020
UK's first all-electric car charging forecourt opens in Essex,2020
Genius crossword 210,2020
The Ballad of Corona V review – promenade through the pandemic,2020
"Cryptic crossword No 28,310",2020
"Quiptic crossword No 1,099",2020
Floyd Mayweather to fight YouTuber Logan Paul in February boxing match,2020
Toxicity on show at Millwall goes beyond the club and football | Sean Ingle,2020
"With time close to running out, Brexit talks reach crunch stage",2020
Eddie Jones hits out at 'disrespectful' critics after England victory,2020
"Liverpool turn on style against Wolves as 2,000 fans return to Anfield",2020
José Mourinho says Tottenham 'grew up' in showing title credentials,2020
Will Kane-Son love story have a romantic ending this season? | Barney Ronay,2020
Liverpool 4-0 Wolves: Premier League – as it happened,2020
"Jerrold Post, CIA psychiatrist who profiled Trump, dies of Covid aged 86",2020
Corrections and clarifications,2020
Busy high streets after lockdown prompt Covid fears but numbers still down,2020
England's fortitude pays off although France show attack needs to sharpen | Andy Bull,2020
Breakthrough on fishing rights as Brexit talks hang in the balance,2020
"World Cup 2022 European qualifying draw: format, pots and rules",2020
Face masks and temperature checks: life as a Spurs fan in a pandemic,2020
Strictly Come Dancing 2020: week seven results – as it happened,2020
Staten Island Covid protests: bar owner held after driving into deputy,2020
"Morning mail: China boycott hits exports, casuals face $39bn loss, Heartbreak High redux",2020
Cinderella: the Socially Distanced Ball review –  a show that radiates delight,2020
England tour in doubt after first ODI cancelled and 'unconfirmed' Covid positives,2020
Netflix has 'no plans' to add disclaimer that The Crown is work of fiction,2020
Theresa May's negotiator on EU tactics and her worst Brexit day,2020
Sergio Pérez wins Sakhir Grand Prix: Formula One – as it happened!,2020
Scottie Pippen: 'I told Michael Jordan I wasn’t too pleased with The Last Dance',2020
Tottenham 2-0 Arsenal: Premier League – as it happened,2020
Harry Kane and Son Heung-min a lethal Tottenham double act against Arsenal,2020
Covid vaccine arrives in UK hospitals ready for first jabs,2020
The Guardian view on DeepMind’s brain: the shape of things to come | Editorial,2020
The Guardian view on advent: what are we waiting for? | Editorial,2020
Call for windfall tax on PPE firms to fund £500 bonus for frontline staff,2020
Ministers face double defeat in Lords over China trading links,2020
Van Jones: 'Joe Biden is a romantic idealist in the age of cynicism and snark',2020
Even dedicated Brexit-watchers reluctant to call deal or no deal,2020
The Rev Michael Newman obituary,2020
Margaret Hodge calls for ban on social media anonymity,2020
Marianna Clark obituary,2020
Murder in Mexico: journalists caught in the crosshairs,2020
Trump press secretary appears to acknowledge Biden election victory,2020
Police chief unveils radical plans for community panels to monitor race bias,2020
Why stick with outdated end-of-course exams? | Letters,2020
A warning on climate and the risk of societal collapse | Letter,2020
Windrush and the need for do-gooders,2020
A Glasgow salad and other festive treats | Brief letters,2020
Hamish MacInnes obituary,2020
Letter: Mike Cooley obituary,2020
US health secretary insists Trump has detailed vaccine rollout plan,2020
Leicester's Jamie Vardy scores late winner to sting Sheffield United,2020
Everton 0-3 Manchester City: Women's Super League – as it happened,2020
Tributes paid to NHS psychologist who died of Covid-19,2020
Arriving in the US from Australia during Covid was like walking through the looking glass | Abby Bloom,2020
Cutting waste: how a salon recycles 65 bags of hair,2020
Open thread: What's the perfect song to play as this terrible year ends?,2020
"'Devastating': more than 61,000 koalas among 3 billion animals affected by bushfire crisis",2020
Dave Rennie's Wallabies honeymoon over after another hollow Test season | Bret Harris,2020
China boycott to hit Australian wine harder than expected as fruit and vegetable prices rise,2020
Netflix announces Heartbreak High reboot for 2022: 'We haven’t had a teen show like it since',2020
Owen Farrell kicks England to sudden-death Autumn Nations Cup final win,2020
"Police officer who retired after novichok poisoning 'fighting for pension', says wife",2020
Alex Morgan scores first WSL goal as Tottenham ease to win over Brighton,2020
"Trump's attacks on election integrity 'disgust me', says senior Georgia Republican",2020
Police cells are open to scrutiny. Now the same must happen with body cameras | Rob Beckley,2020
Spain marks 42 years since return of democracy as retired officers dissent,2020
"Peter Alliss, voice of the BBC’s golf coverage, dies aged 89",2020
Remarkable story of Madagascar's last queen emerges from Surrey attic,2020
Falling review – Viggo Mortensen's powerful drama of a father with dementia,2020
Rico Nasty: Nightmare Vacation review – a pummelling debut,2020
'It was a little awkward' – how Rick Schatzberg shot his old friends topless,2020
World Athletics to allow 'prototype' shoes after Kandie breaks half marathon record,2020
Jen Reid: 'I felt a surge of power. Colston is gone. Now there's a new girl in town',2020
Liam Gallagher: Down By the River Thames review – barging through his back catalogue,2020
Brexit: France hints at compromise with UK over divergence from EU standards,2020
Crystal Palace run riot with Zaha after Pereira's VAR red at West Brom,2020
"The Covid vaccines bring hope, but in many parts of the UK this crisis will last | John Harris",2020
"Bereaved by Covid, supported by counselling at the CovidSpeakEasy",2020
‘It’s all about the cracking noise’: the unlikely cult of the online chiropractor,2020
Steve Turney obituary,2020
"Just 27 of 249 Republicans in Congress willing to say Trump lost, survey finds",2020
"I run to keep fit, but I hate it",2020
Neil Ferguson: 'I gave them an open goal to some extent',2020
Mix with the best this Christmas,2020
Sigur Rós: Odin's Raven Magic – bold orchestral manoeuvres from 2004,2020
"Music education in UK schools devastated by pandemic,  survey finds",2020
Peter Pickering obituary,2020
Saturday Night Live: Jason Bateman gets a monkey off his back,2020
"Covid-19 vaccine 'very safe and highly effective', UK health chief says",2020
Don't bank on there being roaring 2020s to save the UK economy,2020
Boom in websites supporting local UK shops amid Covid lockdowns,2020
South Africa v England: first ODI abandoned after Covid positives,2020
Nazi art dispute goes to US supreme court in landmark case,2020
Jung Chang: ‘Most Chinese people in my generation experienced starvation. You could feel it around you’,2020
Wartime Christmases can teach us how to 'muddle through' in the time of Covid | Rhiannon Lucy Cosslett,2020
India win second T20 international against Australia – as it happened,2020
"Hugo Lloris: 'Behind every big team, the main leader is the manager'",2020
"Joe Wicks: 'I believe when you give, give, give, the world ends up giving back'",2020
Minister fails to condemn Millwall fans who booed players taking a knee,2020
Roald Dahl's family apologises for his antisemitism,2020
The girl with her own tattoos: the joy of homemade ink,2020
"Crock of Gold review – Shane MacGowan's colourful, chaotic life",2020
10 great food books of 2020,2020
Watch out for the paycheck protection program's tax sting in the tail | Gene Marks,2020
'Flexing their power': how America's richest zip code stays exclusive,2020
Escape to the country to avoid the virus? No thanks,2020
"Pink and blue toys colour future of our children, study warns",2020
Mustard review – one-woman show doesn't quite cut it,2020
Laura Adlington: ‘I feel honoured that Bake Off brought a bit of joy this year’,2020
"‘Now I have nothing’: Tigray conflict has changed Ethiopia for ever, say refugees",2020
Covid scientist Jeremy Farrar had recurring nightmare about failing A-levels,2020
Patrick Hutchinson: 'My natural instinct is to protect the vulnerable',2020
Look at the Tories - scotch egg all over their faces | Stewart Lee,2020
Joe Biden's staff nominations are early test of relationship with progressives,2020
"A restaurateur, a radical chef and a cook-turned-campaigner: ‘What 2020 has taught us’",2020
The vaccine miracle: how scientists waged the battle against Covid-19,2020
‘I worked so hard in the lab. I cried when the Covid vaccine news came’,2020
"The week in TV: Waterhole; The Undoing; Inside Cinema, Raised by Wolves; Red, White and Blue",2020
"Jack Thorne: 'Dickens wrote A Christmas Carol in anger, and I love him for that'",2020
"If Boris Johnson is to unsettle Starmer, he must first rally his own squabbling ranks | Isabel Hardman",2020
Fears that UK will not cope with Brexit and Covid vaccine rollout,2020
Crazy golf on the first floor? UK’s department stores face radical remake,2020
"As we close in on a Brexit that pleases next to nobody, how did we end up here? | Anand Menon and Jill Rutter",2020
Sleeping on the job: how a quick nap makes us more efficient,2020
Christmas treats to help you put up the tree,2020
Yungblud: Weird! review – not as strange as all that,2020
Benjamina Ebuehi's luxurious Christmas bakes and cakes,2020
"The best books of 2020, chosen by booksellers",2020
The best books of 2020 – picked by our acclaimed guest authors,2020
Bjarke Ingels: the BIG-time architect with designs on the entire planet,2020
Tracey Emin/Edvard Munch: The Loneliness of the Soul review – a meeting of primal screamers,2020
One in three ‘unlikely to take Covid vaccine’,2020
Visa delays put nurse out of a job when she arrived for A&E shift,2020
"A 2021 market boom would be welcome, but there will still be plenty of losers",2020
UK urged to follow Denmark in ending North Sea oil and gas exploration,2020
Sing when you’re winning? Home support doesn’t really help football teams,2020
Our attitudes to race are complex. Our response to racism should be complex too | Sonia Sodha,2020
‘I never thought I had anything to offer. Now I help others’: the charity bringing hope to the UK’s young people,2020
"Even now, Philip Green’s erstwhile chums squirm to avoid criticising the fallen tycoon | Catherine Bennett",2020
Captain Tom: 'I've always believed things will get better. The sun will shine again',2020
Could the Donald Trump presidential library – or theme park – lie ahead?,2020
The robot kitchen that will make you dinner – and wash up too,2020
'It always hits me hard': how a haunting album helped save the whales,2020
The culture of incompetence that led to Grenfell still imperils us | Rowan Moore,2020
The Observer view on the high court's ruling on puberty blocking drugs for children | Observer editorial,2020
Seeing the light: bright ideas for plants,2020
The Christmas taste test challenge: the chef v the critic,2020
Love and loneliness in the time of robots | Eva Wiseman,2020
Our leaders can’t preach respect and treat the vulnerable with contempt | Kenan Malik,2020
The Marvelous Mrs Maisel’s Rachel Brosnahan: ‘You can always find a way forward’,2020
Papa Bouba Diop’s winner against France was Senegal's Maradona moment | Jonathan Wilson,2020
Goa party leader hopes to swing the siesta vote,2020
Simone Lia: St Nicholas meets Father Christmas – cartoon,2020
County Lines review – a deep dive into Britain's drugs trade hell,2020
"Don’t save the high street – change it completely, says retail guru Mary Portas",2020
Making a meal out of it: scotch egg sales soar in tier 2,2020
‘We won’t be cash cows’: UK students plan the largest rent strike in 40 years,2020
Havana’s artists find their voice in  a call to defend creative freedom,2020
Who deserves a personalised Christmas message from Snoop Dogg? | Nosheen Iqbal,2020
The Godless Gospel by Julian Baggini review – Jesus as a moral teacher,2020
"Budgets, vetoes, values, defence … division and dithering shame the EU | Simon Tisdall",2020
Weruche Opia: 'I told my team I didn't want the sassy rude girl roles any more',2020
"The big picture: exodus on the road to Mosul, 2016",2020
Interrailing at 50: reliving our backpacking days … in style,2020
Keira Bell lawyer warns on internet coverage of transgender issues,2020
The book of love: 400-year-old tome of John Donne’s poems is unveiled,2020
"From the land of no cinemas, a film worth watching in one | Kenan Malik",2020
Sunday with Michael Ball: ‘I read a lot – I love a serial killer’,2020
Revealed: Isaac Newton’s attempts to unlock secret code of pyramids,2020
Tiers and scotch eggs: rules for pubs expose a class divide,2020
Mud and maintenance in the month ahead,2020
Keir Starmer urged to wait before telling MPs to approve Brexit deal,2020
"Best tech of 2020: an eco vacuum, electric car and a £12 kettle",2020
Cue Point At Home: ‘I rampage through the delivery menu’ – restaurant review,2020
TV tonight: Jamie Oliver cooks up a Christmas feast,2020
"In search of a cure for the common cold, October 1970",2020
Books for wine lovers | David Williams,2020
We’re not all bad down here in Dover | Letters,2020
The Observer view on Brexit and the Covid vaccine | Observer editorial,2020
Joe Biden's economic team beats Trump's goon squad – but it faces a steep challenge | Robert Reich,2020
What next? Three books for America after Trump,2020
Spain's forgotten literary star from a turbulent age is rescued from oblivion,2020
For the record,2020
Dua Lipa: Studio 2054 review – a celebration of up-close disco joy,2020
"Poetry, the soul of Uighur culture, on verge of extinction in Xinjiang",2020
Trump rails against election result at rally ahead of crucial Georgia Senate runoff,2020
"Stranded Australians are being reclassified to avoid embarrassing PM, Labor says",2020
"Daniel Dubois' boxing career could have been over, eye specialist says",2020
Trump repeats false claims at Georgia rally amid fears he may damage Senate Republicans,2020
Victoria eases Covid restrictions again as it reaches 37 days without a case,2020
US infections reach new high as Australian state eases restrictions – as it happened,2020
Labor says government must explain claim it called for Covid inquiry so it could make an announcement,2020
Eager lenders set to shore up housing market with new loan deals,2020
"Speedy crossword No 1,314",2020
"Azed crossword 2,530",2020
Observer killer sudoku,2020
Observer sudoku,2020
Rita Ora apologises for second breach of Covid lockdown restrictions,2020
Obama: Democrats need 'universal language' to appeal to moderate voters,2020
US sees record coronavirus infections as states face deadline for vaccine orders,2020
David McGoldrick: Sheffield United's system doesn't need a wrecking ball,2020
Liverpool's fit and firing front-three ready to give Wolves stern test,2020
Misfiring strikers dog Mikel Arteta as Arsenal head to Tottenham | Nick Ames,2020
Eddie Jones wary of France and loses Mako Vunipola for England's final,2020
"Raised By Wolves review – staid, stale sci-fi from Ridley Scott",2020
Giroud on target as Chelsea go top after coming from behind to beat Leeds,2020
Chelsea 3-1 Leeds: Premier League – as it happened,2020
Military planes to fly Covid vaccines in to Britain to avoid ports hit by Brexit,2020
Poll reveals scale of ‘home alone’ Christmas in the UK this year,2020
Boring rugby? Wait and see: the sport deserves a break after a difficult year | Ugo Monye,2020
West Ham United 1-3 Manchester United: Premier League – as it happened,2020
Manchester United hit back in style to beat West Ham and go fourth,2020
'To give him space': Biden reveals why he told Obama to wait on Bin Laden raid,2020
Slavery will never be history as long as we turn a blind eye to China | Nick Cohen,2020
Barnardo's hits back at Tory MPs upset by talk of 'white privilege',2020
Australia's cruise ship ban is set to expire – but it won't all be smooth sailing,2020
"1,000 days later: the Biloela family spending their third Christmas in detention",2020
Perth's hidden graveyard: an 'archeological gem' and the human remains being put to proper rest,2020
How we stay together: 'It’s like we’re one person with two personalities',2020
"'Fun, spontaneous and full of love': what three years of same-sex marriages looks like in Australia",2020
Indigenous students from bilingual school in Arnhem Land first in community to qualify for university,2020
"Airports are portals to escape, but in New Zealand there is no way out",2020
The government wants the recession to be over to justify winding back stimulus measures | Greg Jericho,2020
