full_title,date
"Bradley Manning's health deteriorating in jail, supporters say",2010
Blake Edwards: a life in clips,2010
Baseball great Bob Feller pitched in for his team and his country | Lawrence Donegan,2010
Heather Mills targets spot on Britain's 2014 Winter Paralympic ski team,2010
Suez won't be a crisis for International Power,2010
The credit rating agencies are leading an assault on nations and peoples | Martin Kettle,2010
Government publishes ministers' gifts,2010
Jerry Seinfeld announces first UK gig since 1998,2010
FBI arrest technology firms' staff over insider trading,2010
Juventus 1-1 Manchester City | Europa League Group A match report,2010
Tesco's One Stop angers rivals with 77-store purchase,2010
Ed Miliband sets himself his first test,2010
Video: Julian Assange granted bail,2010
Ireland is still in denial over abortion | Fiona de Londras,2010
Spending cuts 'will see rise in absolute child poverty',2010
"War declared as Upstairs, Downstairs creator fires volley at Downton Abbey",2010
Terry Wogan says the BBC has spent too much money on buildings,2010
Strange Quarks Episode 6: David Aaronovitch,2010
Suffolk council accused of ignoring £100m 'overspend' on BT deal,2010
Brunei prince loses embarrassing lawsuit against financial advisers,2010
FA invests £2m in new elite league for women,2010
"Poor boroughs, deep cuts",2010
The Trafalgar Square killers: two found guilty of attack that left gay man dead,2010
Google creates a tool to probe 'genome' of English words for cultural trends,2010
Police seek to charge 14 after inquiry into Anglo Irish Bank,2010
Cash-strapped UK shoppers go online,2010
Vladimir Putin's warning shot to liberals: society must have order,2010
Lebanon braced for bloodshed over report into Rafik Hariri killing,2010
BSkyB loses sex discrimination and unfair dismissal cases,2010
Ivory Coast violence leaves 18 dead,2010
"Prize money for Cheltenham Gold Cup to rise to £500,000 at 2011 Festival",2010
"Blake Edwards, director of Breakfast at Tiffany's and Pink Panther films, dies at 88",2010
"Get your act together or risk losing US ally, EU foreign policy chief tells leaders",2010
Will the Afghanistan war break Obama's presidency? | Simon Tisdall,2010
'No major changes' for Ferrari despite last season's failures,2010
Blake Edwards: a career in photos,2010
Ireland urged to reform abortion legislation,2010
Dublin's brite:bill scores €1.2m for web-friendly accounts tool,2010
José María Olazábal's Ryder Cup captaincy to be confirmed next month,2010
The ignorant speculators who believe Blackburn can play like Barcelona | Paul Hayward,2010
BP and Eric Holder's Deepwater suit | Kate Sheppard,2010
How can your housing association adapt to the localism agenda?,2010
Blackburn's chairman John Williams calls for solidarity from supporters,2010
Sale's Charlie Hodgson insists he has yet to decide his future,2010
Fausto Sarli obituary,2010
Investment bankers blamed for driving up the price of turkeys,2010
Twitter's $200m fundraising raises hopes of stock market flotation next year,2010
Motherwell mount strong defence of Steve Jennings in red-card furore,2010
Boris Tishchenko obituary,2010
Juventus v Manchester City – live! | Paul Doyle,2010
LA Noire – new 'making of' trailer launched,2010
Eric Hawkins obituary,2010
Munster's Paul O'Connell banned for four weeks but free for Six Nations,2010
Guardian Camera Club: Nick Barron on food photography,2010
Leslie Gennery obituary,2010
New band of the day – No 932: James Vincent McMorrow,2010
The Ashes 2010: Stuart Broad knows how to make a Test match special | Barney Ronay,2010
What clouded BSkyB's judgment?,2010
Colin Firth leads British invasion in Screen Actors Guild nominations,2010
Lucile Denney obituary,2010
"BP falls back on US lawsuit, but broker pitches possible Exxon bid",2010
Skins series 5: the new cast revealed,2010
Sam Coniff: What the NHS could learn from the Grameen Eye Hospital,2010
More muscular parliament would make for better lawmaking | Joshua Rozenberg,2010
Electricity market reforms: two cheers | Damian Carrington,2010
Today's mystery bird for you to identify,2010
"If you want to protest, prepare to be kettled | Phil Shiner",2010
The crucial role cities can play in protecting the honeybee | Rosie Boycott,2010
Why the mortgage rescue scheme needs our support,2010
"Greece can only recover if its debt is restructured, say economists",2010
Politics Weekly podcast: 2010 in review,2010
Death of the Afghan surge | James Denselow,2010
Paris to introduce self-service electric car scheme,2010
Prize budgies: owner in heartfelt plea for return of stolen birds,2010
Carlito's Way | Paul Doyle | The Fiver,2010
Football Weekly Extra: Bye Big Sam,2010
24 hours in pictures,2010
Tips for topping up a writer's income,2010
Should Jon Favreau have cast Iron Man 3 and Marvel aside for Disney?,2010
Matt Lucas wins payout over 'grossly intrusive' Daily Mail article,2010
Audio advent calendar: Download Rustie's Hyperthrust,2010
Gaddafi's son retreats on human rights in Libya,2010
Julian Assange granted bail at high court,2010
Diary of a start-up social entrepreneur: Getting down to business,2010
Is Terrence Malick back on top with The Tree of Life?,2010
US embassy cables: Could ailing Fidel Castro make a comeback in Cuba?,2010
Scottish Equitable ordered to pay £60m compensation for 'serious systems and control failings',2010
WikiLeaks and the first amendment | Dan Kennedy,2010
"Albums of 2010, No 02: Kanye West – My Beautiful Dark Twisted Fantasy",2010
Savannah Marshall | 100 hopefuls for 2012,2010
Police sorry for questioning schoolboy over protest at David Cameron's office,2010
Rumney residents have turkey dinner,2010
Danish police ordered to compensate climate protesters,2010
Grace Mugabe sues Zimbabwe newspaper over Wikileaks diamond story,2010
TV ratings - 15 December: The Apprentice baggs nearly 8m viewers,2010
Eyewitness: Joyeux Noël,2010
Season's readings: 'The Oxen' by Thomas Hardy,2010
Reality sucks in the multiplex,2010
Sport England warns of cuts if sports fail to increase participation,2010
Apple to launch its new Mac App Store next month,2010
Switching to Google-hosted jQuery,2010
Britons 'downloaded 1.2bn illegal tracks this year',2010
High court grants bail to Julian Assange,2010
WikiLeaks cables: Fidel Castro almost died in 2006,2010
Chris Huhne unveils plans for reform of UK energy market,2010
"Giovanni Bellini, Leonardo's equal",2010
What makes a great Doctor Who Christmas special?,2010
Shi'ite Muslim Festival of Ashura,2010
Redefine welfare debate or society will pay the price | Jon Cruddas,2010
Catfish – review,2010
"Gallery: The history of Dan Dare, Pilot of the Future",2010
Noises off: The art of protest,2010
BFI to cut 37 jobs and close gallery,2010
Liberal Democrat MP's wife faces trial for kitten theft,2010
Another Jimi Hendrix film project disappears into the haze,2010
The Ashes 2010: 'Australia batted badly. Horribly',2010
Can the financial crisis be a good thing for poorer workers? | Vittorio Longhi,2010
Snow and ice means thousands face Christmas without presents,2010
Tory right may force David Cameron into permanent marriage with Nick Clegg,2010
"Irish abortion ban violates human rights, court rules",2010
When the accent is on creating a good impression | Mind your language,2010
Leeds faces another £1 million winter pothole bill,2010
What the lawsuit against BP can achieve | Thomas Noyes,2010
Tributes paid to Daily Mail writer Lester Middlehurst,2010
Video: Ohio lighthouse frozen by Arctic winds,2010
Charities accuse Nick Clegg of 'rebranding detention' over children of asylum seekers,2010
Bauer's Kiss gets green light to go national,2010
Is Judi Dench really the greatest actor ever? | Michael Billington,2010
Little progress on NHS efficiency savings,2010
Huey Morgan to host Radio 2 show,2010
Douglas Adams's holistic detective Dirk Gently arrives on BBC4,2010
Australian police to investigate asylum-seeker boat deaths,2010
WikiLeaks: the emperor wears no clothes | John Pilger and others,2010
Is now the right time for a new Forth road bridge?,2010
Slideshow: Butetown regeneration,2010
Q&A: Mail delivery delays,2010
The gloves are on again for Eminem and boxing movie mania,2010
Sacha Baron Cohen could play racist cop Torrente in Hollywood remake,2010
"US troops to start Afghan withdrawal next year, says White House",2010
The X Factor's Matt Cardle on course for Christmas No 1,2010
"More than 50% of five-year-old boys making too little progress, data shows",2010
"Albums of 2010, No 3: Hot Chip – One Life Stand",2010
Divine dispatches: a religion roundup | Riazat Butt,2010
The purpose of planning,2010
The Guardian Review literary quiz,2010
Service transformation doesn't have to be stymied by cuts,2010
"Ten top UK winter walks: Silverdale, Lancashire",2010
New MPs' expenses watchdog could be scrapped,2010
"Accidental keyswaps, and other quick questions | Ask Jack",2010
Terms and conditions for Guardian Review's literary quiz,2010
Tuition fees rise 'contravenes human rights law',2010
A charitable dragon: Why Duncan Bannatyne is geared for giving,2010
Tom Waits to enter Rock and Roll Hall of Fame,2010
Former champagne executive and wife toast gastropub deal,2010
Why did Ratcliffe defence fail where Kingsnorth Six succeeded? | Mike Schwarz,2010
Society daily 16.12.10,2010
"Rand Paul, maverick in the making | Michael Tracey",2010
Video | Water solutions to halt Haiti's cholera outbreak,2010
Nick Clegg: 'shameful' detention of children in asylum centres to end by May,2010
Careers Talk: Five ways to detox your job search in the new year,2010
Ian Holloway is happy beside the seaside but should he spread his wings? | Paul Doyle,2010
Talking Horses: Win William Hill tickets to the King George VI Chase,2010
A look at what's coming up at Leeds Community News Hub,2010
Cribsheet 16.12.10,2010
How trust was restored at Cancún | Dean Bialek,2010
"In Chapters, Christmas - review",2010
Zai Bennett appointed BBC3 controller,2010
Jane Austen gets Google doodle tribute,2010
The Ashes 2010: Chris Tremlett steps up and bags role in England set-up,2010
South Korea to start live-fire drill on shelled island,2010
Democracy must be treated as sacred | Gordon Lynch,2010
Was the Yahoo hack techies' payback? | Media Monkey,2010
Reducing reoffending need not cost the earth,2010
Council plans to meet shortfall in Leeds primary school places,2010
Harrier jump jet: from fearsome fighter to final flight,2010
On the scent of the best perfume deals,2010
How to make buildings more energy efficient,2010
Buying Solutions plans £500m software contract,2010
Clashes break out as general strike cripples Athens,2010
Video: Europa League review: Liverpool 0-0 Utrecht,2010
Humanist weddings aren't about appearances | Rupert Morris,2010
David Haye hopes to secure fight with Wladimir Klitschko 'pretty soon',2010
Public Services Summit 2011: Will Straw,2010
Five minutes with … Jake Backus,2010
Heavy snow expected to hit north and west,2010
The Ashes 2010: Chris Tremlett delighted by impact on England return,2010
Tax avoidance trade puts Square Mile in spotlight again,2011
Hidden pop gems of 2011,2011
The 10 best classic Christmas songs,2011
Campaign against pink toys for girls enjoys rosy outlook,2011
"Science in 2011: Triumphs, disasters and climaxes – in pictures",2011
Premier League half-term fans' reports: Arsenal to Manchester United,2011
Why we're watching… Vanessa Kirby,2011
Premier League half-term fans' reports: Newcastle to Wolves,2011
Philippines floods: victims tell of panic as wall of water hit cities,2011
Heineken Cup round-up: Seven tries from Leinster pour cold water on Bath,2011
Manchester City's Micah Richards keeps moving forward,2011
Steve Lomas looks to be a man on the move at St Johnstone,2011
The Killing 2: episodes nine and 10,2011
Sir Alex Ferguson's praise of Spurs may be a dig at Manchester City | Paul Wilson,2011
British Gas insulation offer made a hole in my wall – and pocket,2011
Virgin Atlantic claim delayed by volcanic ash cloud confusion,2011
Plight of the families who rely on food parcels,2011
Berger & Wyse,2011
RAC car insurance payment declined – you have too much money,2011
Matthew Rees ready to lead a Scarlets siege of Munster's fortress,2011
The toil and teamwork that made Mark Cavendish a sports personality,2011
"Said & Done: Zdravko Mamic, Gigi Becali, plus Larissa Riquelme on politics",2011
Fijit Friends just the Christmas gift for Mario Balotelli,2011
Sporting moments 2011: Our writers pick their highlights of the year,2011
London Olympics countdown: 32 weeks to go,2011
Icons of 2011: No2: Andrew Strauss | Andy Bull,2011
Swiss mess could hand Manchester United a European reprieve,2011
Strictly Come Dancing 2011 final: liveblog!,2011
Chelsea manager refuses to blame Petr Cech for Wigan equaliser,2011
Sunderland's Nicklas Bendtner says sorry to club and fans,2011
Revealed: how City fees are eating into our pensions,2011
Flash floods in southern Philippines – in pictures,2011
Let it snow: Google search yields festive flurry,2011
St Paul's protesters accuse police of inflating crime figures,2011
French credit downgrade could come 'within days',2011
Bradley Manning hearing: agents say gunship killing video found in room,2011
Michael Gove accused of seeking selection in state schools,2011
Wigan Athletic 1-1 Chelsea | Premier League match report,2011
Wigan Athletic v Chelsea – as it happened | Simon Burnton,2011
Scott Vernon's penalty gives 10-man Aberdeen victory against Hibs,2011
WikiLeaks lawyers protest at denial of full access to Manning hearing,2011
Science review of 2011: the year's 10 biggest stories,2011
Rangers 2-1 Inverness Caledonian Thistle | Scottish Premier League match report,2011
The week in music - in pictures,2011
Cesária Évora obituary,2011
Leicester 23-19 Clermont Auvergne | Heineken Cup Pool 4 match report,2011
London Irish 19-25 Racing Métro | Heineken Cup Pool Two match report,2011
Football League: your thoughts | Ian McCourt,2011
24 hours in pictures,2011
Kauto Star back to best and aiming for fifth King George on Boxing Day,2011
Libyan scramble for £100bn in assets fractures the peace at Tripoli airport,2011
"Mystery bird: Asian verditer flycatcher, Eumyias thalassina | GrrlScientist",2011
Cardiff City 2-3 Middlesbrough | Championship match report,2011
Blackburn Rovers 1-2 West Bromwich Albion | Premier League match report,2011
Everton 1-1 Norwich City | Premier League match report,2011
Wolverhampton Wanderers 1-2 Stoke City | Premier League match report,2011
Fulham 2-0 Bolton Wanderers | Premier League match report,2011
Newcastle United 0-0 Swansea City | Premier League match report,2011
Saturday football clockwatch – as it happened | Paolo Bandini,2011
Eyewitness: tear gas at West Bank protest,2011
Protest couple targets of  persecution campaign by Vladimir Putin,2011
Today's mystery bird for you to identify | GrrlScientist,2011
"Ban reporting on UK riots young offenders, says children's commissioner",2011
British fishing industry lands controversial EU deal,2011
Blood diamonds 'will pay for Mugabe's terror',2011
James McClean eager for more Premier League action at Sunderland,2011
Philippines tropical storm kills hundreds,2011
New Scottish Labour party leader Johann Lamont warns of overhaul,2011
"Madeleine McCann fund received £125,000 from News of the World",2011
The Olympic effect on east London's small businesses,2011
Young Hungarians are intent on writing their own future | Peter Zilahy,2011
Bradley Manning hearing: court rejects bias claim,2011
US defence secretary warns Libya of struggle ahead,2011
Egypt's violence continues in Cairo streets over military rule,2011
"Abused women need support, not more consultation | Lisa Longstaff",2011
William Hague questioned over British role in drone strikes,2011
Top tips: 2011 round up,2011
Top tips: how can we improve communications in housing,2011
The Arab spring has seen dignity being clawed back | Martin Chulov,2011
Talking Horses: The latest news and best bets in our daily horse racing blog,2011
Bidisha's thought for the day: Queens,2011
Guardian Book Club: Claire Tomalin on Charles Dickens and A Christmas Carol,2011
"For all its flaws, religion remains a force for good | Joseph Harker",2011
Writers and artists design money fit for modern times - in pictures,2011
Last-minute Christmas gifts: kids,2011
Last-minute Christmas gifts: homeware,2011
Last-minute Christmas gifts: for her,2011
Unthinkable: Christopher Hitchens at heaven's gate | Editorial,2011
Last-minute Christmas gifts: for him,2011
Last-minute Christmas gifts: eco and charity,2011
Last-minute Christmas gifts: food and drink,2011
Why we should let Ian Brady die | Deborah Orr,2011
How Britain got its patriotism back | Jonathan Jones,2011
Abortion is not a mental health issue | Deborah Orr,2011
Acceptance in Lieu scheme brings a dozen new gifts to the nation,2011
The Saturday interview: Gillian Anderson,2011
"Lucy Mangan's pick of the week: The story, the stat, the quote, the tweet",2011
This week's new events,2011
Ralph Lawson Q&A,2011
Clubs picks of the week,2011
This week's new comedy,2011
The Guide's best games of 2011,2011
This week's new singles,2011
Live music booking now,2011
This week's new live music,2011
Sherlock Holmes is back … again,2011
This week's new exhibitions,2011
The Best DVD & Blu-ray releases of 2011,2011
Christmas movie events,2011
This week's new films,2011
The Hard Sell: Waitrose,2011
Catch up TV Guide: From Public Enemy to This Is England '88,2011
It's a good week for … Festive competition,2011
King Of Christmas Lights: Grace Dent's TV OD,2011
Populist: Items of interest this week,2011
Tim Jonze On Shuffle … House,2011
Charlie Condou: The three of us,2011
Diary of a separation,2011
A letter to … my estranged brother,2011
Problem solved,2011
Jimmy Osmond: My family values,2011
Infomania: Woody Allen,2011
The Guide cover,2011
Art bequeathed to the nation – in pictures,2011
The Catholic priest with nine children,2011
Last-minute Christmas gifts: crafts and gadgets,2011
Exhibitionist: The week's art shows in pictures,2011
My dead son gave life to my new friend,2011
"He's a Tory, I'm a leftie and we're still happily married",2011
Modern Toss,2011
Loomus: Christmas is a time for families,2011
This week's new theatre and dance,2011
Family life,2011
Last-minute Christmas gifts: culture,2011
Stuart Lancaster rules out immediate England return for Danny Cipriani,2011
The Girl With the Dragon Tattoo: Steven Zaillian on the difficulties of adapting Stieg Larsson,2011
M83's Anthony Gonzalez is ready for the fast lane,2011
Blackest Ever Black and Modern Love take dance music down a dark alley,2011
Last-minute Christmas gifts: sport and travel,2011
Sherlock returns to the BBC: 'He's definitely devilish',2011
Last minute Christmas gifts: gardening,2011
Simon Hoggart's week: Christopher Hitchens: monster and turnip,2011
Snooping around – in pictures,2011
The week In TV: My Big Fat Gypsy Christmas; This Is England '88; and That's Britain! - video,2011
Martin Rowson on Christopher Hitchens – cartoon,2011
Ospreys 13-16 Saracens | Heineken Cup Pool Five match report,2011
Edinburgh 19-12 Cardiff Blues | Heineken Cup Pool Two match report,2011
Credit agencies pile pressure on EU leaders,2011
The Secret Footballer: Is André Villas-Boas Kevin Keegan in disguise?,2011
Roberto Mancini sees the funny side of Mario Balotelli's latest scrape,2011
Arsène Wenger happy with Arsenal's health after emergency surgery | Amy Lawrence,2011
Jermain Defoe may seek a January transfer to enhance England prospects,2011
"Hail the punditry of Gary Neville, a new king in town | Barney Ronay",2011
Icons of 2011: No1: Sarah Stevenson | Donald McRae,2011
Arsène Wenger will not rule out Arsenal loan return for Thierry Henry,2011
Where can I buy a plot for an eco home?,2011
How to get the goods you want for free,2011
Beware bogus car hire offers,2011
Dear Jeremy – your work issues solved,2011
How to build a profitable blog: niche engagement and web strategies,2011
Consumer rights: 'I wasn't prepared for the incompetence',2011
Chris Coekin: factory workers in focus,2011
What I like | Guardian Weekend readers' tips,2011
"Your view | Guardian Weekend readers' letters, emails, comments",2011
The seasonal work that is part and parcel of Christmas,2011
Key fashion trends of the season: Gold and Tuxedo,2011
Lucy Mangan: what Toryboy wants for Christmas,2011
Tim Dowling: the family supper,2011
Christmas lunch recipes | Hugh Fearnley-Whittingstall,2011
Experience: I killed my best friend,2011
The Measure,2011
Alys Fowler: why healthy soil means a healthy garden,2011
This column will change your life: the language police,2011
On the road: Batavus Lento Deluxe,2011
What I'm really thinking: The professional Santa,2011
Blind date,2011
Beauty: the new smellies,2011
Food for Fort: on candied pumpkin and freezing wine,2011
Brown sugar rice pudding with toffee pecans recipe | Dan Lepard,2011
The Weekend quiz,2011
"Roasted butternut squash and red onion with tahini and za'atar recipe, plus lamb-stuffed quince with pomegranate and coriander | Yotam Ottolenghi",2011
How to dress: party frocks,2011
"Weekender: Red Curtis, fashion designer, 40",2011
Ask Alys: your gardening questions answered,2011
Wine: affordable reds (and a couple of rosés) for the festive holiday,2011
Tim Hetherington in Libya: witness to war – in pictures,2011
"Restaurant review: Roti Chai, London W1",2011
The Stephen Collins cartoon,2011
Sweet dreams are made of these | Children's pyjamas,2011
"Let's move to: Ringwood, Hampshire",2011
Will Mellor: my greatest mistake,2011
Am I eligible for a PPI refund?,2011
EDF still hasn't generated my energy bill,2011
The council tax shock of living alone,2011
Parting shots: the death of a factory in pictures,2011
I missed my flight but HSBC has rejected my travel insurance claim,2011
Festive fashion for all occasions – in pictures,2011
British Gas's estimated charges left me with a shocking bill,2011
Rereading: What Shall We Have for Dinner?,2011
Sue Arnold's audiobook choice – reviews,2011
Spies in the Sky by Taylor Downing – review,2011
A Christmas Carol by Charles Dickens,2011
John Mullan's 10 of the best: coaches,2011
Thriller roundup – reviews,2011
Et cetera: non-fiction roundup – reviews,2011
The Lost Word by Oya Baydar - review,2011
Light reading: the illuminated manuscripts of the dark ages,2011
Note worthy: what is the meaning of money?,2011
A life in music: Antonio Pappano,2011
Toy story: Chewing over Tchaikovsky's The Nutcracker,2011
Critical eye: book reviews roundup,2011
Escape the winter in a Helsinki sauna,2011
Unconventional skiing holiday tips,2011
Ruby Redfort: Look Into My Eyes by Lauren Child – review,2011
Five historic city spas,2011
Get your winter sports kicks in Norway,2011
Turtle-watching on Australia's Heron Island,2011
Emma's eccentric Britain: driving a Ferrari at Silverstone,2011
"Hotel review: Raithwaite Hall, near Whitby, North Yorkshire",2011
A Lake District pub crawl for walkers? There's an app for that!,2011
Bradley Manning hearing: defence lawyer turns fire on military accusers,2011
The Exploding Boy and Other Tiny Tales by Nick Parker – review,2011
Christopher Hitchens: a contrarian for whom radicalism was a style,2011
Weatherwatch: 'When people in the streets ran before the weather',2011
"Manchester United will not buy in January, says Sir Alex Ferguson",2011
Bad Santa: your pictures of harrowing mall encounters,2011
"Christopher Hitchens, defined | Ana Marie Cox",2011
TV turn-ons and turn-offs,2011
Rory McIlroy: The year I choked and cried was also the year I grew up,2011
The harsh reality is that the EU has already failed | Deborah Orr,2011
Feltham and Heston byelection: Labour holds its own| Editorial,2011
Britain and France: seasonal greetings | Editorial,2011
"In science, reputations matter – but they aren't always deserved | Philip Ball",2011
Barry Bonds in baseball hell | Michael Solomon,2011
Our schools exam system is no longer fit for purpose | Mehdi Hasan,2011
Letters: Olympics must insist on ethical sponsorship,2011
Letters: Badger cull,2011
Letters: Picking up the pieces after Iraq,2011
The conversation: will the Arab revolutions be good for women?,2011
"Country diary: Sandy, Bedfordshire",2011
Sopa victory for tech community as US House committee adjourns,2011
No bed of roses: Mary Portas plan gets short shrift from struggling stallholders,2011
"Our leadership is dire, but we mustn't despise government | Jeffrey Sachs",2011
Clegg vows to return Britain to heart of Europe and the single-market debate,2011
Doctor is awarded £4.5m compensation for workplace discrimination trauma,2011
Arab Spring anniversary: how a lost generation found its voice,2011
Barry Bonds gets two years probation for obstruction of justice,2011
Smooth Christmas getaway in prospect with UK transport links working well,2011
Liverpool's Luis Suárez must wait for outcome to racial abuse inquiry,2011
Youth services will not be ringfenced from budget cuts,2011
Carl Froch ready to roll again and end sorry year for Brits on a high | Kevin Mitchell,2011
"Seen from my sick bed, a scene straight out of The Singing Detective | Ian Jack",2011
Hampshire to sell Rose Bowl to Eastleigh Borough council for £6.5m,2011
Women start legal action against police chiefs | Rob Evans,2011
Why is Microsoft putting its apps on the iPad – and will Office follow?,2011
Bradley Manning's lawyer demands judge step down over Assange link,2011
Carl Froch prepared to use all means necessary to defeat Andre Ward,2011
legal action over police spies,2011
Cameron calls for return to Christian values as King James Bible turns 400,2011
Truth and fairness are the first casualties of video vigilantes' war,2011
Alzheimer's postal lottery | Andrea Gillies,2011
Seven judges to hear Julian Assange extradition appeal,2011
