,text,date,source,value
966,Lifting the Cap,2010-06-03T20:02:31+0000,NY_TIMES,0
967,Boutique Finds Talent More Elusive Than Clients,2010-06-03T20:08:28+0000,NY_TIMES,0
968,Road to Stardom: When Bob Hope Defined Himself,2010-06-03T20:10:44+0000,NY_TIMES,0
969,A Location Change for Showtime Chief,2010-06-03T20:12:34+0000,NY_TIMES,0
970,"For Teenagers, Job Outlook Brightens Somewhat",2010-06-03T20:15:34+0000,NY_TIMES,0
971,Another Death-of-Books Forecast,2010-06-03T20:17:26+0000,NY_TIMES,0
972,Cuts From the Garden,2010-06-03T20:22:33+0000,NY_TIMES,0
973,Failure Highlights Woes Facing Spanish Banking,2010-06-03T20:22:44+0000,NY_TIMES,0
974,"Hotel Review: Room Mate Emma, in Barcelona",2010-06-03T20:24:26+0000,NY_TIMES,0
975,Reporters Dispute Israeli Account of Raid,2010-06-03T20:26:34+0000,NY_TIMES,0
976,Restaurant Review: Bo Cinq in Amsterdam,2010-06-03T20:28:00+0000,NY_TIMES,0
977,A Lesson in Pruning From an Expert,2010-06-03T20:28:40+0000,NY_TIMES,0
978,Fed Chief Urges More Lending to Small Business,2010-06-03T20:31:00+0000,NY_TIMES,0
979,"Balk, Blasts and Another Yankees Victory",2010-06-03T20:32:53+0000,NY_TIMES,0
980,Should a Bad Call Change Baseball?,2010-06-03T20:34:43+0000,NY_TIMES,0
981,Pictures of the Day: Gaza and Elsewhere,2010-06-03T20:36:07+0000,NY_TIMES,0
982,Vain Glorious | Go with the Glow,2010-06-03T20:40:46+0000,NY_TIMES,0
983,A Conductor’s Passion for ‘Porgy’,2010-06-03T20:43:52+0000,NY_TIMES,0
984,The Morning Skate: Margins Thin in Tight Cup Final,2010-06-03T20:46:16+0000,NY_TIMES,0
985,A Texas Doctor With a Possible Cancer Cure,2010-06-03T20:47:29+0000,NY_TIMES,0
986,"Made to Order, $5,000 Antidote to a Casual Age",2010-06-03T20:52:20+0000,NY_TIMES,0
987,Cameron Pursues Role in Stanching Gulf Gusher,2010-06-03T20:52:23+0000,NY_TIMES,0
988,Movement and Music to Stir the Soul,2010-06-03T20:55:48+0000,NY_TIMES,0
989,Classical Crossover: Let Them Jump Genres,2010-06-03T20:58:15+0000,NY_TIMES,0
990,Living Art vs. Artifact,2010-06-03T20:59:54+0000,NY_TIMES,0
991,Players Channel Their Inner ‘Idol’,2010-06-03T21:00:44+0000,NY_TIMES,0
992,Agnès Jaoui: Not Woody Again,2010-06-03T21:01:23+0000,NY_TIMES,0
993,"Summer Shakespeare, Outside and Urban",2010-06-03T21:02:24+0000,NY_TIMES,0
994,Nathan Lane: And Don’t Forget ‘Butley’,2010-06-03T21:02:43+0000,NY_TIMES,0
995,‘The Last Stand’,2010-06-03T21:04:51+0000,NY_TIMES,0
996,Changes to Chase’s Continental Credit Cards,2010-06-03T21:05:16+0000,NY_TIMES,0
997,Is There More Life for Two Off-Broadway Musicals?,2010-06-03T21:05:21+0000,NY_TIMES,0
998,Last Stand? Yes. Last Word? Never.,2010-06-03T21:07:34+0000,NY_TIMES,0
999,Remembering Iraq,2010-06-03T21:10:12+0000,NY_TIMES,0
1000,Error After the Fact Can Do Justice to Galarraga,2010-06-03T21:10:37+0000,NY_TIMES,0
