,text,date,source,value
321,"After Flotilla Raid, U.S. Is Torn Between Allies",2010-06-02T00:25:23+0000,NY_TIMES,0
322,The Gores Separate After 4 Decades,2010-06-02T00:25:53+0000,NY_TIMES,0
323,"Two Dried Lime Recipes, One Traditional, One Anything But",2010-06-02T00:25:59+0000,NY_TIMES,0
324,3 Mayors Seek to Honor a Master of Campaigns,2010-06-02T00:26:46+0000,NY_TIMES,0
325,A New Subway Map,2010-06-02T00:27:44+0000,NY_TIMES,0
326,Kagan’s View of Presidential Power,2010-06-02T00:29:27+0000,NY_TIMES,0
327,Herbicide-Resistant Weeds,2010-06-02T00:33:13+0000,NY_TIMES,0
328,Day 42: The Latest on the Oil Spill,2010-06-02T00:36:21+0000,NY_TIMES,0
329,North Korea Trying for Unexpected in World Cup Again,2010-06-02T00:40:26+0000,NY_TIMES,0
330,Concussion Committee Breaks With Predecessor,2010-06-02T00:42:16+0000,NY_TIMES,0
331,Entrepreneur or Unemployed? ,2010-06-02T00:42:38+0000,NY_TIMES,0
332,"For Rugby Fans, a First Trip to Soweto",2010-06-02T00:46:11+0000,NY_TIMES,0
333,New N.Y. Schools Face Extra Pain From Layoffs,2010-06-02T00:48:42+0000,NY_TIMES,0
334,Assumptions Go Asunder as Gores Split,2010-06-02T00:50:39+0000,NY_TIMES,0
335,Investment in Rolen Is Paying Off for the Reds,2010-06-02T00:57:43+0000,NY_TIMES,0
336,Cuckoo!  Cuckoo!,2010-06-02T01:00:12+0000,NY_TIMES,0
337,What to Watch: Serena Williams vs. Samantha Stosur,2010-06-02T01:00:36+0000,NY_TIMES,0
338,Is Steve Jobs Big Brother?,2010-06-02T01:00:40+0000,NY_TIMES,0
339,Speaking Up to Stay Silent,2010-06-02T01:01:53+0000,NY_TIMES,0
340,The Continuing Pain of 9/11,2010-06-02T01:03:30+0000,NY_TIMES,0
341,Suffolk Meltdown,2010-06-02T01:06:17+0000,NY_TIMES,0
342,Lottery Numbers,2010-06-02T01:07:25+0000,NY_TIMES,0
343,Israel and the Blockade,2010-06-02T01:10:32+0000,NY_TIMES,0
344,Coach Follows His Father While Leading His Way,2010-06-02T01:10:42+0000,NY_TIMES,0
345,Spain Struggles to Agree on a Path to Recovery,2010-06-02T01:12:25+0000,NY_TIMES,0
346,Hero to Conservatives Often Follows Centrist Path,2010-06-02T01:14:21+0000,NY_TIMES,0
347,Japan’s Premier Will Quit as Approval Plummets,2010-06-02T01:14:47+0000,NY_TIMES,0
348,When Friends Fall Out,2010-06-02T01:18:12+0000,NY_TIMES,0
349,San Diego Police Investigate the Death of a Mexican Man Resisting Deportation,2010-06-02T01:19:34+0000,NY_TIMES,0
350,Altria to Pay $971 Million to Resolve a Tax Dispute,2010-06-02T01:20:14+0000,NY_TIMES,0
351,Blog That Found a Market for Sports News Is Purchased,2010-06-02T01:20:28+0000,NY_TIMES,0
352,Memorial Is Shaping Up Perfectly,2010-06-02T01:21:46+0000,NY_TIMES,0
353,"Calcavecchia Heads to Seniors Tour, Grinning All the Way",2010-06-02T01:26:28+0000,NY_TIMES,0
354,Turkish Funds Helped Group Test Blockade,2010-06-02T01:27:23+0000,NY_TIMES,0
355,"To Take Baby Pictures of the Universe, Click Here",2010-06-02T01:27:38+0000,NY_TIMES,0
356,Pennsylvania: Tax Revenue Falls Short,2010-06-02T01:27:58+0000,NY_TIMES,0
357,Skype on the iPhone Goes 3G … Finally,2010-06-02T01:29:30+0000,NY_TIMES,0
358,Videos Carry On the Fight Over Sea Raid,2010-06-02T01:38:30+0000,NY_TIMES,0
359,Big Setback for A.I.G. in Repaying Taxpayers,2010-06-02T01:38:56+0000,NY_TIMES,0
360,Study Finds Blacks Blocked From Southern Juries ,2010-06-02T01:41:24+0000,NY_TIMES,0
361,Photo Replay: June 1,2010-06-02T01:48:05+0000,NY_TIMES,0
362,20 in Black Caucus Ask for Curbs on Ethics Office,2010-06-02T01:48:36+0000,NY_TIMES,0
363,Afghan Assembly Expected to Back Peace-Talk Plan,2010-06-02T01:54:42+0000,NY_TIMES,0
364,Telefónica Bid Is Rebuffed,2010-06-02T01:55:00+0000,NY_TIMES,0
365,A Million Miles From Earth,2010-06-02T01:55:29+0000,NY_TIMES,0
366,Tribesman of Kenya,2010-06-02T02:00:59+0000,NY_TIMES,0
367,S.E.C. Is Said to Seek to Bar Wall St. Financier,2010-06-02T02:01:59+0000,NY_TIMES,0
368,Afghan Police Earn Poor Grade for Marja Mission,2010-06-02T02:02:34+0000,NY_TIMES,0
369,"For Rugby Fans, a First Trip to Soweto",2010-06-02T02:08:11+0000,NY_TIMES,0
370,"Deep Underwater, Oil Threatens Reefs",2010-06-02T02:10:50+0000,NY_TIMES,0
371,Cleanup Costs and Lawsuits Rattle BP’s Investors,2010-06-02T02:11:59+0000,NY_TIMES,0
372,Morgenthau Withdraws as Monitor on Fire Jobs,2010-06-02T02:12:30+0000,NY_TIMES,0
373,Guatemala Struggles to Recover After Storm,2010-06-02T02:16:31+0000,NY_TIMES,0
374,A Storyteller Loses the Story Line,2010-06-02T02:17:27+0000,NY_TIMES,0
375,Foxconn Raises Worker Pay 30%,2010-06-02T02:22:20+0000,NY_TIMES,0
376,Hanes Banks on Strong Tie With Star,2010-06-02T02:28:29+0000,NY_TIMES,0
377,Vazquez’s Performance at Stadium Is a Good Start,2010-06-02T02:33:36+0000,NY_TIMES,0
378,Liberia Aids U.S. in Drug Fight,2010-06-02T02:48:00+0000,NY_TIMES,0
379,Mets Want Perez to Move Aside for Niese,2010-06-02T02:59:16+0000,NY_TIMES,0
380,Fear Grips a Family,2010-06-02T02:59:25+0000,NY_TIMES,0
381,Watching as the Baton Is Passed,2010-06-02T03:00:15+0000,NY_TIMES,0
382,Blackhawks Are on a Roll in Stanley Cup Finals,2010-06-02T03:04:38+0000,NY_TIMES,0
383,"In Era of LeBron, Kobe Isn’t Stepping Aside",2010-06-02T03:04:43+0000,NY_TIMES,0
384,The Vanishing Mind,2010-06-02T03:11:29+0000,NY_TIMES,0
385,Black Congressman Loses Alabama Primary,2010-06-02T03:12:22+0000,NY_TIMES,0
386,Patient Voices: Alzheimer's Disease,2010-06-02T03:12:34+0000,NY_TIMES,0
387,Lidstrom Puts Off Retiring,2010-06-02T03:24:58+0000,NY_TIMES,0
388,"Kazuo Ohno, a Founder of Japanese Butoh, Dies at 103",2010-06-02T03:25:22+0000,NY_TIMES,0
389,Federer’s Loss Raises New Possibilities,2010-06-02T03:25:42+0000,NY_TIMES,0
390,Corrections,2010-06-02T03:43:05+0000,NY_TIMES,0
391,Bailout Haunts Any A.I.G. Deal,2010-06-02T03:44:39+0000,NY_TIMES,0
392,A Family’s Torment as Relatives Slip Away,2010-06-02T03:59:43+0000,NY_TIMES,0
393,A Perplexing Case Puts a Doctor on the Trail of ‘Madness’,2010-06-02T03:59:44+0000,NY_TIMES,0
394,Alzheimer’s Stalks a Colombian Family,2010-06-02T03:59:49+0000,NY_TIMES,0
395,A Worldwide Whirlwind on Woodwinds,2010-06-02T04:01:06+0000,NY_TIMES,0
396,Phys Ed: Does Massage Help After Exercise?,2010-06-02T04:01:40+0000,NY_TIMES,0
397,Happy Feet or Kicking It New School,2010-06-02T04:01:42+0000,NY_TIMES,0
398,Steve Jobs Muses on All Things Apple,2010-06-02T04:04:33+0000,NY_TIMES,0
399,Corrections,2010-06-02T04:09:19+0000,NY_TIMES,0
400,Video View of Guatemala Sinkhole,2010-06-02T04:33:32+0000,NY_TIMES,0
401,S.E.C. Is Said to Be Seeking to Bar Rattner,2010-06-02T04:36:28+0000,NY_TIMES,0
402,Alabama Voters Reject Coalition Bid,2010-06-02T04:48:37+0000,NY_TIMES,0
403,Word of the Day | diligence,2010-06-02T04:58:14+0000,NY_TIMES,0
404,Big Setback for A.I.G. in Repaying Taxpayers,2010-06-02T05:05:28+0000,NY_TIMES,0
405,E-Books by McMurty,2010-06-02T05:07:39+0000,NY_TIMES,0
406,Zach Braff to Star Off Broadway in ‘Trust’,2010-06-02T05:10:15+0000,NY_TIMES,0
407,"Seinfeld, the Director",2010-06-02T05:11:17+0000,NY_TIMES,0
408,Saudis on MTV May Face Charges,2010-06-02T05:12:21+0000,NY_TIMES,0
409,More Theater for Boston,2010-06-02T05:13:08+0000,NY_TIMES,0
410,License to Shill,2010-06-02T05:13:20+0000,NY_TIMES,0
411,Repeats Beat Reality,2010-06-02T05:14:08+0000,NY_TIMES,0
412,Is Peter Jackson’s Hat in the ‘Hobbit’ Ring?,2010-06-02T05:15:36+0000,NY_TIMES,0
413,Mets’ Pelfrey Wins Fourth Start in a Row,2010-06-02T05:21:59+0000,NY_TIMES,0
414,"News Quiz | June 2, 2010",2010-06-02T05:30:59+0000,NY_TIMES,0
415,South Africa: Union Threatens to Quit Governing Alliance,2010-06-02T05:32:42+0000,NY_TIMES,0
416,Taliban Attacks Shake Afghan Peace Gathering,2010-06-02T05:41:42+0000,NY_TIMES,0
417,Burundi: Candidates Accuse Government of Voter Fraud,2010-06-02T05:45:25+0000,NY_TIMES,0
418,Canada: Man Taken Off Plane Is Questioned by U.S. Officials,2010-06-02T05:51:00+0000,NY_TIMES,0
419,Dominican Republic: Suit Over Haitian Descendants,2010-06-02T05:53:54+0000,NY_TIMES,0
420,Bailout Will Haunt Any A.I.G. Deal,2010-06-02T06:10:13+0000,NY_TIMES,0
421,Loans That Vanished in a Property Bust Reappear,2010-06-02T06:25:19+0000,NY_TIMES,0
422,Telefónica’s New Bid Is Rebuffed by Portugal Telecom,2010-06-02T06:40:46+0000,NY_TIMES,0
423,American Apprentices at the Bolshoi Ballet,2010-06-02T06:53:01+0000,NY_TIMES,0
424,Citigroup Unit Being Revamped for Sale,2010-06-02T06:59:03+0000,NY_TIMES,0
425,Neo-Frugalists,2010-06-02T07:00:21+0000,NY_TIMES,0
426,"In Bid to Quell Anger Over Raid, Israel Frees Detainees ",2010-06-02T07:33:46+0000,NY_TIMES,0
427,Pru in Talks to End Deal; Costs at $662 Million,2010-06-02T08:22:59+0000,NY_TIMES,0
428,Oil Spill Inquiry Chills Traders at the Close,2010-06-02T08:32:52+0000,NY_TIMES,0
429,Germany Balks at Opel Aid for G.M.,2010-06-02T08:36:47+0000,NY_TIMES,0
430,N.Y.S.E. Gets Starbucks as Part of Revamp,2010-06-02T08:43:12+0000,NY_TIMES,0
431,Bad News Fridays,2010-06-02T08:50:36+0000,NY_TIMES,0
432,Sports News Blog Is Sold,2010-06-02T08:58:23+0000,NY_TIMES,0
433,Biglari Extends Offer for Advance Auto Shares,2010-06-02T09:05:07+0000,NY_TIMES,0
434,Do You Have a Summer Job?,2010-06-02T09:08:13+0000,NY_TIMES,0
435,Buffett to Testify at Crisis Panel Wednesday,2010-06-02T09:25:31+0000,NY_TIMES,0
436,Massachusetts Pension Fund Loses Big in May,2010-06-02T09:34:47+0000,NY_TIMES,0
437,Paris Exhibition Questions Where ‘Here’ Is,2010-06-02T10:00:27+0000,NY_TIMES,0
438,"As Governments Borrow, Many People Save",2010-06-02T10:00:59+0000,NY_TIMES,0
439,Caterpillar Buys Locomotive Maker,2010-06-02T10:02:03+0000,NY_TIMES,0
440,Cadbury Deal Prompts Review of Takeover Rules,2010-06-02T10:03:49+0000,NY_TIMES,0
441,Investors May Shy Away From I.P.O.’s This Week,2010-06-02T10:06:13+0000,NY_TIMES,0
442,Porter Aviation Grounds I.P.O.,2010-06-02T10:20:29+0000,NY_TIMES,0
443,The Spare-Time Revolution,2010-06-02T10:36:48+0000,NY_TIMES,0
444,Cancer and Me,2010-06-02T11:00:19+0000,NY_TIMES,0
445,‘You Hired a Chef and You’ve Never Tasted His Food?’,2010-06-02T11:00:30+0000,NY_TIMES,0
446,Ametek Acquires Medical Device Parts Maker,2010-06-02T11:04:12+0000,NY_TIMES,0
447,Prudential Faces Fallout From Failed Deal,2010-06-02T11:10:53+0000,NY_TIMES,0
448,Quarterfinal French Open Showdown: Jankovic vs. Shvedova,2010-06-02T11:14:31+0000,NY_TIMES,0
449,China to Subsidize Electric Cars and Hybrids,2010-06-02T11:30:35+0000,NY_TIMES,0
450,Couche-Tard Begins Tender Offer for Casey’s,2010-06-02T11:45:26+0000,NY_TIMES,0
451,An Earpiece With Controls You Can See,2010-06-02T11:50:31+0000,NY_TIMES,0
452,Your Jokes: ‘I Saw the Smirks …’,2010-06-02T11:55:17+0000,NY_TIMES,0
453,"Speed Read for Wednesday, June 2",2010-06-02T11:57:51+0000,NY_TIMES,0
454,Service Members Share Thoughts on the Personal Items That Come With Them,2010-06-02T12:00:13+0000,NY_TIMES,0
455,Morning Take-Out,2010-06-02T12:00:51+0000,NY_TIMES,0
456,Jupiter Seeks $322 Million in I.P.O.,2010-06-02T12:05:36+0000,NY_TIMES,0
457,"Oil, Inertia and the Energy Quest",2010-06-02T12:06:59+0000,NY_TIMES,0
458,A Video Camera Has Become the Newest Weapon in Global Crises,2010-06-02T12:09:54+0000,NY_TIMES,0
459,A Proliferation of Plumes?,2010-06-02T12:19:04+0000,NY_TIMES,0
460,The Early Word: Midterm Wins and Losses,2010-06-02T12:28:17+0000,NY_TIMES,0
461,Action Sought Against Wall St. Financier,2010-06-02T12:41:35+0000,NY_TIMES,0
462,Conan O’Brien to Fans: Tweet This,2010-06-02T12:45:50+0000,NY_TIMES,0
463,Another View: Punting Financial Reform,2010-06-02T13:00:09+0000,NY_TIMES,0
464,"High-Interest Bonds, in Chocolate",2010-06-02T13:00:23+0000,NY_TIMES,0
465,Wikinvest Introduces Tool to Track Investments,2010-06-02T13:00:53+0000,NY_TIMES,0
466,Q.&A.: Moving a Computer Long Distance,2010-06-02T13:03:45+0000,NY_TIMES,0
467,Questions for Moody’s and Buffett,2010-06-02T13:04:58+0000,NY_TIMES,0
468,Alabama Voters Reject Coalition Bid,2010-06-02T13:12:47+0000,NY_TIMES,0
469,Prosecutor Says Plea Deal Reached in Sheen Case,2010-06-02T13:25:55+0000,NY_TIMES,0
470,Ask a Bartender: Round 2 Responses,2010-06-02T13:29:40+0000,NY_TIMES,0
471,The Voices of Alzheimer’s,2010-06-02T13:34:48+0000,NY_TIMES,0
472,How a Soccer Star Is Made,2010-06-02T13:40:08+0000,NY_TIMES,0
473,The Ajax Soccer Academy: From Boys to Pros,2010-06-02T13:43:04+0000,NY_TIMES,0
474,Training to Play the World's Game,2010-06-02T13:46:49+0000,NY_TIMES,0
475,Interests And Ideas,2010-06-02T13:53:42+0000,NY_TIMES,0
476,Complete Video of Israeli Raid Still Missing,2010-06-02T13:54:01+0000,NY_TIMES,0
477,Jankovic Beats Shvedova to Reach Semifinals,2010-06-02T13:55:50+0000,NY_TIMES,0
478,Do Backyard Chickens Lay Run-of-the-Mill Eggs?,2010-06-02T14:07:26+0000,NY_TIMES,0
479,"The Changing World, Alpine Edition",2010-06-02T14:10:24+0000,NY_TIMES,0
480,Bloomberg Moves to Block Teachers’ Raises,2010-06-02T14:18:07+0000,NY_TIMES,0
481,Wednesday Reading: Late Tax Refund Checks,2010-06-02T14:26:38+0000,NY_TIMES,0
482,Interview With Anand,2010-06-02T14:32:58+0000,NY_TIMES,0
483,A Mint.com for Investments,2010-06-02T14:45:29+0000,NY_TIMES,0
484,Stosur Beats Serena Williams and Surges Into Semifinals,2010-06-02T14:46:05+0000,NY_TIMES,0
485,Encouraging a High-School Dropout,2010-06-02T14:47:38+0000,NY_TIMES,0
486,Panel Seeks More Police Training on Sex Crimes,2010-06-02T14:51:32+0000,NY_TIMES,0
487,Media Companies File Brief on Behalf of Filmmaker in Chevron Case,2010-06-02T15:03:08+0000,NY_TIMES,0
488,"Hey, Mr. Critic!",2010-06-02T15:07:51+0000,NY_TIMES,0
489,Grid Confronts a Threat from Mother Nature,2010-06-02T15:09:19+0000,NY_TIMES,0
490,Push for Europe-Wide Oversight of Credit Raters,2010-06-02T15:09:31+0000,NY_TIMES,0
491,Graphic Content | Whistle While You Work?,2010-06-02T15:12:42+0000,NY_TIMES,0
492,"Car Sales Top Forecasts, With Toyota as Exception",2010-06-02T15:14:51+0000,NY_TIMES,0
493,4 Victims of Sex Assault Tell of Treatment by Police,2010-06-02T15:21:42+0000,NY_TIMES,0
494,An Applicant’s Perspective on the College Essay,2010-06-02T15:27:18+0000,NY_TIMES,0
495,States Receive a Reading List: New Standards for Education,2010-06-02T15:33:39+0000,NY_TIMES,0
496,Rwanda Says Jailed American Tried to Kill Himself,2010-06-02T15:38:33+0000,NY_TIMES,0
497,What Pets Can Teach Us About Marriage,2010-06-02T15:39:12+0000,NY_TIMES,0
498,Hands-On Theater (at Times With Fists),2010-06-02T15:40:54+0000,NY_TIMES,0
499,Stuck Saw Delays Effort to Cap Well,2010-06-02T15:41:37+0000,NY_TIMES,0
500,Midsize S.U.V.’s Score Well in Rollover Test,2010-06-02T15:43:49+0000,NY_TIMES,0
501,Do You Still Hear the People Sing? ‘Les Miz’ Celebrates a Quarter-Century,2010-06-02T15:46:49+0000,NY_TIMES,0
502,Using Theater as a Salve to Soothe Minds,2010-06-02T15:51:43+0000,NY_TIMES,0
503,Un-Innocents Abroad: The Drubbing,2010-06-02T15:57:30+0000,NY_TIMES,0
504,Paterson Proposes Juvenile Justice Overhaul,2010-06-02T16:00:09+0000,NY_TIMES,0
505,"On Alabama Coast, a Sense of Urgency",2010-06-02T16:03:12+0000,NY_TIMES,0
506,First-Place Reds Follow Scott Rolen’s Lead,2010-06-02T16:04:13+0000,NY_TIMES,0
507,Sit. Stay. Appreciate: Music for Dogs,2010-06-02T16:28:31+0000,NY_TIMES,0
508,Flarf,2010-06-02T16:30:46+0000,NY_TIMES,0
509,The BP Spill and the Favorite-Longshot Bias,2010-06-02T16:30:59+0000,NY_TIMES,0
510,"Chris Haney, an Inventor of Trivial Pursuit, Dies at 59",2010-06-02T16:32:13+0000,NY_TIMES,0
511,AT&T Eliminates the Unlimited Data Plan,2010-06-02T16:33:13+0000,NY_TIMES,0
512,What We’re Reading: Hemline Indicator,2010-06-02T16:38:06+0000,NY_TIMES,0
513,Dot Shot: Amphibians in Suburbia,2010-06-02T16:39:48+0000,NY_TIMES,0
514,"First Came the Idea for a Tablet, Jobs Says",2010-06-02T16:41:28+0000,NY_TIMES,0
515,French Trial Begins for Former Vivendi Chief,2010-06-02T16:46:27+0000,NY_TIMES,0
516,More Dispersant? Asking Hard Questions,2010-06-02T16:47:01+0000,NY_TIMES,0
517,Accounts of the Israeli Raid From Activists,2010-06-02T16:49:21+0000,NY_TIMES,0
518,Scannell Takes Over at BBC America,2010-06-02T16:49:55+0000,NY_TIMES,0
519,"TimesCast | June 2, 2010",2010-06-02T16:52:47+0000,NY_TIMES,0
520,"Year-End Round-Up | Science, Health, Technology and Math",2010-06-02T16:54:25+0000,NY_TIMES,0
521,"Paul R. Garabedian, Calculator of Planes’ Wing Dynamics, Dies at 82",2010-06-02T16:54:47+0000,NY_TIMES,0
522,"Getting There From Here, Near Future Edition",2010-06-02T16:55:35+0000,NY_TIMES,0
523,"Republicans Tap Lazio to Run for Governor, Spurn Levy",2010-06-02T16:58:45+0000,NY_TIMES,0
524,"Enough Teasing, BMW Unveils Koons Art Car in Paris",2010-06-02T17:00:59+0000,NY_TIMES,0
525,What Happens to Items Left on Planes,2010-06-02T17:01:01+0000,NY_TIMES,0
526,Obama Wants to Roll Back Tax Breaks for Oil Companies,2010-06-02T17:01:25+0000,NY_TIMES,0
527,U.S. Presses the Airlines to Satisfy the Traveler,2010-06-02T17:07:39+0000,NY_TIMES,0
528,Marina Abramovic’s Costume Change,2010-06-02T17:09:00+0000,NY_TIMES,0
529,12 Killed in Rampage in Rural Britain,2010-06-02T17:23:24+0000,NY_TIMES,0
530,"For Nicklaus, Another Milestone in a Career Filled With Them",2010-06-02T17:25:53+0000,NY_TIMES,0
531,"In Rome, Really Local Food",2010-06-02T17:26:23+0000,NY_TIMES,0
532,Doing the Math on Lakers-Celtics Tickets,2010-06-02T17:28:57+0000,NY_TIMES,0
533,A Viennese District Is Reborn,2010-06-02T17:29:41+0000,NY_TIMES,0
534,Buffett Defends How Rating Agencies Are Paid,2010-06-02T17:32:26+0000,NY_TIMES,0
535,‘Glee’ Soundtrack Stays on Top,2010-06-02T17:34:24+0000,NY_TIMES,0
536,"Slings, Arrows, Self-Pity. What a Kidder!",2010-06-02T17:37:16+0000,NY_TIMES,0
537,Ackman on the Rating Agencies: ‘Wait to Rate’,2010-06-02T17:43:05+0000,NY_TIMES,0
538,An Imbalanced Chess World,2010-06-02T17:50:11+0000,NY_TIMES,0
539,Nadal Advances to Semifinals,2010-06-02T17:53:10+0000,NY_TIMES,0
540,The Contrarian,2010-06-02T17:56:26+0000,NY_TIMES,0
541,Founders of Gallery Owned by Christie’s to Step Down,2010-06-02T18:01:39+0000,NY_TIMES,0
542,Artifacts | Marina the Magnificent,2010-06-02T18:07:06+0000,NY_TIMES,0
543,U.N. Report Highly Critical of U.S. Drone Attacks,2010-06-02T18:07:36+0000,NY_TIMES,0
544,Upfront Market Starts to Move,2010-06-02T18:08:35+0000,NY_TIMES,0
545,Will Insurance Be Given to Those Who Can’t Afford It?,2010-06-02T18:13:27+0000,NY_TIMES,0
546,Steve Reich and More at June in Buffalo,2010-06-02T18:17:28+0000,NY_TIMES,0
547,LeBron James Likes Gaga and Suspense,2010-06-02T18:25:40+0000,NY_TIMES,0
548,U.S. Team Is Nestled in a Bucolic South African Bubble,2010-06-02T18:28:57+0000,NY_TIMES,0
549,Ice Box Is 3-1 Favorite for the Belmont,2010-06-02T18:30:33+0000,NY_TIMES,0
550,Celtics Slowly Recovering From Injuries,2010-06-02T18:30:46+0000,NY_TIMES,0
551,"IPad Efficiency, and a Teenager in the Press Corps",2010-06-02T18:36:35+0000,NY_TIMES,0
552,Quote Unquote | Mad Hatter,2010-06-02T18:40:52+0000,NY_TIMES,0
553,A Swirling Current Beneath a Smooth Surface,2010-06-02T18:41:21+0000,NY_TIMES,0
554,Melzer Rallies to Upset Djokovic in Five Sets,2010-06-02T18:41:26+0000,NY_TIMES,0
555,Kindles Soon To Be Available at Target,2010-06-02T18:42:25+0000,NY_TIMES,0
556,The Culture of Narcissism,2010-06-02T18:47:34+0000,NY_TIMES,0
557,Living With Music (Videos): A Playlist by Sharon Oreck,2010-06-02T18:49:53+0000,NY_TIMES,0
558,The Shock Heard Round the World,2010-06-02T18:50:19+0000,NY_TIMES,0
559,Video on Netanyahu’s Facebook Page Says Activists Plotted ‘a Terrorist Attack’,2010-06-02T18:53:47+0000,NY_TIMES,0
560,The Morning Skate: An Irreverent Pronger Creates a Disturbance,2010-06-02T18:59:24+0000,NY_TIMES,0
561,Ford to End Production of Its Mercury Line,2010-06-02T18:59:32+0000,NY_TIMES,0
562,The Takeaway From the Failed A.I.A. Deal,2010-06-02T19:00:42+0000,NY_TIMES,0
563,"Richard Migliore, a Peerless Horseman, Retires",2010-06-02T19:00:45+0000,NY_TIMES,0
564,The Rail Bookshelf: ‘Randy Romero’s Remarkable Ride’,2010-06-02T19:00:47+0000,NY_TIMES,0
565,Panasonic FX75 Goes Wide and Bright,2010-06-02T19:04:58+0000,NY_TIMES,0
566,2010: Honey-and-Ricotta Mousse With Strawberry-Rhubarb Broth,2010-06-02T19:17:28+0000,NY_TIMES,0
567,1989: Rhubarb-Strawberry Mousse,2010-06-02T19:17:28+0000,NY_TIMES,0
568,"Recipe Redux: Rhubarb-Strawberry Mousse, 1989",2010-06-02T19:17:34+0000,NY_TIMES,0
569,Florida G.O.P. Figure Indicted,2010-06-02T19:18:52+0000,NY_TIMES,0
570,Jane Lynch and Lara Embry,2010-06-02T19:21:27+0000,NY_TIMES,0
571,By the Numbers: A-Rod’s Grand Slams,2010-06-02T19:32:58+0000,NY_TIMES,0
572,A Trick to Earn More Interest,2010-06-02T19:37:27+0000,NY_TIMES,0
573,Greater New Yorkers | Tala Madani,2010-06-02T19:41:33+0000,NY_TIMES,0
574,Ray Stevens Comes Streaking Back With Immigration Song,2010-06-02T19:41:46+0000,NY_TIMES,0
575,TerraCycle,2010-06-02T19:42:47+0000,NY_TIMES,0
576,"The Kno, a Tablet for the College Market",2010-06-02T19:49:02+0000,NY_TIMES,0
577,Town House in Crane Collapse Is for Sale,2010-06-02T19:55:09+0000,NY_TIMES,0
578,Ex-Officer Is Convicted of Sexual Abuse,2010-06-02T20:03:14+0000,NY_TIMES,0
579,Katrina and Climate: Case Dismissed?,2010-06-02T20:06:03+0000,NY_TIMES,0
580,How I Saved My Company: TerraCycle,2010-06-02T20:10:26+0000,NY_TIMES,0
581,No Hawk-Eye to Help Out Djokovic,2010-06-02T20:22:12+0000,NY_TIMES,0
582,The Morning Line: Singing a New Belmont Tune,2010-06-02T20:30:05+0000,NY_TIMES,0
583,Mercury: A Brand Without a Cause,2010-06-02T20:31:56+0000,NY_TIMES,0
584,The Crew Behind a One-Woman Show,2010-06-02T20:38:57+0000,NY_TIMES,0
585,World Cup Chic | Kehinde Wiley’s Fancy Footwork,2010-06-02T20:41:08+0000,NY_TIMES,0
586,‘Phantom’ Now Available to Students,2010-06-02T20:49:38+0000,NY_TIMES,0
587,Laurent Manrique Is Taking Over Country in the Carlton Hotel,2010-06-02T20:51:34+0000,NY_TIMES,0
588,Trunk Show,2010-06-02T20:52:32+0000,NY_TIMES,0
589,Palin Backs Murkowski Rival in Alaska,2010-06-02T20:55:47+0000,NY_TIMES,0
590,A Lifeguard for Before You Get to the Beach,2010-06-02T20:59:38+0000,NY_TIMES,0
591,20 Young Writers Earn the Envy of Many Others,2010-06-02T20:59:38+0000,NY_TIMES,0
592,Answers From a Train Operator,2010-06-02T20:59:43+0000,NY_TIMES,0
593,Pictures of the Day: Kabul and Elsewhere,2010-06-02T21:00:49+0000,NY_TIMES,0
594,Transit Maps in the Palm of Your Hand (No Refolding Required),2010-06-02T21:01:09+0000,NY_TIMES,0
595,Tech Talk Podcast: Robot Surgery,2010-06-02T21:01:22+0000,NY_TIMES,0
596,Buffett Warns of Possible Call for Muni Bailouts,2010-06-02T21:01:34+0000,NY_TIMES,0
597,Advising Graduates,2010-06-02T21:02:31+0000,NY_TIMES,0
598,The Beautiful Game’s Serious Blemish,2010-06-02T21:03:38+0000,NY_TIMES,0
599,"Finding America, Searching for Identity",2010-06-02T21:04:33+0000,NY_TIMES,0
600,"In May, Lower Ratings for Larry King",2010-06-02T21:08:01+0000,NY_TIMES,0
601,Products for Sensitive Skin,2010-06-02T21:09:31+0000,NY_TIMES,0
602,New Korean Skin-Care Import,2010-06-02T21:15:12+0000,NY_TIMES,0
603,Top Players Have Up-and-Down Day at French Open,2010-06-02T21:16:42+0000,NY_TIMES,0
604,As Certain as Taxes: New Version of Office,2010-06-02T21:21:45+0000,NY_TIMES,0
605,"Turning Heads, and Topping Them, Too",2010-06-02T21:24:28+0000,NY_TIMES,0
606,Push for Europewide Oversight of Credit Raters,2010-06-02T21:29:18+0000,NY_TIMES,0
607,"Table for 5, Rookies Need Not Apply",2010-06-02T21:32:09+0000,NY_TIMES,0
608,Thrifty Wi-Fi That Travels With You,2010-06-02T21:40:17+0000,NY_TIMES,0
609,The Woman Behind Jean-Georges’s Juices,2010-06-02T21:41:53+0000,NY_TIMES,0
610,The 10 Things to Talk About This Weekend,2010-06-02T21:43:57+0000,NY_TIMES,0
611,Throwing Stones at Builders’ Crass Houses,2010-06-02T21:44:58+0000,NY_TIMES,0
612,The New Yorker’s ’20 Under 40’,2010-06-02T21:45:25+0000,NY_TIMES,0
613,"Make Bikes in the U.S., or Go Abroad to Cut Costs?",2010-06-02T21:49:49+0000,NY_TIMES,0
614,Carly Fiorina Means Business,2010-06-02T21:49:52+0000,NY_TIMES,0
615,"This Year, Men’s Semifinals Should Be Televised Live",2010-06-02T21:50:31+0000,NY_TIMES,0
616,Pacific Crossing: Brahms by Way of Seoul,2010-06-02T21:50:33+0000,NY_TIMES,0
617,Would You Build Bikes in the U.S. or the Far East?,2010-06-02T21:52:03+0000,NY_TIMES,0
618,Egalitarian Virtues Trump Fireworks,2010-06-02T21:55:45+0000,NY_TIMES,0
619,Around the Grill | Share Your Barbecue,2010-06-02T21:59:38+0000,NY_TIMES,0
620,Italy Focuses on a Princeton Curator in an Antiquities Investigation,2010-06-02T22:01:59+0000,NY_TIMES,0
621,Award to Aid Playwright and the Play,2010-06-02T22:02:15+0000,NY_TIMES,0
622,Colorado Prosecutor Says a Deal Is Reached in Charlie Sheen Case,2010-06-02T22:02:24+0000,NY_TIMES,0
623,‘Glee’ Soundtrack Stays On Top,2010-06-02T22:03:32+0000,NY_TIMES,0
624,Sit. Stay. Appreciate: Music For Dogs,2010-06-02T22:04:56+0000,NY_TIMES,0
625,Christie’s Alters Gallery Management,2010-06-02T22:06:16+0000,NY_TIMES,0
626,Topping Fish With a Classic Onion Sauce,2010-06-02T22:07:21+0000,NY_TIMES,0
627,Media Companies Support Filmmaker in Chevron Case,2010-06-02T22:07:35+0000,NY_TIMES,0
628,Life Along the Gowanus,2010-06-02T22:07:36+0000,NY_TIMES,0
629,Celebration at the Edge of Decay,2010-06-02T22:07:47+0000,NY_TIMES,0
630,"Still Dancing, Her Way, From the Soul",2010-06-02T22:11:27+0000,NY_TIMES,0
631,Packing the Computer for a Move,2010-06-02T22:13:10+0000,NY_TIMES,0
632,Private Collection Becomes Very Public,2010-06-02T22:16:50+0000,NY_TIMES,0
633,Superfun Site,2010-06-02T22:19:02+0000,NY_TIMES,0
634,Which Minor to Ruff? Declarer Puzzles It Out,2010-06-02T22:24:36+0000,NY_TIMES,0
635,Theater Talkback: Summer Reading List,2010-06-02T22:26:39+0000,NY_TIMES,0
636,"‘Jersey Shore,’ Without the Sun",2010-06-02T22:30:53+0000,NY_TIMES,0
637,Brazil’s Best Player: A Goalkeeper?,2010-06-02T22:30:59+0000,NY_TIMES,0
638,"Eyebrow Shaping, Pain Included",2010-06-02T22:31:10+0000,NY_TIMES,0
639,Classic Ads: Mercury,2010-06-02T22:41:15+0000,NY_TIMES,0
640,Looking for Missing Culprit in Credit Ratings ‘Mess’,2010-06-02T22:42:14+0000,NY_TIMES,0
641,Two Different Pictures of Hospitals,2010-06-02T22:46:13+0000,NY_TIMES,0
642,Jamaican Forces Accused of Killing Unarmed Men,2010-06-02T22:47:09+0000,NY_TIMES,0
643,When Poets Rocked Russia’s Stadiums,2010-06-02T22:50:50+0000,NY_TIMES,0
