,text,date,source,value
0,Cellphone in New Role: Loyalty Card,2010-06-01T00:00:30+0000,NY_TIMES,0
1,"Three Men and a Video Camera, Out to Reveal Urban Truths",2010-06-01T00:08:25+0000,NY_TIMES,0
2,Paterson Now Focuses on Layoffs to Cut Budget,2010-06-01T00:14:03+0000,NY_TIMES,0
3,"Iraq’s Psyche, Through a Green Zone Prism",2010-06-01T00:14:44+0000,NY_TIMES,0
4,Airline Reward Programs Pay Off Less Frequently,2010-06-01T00:16:30+0000,NY_TIMES,0
5,Throwing a Lifeline to a Teenager in Need,2010-06-01T00:17:30+0000,NY_TIMES,0
6,"Who Should Be Called Soldier, and Who Shouldn’t",2010-06-01T00:17:32+0000,NY_TIMES,0
7,Obama Improvises After Speech Rainout,2010-06-01T00:17:36+0000,NY_TIMES,0
8,Pletcher Adds a Colt to the Belmont Stakes,2010-06-01T00:17:58+0000,NY_TIMES,0
9,Make Kendra’s Law Permanent,2010-06-01T00:19:43+0000,NY_TIMES,0
10,Raid Complicates U.S. Ties and Push for Peace,2010-06-01T00:20:15+0000,NY_TIMES,0
11,Compromise Sought Over A.I.G. Unit,2010-06-01T00:23:37+0000,NY_TIMES,0
12,Gender Breakdown in Schools for Gifted: ‘It’s Kind of Weird’,2010-06-01T00:29:41+0000,NY_TIMES,0
13,Reform for the Next Census,2010-06-01T00:32:55+0000,NY_TIMES,0
14,"It’s Up to You, Mr. Holder",2010-06-01T00:35:51+0000,NY_TIMES,0
15,Louisianan Becomes Face of Anger on Spill,2010-06-01T00:39:28+0000,NY_TIMES,0
16,The Booming Voice of the Bayou,2010-06-01T00:39:41+0000,NY_TIMES,0
17,Gender Gap for the Gifted in City Schools ,2010-06-01T00:40:54+0000,NY_TIMES,0
18,So You Still Want to Choose Your Senator?,2010-06-01T00:41:53+0000,NY_TIMES,0
19,Backward at Bagram ,2010-06-01T00:47:48+0000,NY_TIMES,0
20,"Behind Unassuming Walls, a War of Words Among Co-op Board Members",2010-06-01T00:53:20+0000,NY_TIMES,0
21,A Private School’s Ads Imply Public School Slippage,2010-06-01T00:54:20+0000,NY_TIMES,0
22,"Owners Stop Paying Mortgages, and Stop Fretting",2010-06-01T00:55:23+0000,NY_TIMES,0
23,Break in Protocol for a Rock Star With Putin,2010-06-01T00:57:32+0000,NY_TIMES,0
24,Our Epic Foolishness,2010-06-01T00:58:28+0000,NY_TIMES,0
25,Bloggingheads: Palin's New Neighbor,2010-06-01T01:02:25+0000,NY_TIMES,0
26,BP Tries Again to Divert Oil Leak With Dome,2010-06-01T01:06:01+0000,NY_TIMES,0
27,European Central Bank’s Report Issues Warning,2010-06-01T01:16:13+0000,NY_TIMES,0
28,Jamaica Strains to Fill Void Left by Gang Bosses,2010-06-01T01:16:30+0000,NY_TIMES,0
29,20 Questions in a Quest for Meaning,2010-06-01T01:24:34+0000,NY_TIMES,0
30,The Oil Plume,2010-06-01T01:29:19+0000,NY_TIMES,0
31,Alabama Candidate Tries Obama Coalition Style ,2010-06-01T01:40:09+0000,NY_TIMES,0
32,"Chinese Supercomputer Is Ranked World’s Second-Fastest, Challenging U.S. Dominance",2010-06-01T01:41:32+0000,NY_TIMES,0
33,"
China: Earthquake Death Toll Increased",2010-06-01T01:45:06+0000,NY_TIMES,0
34,Iran Moves to Thwart Protests Ahead of Election Anniversary,2010-06-01T01:47:57+0000,NY_TIMES,0
35,"In Review, Europe Accuses China of Protectionism",2010-06-01T01:56:48+0000,NY_TIMES,0
36,Inquiry Faults Ex-Canadian Leader on Cash From Lobbyist,2010-06-01T01:57:57+0000,NY_TIMES,0
37,Bed Bod,2010-06-01T02:00:09+0000,NY_TIMES,0
38,Canada: Passenger on Flight Identified,2010-06-01T02:01:56+0000,NY_TIMES,0
39,Microsoft in Venture for Health Database in Canada,2010-06-01T02:01:59+0000,NY_TIMES,0
40,Sweden’s Soderling Is a Force to Be Reckoned With,2010-06-01T02:02:38+0000,NY_TIMES,0
41,New Way to Crown Winners in Games That End in Ties,2010-06-01T02:04:39+0000,NY_TIMES,0
42,"Suddenly, Duke Ends Long Road to a Title",2010-06-01T02:11:53+0000,NY_TIMES,0
43,Corrections,2010-06-01T02:14:55+0000,NY_TIMES,0
44,Banking Shares Are Looking Up,2010-06-01T02:22:26+0000,NY_TIMES,0
45,An American at the Bolshoi,2010-06-01T02:23:54+0000,NY_TIMES,0
46,Perez Has Become a Joking Matter,2010-06-01T02:24:06+0000,NY_TIMES,0
47,"Racing Silks in Every Color, Provided You Wear a Small",2010-06-01T02:26:03+0000,NY_TIMES,0
48,"Ukrainian Ex-Pat, in His Homeland, Wins World Rapid Cup",2010-06-01T02:41:50+0000,NY_TIMES,0
49,"Reflection, Relaxation and a Taste of Summer",2010-06-01T02:43:17+0000,NY_TIMES,0
50,Security Council Debates Criticism of Israeli Raid,2010-06-01T02:43:53+0000,NY_TIMES,0
51,This Bench Belongs in a Dugout ,2010-06-01T02:44:31+0000,NY_TIMES,0
52,Justices Share Devotion to Baseball,2010-06-01T02:44:34+0000,NY_TIMES,0
53,Young Americans Embrace Rigors of the Bolshoi ,2010-06-01T02:49:59+0000,NY_TIMES,0
54,American Strike Is Said to Kill a Top Qaeda Leader,2010-06-01T02:57:17+0000,NY_TIMES,0
55,The States of War,2010-06-01T03:09:09+0000,NY_TIMES,0
56,Path to Victory Starts With Reyes on Base,2010-06-01T03:17:10+0000,NY_TIMES,0
57,Americans at the Bolshoi,2010-06-01T03:34:01+0000,NY_TIMES,0
58,Lottery Numbers,2010-06-01T03:35:45+0000,NY_TIMES,0
59,Queens Man Is Critically Injured in Garage Explosion,2010-06-01T03:46:16+0000,NY_TIMES,0
60,Grasso: Stopping Flash Crashes Starts With 1 Set of Rules,2010-06-01T03:47:10+0000,NY_TIMES,0
61,The Transatlantic Crisis: Europe’s Endangered Banks,2010-06-01T03:48:48+0000,NY_TIMES,0
62,"3,000 Pages of Financial Reform, but Still Not Enough",2010-06-01T03:49:53+0000,NY_TIMES,0
63,U.S. Bank Failure Total Rises to 77,2010-06-01T03:50:03+0000,NY_TIMES,0
64,"Parkmerced’s Owners Bet on Raising the Rent, and Lost",2010-06-01T03:51:29+0000,NY_TIMES,0
65,Removing Federal Aid From Bank Ratings,2010-06-01T03:53:44+0000,NY_TIMES,0
66,World’s Biggest Games Brought to Tiny Screens,2010-06-01T03:55:02+0000,NY_TIMES,0
67,Consumers Get a Chance to Go Commercial,2010-06-01T04:01:12+0000,NY_TIMES,0
68,Quality Road Wins Met Mile,2010-06-01T04:02:05+0000,NY_TIMES,0
69,Ask the Dancers: Young Americans in a Russian Bastion,2010-06-01T04:05:43+0000,NY_TIMES,0
70,"China's Manufacturing Sector Grew in May, but at a Slower Pace",2010-06-01T04:07:18+0000,NY_TIMES,0
71,Swiss Report Slams Government on UBS Crisis,2010-06-01T04:09:50+0000,NY_TIMES,0
72,Blackhawks Win Again but Cut It Close,2010-06-01T04:09:52+0000,NY_TIMES,0
73,Cocktails of the Italian Avant-Garde in TriBeCa,2010-06-01T04:13:48+0000,NY_TIMES,0
74,Photo Replay: May 31,2010-06-01T04:20:05+0000,NY_TIMES,0
75,Lewis: Shorting Reform,2010-06-01T04:20:08+0000,NY_TIMES,0
76,Fitch Downgrades Spain’s Credit Rating,2010-06-01T04:28:10+0000,NY_TIMES,0
77,Afghan and U.S. Forces Begin Effort to Reclaim Remote Area From Taliban,2010-06-01T04:29:27+0000,NY_TIMES,0
78,Word of the Day | impeach,2010-06-01T04:40:34+0000,NY_TIMES,0
79,Start-Ups Offer Bargains for Users’ Data,2010-06-01T04:45:07+0000,NY_TIMES,0
80,Three BP Fuel Oil Traders in U.S. Quit,2010-06-01T04:46:20+0000,NY_TIMES,0
81,"On Quiet Day, Markets in Europe End Mixed",2010-06-01T05:00:18+0000,NY_TIMES,0
82,Banksy Work Is Moved After Threats,2010-06-01T05:28:01+0000,NY_TIMES,0
83,"News Quiz | June 1, 2010",2010-06-01T05:30:14+0000,NY_TIMES,0
84,"After Theft, Paris Museum Is to Reopen",2010-06-01T05:31:26+0000,NY_TIMES,0
85,Fans Say Farewell to Dio,2010-06-01T05:35:22+0000,NY_TIMES,0
86,E.C.B.’s Report Issues Warning for Banks,2010-06-01T05:36:31+0000,NY_TIMES,0
87,"Perez Gets Call, but by Then All Was Said and Done",2010-06-01T06:13:32+0000,NY_TIMES,0
88,Unknown Warriors,2010-06-01T06:22:49+0000,NY_TIMES,0
89,Verhofstadt: Europe’s Banks,2010-06-01T06:27:57+0000,NY_TIMES,0
90,Dubai Holding Reports $6.2 Billion 2009 Loss,2010-06-01T06:59:34+0000,NY_TIMES,0
91,Kitanachelin,2010-06-01T07:00:58+0000,NY_TIMES,0
92,On the Go and Hungry? Try an ‘Appy’ Meal,2010-06-01T07:03:20+0000,NY_TIMES,0
93,Rakoff Clarifies View on Rating Agencies,2010-06-01T07:04:44+0000,NY_TIMES,0
94,U.N. Security Council Condemns ‘Acts’ in Israeli Raid,2010-06-01T07:11:13+0000,NY_TIMES,0
95,House Votes to Eliminate Tax Break,2010-06-01T07:11:37+0000,NY_TIMES,0
96,Canadian I.P.O.’s Said to Be on the Horizon,2010-06-01T07:23:39+0000,NY_TIMES,0
97,K.K.R. and Tenet Said to Join Race for Healthscope,2010-06-01T07:45:37+0000,NY_TIMES,0
98,E.U. to Investigate Unilever Plans for Sara Lee Units,2010-06-01T08:15:23+0000,NY_TIMES,0
99,Unexpected M&A Gains for Credit Suisse,2010-06-01T08:27:10+0000,NY_TIMES,0
100,Taliban Driven From Afghan District,2010-06-01T08:27:21+0000,NY_TIMES,0
101,Laser Focus Across Pop Culture,2010-06-01T08:44:17+0000,NY_TIMES,0
102,Tech Innovator in Japan Sets Its Sights on China,2010-06-01T08:57:54+0000,NY_TIMES,0
103,Do Hedge Funds Have It Right on Bank Shares?,2010-06-01T09:00:15+0000,NY_TIMES,0
104,BNP and SocGen Said to Eye A.I.B.’s Zachodni Stake,2010-06-01T09:17:48+0000,NY_TIMES,0
105,Sorkin: Time for Answers on Credit Ratings,2010-06-01T09:20:14+0000,NY_TIMES,0
106,Pressure Mounts on Israel as Activists Vow to Test Blockade Again,2010-06-01T09:26:36+0000,NY_TIMES,0
107,A.I.G. Rejects Price Cut for Sale of Asia Unit,2010-06-01T09:30:45+0000,NY_TIMES,0
108,Oil Spill Inquiry Chills Traders at the Close,2010-06-01T09:46:11+0000,NY_TIMES,0
109,Barry Sternlicht: Real Estate Bargain Hunter,2010-06-01T09:47:05+0000,NY_TIMES,0
110,Quieting Noisy Hospitals,2010-06-01T09:52:45+0000,NY_TIMES,0
111,"What We Don’t Know, and Perhaps Can’t",2010-06-01T10:00:18+0000,NY_TIMES,0
112,Setting Sail From Trafalgar Square,2010-06-01T10:00:37+0000,NY_TIMES,0
113,Your Jokes: ‘A Cooking Show’,2010-06-01T10:05:20+0000,NY_TIMES,0
114,Bilfinger Said to Be Finishing Australia I.P.O.,2010-06-01T10:16:19+0000,NY_TIMES,0
115,Hong Kong Fines Merrill for Exec Concealing Losses,2010-06-01T10:21:28+0000,NY_TIMES,0
116,Funds Post Biggest Drop Since Dark Days of Lehman,2010-06-01T10:35:20+0000,NY_TIMES,0
117,How Do You Hire Salespeople?,2010-06-01T11:00:45+0000,NY_TIMES,0
118,"The Temporary Vegetarian: Stir-Fried Glass Noodles, Malaysian Hawker Style",2010-06-01T11:00:58+0000,NY_TIMES,0
119,Merger Talks Heat Up for Spanish Banks,2010-06-01T11:33:09+0000,NY_TIMES,0
120,A Carbon Price as a Nuclear Incentive,2010-06-01T11:41:34+0000,NY_TIMES,0
121,Morning Take-Out,2010-06-01T11:42:14+0000,NY_TIMES,0
122,Antiradiation Products With Some Science in Them,2010-06-01T12:00:05+0000,NY_TIMES,0
123,Bright Passages,2010-06-01T12:00:08+0000,NY_TIMES,0
124,Bright Passages,2010-06-01T12:00:08+0000,NY_TIMES,0
125,Q.&A.: Personalizing the Mac Desktop,2010-06-01T12:02:28+0000,NY_TIMES,0
126,"Can We Do Better at Managing Rare, Big Risks?",2010-06-01T12:04:54+0000,NY_TIMES,0
127,Covidien to Buy ev3 for $2.6 Billion in Cash,2010-06-01T12:10:21+0000,NY_TIMES,0
128,"As the Weather Warms, Hyperthermia Deaths Mount",2010-06-01T12:15:27+0000,NY_TIMES,0
129,Iraqi Court Ratifies Election Results,2010-06-01T12:22:53+0000,NY_TIMES,0
130,"H.P. Will Cut 9,000 Jobs as It Streamlines Its Data Centers",2010-06-01T12:31:11+0000,NY_TIMES,0
131,The Early Word: Still the Spill,2010-06-01T12:39:47+0000,NY_TIMES,0
132,A Farewell to the Green Zone,2010-06-01T12:43:55+0000,NY_TIMES,0
133,Is Peter Jackson’s Hat in the ‘Hobbit’ Ring?,2010-06-01T12:49:42+0000,NY_TIMES,0
134,Will Medicare Taxes Increase?,2010-06-01T13:00:54+0000,NY_TIMES,0
135,Red Zone Channel in Every Stadium,2010-06-01T13:10:13+0000,NY_TIMES,0
136,A Gender Gap Among Gifted Students,2010-06-01T13:12:51+0000,NY_TIMES,0
137,"Andrei Voznesensky, Defiant Russian Poet, Dies at 77",2010-06-01T13:20:12+0000,NY_TIMES,0
138,"Speed Read for Tuesday, June 1",2010-06-01T13:30:22+0000,NY_TIMES,0
139,Collapse of A.I.A. Deal Would Cost Banks Big Fees,2010-06-01T13:39:03+0000,NY_TIMES,0
140,Tell Us About Enmity in Your Building’s Board,2010-06-01T13:39:05+0000,NY_TIMES,0
141,Zipcar Files for a $75 Million I.P.O.,2010-06-01T13:57:41+0000,NY_TIMES,0
142,"Hey, Mr. Critic!",2010-06-01T14:03:20+0000,NY_TIMES,0
143,Today in Business Travel,2010-06-01T14:09:38+0000,NY_TIMES,0
144,Tuesday Reading: The Legal Risk of Online Complaining,2010-06-01T14:10:04+0000,NY_TIMES,0
145,Zipcar Files for a $75 Million I.P.O.,2010-06-01T14:19:07+0000,NY_TIMES,0
146,Ask a Bartender: Round One Responses,2010-06-01T14:28:26+0000,NY_TIMES,0
147,"Immigrant in Run for Mayor, Back Home in Mexico",2010-06-01T14:31:56+0000,NY_TIMES,0
148,Fallon: ‘A Bunch of Helium’,2010-06-01T14:32:29+0000,NY_TIMES,0
149,Leno: ‘Junk Shot’,2010-06-01T14:35:56+0000,NY_TIMES,0
150,Soderling Ends Federer’s Streak,2010-06-01T14:52:45+0000,NY_TIMES,0
151,The Twists and Turns in the Pequot Inquiry,2010-06-01T14:55:38+0000,NY_TIMES,0
152,"Canada Raises Key Interest Rate, With Eye on Inflation and Global Stability",2010-06-01T15:13:45+0000,NY_TIMES,0
153,The Webber/Vettel Controversy Continues,2010-06-01T15:14:34+0000,NY_TIMES,0
154,"June in Buffalo: Composers Hear Their Music, and Not Just in Their Heads",2010-06-01T15:18:01+0000,NY_TIMES,0
155,Indy 500 Driver ‘Lucky’ to Survive Crash,2010-06-01T15:18:36+0000,NY_TIMES,0
156,"Paterson Defends Layoff Plan, Blaming Union Leaders",2010-06-01T15:19:10+0000,NY_TIMES,0
157,Saudis Could Face Punishment by Religious Court for MTV Appearances,2010-06-01T15:19:33+0000,NY_TIMES,0
158,Chinese Honda Strike a Wake-Up Call for Japan ,2010-06-01T15:23:41+0000,NY_TIMES,0
159,What We’re Reading: The Popular Kids,2010-06-01T15:29:27+0000,NY_TIMES,0
160,U.S. Opens Criminal Inquiry Into Oil Spill,2010-06-01T15:32:09+0000,NY_TIMES,0
161,Inside Out | California Dreamy,2010-06-01T15:39:02+0000,NY_TIMES,0
162,A Godfather of Political Advertising,2010-06-01T15:39:27+0000,NY_TIMES,0
163,On Our Radar: BP Stock Falls,2010-06-01T15:41:33+0000,NY_TIMES,0
164,"Photographs From Coachella, Day 3",2010-06-01T15:44:34+0000,NY_TIMES,0
165,Bank Guard Kills 3 at Chinese Courthouse,2010-06-01T15:55:46+0000,NY_TIMES,0
166,The Best Places to Store Your Down Payment Money,2010-06-01T16:00:27+0000,NY_TIMES,0
167,Tea Party’s Push on Senate Election Exposes Limits,2010-06-01T16:15:21+0000,NY_TIMES,0
168,A School Grieves for Its Beloved Cook,2010-06-01T16:18:01+0000,NY_TIMES,0
169,Should Andy Pettitte Start the All-Star Game?,2010-06-01T16:21:20+0000,NY_TIMES,0
170,Not Loving Your Child,2010-06-01T16:27:04+0000,NY_TIMES,0
171,Q. and A. With Stuart Elliott,2010-06-01T16:28:24+0000,NY_TIMES,0
172,Zombie-Sat,2010-06-01T16:30:16+0000,NY_TIMES,0
173,Accounts and People of Note in the Ad Industry,2010-06-01T16:31:40+0000,NY_TIMES,0
174,Anger in Thai Parliament Mirrors Nation’s,2010-06-01T16:34:34+0000,NY_TIMES,0
175,"Quote Unquote | Hey, Knock It Off",2010-06-01T16:36:36+0000,NY_TIMES,0
176,Blackhawks Owner Reverses Team’s Old-School Legacy of Failure,2010-06-01T16:36:54+0000,NY_TIMES,0
177,"Master of His Domain; Lord of the Manor; Now, Director",2010-06-01T16:38:47+0000,NY_TIMES,0
178,Spillonomics: Underestimating Risk,2010-06-01T16:41:33+0000,NY_TIMES,0
179,Al and Tipper Gore Split Up,2010-06-01T16:45:25+0000,NY_TIMES,0
180,Bradley Expresses Confidence in Security Measures,2010-06-01T16:49:12+0000,NY_TIMES,0
181,"TimesCast | June 1, 2010",2010-06-01T16:54:14+0000,NY_TIMES,0
182,Fete Accompli | El Museo del Barrio Gala,2010-06-01T16:55:03+0000,NY_TIMES,0
183,Zach Braff to Star Off Broadway in ‘Trust’,2010-06-01T17:03:22+0000,NY_TIMES,0
184,"Eliminating Al Qaeda’s No. 3, Again",2010-06-01T17:17:50+0000,NY_TIMES,0
185,Health and the Broken Heart,2010-06-01T17:24:47+0000,NY_TIMES,0
186,"For Federer, Imagination Matches His Skill",2010-06-01T17:37:54+0000,NY_TIMES,0
187,Can a Small Company Say No to Whole Foods?,2010-06-01T17:47:01+0000,NY_TIMES,0
188,Justice Dept. Faults Attack Readiness,2010-06-01T17:48:58+0000,NY_TIMES,0
189,Berdych Reaches Semifinals,2010-06-01T17:52:26+0000,NY_TIMES,0
190,We Made It Ourselves | CB Sides’s Burger Booster,2010-06-01T17:55:22+0000,NY_TIMES,0
191,A Maker of Mayors Has His Moment in the Spotlight,2010-06-01T17:55:41+0000,NY_TIMES,0
192,Escape Clause Seen for Goldman and the S.E.C.,2010-06-01T18:00:11+0000,NY_TIMES,0
193,Go Tell the Spartans: Upload Your Video,2010-06-01T18:00:26+0000,NY_TIMES,0
194,Life as Bret Michaels Knows It,2010-06-01T18:01:30+0000,NY_TIMES,0
195,Malaria: A Student’s Firsthand Account,2010-06-01T18:02:05+0000,NY_TIMES,0
196,Q&A: A Low-Key Spot for Surfing,2010-06-01T18:08:33+0000,NY_TIMES,0
197,TimesCast: Responding to the Israeli Raid,2010-06-01T18:11:23+0000,NY_TIMES,0
198,Music Director Leaving Spoleto Festival USA,2010-06-01T18:13:40+0000,NY_TIMES,0
199,Bailouts in Retrospect,2010-06-01T18:13:52+0000,NY_TIMES,0
200,Ship Sinking Aids Ruling Party in S. Korean Vote,2010-06-01T18:17:56+0000,NY_TIMES,0
201,Judge Rules Moody’s and S.&P. Aren’t Underwriters,2010-06-01T18:28:52+0000,NY_TIMES,0
202,Critics’ Picks Video: ‘Monsoon Wedding’,2010-06-01T18:30:26+0000,NY_TIMES,0
203,Electric Car Warning Sounds: Don’t Expect Ring Tones,2010-06-01T18:34:38+0000,NY_TIMES,0
204,"Bees, Birds and Words to Ban From the Internets Crew",2010-06-01T18:35:19+0000,NY_TIMES,0
205,Polish Pilot Saw Chance of Landing,2010-06-01T18:50:59+0000,NY_TIMES,0
206,Updates,2010-06-01T19:00:14+0000,NY_TIMES,0
207,Why Photocopiers Have Hard Drives,2010-06-01T19:00:53+0000,NY_TIMES,0
208,The Morning Skate: Blackhawks Survive Carcillo and Flyers’ Pressure,2010-06-01T19:04:16+0000,NY_TIMES,0
209,Hotels: Fewer Deals but Low Rates,2010-06-01T19:11:14+0000,NY_TIMES,0
210,Memorial Day Racing on TV: Fox Wins Again,2010-06-01T19:15:57+0000,NY_TIMES,0
211,Game 2 Produces Strong Ratings,2010-06-01T19:17:54+0000,NY_TIMES,0
212,Tenet Confirms It Is in Talks to Buy Healthscope,2010-06-01T19:21:56+0000,NY_TIMES,0
213,"Dating, Sex and Herpes",2010-06-01T19:28:46+0000,NY_TIMES,0
214,"Stop, Laptop Thief!",2010-06-01T19:32:04+0000,NY_TIMES,0
215,The Week That Was: Team Nos. 100-94,2010-06-01T19:34:45+0000,NY_TIMES,0
216,Where Public Workers Run the Show,2010-06-01T19:36:13+0000,NY_TIMES,0
217,Vain Glorious | Fragrances for the Affianced,2010-06-01T19:40:12+0000,NY_TIMES,0
218,Schiavone in Semifinals After Her Latest Upset,2010-06-01T19:40:33+0000,NY_TIMES,0
219,Why Nudibranchs? And Readers’ Questions,2010-06-01T19:41:11+0000,NY_TIMES,0
220,"Kruse Auction House Has License Revoked, Owner Suspended",2010-06-01T19:42:19+0000,NY_TIMES,0
221,"Year-End Round-Up | Social Studies, History, Geography and Civics",2010-06-01T19:45:48+0000,NY_TIMES,0
222,Disney Puts Tickets on a Facebook Site,2010-06-01T19:46:35+0000,NY_TIMES,0
223,Regulators Examine 2 Ford Sedans After Mats Catch Accelerator Pedals,2010-06-01T19:49:30+0000,NY_TIMES,0
224,"Democrats Have Failed, G.O.P. Leader Tells Convention",2010-06-01T19:50:25+0000,NY_TIMES,0
225,A Waiting Game for Fishermen,2010-06-01T19:50:51+0000,NY_TIMES,0
226,A Bullish View of Wind Power Out West,2010-06-01T19:59:22+0000,NY_TIMES,0
227,New Feature: Great Ideas From Our Readers,2010-06-01T20:00:48+0000,NY_TIMES,0
228,Pre-refuting William Galston,2010-06-01T20:03:17+0000,NY_TIMES,0
229,Benmosche: We Have Options for A.I.A.,2010-06-01T20:08:17+0000,NY_TIMES,0
230,A Maker of Mayors Has His Moment in the Spotlight,2010-06-01T20:14:56+0000,NY_TIMES,0
231,Larry McMurtry Joins the E-Book Rush,2010-06-01T20:15:45+0000,NY_TIMES,0
232,A Changing Art Scene in Paris,2010-06-01T20:17:46+0000,NY_TIMES,0
233,"Andrei Voznesensky, Russian Poet, Dies at 77",2010-06-01T20:19:37+0000,NY_TIMES,0
234,Pictures of the Day: The West Bank and Elsewhere,2010-06-01T20:32:25+0000,NY_TIMES,0
235,The Morning Line: Pletcher Ends Another Hex,2010-06-01T20:32:33+0000,NY_TIMES,0
236,Putting Queens on the Tourism Map,2010-06-01T20:34:49+0000,NY_TIMES,0
237,More on Cortney Munna’s Student Loan Tale,2010-06-01T20:35:46+0000,NY_TIMES,0
238,"Queens Students Sickened, Probably by Contaminated Water",2010-06-01T20:46:55+0000,NY_TIMES,0
239,Not Exactly Preaching to the Choir,2010-06-01T20:50:10+0000,NY_TIMES,0
240,Some iPads Can’t Take the Heat,2010-06-01T20:51:54+0000,NY_TIMES,0
241,Case Study | Vintage Cocktails,2010-06-01T20:52:29+0000,NY_TIMES,0
242,"Mere Silence Doesn’t Invoke Miranda, Justices Say",2010-06-01T20:58:33+0000,NY_TIMES,0
243,Perfectionist Parents,2010-06-01T21:00:09+0000,NY_TIMES,0
244,Upscale Mexican Food in Philadelphia,2010-06-01T21:00:21+0000,NY_TIMES,0
245,Posada Is Closer to Returning,2010-06-01T21:01:37+0000,NY_TIMES,0
246,Kirsten Dunst Forgoes Laughs in Return to the Witness Stand,2010-06-01T21:04:24+0000,NY_TIMES,0
247,How Soderling Knocked Off Federer,2010-06-01T21:06:01+0000,NY_TIMES,0
248,"So Far, Revivals Eclipse Newer Pieces in City Ballet’s Season",2010-06-01T21:08:46+0000,NY_TIMES,0
249,Off the Menu: 1st Ave Steak Shoppe,2010-06-01T21:10:02+0000,NY_TIMES,0
250,The TV Watch: An ‘Oprah’ Visitation for the Royal She,2010-06-01T21:10:08+0000,NY_TIMES,0
251,Rachel Alexandra May Race on June 12,2010-06-01T21:21:14+0000,NY_TIMES,0
252,‘The Passage’,2010-06-01T21:21:55+0000,NY_TIMES,0
253,The Justice Department Seeks Evidence of Crimes in the Gulf,2010-06-01T21:22:34+0000,NY_TIMES,0
254,Blumenthal Is on the Air in Connecticut,2010-06-01T21:26:13+0000,NY_TIMES,0
255,Disney and Facebook Join Hands to Move Some Tickets,2010-06-01T21:27:45+0000,NY_TIMES,0
256,Literary Novelist Turns to Vampires and Finds Pot of Gold,2010-06-01T21:29:29+0000,NY_TIMES,0
257,Economist: Blame Government for the Crisis,2010-06-01T21:30:53+0000,NY_TIMES,0
258,Lexus Drives to the Jagged Edge,2010-06-01T21:32:12+0000,NY_TIMES,0
259,The Pink Tea Cup Returns,2010-06-01T21:32:35+0000,NY_TIMES,0
260,On Location in Transylvania,2010-06-01T21:33:05+0000,NY_TIMES,0
261,Morgenthau Withdraws From Fire Dept. Case,2010-06-01T21:39:57+0000,NY_TIMES,0
262,"In Romania, Creating a Bohemian Attic",2010-06-01T21:58:06+0000,NY_TIMES,0
263,Half a Dozen States Delay Tax Refunds,2010-06-01T21:59:37+0000,NY_TIMES,0
264,"Readers Take No Ifs, Ands or Cigarette Butts on the Sidewalk",2010-06-01T22:02:21+0000,NY_TIMES,0
265,Strike Status at Honda in China Is Uncertain,2010-06-01T22:06:48+0000,NY_TIMES,0
266,Loans That Vanished in a Property Bust Reappear,2010-06-01T22:09:00+0000,NY_TIMES,0
267,The iPad Pulse Reader Scales the Charts,2010-06-01T22:10:16+0000,NY_TIMES,0
268,On The Things They Carry,2010-06-01T22:12:04+0000,NY_TIMES,0
269,Another Los Angeles in ‘Gardener’,2010-06-01T22:12:44+0000,NY_TIMES,0
270,Showing the Benefits of ‘Green’ Retrofits,2010-06-01T22:17:20+0000,NY_TIMES,0
271,Recasting the Cold War as the Hitchcock Years,2010-06-01T22:22:12+0000,NY_TIMES,0
272,House Hunting in France,2010-06-01T22:23:38+0000,NY_TIMES,0
273,"Husband’s Expectation Meets Life, and Loses",2010-06-01T22:24:14+0000,NY_TIMES,0
274,House Hunting in ... France,2010-06-01T22:24:56+0000,NY_TIMES,0
275,"In Memoir, Christopher Hitchens Looks Back",2010-06-01T22:25:36+0000,NY_TIMES,0
276,"What You Get for $500,000",2010-06-01T22:31:04+0000,NY_TIMES,0
277,"What You Get for ... $500,000",2010-06-01T22:31:29+0000,NY_TIMES,0
278,Home Cooks Take to the Street,2010-06-01T22:36:32+0000,NY_TIMES,0
279,"Gaza: Reaction in Iraq, Pakistan and Afghanistan",2010-06-01T22:37:53+0000,NY_TIMES,0
280,Voters Make Choices in 3 Primaries,2010-06-01T22:38:59+0000,NY_TIMES,0
281,Activists Pledge to Send More Ships to Gaza,2010-06-01T22:40:09+0000,NY_TIMES,0
282,"Israeli Force, Adrift on the Sea",2010-06-01T22:41:58+0000,NY_TIMES,0
283,"Exotic Isle for Artists, Right in City",2010-06-01T22:47:16+0000,NY_TIMES,0
284,Sculptors With a D.I.Y. Style,2010-06-01T22:49:45+0000,NY_TIMES,0
285,"Creative Debate Among Sculptors, Not Too Loud",2010-06-01T22:49:51+0000,NY_TIMES,0
286,"At Spoleto, a Departing Director and a Premiere",2010-06-01T23:00:22+0000,NY_TIMES,0
287,"Unemployed and O.K. With It, if They’re Not Alone",2010-06-01T23:05:45+0000,NY_TIMES,0
288,A More Cheerful New York Subway Map,2010-06-01T23:09:09+0000,NY_TIMES,0
289,Rethinking the Gaza Blockade,2010-06-01T23:34:21+0000,NY_TIMES,0
290,Beirut’s Updated Lebanese Cuisine,2010-06-01T23:35:35+0000,NY_TIMES,0
291,"At Co-op City, Trash Piles Up as Workers Go on Strike",2010-06-01T23:41:16+0000,NY_TIMES,0
292,"A Chorus of Echoes, for Better and Worse",2010-06-01T23:41:20+0000,NY_TIMES,0
293,Frustrated Posada Is Eager to Return,2010-06-01T23:42:21+0000,NY_TIMES,0
294,ABC Kitchen,2010-06-01T23:42:25+0000,NY_TIMES,0
295,"Reviewing ABC Kitchen, in ABC Carpet and Home",2010-06-01T23:42:42+0000,NY_TIMES,0
296,Is There Still Hope for Syrah?,2010-06-02T00:01:12+0000,NY_TIMES,0
297,10 Ideal Syrahs From California,2010-06-02T00:02:43+0000,NY_TIMES,0
298,"Jobs Bill vs. Deficit, a Showdown in the Senate",2010-06-02T00:06:15+0000,NY_TIMES,0
299,Icahn Extends His Hostile Bid for Lions Gate,2010-06-02T00:08:25+0000,NY_TIMES,0
300,YouTube Dominates Online Video Views,2010-06-02T00:08:53+0000,NY_TIMES,0
301,Rossi a Surprise Omission From Italy,2010-06-02T00:10:08+0000,NY_TIMES,0
302,Flavors of the Garden in Shortbread Cookies,2010-06-02T00:15:35+0000,NY_TIMES,0
303,A Blade That Makes Pizza Cutting Easier,2010-06-02T00:15:36+0000,NY_TIMES,0
304,Off the Menu,2010-06-02T00:15:40+0000,NY_TIMES,0
305,Kyochon and Bon Chon,2010-06-02T00:15:44+0000,NY_TIMES,0
306,"For Would-Be Cooks in New York, a School With Small Classes
",2010-06-02T00:15:59+0000,NY_TIMES,0
307,Dining Calendar,2010-06-02T00:16:01+0000,NY_TIMES,0
308,"Young Food Entrepreneurs Make Their Future by Hand
",2010-06-02T00:16:02+0000,NY_TIMES,0
309,Organic Gin Just Like Farmers Make (but Legal),2010-06-02T00:16:03+0000,NY_TIMES,0
310,"Dried Limes, a Middle Eastern Secret for Flavoring Soups and Stews
",2010-06-02T00:16:09+0000,NY_TIMES,0
311,Top Chefs and Restaurateurs Are Drawn to Beirut,2010-06-02T00:16:11+0000,NY_TIMES,0
312,"Sour Beer Is Risky Business, Starting With the Name",2010-06-02T00:16:26+0000,NY_TIMES,0
313,The Israeli Commandos and the Flotilla,2010-06-02T00:17:47+0000,NY_TIMES,0
314,Cooking Up a Dream,2010-06-02T00:18:50+0000,NY_TIMES,0
315,Alaska Wants to Drill,2010-06-02T00:19:51+0000,NY_TIMES,0
316,Names of the Dead,2010-06-02T00:20:39+0000,NY_TIMES,0
317,First Aid for the Economy,2010-06-02T00:22:24+0000,NY_TIMES,0
318,Europe’s Debt Crisis Starts to Weigh on Manufacturing,2010-06-02T00:22:41+0000,NY_TIMES,0
319,Ball Kids Wake Up the French Open,2010-06-02T00:24:46+0000,NY_TIMES,0
320,Mayor Proposes Cutting School Nursing Positions,2010-06-02T00:24:57+0000,NY_TIMES,0
