full_title,date
Lisa Smith released on bail and moved to undisclosed location,2019
Five workplace trends for the new year,2019
"Delayed discharge of patients led to ‘loss’ of 200,000 bed days",2019
Traveller fails in race claim against Michael Healy Rae shop,2019
Person killed after being hit by train in Belfast,2019
Get Running with The Irish Times,2019
The changing culture of the workplace,2019
"Fair City actress ‘the life and soul of the party,’ funeral hears",2019
Two arrested after masked raiders use meat cleaver in shop raid,2019
Firm being blackmailed by hackers for $6m obtains Irish court injunction,2019
Fintan O’Toole: Snobbery is at the root of the housing crisis,2019
Man arrested over alleged rape on a ferry in Rosslare,2019
Flexibility a powerful tool in attracting staff,2019
Earn more than you think while working less,2019
Coombe hospital obstetrician appointed HSE clinical lead for abortion,2019
Greta Thunberg column is most read Irish Times article of 2019,2019
Closure of Cúnamh Adoption Services ‘a huge disappointment’,2019
Home helps to ballot for strike action in dispute over pay restoration,2019
Immigration crackdown sees rise in foreign nationals turned back at Dublin Airport,2019
Immigrant airport checks revised over destruction of fake papers,2019
People receiving homecare services face charges under Government reforms,2019
Suspect in Rose Hanrahan murder in Limerick held in UK,2019
Coveney says ‘mature debate’ needed on constitutional settlement for Ireland,2019
Priced out: Is Dublin’s accommodation crisis affecting business?,2019
Bars co-ordinate to ban ‘persistent troublemakers’ in Waterford,2019
Dutch hospital failed to tell Irishwoman of missed chance to identify cancer,2019
Win a National Book Tokens gift card,2019
Less than 15% of GPs sign up to provide abortion services,2019
Here is your handy guide to sport on television this week,2019
"Crime fiction: the pick of the criminal crop from Rebecca Gowers, Tim Maleeny and more",2019
Fintan O’Toole: Varadkar’s vacuous slogan reveals mean streak,2019
"Man arrested after gardaí seize €140,000 worth of heroin",2019
Mrs Brown’s Boys most watched TV show on RTÉ on Christmas Day,2019
Man found dismembered at Cork house seen alive evening before,2019
Thousands of Dublin homes face end of wheelie bin reprieve,2019
Pricewatch: 2019 was eventful for hard-pressed consumers,2019
Oliver Callan: lack of organised protest sees rents in Ireland rise unchecked,2019
Dublin Airport must pay compensation to deaf passenger who missed flight,2019
Local Property Tax: Another case of the Dubs versus the rest,2019
Minister says early flu season has led to more people on trolleys,2019
Images of the Day,2019
Fifty Syrian refugees arrive at Mosney Direct Provision centre,2019
Catholic parish apologises for hurt caused by anti-IVF message,2019
Dublin pitches closed due to damage caused by joyriders,2019
Irish Coast Guard warns against over-reliance on mobile phones when at sea,2019
"Abuse towards nurses now ‘expected’ part of job, INMO says",2019
Europe basks in unseasonably warm temperatures as New Year beckons,2019
Una Mullally: We can use the new decade to claw back freedom from technology,2019
Johnson will abandon pledge on Brexit transition period - Hogan,2019
"FAI has been run ‘like a fiefdom’, Harris says",2019
"Death of Brendan Ó Cathaoir, historian and former Irish Times journalist",2019
New Year’s Eve events guide: Where to go and what to do,2019
Warm tributes paid to man murdered in derelict Cork house,2019
Attenborough tells Greta Thunberg she has made ‘astonishing’ impact,2019
Rescue 116 crash could happen again unless there is reform - pilots warn,2019
Plan to double number of pupils in Irish-speaking schools,2019
Postmortem confirms homeless man was murdered in Cork,2019
‘Dear Anne’: Woman tries to reunite 1943 letter with family,2019
Brendan Bracken - press relations expert and loyal friend and family man,2019
Loyalty cards and other drinks promotions to be banned in 2021,2019
All homes to have brown bins in move to improve waste management,2019
Woman (30s) sexually assaulted in Tallaght on Christmas Eve,2019
Voluntary pay cut by McCarthy would be ‘welcome’ - Ross,2019
List of people murdered by IRA over alleged ‘informing’ published,2019
Commuter group urges ‘big bang introduction’ of BusConnects,2019
The Great American Sports Page: Tracing the evolution of sports writing,2019
Gardaí receive 30% more reports of domestic violence in December,2019
TD expresses shock at ‘intolerable’ abuse of hospital personnel,2019
"Busted flush: Dublin City Council fails to spend €200,000 fund for public toilets",2019
Phil Hogan: 'A no-deal Brexit would pour salt into the wounds',2019
Man dies after taking ill during a dive in Cork Harbour,2019
"Liquidation of FAI not a viable option, says Ross",2019
Creed rejects call for ban on live animal exports,2019
Murder in Cork is a violent tale with a Gothic setting,2019
Catholic parish under fire for Christmas message condemning IVF,2019
"Fintan O’Toole: Greta Thunberg is a prophet, preacher, rulebreaker, avenging angel",2019
Win a luxurious two night stay for two at any of Flynn Hotels,2019
Man dies after house fire in east Belfast,2019
Images of the weekend,2019
Chris Johns: Happiness requires economic growth but not excess,2019
DCU team examines use of drones to monitor wind and solar farms,2019
Christmas goodbyes: ‘The hardest part is when you don’t have a date to meet again’,2019
Sally Rooney’s novel among Barack Obama’s favourite reads of 2019,2019
Luas Green line services resume following stoppages on Saturday,2019
‘I’m a 31-year-old woman and I have never orgasmed with a partner’,2019
Archbishop calls for alliance to combat ‘the right’,2019
There was only one story of 2019 in Irish politics. And it wasn’t ‘Swing-gate’,2019
"Varadkar pledges tax cuts, pensions hike and public sector pay rises",2019
How Boris Johnson became Britain’s most powerful prime minister since Tony Blair,2019
2019 in pictures: Irish Times photographers select their images of the year,2019
Should you get up early or sleep in during winter holidays?,2019
Victim of violent Cork death may have been homeless man in 50s,2019
Best pictures of 2019,2019
Man dies after car crash in Co Longford,2019
Gym membership: why Ireland is among the most expensive in Europe,2019
Five hospitalised after two-car collision in Co Roscommon,2019
Enoch Powell: Radical and racist figure still haunts British politics,2019
Gifting of ancient table caused protests and court actions,2019
Church services,2019
Body of man discovered at derelict house in Cork city,2019
"Win €1,000 to spend at Kildare Village this weekend",2019
Large section of Luas Green line down until Sunday due to power failure,2019
The 10 reasons why house prices and rents must fall,2019
"Fair City actor Jean Costello, known for playing Rita Doyle, dies",2019
Dublin house evacuated after electric scooter went on fire,2019
"Mental health services need 2,400 extra staff, figures show",2019
Suffer Little Childer - Frank McNally on one of the year’s most inauspicious dates,2019
Our top 10 most read business stories of the year,2019
Mother (25) who died following crash in Co Donegal is named,2019
"For Ana Kriégel’s family, the ordeal is far from over",2019
Arrest made in Rose Hanrahan murder investigation,2019
The Americanisation of Ireland: Our relationship with America was not all one way,2019
Flu outbreak linked to 18 deaths and strain on emergency departments,2019
Mother claims there was ‘something wrong’ with Costa del Sol pool where children died,2019
Wild romantic stays: Eight cosy Irish rentals for the holidays,2019
Revenue: P60 and P45 to be replaced by online tax system changes,2019
Lyra McKee death: Police examining ‘significant amount’ of video evidence,2019
Maybe Johnson and Trump should try diplomacy for a change in 2020,2019
Thinking Anew - Songs of regret and songs of hope,2019
Fees for private schools jump as enrolments return to boom-time high,2019
"Fintan O’Toole: 2019 was a bit like Game of Thrones - lots of action, no climax",2019
Rising fees lead many to question value of private education,2019
Lessons in diversity: The changing face of teaching in Ireland,2019
David McWilliams: Where is the slowdown experts warned us about?,2019
"Lyra McKee’s legacy: 'I have no doubt it will happen again,' partner says",2019
The Greta Thunberg effect: ‘Hero and villain’ of 2019,2019
Snow Patrol’s Gary Lightbody and cricketer Eoin Morgan on queen’s honours list,2019
Self-care best tonic for most as flu season stretches hospital capacity,2019
The five financial mistakes to avoid in your 30s,2019
Mystery still surrounds 1929 disappearance of Co Waterford postman,2019
Man in court following St Stephen’s Day stabbing in Belfast,2019
"Judging Bertie Ahern: ‘We all partied, but he served the drinks’",2019
The Irish Times Digital & Print Subscriptions,2019
Man charged after shooting in Waterford,2019
Gardaí investigate video of child on scrambler bike hitting lamp post,2019
"Gardaí seize €250,000 worth of stolen bicycles in south Dublin",2019
Making and selling of products containing microbeads banned,2019
Man charged over Cork stabbings to apply to High Court for bail,2019
Man charged with double murder in Belfast makes ‘full admissions’,2019
Last call: Latest Irish phonebook could be the final edition,2019
Just 456 public payphones are left in the State,2019
PPS numbers to verify voters’ identity in electoral register,2019
"Goodbye to a decade, hello to a 2020 full of uncertainty",2019
Women living longer than men - but only by three years,2019
"Record 900,000 passport applications in 2019 - 94,000 from UK",2019
"Cyber attack on Irish data centres would badly hit economy, report warns",2019
Suicide rate fell by over a third in past decade,2019
"Climate change will impact people’s health, expert says",2019
Minister warned by Revenue over tax relief for bookmakers,2019
"The Eighth Life review: czars, communism and misery",2019
Works to secure house where Ana Kriégel murdered,2019
Government planning to clamp down on quad bike ‘anarchy’,2019
Harris asks media to stop using alcohol industry-funded resources,2019
Plans to create new drugs helpline for people living with addiction,2019
News Subscription Gift | IrishTimes.com,2019
Clifden Road closes after eight injured in two-car collision,2019
Taoiseach seeks banker as Leopardstown festival begins,2019
"Airbnb appeal: Lucrative, exempt from rent controls and possibly tax free",2019
North’s police chief angers nationalists with provocative photograph,2019
Trump warns of ‘carnage’ in rebel Syrian stronghold,2019
Ten reasons why you can’t get a mortgage in Ireland,2019
Images of the day,2019
Police search for armed assailant after car hijacking,2019
Man in his 30s dies after single-car crash in Co Donegal,2019
Two men jointly charged with raping 12-year-old girl in Belfast,2019
Gardaí say drug driving is becoming as prevalent as drink driving,2019
Man appears in court over Navan house fire on Christmas night,2019
Belfast man (35) charged with double murder of friends he was drinking with,2019
Nearly 800 children contacted Childline on Christmas Day,2019
"Conor Pope's ultimate guide to the Christmas sales - tips, deals and your rights",2019
Man in his 30s arrested after house fire in Co Meath,2019
Philippines typhoon: Death toll rises to at least 20,2019
Meath murder mystery: The case of the poison potato cake,2019
‘People were queuing from 3am’ - rampant consumerism resumes after Christmas break,2019
Four graphs show how key economic trends affected people in Ireland in 2019,2019
Fintan O'Toole: There is nothing undemocratic about voting again on Brexit,2019
Woman in critical condition after road crash in Co Galway,2019
Galway cafe opens its doors to those in need on Christmas day,2019
Man’s 4th Best Hospital review: satirical sequel to The House of God,2019
Children's hospital: A spectacular example of how things can go wrong,2019
Thousands of people take part in Goal Mile this Christmas,2019
"Taoiseach, partner and thousands of others take part in Christmas day swims",2019
Hundreds attend St Columbanus annual Christmas day dinner,2019
Conor Pope chats to Santa | The Irish Times,2019
Woman released without charge in relation to Waterford shooting,2019
Man (54) charged with stabbing three members of same family in Cork,2019
Fintan O’Toole: The logic of Trump and fascism is escalating violence,2019
It’s back to the future at beautiful Breaffy,2019
Three arrested over shooting of man in Waterford city,2019
No Authority: Anne Enright’s forensic reflections as fiction laureate,2019
Bono is a hypocrite - and so is Ireland,2019
Man charged with murder of two people in Belfast flat,2019
Lisa Smith likely to spend Christmas in prison after ruling,2019
‘Santa Claus is Coming!’ A Christmas Eve poem from 1885,2019
"Numbers using methadone soared over past decade, figures show",2019
Merchant’s Quay granted permission for Dublin drug injection facility,2019
Charity Auction: Enjoy a Michelin star dinner for 6 in your home,2019
Fintan O'Toole: We need to sing a Christmas lullaby to ourselves,2019
Christmas tree sales grow strongly as consumers ditch plastic,2019
Three prisoners removed from Mountjoy roof after overnight protest,2019
"Attack on Cork family may be related to family dispute, gardaí say",2019
The Catholic Church and the Northern Ireland Troubles: A seminal book,2019
Family of eight to endure a fourth homeless Christmas,2019
Negotiators ‘engaging’ with four prisoners on Mountjoy Prison roof,2019
Charity Prints from The Irish Times,2019
All I want for Christmas is an anti-consumerist backlash,2019
"Failure to disclose errors should mean sanctions, says HSE chief",2019
Plan for 550 apartments on Chivers site leaves sour taste,2019
Woman given non-custodial sentence for serious assault of boy (4),2019
"Bus driver faces racial abuse regularly, called a ‘Tan’ and told ‘go home’",2019
‘Cash-for-ash’ scandal book becomes publishing sensation in North,2019
"‘The trial was on a par with the rape, but I’m glad I testified’",2019
Merchants Quay: ‘When they’re asleep we leave their gift at the end of their mat’,2019
Woman assaulted for six hours by ex-partner granted protection order,2019
Part of M1 motorway closed in North after ‘serious’ crash,2019
This year’s top 10 Christmas conversation killers,2019
Teen spared sentence for role in vicious gang attack over greeting card,2019
"Inquiry still possible into Dara Murphy Dáil attendance, says Creed",2019
Lisa Smith may spend Christmas in jail despite bail ruling,2019
David McWilliams: Dublin’s housing market not yet ripe for a crash,2019
Varadkar leapfrogs Bruton to avoid being shortest-serving Taoiseach,2019
Home - Drinkaware,2019
Governments to make big post-Christmas push for agreement to restore Stormont,2019
Murder investigation after two people stabbed to death in Belfast flat,2019
Man in 30s seriously injured in Waterford shooting,2019
Students’ Dublin city centre sleep-out: ‘We get to all go back to our beds tomorrow’,2019
Enrolments in multidenominational schools up 4%,2019
"HSE to pay €30,000 to nurses over delay in publishing bullying claims report",2019
Minor injury unit fees drop to €75 in effort to relieve A&E overcrowding,2019
Mother killed in crash had ‘heart of gold’ and ‘lived life to the full’,2019
Cork man remanded over alleged child porn offence in Co Kerry,2019
All hands on deck when Ireland’s only quintuplets first came home at Christmas,2019
Mayor of Palermo accuses EU of ‘genocide’ against refugees,2019
Boeing ousts Muilenburg as CEO as 737 Max crisis deepens,2019
Injunction granted against protesters at Ballinamore direct provision centre,2019
"Garda spent €72,000 repairing bicycles used by officers",2019
A 23-year investigation: What next for the Sophie Toscan du Plantier murder case?,2019
"Legionaries founder sexually abused 60 boys, order’s report finds",2019
Christmas weather: mixed outlook with no chance of snow,2019
"Choirs welcome 120,000 passengers at Cork Airport over Christmas",2019
What changes could improve education in 2020?,2019
Higgins calls for ‘spirit of hospitality’ in Christmas message,2019
Mother grieving loss of all three children says ‘there is too much space around me now’,2019
"Five Irish Women: The second republic, 1960-2016: A well-written, clever, very useful book",2019
"M11 upgrade will ‘devastate’ historic houses, say conservationists",2019
Patient kept in seclusion for 111 hours in Central Mental Hospital,2019
Religious leaders urge NI parties to restore Assembly,2019
Ken Early: The secret of Liverpool’s success - failure is no longer indulged,2019
'They were all devastated': Insurance costs shut child gym classes,2019
"Alerts missed at Leixlip water plant that put 600,000 on boil notice",2019
Sligo community playground shuts due to lack of insurance,2019
I found out my partner cheated years ago and I'm so angry,2019
Substandard housing: A dozen Dublin landlords lose Hap payment,2019
Images of the Weekend,2019
PSNI revisit scene of ‘vicious’ and ‘prolonged attack’ on family in Belfast,2019
Damages claim by man whose murder conviction was quashed fails,2019
Micheál Martin: Varadkar will run a 'Boris Johnson-style campaign' in the general election,2019
Great-grandfather left fighting for life looks forward to family Christmas,2019
Tesco Ireland pulls sale of charity Christmas cards from Chinese factory,2019
Varadkar says domestic violence is at ‘epidemic’ levels,2019
"Architect, engineer, technician or builder? Who to call when you plan to build",2019
"No Child 2020: Its five demands, and what it achieved",2019
Rugby stars line out with Focus Ireland to take on homelessness,2019
Garda Ombudsman says commissioner won’t alert it of complaints,2019
"It’s our fourth homeless Christmas, our third in a ‘family hub’",2019
Gardaí appealing for information following shooting incident in Galway,2019
"Poverty in Dublin: Over 2,500 food parcels given to city’s poor",2019
Central Bank inquiry into Fingleton terminated,2019
‘My house was destroyed. The whole place was soaking’,2019
Life in a hospice: ‘Everything is done. The plot is bought’,2019
Taoiseach says he has experienced ‘a degree of racism and discrimination’,2019
How best to tackle the pressing matter of inheritance tax,2019
"Hundreds of elderly people could end up in homeless hubs within 5 years, says charity",2019
Man due in court over planned murder in relation to Coolock gang feud,2019
"‘After the death of my children, Christmas is a black surround, without tinsel’",2019
Pesto sauces recalled over fears of unaccounted peanuts,2019
"Gardaí investigating €1,200 theft from prisoner at Cork station",2019
Nadine Lott’s funeral hears of ‘amazing mother’ and ‘incredible daughter’,2019
"Drivers must not get behind the wheel when hungover, says AA Roadwatch",2019
Allegations of sexual abuse rock the US world of Irish dancing,2019
"More than €70,000 raised to help family of Irish nurse killed in Australia",2019
More than 100 prisoners being given temporary release over Christmas,2019
Irish Rail apologises to married lesbian couple who were asked for proof of union,2019
Garda liaisons planned for South America to tackle cocaine importation,2019
Foul play ruled out in death of woman (60) found in Cork city flat,2019
"Knuckle dusters, hammers, bats used by paramilitaries in North in 2019",2019
David McWilliams: Brexit and the economics of love/hate,2019
High-profile rape case raises questions for Japanese society,2019
Man accused of using Snapchat for witness intimidation,2019
Christmas tech: smart toys to keep the kids entertained - and educated,2019
Husband and wife accused of murdering five-year-old daughter,2019
The Poems of Dorothy Molloy: lost jewels rescued,2019
Cardinal (92) who ‘sought deal’ to bury sex abuse documents resigns,2019
Kerry Group criticised for poor human rights disclosure,2019
Berlin police evacuate Christmas market to investigate suspicious object,2019
Donegal nurse killed in Australia when ‘tree fell on car’,2019
Rescue of horse from pool of bog water hailed as ‘Christmas miracle’,2019
Elizabeth Bowen - a Literary Life: Refreshing interpretation of novelist’s life,2019
Green homebuyers can avail of lower rate mortgages and loans,2019
Senior executive unfairly dismissed for posting 'very offensive' WhatsApp messages,2019
Two confirmed dead in south Australian bushfires,2019
Fintan O'Toole: The big question of the last decade is...,2019
‘I’m a 40-year-old woman. How do I tell a man I’m a virgin?’,2019
Facing reality on the State pension,2019
Man who drove through red light causing fatal collision avoids jail,2019
Johnny Ronan: The ‘sweat equity’ comeback of a flamboyant businessman,2019
Catholic adoption agency Cúnamh closes its Dublin doors after 106 years,2019
Man (30s) killed in road traffic collision in Dublin,2019
Man due before court over child pornography allegations,2019
Man arrested in connection with 2011 Co Leitrim murder,2019
Farry’s cúpla focal is music to ears of the House of Commons,2019
Woman (70s) killed in road traffic collision in Co Cavan,2019
Killer whales stranded on Irish shores had ‘very high’ pollutants,2019
Leo Varadkar ‘glad’ Verona Murphy did not get elected,2019
"Court writes down Laois woman’s mortgage by almost €175,000",2019
Man (38) dies after being struck by car early on Saturday morning,2019
Two men released without charge after arrest following Cork robbery,2019
DUP denies it is responsible for failure to reach deal to restore Assembly,2019
Clouds block sunlight entering Newgrange chamber ahead of Winter solstice,2019
Fintan O’Toole: Did the Irish Times ‘No Child 2020’ project work?,2019
"For some Irish emigrants, New York has been a fairy tale",2019
Ireland’s shortest day will not fall on December 21st this year,2019
Over 200 people to avail of Cork Penny Dinners on Christmas day,2019
MI5 has ‘legal power’ to authorise agents to commit crimes,2019
Man (40s) struck by car in Limerick city,2019
"Chawke to appeal €33,000 award to Traveller family refused service",2019
Gardaí seek help in locating missing Cork man,2019
Varadkar issues election date challenge to Fianna Fáil leader,2019
Critical role of homecare: ‘I don’t want to go into a home’,2019
"Attempted ATM theft in Ardee, Co Louth",2019
Ross O’Carroll-Kelly: ‘I might be a d**khead - but I’m not an a**hole’,2019
Soulful ditches: A day of fencing,2019
Dara Murphy failed to vote despite being fobbed in,2019
Rector and priest embark on joint Christmas fast for charity,2019
Priest says most Christmas hymns a load of ‘holy smoke’,2019
Government accused of failing to deliver on homecare promises,2019
What bird built this nest? Readers’ nature queries,2019
Public has limited sympathy for children locked in poverty,2019
The time has come to end child poverty once and for all,2019
Michael Viney’s Christmas quiz: Test your nature knowledge,2019
Sometimes we may not be happy at Christmas,2019
Michael Harding: I worry I’m the elephant in the room,2019
"Garda operation saw fall in Bangladeshi, Pakistani and Indian men getting married",2019
Insurers paying out on ‘spurious’ claims rather than going to court,2019
Shane Ross welcomes proposal for FAI ‘crisis committee’,2019
Visually impaired driver who killed woman has sentence reduced,2019
Best new poetry of 2019: Strong year for work from the living and the dead,2019
Man who spent 16 years in jail for son’s murder sent to Central Mental Hospital,2019
"Are you a high income earner if you are on €80,000 a year?",2019
Man’s conviction for murdering woman he had affair with upheld,2019
Government approves appointment of three new judges,2019
No white Christmas on horizon with bright and dry days forecast,2019
Hundreds of restaurants at risk of closure as insurers exit hospitality sector,2019
Industrial action called off at Virgin Media Ireland as talks are agreed,2019
Taoiseach wants guarantee of FF support before agreeing election date,2019
"Man who exposed genitals near child in Penneys, gets suspended sentence",2019
"Mother-of-three, charged with murdering boyfriend, granted Christmas bail",2019
Campaign by Irish woman changes how UK police deal with suicidal drivers,2019
Permission for wind farm between Cork and Kerry villages quashed,2019
Group’s challenge to Cork-Ringaskiddy motorway dismissed,2019
"Couple are first to be convicted of female genital mutilation, court told",2019
Man (54) jailed for defiling three girls and child porn possession,2019
"Minimum wage still lagging behind living wage, say unions",2019
Varadkar tells Ministers Dáil does not have to be sitting for election to be called,2019
Court hears of ‘translation issues’ with French Ian Bailey judgment,2019
"‘Hey, beautiful ladies’: Man cleared of street harassment in Rotterdam",2019
"Rotunda ultrasound machine appeal passes €76,500 target",2019
Supreme Court rejects man’s appeal over conviction for rape of niece (11),2019
Grand Canal CCTV cameras to be reinstated following attacks on cyclists,2019
Cooking Christmas dinner: The ultimate guide to the big day,2019
Olympic Federation president calls for crisis committee for FAI,2019
Slow growth in retail sector as online shopping levels off,2019
Man who stabbed Japanese victim to death sent to Central Mental Hospital,2019
"Parties must agree deal to take Dáil to Easter, says Martin",2019
Brexit: British MPs resoundingly approve EU withdrawal agreement,2019
"Monica Leech loses court challenge over €165,000 legal fee rulings",2019
