full_title,date
Man wins ‘fleeting defamation’ case against Luas and is awarded €500,2019
Burglary stories: ‘I slept with the light on for a year afterwards’,2019
Asylum seeker not guilty of murder by reason of insanity,2019
What Irish house prices say about the regional economic divide,2019
Newborn baby dies after being found in toilets of Rotunda,2019
FAI reform group wants board appointments shake-up,2019
How Northern Ireland will vote: Election 2019 predictions,2019
Police make several arrests in Fermanagh over historical abuse,2019
"State is ‘letting children down’ on housing, says Minister",2019
Ross and McDowell trade insults over Judicial Bill,2019
Voluntary housing association Circle to build 250 homes,2019
FAI crisis: Ross says plan to fund grassroots nearly ready,2019
Three arrests over Wayne Whelan murder in Lucan,2019
Delays to Heuston services after horses hit by train,2019
Leixlip water plant repairs causing shortage in supply across Dublin,2019
Over 40% of people wash Christmas turkey despite warning,2019
"One person dies of cocaine overdose every week, figures show",2019
These books on science history are ideal for Christmas stockings,2019
"Tottenham brushed aside by Bayern, could the clock be stopped at scrum time?",2019
Gay Byrne and Brexit: What Ireland talked about most on Facebook,2019
New BusConnects proposals ensure most areas near ‘decent’ services,2019
The battle to save Ireland’s birds,2019
"No ‘major retail’ for Phoenix Park, says OPW commissioner",2019
Gordon D’Arcy: The Ireland camp in 2019 became a difficult place to operate,2019
Former Irish naval vessel sold to Libyan civil war leader,2019
Funicular plans for Phoenix Park to be abandoned,2019
State advised on further events in ’decade of commemorations,2019
Mothers with newborns going from hospital to homeless services,2019
Man who sued Lidl over back pain from lifting onions settles case,2019
"COP25: ‘If the big emitters fail, everything will fail,’ UN secretary general warns",2019
Two Irish men charged in the UK with drug and weapons offences,2019
Gardaí arrest 300 for intoxicated driving since end of November,2019
Farmers protest outside Dunnes Stores depot over beef prices,2019
Alleged perpetrators of acid attack on teenagers will not be charged,2019
Bruton tells UN of Ireland’s high target for decarbonised economy,2019
Existence of policing ‘no-go areas’ denied by Garda,2019
Woman who didn’t recognise herself in mirror after crash wins award,2019
Around 500 families turned away from one refuge last year due to a lack of space,2019
Call for clarity on cap for personal injury damages,2019
Sex education review does not recommend changes to ethos opt-out rule,2019
"Man fled naked to granny’s house after being found in bed with another man’s fiancee, court told",2019
Healy-Rae brothers and their friend appeal convictions for assault,2019
"Best debuts of 2019: despite perennial difficulties, talent has emerged",2019
UCD president: ‘Employers nowadays want more rounded graduates’,2019
"‘All these years, I’ve taken the rap for being the unfaithful one’",2019
"Europe’s green new deal leaps climate issue centre stage, Ryan says",2019
East Belfast: Can DUP staunch Alliance ‘surge’?,2019
Judicial Bill finally passes Seanad after almost 125 hours of debate,2019
"Couple moved back into repossessed boarded-up home after it was vandalised, court told",2019
Taoiseach says Government will end lower pay for doctors who treat only public patients,2019
Taxi driver (84) jailed for abusing adopted daughter,2019
Newton Emerson: I can imagine being in a united Ireland but not of it,2019
Northern Ireland leaders make final pitches to voters,2019
Government introduces new capital project spending rules,2019
Solidarity TDs to put forward Bill facilitating political strikes,2019
UCD plans to expand and become Ireland’s ‘largest’ third-level institution,2019
‘My son believes he is female and I am finding it incredibly difficult’,2019
Solicitor given four-year suspended jail term over theft from clients,2019
Food and Drink Club Newsletter - The Irish Times,2019
Cost of Dáil printer that was too big for room rises above €2m,2019
"National Lottery scratch cards were missing €180,000 in prizes",2019
More stories from commuter hell: ‘On the bike there is the constant battle between logic and chance’,2019
Limerick FC owner hits out at FAI as club heads for liquidation,2019
Man arrested over killing of Derry teenager 20 years ago,2019
‘No evidence’ for terrorism links behind Dundalk killing,2019
"Family of woman who died in hit and run secures €135,000 settlement",2019
Taoiseach says ‘Santa will find’ homeless children,2019
"Creches should make vaccinations mandatory for children, Harris says",2019
Anti-social behaviour used by gangs to control parts of south Dublin - research,2019
Bertie Ahern announces referendum result in Papua New Guinea,2019
"EU’s Green Deal a ‘European man on the moon moment’, says commission president",2019
D-Day minus one: UK faces most consequential election in a generation,2019
Ex-garda arrested on suspicion of bribery over fraudulent immigration applications,2019
Lisa Smith remanded in custody for further four weeks,2019
"More CervicalCheck women to receive €2,000 payment, Minister confirms",2019
Greta Thunberg accuses politicians of looking for carbon trading loopholes,2019
Greta Thunberg named Time magazine’s person of the year,2019
"What’s going on at the Abbey: heated exchanges, impassioned defences and disputed records",2019
"More than 3,500 parents waiting to have childcare scheme applications approved",2019
"Over 3,000 requests for refuge from domestic violence refused in 2018",2019
"Proposed bus services for Stepaside, Ballyogan remain ‘limited’, says council",2019
Garda to train ‘champions’ to encourage human rights approach to policing,2019
Ireland to join global alliance committed to climate action,2019
Medics call for end to direct provision over child welfare concerns,2019
‘Pristine’ waterways: Ireland’s best rivers,2019
"Rugby World Cup, Gay Byrne and ‘How to boil an egg?’ among Google most searched in 2019",2019
All Blacks reveal new head coach; Liverpool qualify for last-16 on top,2019
Disease prediction brought closer by Irish research discovery,2019
Hospitals to open 190 extra beds to in attempt to ease winter pressure,2019
New Liffey bridge in Dublin to cost more than €20m,2019
Plans to build 512 apartments in Howth lodged with Bord Pleanála,2019
Law reform body reviews cap on personal injury awards,2019
"The End of Love: Disposable partners, ghosting and casual sex",2019
Miriam Lord: Leo uses UN rankings to shield himself from Dáil attacks,2019
Taoiseach tells Dáil remedy for whiplash a ‘compensation payment’,2019
Climate striker hits out at deliberate jargon and confusion at UN talks,2019
Call for endometriosis ‘centre of excellence’ to be developed,2019
Wife of man accused of murdering infant son says way husband treated is ‘beyond cruel’,2019
Key witness in Sophie Toscan du Plantier murder inquiry dies,2019
Millennials and money: Four dangers of leaving things late,2019
Trinity College researcher awarded €2m for project on back pain,2019
New Bill aims to improve delivery of public services in Irish language,2019
Direct provision centre to open in Ennis,2019
Northern Ireland politicians battle it out on BBC debate ahead of polling day,2019
Man (57) hurt lifting 20kg bag of onions sues Lidl over back pain,2019
Fintan O’Toole: Boris the loveable buffoon beats Johnson the charlatan,2019
Bill Cosby loses appeal to overturn sex assault conviction,2019
Driver pleads guilty to fleeing scene of fatal hit and run,2019
Call for funds for environmentally-friendly farmers to protect rivers and lakes,2019
Man pleads not guilty by reason of insanity to fatal stabbing in Dundalk,2019
Embattled FAI reports threats made against staff to gardaí,2019
Irish Times parliamentary correspondent Michael O’Regan retires,2019
Hundreds of online child abuse investigations on hold pending Dwyer ruling,2019
"Garda ‘came forward’ to strike RTÉ cameraman, reporter says",2019
"Girl (9) remains in critical condition after alleged attack by parents, court told",2019
Rent freeze Q&A: Could a Bill before the Dáil end ‘high-rent misery’?,2019
Fianna Fáil to support Sinn Féin Bill on rent freeze,2019
Religious order has ‘ethical responsibility’ to pay more towards Tuam excavation,2019
The four tricks the super rich use to avoid paying tax,2019
Paul Anthony McDermott obituary: Leading lawyer and academic destined for the bench,2019
Nun found guilty of breaking planning laws at Cork compound,2019
Settlement of €1.35m for woman injured in ‘horrific crash’,2019
"Kerry slug and bat habitats will be disturbed by greenway, court told",2019
Hit-and-run driver jailed for 20 months after fatal Naas Road crash,2019
Abbey accused of reneging on promise of more Irish plays,2019
Sniffer dog detects grow house worker concealed in chimney,2019
"Elderly woman fit for discharge remains in busy hospital, court told",2019
Royal College of Surgeons becomes State’s ninth university,2019
Democrats unveil impeachment charges against Donald Trump,2019
FAI employees remain in dark on potential redundancies,2019
PSNI investigate fake Colum Eastwood campaign letter,2019
Suspected serial burglar arrested after high-speed M50 chase,2019
A luxury escape to the five star Westin Dublin,2019
Girl scout was ‘stabbed’ in knife-throwing incident at camp,2019
UK election: Brexit and Boris trigger fear and loathing in Tory Town,2019
"More than 1,000 homes approved for south Dublin",2019
FAI staff looking for clarity on job security; Gerry Thornley on Ireland’s halfback dilemma,2019
Three arrested as part of Garda operation targeting forgery gang,2019
Ryanair set a profit target of €1.75bn for managers in share options scheme,2019
"Travellers forced to hide identity to get jobs, committee hears",2019
"Central Bank says 34,000 houses needed each year for next decade",2019
Woman in her 80s dies in Wexford house fire,2019
"‘The injuries I saw were like any victim of a car crash,’ says dentist honoured for fighting domestic violence",2019
Irish universities secure six prestigious European research grants,2019
Consumers warned about buying stolen meat,2019
"Current family law court facilities ‘archaic’, says campaign group",2019
Brexit explainer: Why are border checks back in the news?,2019
Beef prices: Farmers protest at Musgrave centre in Co Kildare,2019
Irish woman feared caught up in NZ volcano was miles away,2019
"Brexit deal requires checks between Britain and North, Coveney says",2019
"Ireland improved on climate change last year, report says",2019
Denis Staunton’s UK election diary - Disastrous day for Johnson,2019
Nationwide wind warning issued with damaging gusts forecast,2019
Raising minimum wage in 2018 had only ‘short-lived’ impact,2019
CEO hacked employee’s phone and downloaded ‘intimate’ images,2019
Barrister Paul Anthony McDermott dies,2019
The Secret Teacher: Should we allow teachers have their own child in class?,2019
"Ireland has third highest quality of life in world, says UN report",2019
"Poverty in Ireland: Over 140,000 children in cold, damp homes",2019
RTÉ gets a €10m Christmas present from Government,2019
Commuter hell: ‘My daily commute is affecting my mental health’,2019
Halls not decked with boughs of lolly? These money tips might help,2019
Thief escapes with money after cash in transit robbery in Dublin,2019
RTÉ set to receive extra €10m from Government,2019
"FAI will have to restructure or face winding-up, says expert",2019
"Couple’s €75,000 defamation claim over being asked to pay restaurant bill fails",2019
I teach in a Catholic primary school but I’m not a believer. Must I teach the sacraments?,2019
"Just 20 of Ireland’s rivers are ‘pristine’, down from 500 in 1980s",2019
Where are Ireland’s most polluted rivers and lakes?,2019
Will Mandarin be the next global language?,2019
"Military and Garda ill-prepared for drone threat, says report",2019
Garda to spend €15m on new uniforms over next three years,2019
"Smoky coal labelled as smokeless to get around ban, says CPL",2019
Seeing more of your eye than ever before,2019
Raw sewage and rodents account for record food-safety closures,2019
Irish climate activist groups urge increase in EU 2030 target,2019
GAA county board to auction home in London in bid to raise €1 million,2019
Owners of four crèches ordered to close will fight to continue operating,2019
RTÉ director to say a seven-year wait for new broadcasting charge is ‘untenable’,2019
How Ireland’s property crisis is affecting the real economy,2019
Calm after the storm,2019
"At Kerry ceremony 2,000 new citizens told Ireland a place of openness",2019
Here are 30 Irish websites to get this year’s Christmas presents from,2019
Doctor challenges decision to proceed with inquiry into patient's withdrawn complaint,2019
New declaration could recognise legal right of children to healthy environment,2019
Two arrested over 2018 Leixlip shooting of Clive Staunton,2019
Ruling may change way IRA cases are tried,2019
Harris says Murphy should pay back some of the expenses he claimed when in Dáil,2019
Trains and security: ‘I tried to pacify the situation’,2019
"New Zealand volcano eruption: Five dead, at least eight missing",2019
Fintan O’Toole: Catholic Ireland is now a religious rust belt of half-empty churches,2019
Security alert for Dart getting 60-plus passenger texts monthly,2019
School secretaries to stage one-day strike in January,2019
Firefighter jailed over fatal hit and run banned from driving,2019
Petty criminals shun burglary for lucrative drug dealing,2019
"Advertising of e-cigarettes to be restricted, Harris says",2019
Stress and anxiety factors in homeschool numbers rising,2019
Garda denies assaulting RTÉ cameraman at Dublin protest,2019
Biggest mumps outbreak in a decade continues with 103 new cases last week,2019
Homeschooling: ‘It’s part of our everyday. It’s part of our family culture’,2019
Thunberg takes climate stance in solidarity with young indigenous people,2019
Burglars’ secrets: ‘I love creeping around houses when people are in bed’,2019
Irish woman and wife’s struggle to bring their baby home to Ireland,2019
Court seeks clarification before approving €2.9m debt write-off for Frank McNamara and Theresa Lowe,2019
Students ‘losing out’ on tuition time due to dispute,2019
Woman with cerebral palsy in legal challenge over home care,2019
Dublin private members club refused planning for flagpoles,2019
Una Mullally: Chinese millionaires taking advantage of golden Irish visas,2019
"Workers to have legal right to tips paid by credit or debit cards, says Minister",2019
Abuse redress: Christian Brothers pay €30m,2019
"Lives ‘at risk’ due to scant information, first responders say",2019
"Storm Atiyah: 2,000 homes still without power",2019
"New online support to help students learn Polish, Lithuanian and Portuguese",2019
Ross hopes to restore majority of State funding to football at grassroots level,2019
Ban on turf and other smoky fuels considered by Coalition,2019
Ex-Rehab chief Angela Kerins seeks mediation over damages,2019
"Lessons learned from man’s death have improved safety, inquest hears",2019
Woman dies swimming off Antrim coast,2019
"Boy (12) who broke arm on escalator at Dublin store awarded €35,000",2019
"Weekend’s €6 million winning Lotto ticket was sold in Mooncoin, Co Kilkenny",2019
Jury sworn in for trial of man accused of murdering infant son,2019
Ryanair again ranked among Europe’s worst polluters,2019
Have you been the victim of a burglary in Ireland?,2019
Man pleads not guilty to murdering Japanese national,2019
"NBRU says nearly 1,000 anti-social incidents on Dublin Bus services",2019
Finland’s Sanna Marin to become world’s youngest prime minister,2019
Golden Globes 2020: Saoirse Ronan nominated for best actress,2019
"Mount Trenchard direct provision centre must close, says Limerick charity",2019
"Lightning may have been to blame for Michael Healy-Rae fire, locals say",2019
Angela Kerins damages case against Dáil adjourned until January,2019
"Boris Johnson ‘broke his word’ over Brexit union pledge, says Arlene Foster",2019
Record number of domestic abuse incidents reported in North,2019
Man found not guilty of attempted murder of love rival’s mother,2019
Thefts of defibrillators over weekend is criticised,2019
On Swift Horses: Secrets and lies in 1950s California and Mexico,2019
Dentist helped woman to escape domestic abuse after treating broken tooth,2019
Farmers blockade Tesco in ongoing row about beef prices,2019
FAI is on the brink; news expected on extent of Johnny Sexton’s injury,2019
ESB eCars advises electric vehicle owners to ‘disregard’ its own app,2019
Smartwatch Christmas gift guide: A little something for everyone,2019
St Vincent de Paul plaque unveiled for 175th anniversary in Ireland,2019
"No prospect of free dental care for children under 6 from next year, dentists warn",2019
Judge refuses to lift four-year driving ban for woman involved in fatal crash,2019
Denying cannabis link to mental illness is ‘like arguing earth is flat’,2019
Pankhurst backed by DUP amid housing intimidation claims,2019
Senator warns of violence if loyalists pushed too far over a united Ireland,2019
"Varadkar’s praise for less meat in diet ‘demonised’ farmers, MEP claims",2019
Coats left for homeless on Ha’penny bridge removed by council,2019
Hong Kong sees biggest protests since democrats’ election boost,2019
50 tips for a more sustainable (and cheaper) Christmas,2019
UK election: ‘Has the beast of Bolsover lost his teeth?’,2019
"Banana artwork valued at €108,000 is eaten by visitor",2019
Euthanasia is sometimes the right choice,2019
Oxygen in world’s oceans depleting at unprecedented rate,2019
"The best 50 films of 2019: Odd, rich, startlingly varied. And brilliant",2019
Arrest made for alleged racist abuse during Manchester United’s win over City,2019
Man (30s) dies in Co Kildare after being hit by car,2019
December 8th: The day when people ‘from the country’ came to Dublin to shop,2019
Storm Atiyah makes landfall on west coast: ‘Extreme caution’ advised,2019
Boris Johnson restates immigration pledge as lead in polls narrows,2019
"After a broken marriage, I’m scared to let the perfect man love me",2019
‘Civil discobedience’: Dancing in protest as UN climate summit proceeds,2019
Driver of car dies after collision with lorry in Co Cavan,2019
Council chairman defends Dundrum lease deal with ‘foreign cuckoo fund’,2019
New Delhi factory fire leaves at least 43 people dead,2019
Higgins highlights ‘welcoming of strangers’ at Áras tree-lighting event,2019
One winner of Saturday Lotto jackpot worth more than €6.8m,2019
"The disappearance of Trevor Deely, part 1",2019
Winter Papers: a potent antidote to the season’s blues,2019
The wild chase of a murderous ‘Cork tramp’ in Co Donegal,2019
"Woman awarded €54,204 over heating oil spill will have to pay part of legal costs",2019
Illicit online trading ‘may eclipse’ traditional organised crime,2019
Automation on rise at An Post but ‘mass redundancies’ not on horizon,2019
"David McWilliams: Without multinationals, Ireland is a bad-weather Albania",2019
"More than 200,000 children on waiting lists for health care services",2019
From ‘ballerina girly-girl’ to first new female Air Corps pilot for 15 years,2019
Fintan O’Toole: Labour's failure in this election will be due to Jeremy Corbyn,2019
Fresh appeal over Trevor Deely 19 years after he went missing,2019
Two arrested at Dublin Airport in relation to global cyber fraud investigation,2019
Man charged over digger theft of double ATM from Tesco store,2019
Labour and Tories clash over claim of Russian ‘interference’ in election,2019
Cliff Taylor: Time to shout WTF on Dublin’s white-water rafting project,2019
Gang rapes and murders prompt wave of anger and revulsion in India,2019
Hundreds sleep out in Trinity College as part of homeless campaign,2019
Watchdog warns of using ‘windfall taxes’ to fund public services,2019
UK election: ‘I will hold my nose and vote Liberal’,2019
Indian rape victim (23) dies in hospital after being set ablaze,2019
Primary teachers set deadline for end of two-tier pay system,2019
Over 30 dogs rescued during series of searches in Co Tyrone,2019
Stephen’s Green Shopping Centre bought by Davy for €175m,2019
"Dáil expenses system ‘too lax’, says Varadkar",2019
COP25: Evidence of climate change not being met with urgency from wealthy nations,2019
The Outsiders: Refugees in Europe since 1492,2019
Supreme Court ruling on rape sentences welcomed,2019
Memes of the year: The 2019 version of the internet,2019
British diplomat quits over government’s Brexit ‘half-truths’,2019
Man jailed for sexually assaulting four women during ‘spree’,2019
Irish potholes and poor road markings great test for self-driving cars,2019
Giant fire near Sydney may burn for weeks as respiratory illness spikes,2019
"Victoria Falls shrinks to a trickle, feeding climate change fears",2019
Elon Musk cleared of defamation over ‘pedo guy’ tweet,2019
"Pat Leahy: The Government is flat out of energy, mission and purpose",2019
Teenager dies following two-vehicle collision in Dublin,2019
More than 100 children have absconded from care facilities,2019
Regulator issues enforcement notice on public services card project,2019
Broadband plan: First 35 areas to get high-speed service are revealed,2019
"Empty direct provision housing in Achill is costing Government €350,000",2019
Man found guilty of killing friend during row over pint in Co Cork pub,2019
"Domestic homicides far outstrip gangland murder, says commissioner",2019
Bingo players express relief as Government backs down on prize cap,2019
"Ross O’Carroll-Kelly: ‘When I say Lapland, I’m not talking about the gentlemen’s club’",2019
Michael Viney: These hills are made for walking,2019
Bring back my bunny to me: Readers’ nature queries,2019
‘There will always be two groups in Achill now’,2019
Girl (15) was on waiting list for assessment when she died by suicide,2019
"Electric Picnic capacity to be expanded to 70,000 next year",2019
John Delaney was due to be paid almost €3m by FAI over final three years,2019
Firefighter drank up to 15 pints before knocking down 27-year-old,2019
Senior garda suspended while conduct allegations investigated,2019
Storm Atiyah to bring strong winds across country from Sunday,2019
Secondary students urged to learn foreign languages to boost career prospects,2019
Fashionopolis: how fast fashion is destroying the planet,2019
Man (36) arrested over improvised mortar device found in Strabane,2019
Death of baby with drugs in system ‘not related to deficit in service’,2019
Healy Rae brothers given suspended sentences for chip van assault,2019
Convicted sex offender jailed for assaulting garda,2019
Mary McAleese inaugurated as new chancellor of Trinity College,2019
"Foster wants to see return of ‘rejuvenated, re-energised’ NI Assembly",2019
Fintan O’Toole conferred with honorary degree by Trinity College,2019
Dublin City University announces new president,2019
Man given suspended sentence for racially abusing and attacking taxi driver,2019
Teenager guilty of dangerous driving in Dublin graveyard,2019
Three Portuguese men who cultivated cannabis in ‘sophisticated grow house’ jailed,2019
"EU wants ‘close’ trading relationship with UK after Brexit, Hogan says",2019
Alleged Albanian people trafficker raided by Criminal Assets Bureau,2019
Boy with cerebral palsy secures interim €3.6m payment under High Court settlement,2019
Man leading Northern Ireland in absence of government to retire,2019
Judge urged to lift injunctions over protests at asylum seekers accommodation,2019
Rape case sentencing judgement issued by Supreme Court,2019
Warning signs for Fine Gael in byelection results,2019
‘Disturbing’ story of brain-damaged man in prison prompts calls for reform,2019
Retained firefighters look to Belgian case in pay dispute,2019
Review of Irish greyhound industry recommends closure of four tracks,2019
How green are the homes in your county? Only one in 20 houses has top energy rating,2019
"UK election a chance to restore Northern Assembly, says Micheál Martin",2019
Zappone orders second review of Scouting Ireland operations,2019
Dara Murphy must ask for attendance inquiry if one is to be held,2019
South Antrim: DUP likely to prevail despite voters’ anger,2019
Lack of storage and staff will stall State document release,2019
"‘Severe intoxication’ factor in alleged killing by Irish men in Sydney, court told",2019
‘Significant drugs wholesaler’ has 17 year jail term reduced by four years,2019
Ireland’s only cable car celebrates 50 years of connection to mainland,2019
Two ATMs stolen at Antrim supermarket,2019
CervicalCheck scandal: Harris denies ‘lack of empathy’ for women affected,2019
M50 traffic between 6am and 7am increases by 86% in five years,2019
Schools get green light for online job interviews with teachers,2019
‘No room on courts website’ for High Court Master’s rulings,2019
Top-earning city council tenants most likely to default on rent,2019
Specialist Garda unit seizes €177m in drugs and cash in five years,2019
"Over €23,000 annual management fee for eight Dublin social homes",2019
"Brighton claim first ever win at Arsenal, Jim Gavin did what’s best for Dublin",2019
Landlords of energy-inefficient homes may have to pay heating bills,2019
Gardaí would be ‘demoralised’ over low conviction rates for driving without licence,2019
