full_title,date
Creche fire regulations delayed amid fear of closures,2019
‘Broken’ system failing those with mental health issues,2019
Life expectancy for children born in NI 1.6 years shorter than in South,2019
Seven families to be housed in Leitrim direct provision by Christmas,2019
Judge sets new Playstation rules for truant teenagers,2019
Government will not resume funding FAI in ‘near future’,2019
Jail for liquidator (72) who failed to pass money on to employee,2019
‘Death is not the worst thing that can happen in road accidents’,2019
Poverty rates fall slightly overall but worsen for vulnerable groups,2019
Newton Emerson: Road to united Ireland is via united North,2019
Calls by RTÉ staff for pay cuts for top earners at odds with official policy - NUJ,2019
Piano at Pearse Street train station out of action due to vandalism,2019
"Cleaner who broke arm in Blackrock Market awarded €105,000",2019
Launch of interactive map to identify all legal waste companies,2019
Attack on Patrickswell home of Limerick councillor,2019
‘Where are my kids going to go?’ Parents on Hyde & Seek closures,2019
"Woman jumped off balcony to flee ex-partner threatening to kill her, court told",2019
‘Reality must take precedence over public relations for nature cannot be fooled’,2019
Nigerian man loses bid to stay in Ireland after EU citizen wife left,2019
Officials warn of ‘spike’ in respiratory illness among children as flu season arrives,2019
Man avoids jail for abuse of suicidal teenage daughter,2019
GAA club gets green light for 161 homes in Dolphin’s Barn,2019
"Turf cutter needs licence to harvest peat from his land, judge rules",2019
Special Criminal Court ‘minded’ to look at material gardaí refused to hand over,2019
"Film company may seek injunction for planned sequel to Vikings series, court told",2019
"Key issue of Irish language can be resolved to restore Stormont, says Arlene Foster",2019
Couple found guilty of female genital mutilation of their daughter,2019
What you need to know about the three key Brexit dates in 2020,2019
Chief Justice rejects comments by Minister on personal injuries,2019
Argument that alcoholism diminished responsibility for murder rejected by court,2019
Closure orders on four Dublin creches to affect 220 children,2019
Miriam Lord: How will the Dáil fill a huge void left by a huge void?,2019
Government to ‘explore’ including LGBTI+ studies on school curriculum,2019
Private sector workers receiving higher pay rises than those working for State-- union,2019
Whistleblower who exposed rape in Defence Forces thanked 20 years on,2019
Coroner apologises to family of missing man identified by DNA after 20 years,2019
‘Our house is on fire’: MEPs declare climate emergency,2019
"‘Grave concern’ over referral of FAI report to Garda, says Flanagan",2019
Some recruits to Defence Forces ‘just not able for it’ - Kehoe,2019
High Court hearings cancelled due to shortage of judges,2019
Helpline to direct people to mental health services set up,2019
Ireland’s national genome project should not be in private control,2019
"Politicians should face sanctions for racist comments, rights body says",2019
Donnybrook nursing home residents ‘not protected’ against abuse,2019
Vomiting babies and head injuries: TD says children’s hospital conditions ‘shocking’,2019
Row over whether State funding should be restored to FAI,2019
Fiach Kelly: Dáil byelections a leap into the unknown,2019
One last push in four byelections,2019
High levels of under-reporting of sexual harassment at work in North - survey,2019
Developer plans to demolish Georgian terrace on Kildare Street,2019
In-depth investigation on FAI finances referred to Garda,2019
SFI awards showcase breadth of research,2019
"Chelsea and Liverpool made to wait, Sonia O’Sullivan’s half century",2019
The Dubliner driving environmental innovation in Europe,2019
"White water, white elephant? Cost of planned Dublin rafting course doubles to €23m",2019
"Kathy Sheridan: If Verona Murphy is elected on Friday, what will it tell us?",2019
Sloot: A wonderfully funny slice of delicious Dublinese,2019
Funeral of Irish missionary Fr Michael Sinnott takes place,2019
Anti-racism report makes uncomfortable reading for Government,2019
"Dalkey woman awarded €54,000 over heating oil spill as neighbour cleared of lying",2019
"State must act urgently to tackle climate change, committee told",2019
Man convicted of raping a sleeping woman at Kildare house party,2019
Fourteen-year-old girl drowns after falling into Co Antrim river,2019
"Man died from inhaling own blood and teeth, murder trial hears",2019
Man dies in road traffic collision in Co Limerick,2019
Self-help guru Tony Robbins sues Buzzfeed in Irish courts,2019
"At least 3,000 gardaí need to be trained to drive patrol cars",2019
"Boil water notice issued in Cork affecting 9,500 people",2019
"Military pilots could receive €200,000 under loyalty scheme, says Minister",2019
Gardaí issue appeal for missing Cork teenager,2019
"Right-wing extremism ‘arriving on our shores’, says Harris",2019
University of Limerick facing academic revolt over restructuring,2019
"Affordable childcare the key to gender equality in workplace, say experts",2019
More than 20 men stopped on suspicion of buying sexual favours,2019
‘I’m tempted to run away and start all over again’,2019
Homicide review confirms shortcomings in Garda investigations,2019
Farmers threaten to blockade supermarket distribution centres,2019
Man’s body discovered in residence off the Navan Road,2019
Police release footage of last movements of murdered Bangor man,2019
Farmers say they do not want right-wing figures at their protests,2019
Connemara farmer says small-scale beef farming now ‘deeply demoralising’,2019
"Unionists must prepare for inevitable border poll, says leading loyalist",2019
Co Meath man jailed for 2½ years for crash that killed his girlfriend,2019
Harris criticises drinks industry role in educating schoolchildren about alcohol,2019
Forensic audit on FAI finances referred to Garda,2019
Man loses High Court appeal over repossession of Dublin family home,2019
Foyle: No election pacts in Derry where battle is within nationalism,2019
"Staff refuse to operate €808,000 Dáil printer without ‘safety assessments’",2019
Free contraception scheme unlikely until at least 2021,2019
Farmer protests: Creed stands over ‘death threats’ claim,2019
Man arrested over New IRA mortar bomb find in Strabane,2019
Patients moved from trolleys at Limerick hospital after fire inspection,2019
About 75% of people do not report workplace sexual harrassment in NI,2019
Call to allow higher buildings in Dublin’s docklands from business leaders,2019
Two people taken to hospital after four-car pile-up on N7,2019
Sligo woman sentenced to four years for staging musician’s suicide,2019
"Talks to reinstate Stormont to start on December 16th, Northern Secretary says",2019
Woman who sued over caravan park fall loses damages appeal,2019
Cabinteely residents fear intrusion from eight storey ‘tower’,2019
Sexual assault case against comedian Al Porter is dropped,2019
"Trolley numbers: 654 patients waiting for beds, say nurses",2019
Cabinet agrees nominations for three judicial appointments,2019
Dine out for a year at 12 of Ireland's top restaurants,2019
‘For the average beef farmer there just is not a living in it’,2019
Children’s hospital: Construction progress slower than expected,2019
Calls for Bruton to stop plans to import fracked gas to Cork,2019
"Irish coverage of climate change low by EU standards, study says",2019
Bank of Ireland resolves payments delay,2019
"Mourinho’s welcome party ends with a win, Gordon D’Arcy says focus on the clubs",2019
Farmers’ protests: Government cannot increase beef price - Varadkar,2019
LinkedIn Ireland pays out $1bn in dividends as revenues rise,2019
Washout: Dublin is having its wettest month in four years,2019
Miriam Lord: What’s Leo going to do about You-Know-Who?,2019
Consultants will have to be paid more to stay in public system - Harris,2019
"Irish criminals exporting drugs as far as Australia, says Europol",2019
Farmers end Dublin blockade but warn of further protests,2019
Denis Staunton’s UK election diary: Corbyn’s disastrous interview,2019
Breast milk linked to preventing heart disease in premature babies,2019
Irish drug trade’s scale and severity laid bare by Europol,2019
Irish consumers warned about fraud on ‘Black Friday’,2019
Fintan O’Toole: Schools with immigrants producing tomorrow’s Irish speakers,2019
"Roddy Doyle says he would scrap Leaving Cert, which has become part of ‘utterly corrupt’ industry",2019
"Population over 80 to increase 270% by 2050, conference hears",2019
Sudden death of baby in Co Armagh investigated by police,2019
Councillor claims Galway hospital being used as ‘a GP practice’,2019
Has the shadow of anti-immigrant politics reached Ireland?,2019
Some FG Ministers register concern as new penalty points scheme is approved,2019
Sealing abuse records for 75 years would make survivors ‘invisible once more’,2019
Protesting farmers vow to ‘shut down’ Dublin city and block M50,2019
The Oireachtas printer: how installation costs hit the ceiling,2019
Government seeks public views on how best to decarbonise by 2050,2019
"Abuse inquiry error is ‘embarrassing’ not damaging, academic says",2019
Brian Mooney receives National University of Ireland’s highest award,2019
Taxpayer faces up to €6m bill to clear illegal dump in Co Meath,2019
Man (76) is suing 86-year-old over alleged sex abuse 70 years ago,2019
Commemorative Phil Lynott coin launched by Central Bank,2019
Verona Murphy criticised in Dáil over RSA ‘interference’,2019
Events highlight challenges facing Travellers in education,2019
New maximum stake of €5 for gambling machines approved,2019
Farmer died after he was trampled by cattle on his farm,2019
Honohan says some judges lack experience for banking cases,2019
Parts of Cork remain flooded after Atlantic storm passes coast,2019
Manslaughter trial hears man died after suffering blunt trauma to head,2019
Driver caught 58km/h over limit in Co Waterford,2019
Advertising watchdog rejects Irish Heart Foundation’s complaints,2019
"‘Unacceptable’ that 6,000 children not assigned social worker, PAC says",2019
"Senior staff in beef company receiving death threats, Minister says",2019
Public not being educated about the dangers of drug-taking - Drew Harris,2019
Snow Patrol cancel concert in Dublin’s Olympia Theatre,2019
Department of Foreign Affairs defends Pat Finucane Centre funding,2019
How will the new graduated speeding penalties work?,2019
Selfies and smartphones blamed for rise in head lice among schoolchildren,2019
Solicitor whose home was raided in ‘catastrophic mistake’ settles court action,2019
Foxrock home of convicted murderer Graham Dwyer put up for sale,2019
"Anseo: a beautiful book interweaving family, race, Gaeilge and social media",2019
Noel Grealish row could be the tip of the iceberg,2019
Stowaways at Cherbourg: ‘All day they play cat and mouse’,2019
Beer by-products converted into renewable fuel by Belfast scientist,2019
Man who stabbed taxi driver and left him to die has sentence increased,2019
"Friday's byelections: All you need to know about candidates, constituencies and issues",2019
Direct Provision ‘not a bad system’ - UN migration head,2019
Extra charges brought against couple whose daughter suffered serious injuries,2019
"Costs of cancer: ‘I wondered could I put diesel in the car, pay for groceries’",2019
Four men charged over abduction of Kevin Lunney,2019
Trinity student admits spitting at Garda while resisting arrest,2019
Michael Smurfit says ‘time to move on’ after €70m K Club sale,2019
Ciara Glennon murder: Prosecution claims DNA links accused to killing,2019
Purchase of printer too big to fit inside Dáil investigated,2019
Graduated speeding penalties plan approved by Cabinet,2019
"Gerry Thornley on Ronan Kelleher, Conor Hourihane inspires Villa win",2019
Van crashes into Irish Times building after collision with unmarked Garda car,2019
Nurses say 660 patients waiting for beds in hospitals,2019
Pedestrian (30s) dies following crash in Co Tipperary,2019
All set to be pensioned off: But are you really prepared for retirement?,2019
High Court bans man from providing property services,2019
"School ordered to pay €3,500 to student with nut allergy over school trip",2019
Black Friday: Investigation pours cold water on so-called deals,2019
"Human error costs State agency €720,000, notes Dáil group",2019
Man to appear in court over death of prisoner in Cloverhill,2019
Report containing submissions from abuse survivors will not be made public,2019
My son has dyspraxia. How can I ensure he’s supported in school?,2019
The Secret Teacher: Desperately seeking a Junior Cycle sample paper,2019
How simple classroom design changes can boost children’s learning,2019
Where a house of God succumbed to Apollo: Church ruins revealed in Dublin dig,2019
Munster rugby more inclusive than Leinster rivals,2019
Graduated speeding penalties expected to be approved by Cabinet,2019
JOE is the voice of Irish people at home and abroad,2019
"Community centre services at risk over low pay, managers claim",2019
Ross set for penalty points victory,2019
Intel welcomes planning approval for €3.6bn Leixlip facility,2019
Papal visit to Ireland prompted increase in abuse allegations,2019
"Harsh austerity ‘imposed on Ireland’ by Berlin, says ex-official",2019
Air quality stations absent in many towns burning smoky coal,2019
Call for Irish officials to police illegal migration at French ports,2019
Coolock gang violence is a complex web of shaky loyalties,2019
Dublin parish paid €3.5m compensation for loss of light due to new developments,2019
Publication of Murphy report 10 years ago gave ‘confidence’ to abuse survivors,2019
Falling demand for IRA merchandise threatens SF firm,2019
Four held after man found with lacerations in Athy,2019
Special needs teachers used for mainstream classes in breach of rules,2019
Child abuse inquiry admits to ‘seriously erroneous statistic’,2019
Creche accused of allowing staff to wake a child with wet cloth on face,2019
UK election: ‘Labour is promising to give away everything bar a free unicorn’,2019
"Government stalling gift voucher law for Black Friday PR stunt, FF claims",2019
Christmas shows our approach to climate change is crackers,2019
Man pleads guilty to manslaughter of father of four in Cork pub,2019
Alleged neo-Nazi returns to US after almost two weeks in Ireland,2019
Emma DeSouza takes citizenship dispute to appeal court,2019
Trial hears accused woman was victim of FGM in Somalia,2019
"Windrush generation: ‘If people had information on you, you never knew what they might do’",2019
Global warming bringing new species of moths to Ireland,2019
Taxi driver who stole from passengers fails in appeal against losing licence,2019
Social media companies ‘must do more’ on vaccine misinformation - Harris,2019
Child abuser (69) who is ‘likely to die in prison’ has sentence cut,2019
Healy-Rae brothers convicted of assault at Kenmare chip van,2019
Boy who fractured leg in play area gets €65k settlement,2019
"Bomb components picked by child in Newry, says PSNI",2019
Girl awarded €80k after cutting her knee at funfair,2019
Driver convicted of causing friend’s death told to leave Ireland,2019
Opportunity for talks to restore Stormont ‘closing rapidly’,2019
Jail for man who stabbed mother repeatedly during argument,2019
"Climate-heating greenhouse gases hit record high, UN says",2019
Suspended sentence for man who deliberately crashed into cyclist,2019
Council bans drop-offs near gates at two Malahide schools,2019
Too old. No legs. Memories of a good lad gone way too soon,2019
Mairia Cahill welcomes support to change law over election candidates’ home address,2019
Constituency byelection profile: Dublin Mid West,2019
Martial arts instructor jailed over fatal stabbing of man,2019
Una Mullally: Far-right ideology is entering mainstream politics in Ireland,2019
Children’s hospital procedures postponed amid sharp rise in admissions,2019
Weather advisory issued for south with gales and heavy rain forecast,2019
Death of man found in Ballymun a ‘personal tragedy’,2019
Dublin gangland murder victim warned by gardaí his life was at risk,2019
QIH directors advised online group ‘to stop company break-up’,2019
Less than third of patients in A&E admitted to ward within six hours - survey,2019
"Advent calendars: the good, the bad and the cheesy",2019
Gerry Thornley on the weekend’s Champions Cup; Ken Early asks if City can maintain intensity,2019
Pricewatch: Be careful of clampers if your car is from Wexford,2019
One in seven believe women may provoke abuse - survey,2019
Garda will not introduce dedicated unit for transport services,2019
"‘Cherbourg is wide open. There’s next to no security’, says haulier",2019
Advice to Christmas shoppers: Don’t buy gift card this week,2019
Schmidt says son is reaping benefits of transition year system,2019
"Alexa, what helps me feel more organised and keeps me focused on fitness goals?",2019
Private school accused of heating up points race in fourth year,2019
Ciara Glennon murder in 1997: court hears detail of day she died,2019
Bloody Sunday: Decision not to prosecute soldiers under review,2019
Migrants can simply leave Ireland or disappear,2019
"Vacant barracks could house asylum seekers, department says",2019
Air pollution doubled on car-free day in parts of Dublin,2019
New legislation to provide for mandatory open disclosure,2019
Man dies after gangland-style shooting in Dublin,2019
Students to extend hand of friendship across Border,2019
Boy (15) who claims he got narcolepsy from vaccine seeks early hearing,2019
UK election: Nasty North Belfast contest to have wider repercussions,2019
Limerick woman who died in Italy named as Breffni O’Connor,2019
Perth trial of alleged killer of Irish woman hinges on DNA,2019
Sean FitzPatrick seeks permission to build new house behind Wicklow home,2019
Foster urges new SF talks on Stormont impasse after election,2019
Win tickets to Other Voices with a two-night stay in Dingle,2019
Poor Clare Sisters resist temptation to appear on Britain's Got Talent,2019
Man strangled in Cloverhill Prison named as Mark Lawlor (37),2019
"Driving tests, licence and insurance should be required for e-scooters, says council",2019
Nine of 16 migrants found in truck on ferry to Rosslare now missing,2019
Blindboy’s new book is a bestseller - but I don’t get it,2019
Potential drugs link investigated after five sudden deaths in Belfast,2019
Armagh man (23) charged with human trafficking after bodies found in Essex truck,2019
Dublin shop seeks permission to erect shutters to stop homeless sleeping in doorway,2019
Man critical after he was found lying on a footpath in Co Tyrone,2019
Mary McAleese: Irish people have ‘no right’ to be racist,2019
"Limerick woman dies in late-night incident in Ancona, Italy",2019
I do not like my boyfriend’s drug-using friends,2019
David McWilliams: The post-Trump era could see the disruption of capitalism,2019
No injuries reported after shots fired at house in north Belfast,2019
Head of Anglicans hopes conservative wing will not spur schism,2019
Dubliner wins Prix Galien 2019 award for pharmaceutical research,2019
Man found tampering with election posters in north Dublin arrested by gardaí,2019
Man arrested on suspicion of murder following death of prisoner at Cloverhill,2019
Monster ink: €800k printer too big to fit in Leinster House,2019
Government to start ‘long overdue’ talks with islanders about their future,2019
"Up to 1,500 attend rally over planned closure of holiday centre for disabled",2019
It’s a Yes! The inside stories of how Ireland repealed the Eighth,2019
"CervicalCheck performance similar to UK programmes, review finds",2019
Joe Schmidt guest of honour as 125 students receive scholarships at UL,2019
Fintan O’Toole: Ireland’s well-off live five years longer than its poor,2019
Miriam Lord: Leo makes Wexford wait while Wallace takes the Mick,2019
Doctors feel unable to apologise to patients,2019
'My 13-year-old does not have a smartphone. Parents can say no',2019
‘It was so frightening’: Four houses and two vehicles damaged in Meath fire,2019
Man subjected to ‘vicious and brutal’ paramilitary-style attack in west Belfast,2019
"Works of at least €230,000 required to fit printer in Oireachtas",2019
Q&A: What responsibilities fall on lorry drivers for their loads?,2019
New direct provision housing for asylum seekers is running over budget,2019
Migrants may be using Cherbourg-Rosslare as ‘new route’ to UK,2019
Truck driver and Irish firm ‘not suspects’ in case of 16 migrant stowaways,2019
Trump impeachment: Documents reveal contact between Giuliani and Pompeo,2019
UK general election: Remain pact should see SDLP take South Belfast back,2019
Hospitals warned they must ensure legal requirements for abortions are met,2019
Pat Finucane Centre director admits past membership of IRA,2019
The big bird census: It’s that time of year to keep an eye on the garden,2019
"These days, Marian Finucane sounds lofty and out of touch",2019
Irish haulage firm says security must be improved at Cherbourg,2019
Priest honoured at Áras says sexual abuse allegations against him are ‘false’,2019
Removal of organist after same-sex marriage prompts open letter,2019
"Monitoring the otter, Ireland’s elusive, enigmatic river-dweller",2019
Thinking Anew: Why Advent is a time to savour the darkness and light,2019
What are chances of migrants making it through Irish port in a truck?,2019
Mother who left children home alone locked in bedrooms is jailed for six months,2019
Metal detectorists who hid €14m Viking haul of coins and jewels are jailed,2019
Can you identify this chirpy creature? Readers’ nature queries,2019
"Cholesterol-lowering drugs may reduce prostate cancer risk, research suggests",2019
Stephen Collins: Our system favours chancers and crooks,2019
Expert warns Dublin is showing signs of ‘over-tourism’,2019
Abandoned baby giraffe bonds with dog at animal orphanage,2019
Yellow weather warning in place for southeast ahead of wet weekend,2019
Kerry student wins SciFest 2019 with ocean ‘dead zone’ combatting filter,2019
Time to stop hyperventilating about RTÉ’s finances and take calm decisions,2019
Speed camera operator dispute talks end without resolution,2019
WeWork to ditch leasing business model in many cities,2019
Bewley’s posts profit despite €1.5m loss on Grafton St café,2019
"Systems failure contributed to death of young man in Limerick prison, inquest hears",2019
Death of a man (55) in Killarney being investigated by gardaí,2019
Mechanic guilty of endangerment over fatal crash involving defective vehicle,2019
Four Lunney attack suspects remain in Garda custody,2019
Man (36) jailed for setting fire to home of murder inquiry detective,2019
Lay litigant attempts citizen’s arrest on DPP solicitor in court,2019
Hundreds express interest after public appeal for foster carers,2019
Murdered pensioner suffered ‘vicious’ beating in Co Down home,2019
Twenty residents ordered to leave three Dublin properties,2019
Tullow Oil finds itself over a barrel after ‘epic setback’,2019
"‘He depends on me all the time, he’s the joy of our home’",2019
Suspended term for biting and breaking garda’s finger ‘unduly lenient’,2019
Three men accused of posting threatening videos on social media,2019
Men found in truck on Rosslare-bound ferry claim asylum in Ireland,2019
‘She wouldn’t hang my picture’: Trump again hits out at US ambassador,2019
How do other countries compare to Ireland on asylum applications?,2019
Kiely’s of Donnybrook set for high-end apartments and rooftop bar,2019
"If someone offered you €10,000 to leave Dublin, would you jump at it?",2019
Man jailed for making hoax 999 call about pub shooting,2019
Femicide Watch: 230 women have died violently in State since 1996,2019
Woman settles case for nervous shock over husband’s death in hospital,2019
"RTÉ journalists want €208,000 cap on pay of top presenters and management",2019
Man guilty for disposing of chainsaw which dismembered Kenneth O’Brien,2019
So it Goes: travel writer who said tourism is ‘a rotten affair’,2019
Northern Irish man (23) arrested in UK over Essex truck deaths,2019
Group seeks to appeal failed challenge to ‘flawed’ climate action plan,2019
‘Systems change’ backed by regulation needed on plastics,2019
Diversion programme must reconsider case of student facing child porn charges,2019
Men wanted over attempt to murder PSNI officer fear rights breach,2019
Ana Kriégel case against Facebook and Twitter struck out despite ‘alarming posts’,2019
"Ritchie died alone at home, and lay undiscovered for six months",2019
"Nearly 5,500 asylum seekers to be housed in new direct provision centres across Ireland",2019
Most 20-year-olds live with parents and worry about housing,2019
Provinces prepare to face French foes; Ireland set to learn playoff final venue,2019
"Dirty, dreary, expensive, nothing to do: British parents give their verdict on Dublin",2019
Three men to appear in court over social media threats,2019
Kevin Lunney attack: chief suspect among four interrogated,2019
Migrants found on Rosslare-bound ferry ‘thought they were going to UK’,2019
Greens in government would ‘cancel’ N11/M11 road upgrade,2019
Cannabis grow house discovered on Moore Street Rising site,2019
Farmers accuse sustainable energy body of ‘demonising’ red meat,2019
Direct provision: What should happen next?,2019
